Firstan,https://www.crunchbase.com/organization/firstan-holdings,101-250,Active,http://www.firstan.co.uk,sales@firstan.co.uk,+44 (0) 1480 418418,,,,,,,,,"Administrative Services, Design, Manufacturing, Software","CAD, Manufacturing, Packaging Services",,,,,,,,,,"Godmanchester, Cambridgeshire, United Kingdom",,1977-01-01,year,,https://www.linkedin.com/company/firstan-healthcare-packaging/
MG Group,https://www.crunchbase.com/organization/mg-group-6bb6,101-250,Active,https://www.mgbusandcoach.com,sales@mggroup.in,+91 9985744338,,,,,,,,,"Design, Manufacturing, Software, Transportation","Automotive, CAD, Manufacturing",,,,,,,,,,"Mumbai, Maharashtra, India",$1M to $10M,1980-01-01,year,,https://www.linkedin.com/company/mg-bus-coach
Cadjobs,https://www.crunchbase.com/organization/cadjobs,101-250,Active,https://www.cadjobs.nl,info@cadjobs.nl,+31 10 750 4580,,,,,,,,,"Administrative Services, Design, Professional Services, Software","CAD, Recruiting, Staffing Agency",,,,,757701,USD,757701,,,"Rotterdam, Zuid-Holland, The Netherlands",$10M to $50M,1999-01-01,year,,https://www.linkedin.com/company/cadjobs.nl-&-cadzone/
Pharea Software,https://www.crunchbase.com/organization/pharea-software,51-100,Active,https://www.pharea-software.com,,+33 04 37 66 11 40,,,,,,,,,"Design, Education, Software","CAD, Software, Training",,,,,140700,USD,140700,,,"Lyon, Rhone-Alpes, France",,2017-01-01,year,,https://www.linkedin.com/company/pharea-software
Right Angle Staffing,https://www.crunchbase.com/organization/right-angle-staffing,51-100,Active,https://rightangleusa.com,info@rightangleusa.com,+1 248 601 7900,,,,,,,,,"Administrative Services, Design, Professional Services, Software","CAD, Recruiting, Staffing Agency",,,,,1441839,USD,1441839,,,"Troy, Michigan, United States",$1M to $10M,2000-01-01,year,,https://www.linkedin.com/company/right-angle-staffing
MKS Industrial Solutions,https://www.crunchbase.com/organization/mks-industrial-solutions,51-100,Active,https://mks.co.in,Sales@mks.co.in,+91 9991000118,,,,,,,,,"Design, Manufacturing, Professional Services, Software","CAD, Consulting, Industrial",,,,,,,,,,"Haryana, Haryana, India",$1M to $10M,2006-01-01,year,,https://www.linkedin.com/company/mks-industrial-solutions/
Uchiyama,https://www.crunchbase.com/organization/uchiyama-15e0,501-1000,Active,https://uchiyamass.com,,0276-56-4414,,,,,,,,,"Design, Hardware, Manufacturing, Science and Engineering, Software","CAD, Laser, Manufacturing",,,,,,,,,,"Tatebayashi, Gumma, Japan",,1985-01-01,month,,
Jewelry Hunt,https://www.crunchbase.com/organization/jewelry-hunt,51-100,Active,https://www.jewelryhunt.net,official@jewelryhunt.net,,,,,,,,,,"Clothing and Apparel, Consumer Goods, Design, Software","CAD, Fashion, Graphic Design, Jewelry",,,,,,,,,,"Shanghai, Shanghai, China",$1M to $10M,2004-01-01,year,,https://www.linkedin.com/company/jewelryhunt/
LIFA A/S,https://www.crunchbase.com/organization/lifa-a-s,101-250,Active,https://www.lifa.dk/,land@lifa.dk,63 13 68 00,,,,,,,,,"Administrative Services, Design, Other, Real Estate, Software","CAD, Construction, Infrastructure, Professional Services, Project Management, Property Development",,,,,1159002,USD,1159002,,,"Odense, Syddanmark, Denmark",,1981-01-01,year,,https://www.linkedin.com/company/lifa-a-s/?originalSubdomain=ar
Hepatica Technologies,https://www.crunchbase.com/organization/hepatica-technologies,51-100,Active,https://hepaticatech.com,enquiry@hepaticatech.com,+91 80 28525250,,,,,,,,,"Design, Manufacturing, Science and Engineering, Software","CAD, Industrial Engineering, Product Design",,,,,954135,USD,954135,,,"Bangalore, Karnataka, India",$10M to $50M,2006-01-01,year,,https://www.linkedin.com/company/hepatica-technologies-pvt-ltd
CAADRIA,https://www.crunchbase.com/organization/caadria,51-100,Active,https://caadria.org,,+852 26096583,,,,,,,,,"Design, Education, Real Estate, Software","Architecture, CAD, Education, Interior Design",,,,,,,,,,"Sha Tin, New Territories, Hong Kong",$10M to $50M,1996-01-01,year,,https://www.linkedin.com/company/caadria
RSP Consulting Engineers,https://www.crunchbase.com/organization/rsp-consulting-engineers,51-100,Active,https://rsp.net,enquiries@rsp.net,+44 0131 333 8000,,,,,,,,,"Design, Energy, Manufacturing, Professional Services, Real Estate, Science and Engineering, Software","CAD, Construction, Consulting, Electrical Distribution, Industrial Engineering",,,,,46864,USD,46864,,,"Edinburgh, Edinburgh, City of, United Kingdom",$1M to $10M,1987-01-01,year,,https://www.linkedin.com/company/rsp-consulting-engineers-llp/?trk=jserp_company_name&originalSubdomain=uk
Centillion Networks,https://www.crunchbase.com/organization/centillion-networks-7650,251-500,Active,https://www.centillionnetworks.com,info@centillionsolutions.com,91 40 42200027,,,,,,,,,"Design, Hardware, Real Estate, Software","CAD, Construction, Telecommunications",,,,,,,,,,"Hyderabad, Andhra Pradesh, India",$10M to $50M,2007-01-01,year,,https://www.linkedin.com/company/centillion-networks-private-limited
Integrity Testing Services,https://www.crunchbase.com/organization/integrity-testing-services,51-100,Active,https://www.integrity-testing.com/,info@integrity-testing.com,+1 780 417-0340,,,,,,,,,"Design, Financial Services, Information Technology, Other, Software","Asset Management, CAD, Document Management, Service Industry",,,,,1228045,USD,1228045,,,"Edmonton, Alberta, Canada",$10M to $50M,2006-01-01,year,,https://www.linkedin.com/company/integrity-testing-services-inc-/
Esiste Group,https://www.crunchbase.com/organization/esiste-group,51-100,Active,https://www.esiste.com,info@exist.net,,,,,,,,,,"Design, Hardware, Software","3D Technology, CAD, Product Design",,,,,433608,USD,433608,,,"Trofarello, Piemonte, Italy",$1M to $10M,2003-01-01,year,,https://www.linkedin.com/company/esiste/
Schwichtenberg,https://www.crunchbase.com/organization/schwichtenberg,51-100,Active,https://www.schwichtenberg.gmbh,info@schwichtenberg.gmbh,+49 5261 77 99 81 00,,,,,,,,,"Design, Manufacturing, Software","CAD, Industrial, Manufacturing",,,,,82432,USD,82432,,,"Lemgo, Nordrhein-Westfalen, Germany",$1M to $10M,2002-01-01,year,,https://www.linkedin.com/company/schwichtenberg-gmbh
Shri Padmavathi Consultants,https://www.crunchbase.com/organization/shri-padmavathi-consultants,101-250,Active,https://shri-padmavathi.com,info@shripadmavathi.com,91 98441 72464,,,,,,,,,"Administrative Services, Design, Manufacturing, Science and Engineering, Software","CAD, Human Resources, Industrial Automation",,,,,,,,,,"Bengaluru, Karnataka, India",$10M to $50M,2003-01-01,year,,https://www.linkedin.com/company/shri-padmavathiconsultants
Silicon Outsourcing,https://www.crunchbase.com/organization/silicon-outsourcing,51-100,Active,http://www.siliconoutsourcing.net,info@siliconoutsourcing.net,91-79-40037887,,,,,,,,,"Design, Hardware, Manufacturing, Professional Services, Science and Engineering, Software","CAD, Civil Engineering, Consulting, Industrial Engineering, Mechanical Design, Mechanical Engineering",,,,,,,,,,"Ahmedabad, Gujarat, India",,2007-06-01,day,,https://www.linkedin.com/in/silicon-outsourcing-329a6718a/
TBL Systems,https://www.crunchbase.com/organization/tbl-systems,51-100,Active,https://www.tblsys.com,djane@tblsys.com,+1 855 844 6258,,,,,,,,,"Data and Analytics, Design, Internet Services, Software","Analytics, CAD, Cloud Computing",,,,,310471,USD,310471,,,"Paradise Valley, Arizona, United States",,2013-01-01,year,,https://www.linkedin.com/company/tbl-systems-inc
Hangi Co.,https://www.crunchbase.com/organization/hangi-co,101-250,Active,https://www.hangi.co.jp,hangi.info@hangi.co.jp,079-443-4405,,,,,,,,,"Design, Other, Software","CAD, Professional Services, Software",,,,,,,,,,"Takasago, Hyogo, Japan",,1981-01-14,day,,
Extrusions,https://www.crunchbase.com/organization/extrusions,101-250,Active,https://www.aluminumextrusions.com,,+1 620 223 1111,,,,,,,,,"Design, Manufacturing, Software","CAD, Industrial, Manufacturing, Product Design",,,,,546043,USD,546043,,,"Fort Scott, Kansas, United States",$10M to $50M,,,,https://www.linkedin.com/company/extrusions-inc.
Olimac,https://www.crunchbase.com/organization/olimac,51-100,Active,https://www.olimac.it,infodrago@olimac.it,+39 0171 384898,,,,,,,,,"Design, Manufacturing, Software","CAD, Industrial, Manufacturing, Product Design",4,4,Agriculture; Forestry; Animal Husbandry; Hunting; Trapping; Fishing,Machines and machine tools,100050,USD,100050,,,"Cuneo, Piemonte, Italy",$1M to $10M,1980-01-01,year,,https://www.linkedin.com/company/olimac-s.r.l.
O-Seven,https://www.crunchbase.com/organization/o-seven,51-100,Active,https://www.o-seven.co.jp/,inet@o-seven.co.jp,048-840-1577,,,,,,,,,"Design, Sales and Marketing, Software","CAD, Sales, Software",,,,,,,,,,"Saitama, Saitama, Japan",$1M to $10M,1995-02-22,day,,
Lead Rebar Solutions,https://www.crunchbase.com/organization/lead-rebar-solutions,101-250,Active,https://leadrebarsolutions.com,leadrebarsolutions@gmail.com,+91 9791174536,,,,,,,,,"Design, Real Estate, Science and Engineering, Software","CAD, Civil Engineering, Interior Design",,,,,,,,,,"Trichy, Tamil Nadu, India",$1M to $10M,2014-01-01,year,,https://www.linkedin.com/company/leadrebarsolutions-com
Ourakousoku,https://www.crunchbase.com/organization/ourakousoku,251-500,Active,http://www.oura.co.jp,sales@oura.co.jp,03-5916-4901,,,,,,,,,"Design, Real Estate, Science and Engineering, Software","CAD, Civil Engineering, Construction",,,,,,,,,,"Kita, Tokyo, Japan",,1965-05-01,month,,
Teide Refractory Solutions,https://www.crunchbase.com/organization/teide-refractory-solutions,51-100,Active,https://www.teiderefractories.com/,teide@teide.es,+34 93 844 58 80,,,,,,,,,"Design, Manufacturing, Other, Science and Engineering, Software","CAD, Industrial Engineering, Product Management",,,,,1330693,USD,1330693,,,"Barcelona, Catalonia, Spain",$10M to $50M,1954-01-01,year,,https://www.linkedin.com/company/teide-refractory-solutions/
ASVIC Engineering & Software,https://www.crunchbase.com/organization/asvic-engineering-software,51-100,Active,https://www.asvic.com.au,info@asvic.com.au,+ 61 1300 654 616,,,,,,,,,"Design, Science and Engineering, Software","CAD, Software, Software Engineering",,,,,,,,,,"Cronulla, New South Wales, Australia",$10M to $50M,1992-01-01,year,,
Embeka,https://www.crunchbase.com/organization/embeka,51-100,Active,https://www.embeka.de,info@embeka.de,+49 06704  96249-0,,,,,,,,,"Design, Hardware, Manufacturing, Natural Resources, Software","3D Technology, CAD, Industrial, Precious Metals",,,,,,,,,,"Langenlonsheim, Rheinland-Pfalz, Germany",$1M to $10M,2004-01-01,year,,https://www.linkedin.com/company/embeka-technologies-gmbh/
Crishna International,https://www.crunchbase.com/organization/crishna-international,51-100,Active,https://www.crishnainternational.com,info@crishnainternational.com,+91 84490 70333,,,,,,,,,"Design, Manufacturing, Software","CAD, Industrial, Manufacturing, Product Design",,,,,,,,,,"Aliganj, Uttar Pradesh, India",,2006-01-01,year,,https://www.linkedin.com/company/crishna-international/
James Johnson,https://www.crunchbase.com/organization/james-johnson-b2ab,51-100,Active,https://www.james-johnson.co.uk,info@james-johnson.co.uk,+44 020 8596 5200,,,,,,,,,"Design, Financial Services, Manufacturing, Software","CAD, Finance, Manufacturing, Product Design",,,,,,,,,,"Dagenham, Barking and Dagenham, United Kingdom",,1991-01-01,year,,https://www.linkedin.com/company/james-johnson-&-company-joinery-limited
Benham Precision Engineering,https://www.crunchbase.com/organization/benham-precision-engineering,51-100,Active,https://benhamprecisionengineering.co.uk,,+44 0 2380 668 555,,,,,,,,,"Design, Manufacturing, Science and Engineering, Software","Aerospace, CAD, Machinery Manufacturing",,,,,1041448,USD,1041448,,,"Southampton, Southampton, United Kingdom",,1978-01-01,year,,https://www.linkedin.com/company/benham-precision-engineering
3dcgstore,https://www.crunchbase.com/organization/3dcgstore,10001+,Closed,https://3dcgstore.com,mashafeeq@3dcgstore.com,7719656864,,,,,,,,,"Design, Hardware, Manufacturing, Software, Transportation","3D Printing, 3D Technology, Automotive, CAD, Graphic Design, Industrial Design, Manufacturing",,,,,,,,,,"Parkersburg, Iowa, United States",Less than $1M,2017-08-01,day,,https://www.linkedin.com/company/3dcg-store
Man and Machine,https://www.crunchbase.com/organization/man-and-machine-17b2,1001-5000,Active,https://mum-acadgraph.de,info@mum-acadGraph.de,+49 89 3065896 0,,,,,,,,,"Design, Real Estate, Science and Engineering, Software","Architecture, CAD, Civil Engineering, Construction",,,,,,,,,,"Munich, Bayern, Germany",,1984-01-01,year,,https://www.linkedin.com/company/mensch-und-maschine-deutschland-gmbh/
Airsys UK,https://www.crunchbase.com/organization/airsys-uk,51-100,Active,https://air-sys.uk,enquiries@air-sys.uk,+44 0192 537 7272,,,,,,,,,"Design, Manufacturing, Science and Engineering, Software","CAD, Industrial, Mechanical Engineering",,,,,219915,USD,219915,,,"Warrington, Warrington, United Kingdom",,1995-01-01,year,,https://www.linkedin.com/company/airsys-uk
IBER-OLEFF Brasil,https://www.crunchbase.com/organization/iber-oleff-brasil,101-250,Active,https://iber-oleff.com.br,iber-oleff@iber-oleff.com.br,55-11-4602-8200,,,,,,,,,"Consumer Goods, Design, Manufacturing, Software, Transportation","Automotive, CAD, Consumer Goods, Home Appliances, Industrial, Manufacturing, Product Design",,,,,,,,,,"Salto, Sao Paulo, Brazil",$500M to $1B,1998-01-01,year,,https://www.linkedin.com/company/iber-oleff-brasil/
Gein Merchandising,https://www.crunchbase.com/organization/gein-merchandising,51-100,Active,https://gein.com.mx,contacto@gein.com.mx,+52 55 5049 3504,,,,,,,,,"Consumer Goods, Content and Publishing, Design, Manufacturing, Media and Entertainment, Software","CAD, Furniture, Manufacturing, Printing",,,,,,,,,,"Estado De México, Campeche, Mexico",$1M to $10M,2002-01-01,year,,https://www.linkedin.com/company/gein-merchandising
DesignTech CAD Academy,https://www.crunchbase.com/organization/designtech-cad-academy,501-1000,Active,https://www.designtechcadacademy.com,training.pune@designtechcadacademy.com,+91 020 41311235,,,,,,,,,"Design, Education, Software","CAD, Education, Training",,,,,,,,,,"Pune, Maharashtra, India",$10M to $50M,1998-01-01,year,,https://www.linkedin.com/company/designtech-cad-academy/
Astral Informatics,https://www.crunchbase.com/organization/astral-informatics,51-100,Active,https://astralcad.com,training@astralcad.com,+91 0712 2545200,,,,,,,,,"Design, Education, Science and Engineering, Software","CAD, Civil Engineering, Software, Training",,,,,,,,,,"Nagpur, Maharashtra, India",,1992-01-01,year,,https://www.linkedin.com/company/astral-informatics-private-limited
Daniel Gruppe,https://www.crunchbase.com/organization/daniel-group-59df,101-250,Active,https://www.daniel-gruppe.de/daniel-gruppe-gmbh.html,info@daniel-gruppe.de,+49-05741-34800,,,,,,,,,"Design, Manufacturing, Science and Engineering, Software","CAD, Machinery Manufacturing, Manufacturing, Mechanical Engineering",0,1,,Common metals and their alloys; ores,150765,USD,150765,,,"Lübbecke, Nordrhein-Westfalen, Germany",$10M to $50M,,,,https://www.linkedin.com/company/daniel-gruppe-gmbh
Dero Construction,https://www.crunchbase.com/organization/dero-construction,51-100,Active,https://www.derooconstructie.be,info@derooconstruction.be,+32 057 33 68 16,,,,,,,,,"Design, Hardware, Manufacturing, Real Estate, Software","3D Technology, CAD, Construction, Manufacturing",,,,,276418,USD,276418,,,"Poperinge, West-Vlaanderen, Belgium",$10M to $50M,,,,https://www.linkedin.com/company/deroo-constructie-nv
Hisoftec,https://www.crunchbase.com/organization/hisoftec,101-250,Active,http://www.hisoftec.co.jp/,hp@hisoftec.co.jp,029-354-3450,,,,,,,,,"Design, Information Technology, Other, Software","CAD, Information Technology, Software, Technical Support",,,,,,,,,,"Hitachi-naka, Ibaraki, Japan",$1M to $10M,1983-12-01,day,,https://www.linkedin.com/company/%EF%BC%88%E6%A0%AA%EF%BC%89%E3%83%8F%E3%82%A4%E3%82%BD%E3%83%95%E3%83%86%E3%83%83%E3%82%AF/
InfoTech Enterprises,https://www.crunchbase.com/organization/infotech-enterprises-b88d,51-100,Active,https://www.infotechenterprises.net,info@infotechit.net,91 989-100-0445,,,,,,,,,"Design, Information Technology, Software","CAD, Information Technology, Web Design, Web Development",,,,,,,,,,"New Delhi, Delhi, India",$100M to $500M,2010-01-01,year,,https://www.linkedin.com/company/infotechgeo
Systech,https://www.crunchbase.com/organization/systech-617e,51-100,Active,https://www.systech-ste.fr,,+33 02 37 31 40 00,,,,,,,,,"Consumer Electronics, Design, Energy, Hardware, Software","CAD, Electrical Distribution, Electronics",,,,,176376,USD,176376,,,"Gallardon, Centre, France",,1991-01-01,year,,https://www.linkedin.com/company/systechfr/
MANiFAB,https://www.crunchbase.com/organization/manifab,51-100,Active,https://manifab.com,websales@manifab.com,+44 0 1952 883188,,,,,,,,,"Design, Manufacturing, Software","CAD, Industrial, Machinery Manufacturing, Manufacturing",,,,,96554,USD,96554,,,"Broseley, Shropshire, United Kingdom",,,,,https://www.linkedin.com/company/manifab/
Estrelz Global Trace,https://www.crunchbase.com/organization/estrelz-global-trace,51-100,Active,https://estrelz.com,mohan@estrelz.com,+91 81230 31230,,,,,,,,,"Design, Navigation and Mapping, Other, Professional Services, Software","CAD, Customer Service, Mapping Services",,,,,,,,,,"Coimbatore, Tamil Nadu, India",$1M to $10M,2013-01-01,year,,https://www.linkedin.com/company/estrelz-maps-private-limited/
InfoTech,https://www.crunchbase.com/organization/infotech-03e2,101-250,Active,https://www.infotechit.net/,info@infotechit.net,+ 91 989-100-0445,,,,,,,,,"Data and Analytics, Design, Navigation and Mapping, Professional Services, Software","CAD, Consulting, Geospatial, Mapping Services, Web Development",,,,,,,,,,"New Delhi, Delhi, India",$100M to $500M,2010-01-01,year,,https://www.linkedin.com/company/infotechgeo/
Behncke,https://www.crunchbase.com/organization/behncke-28de,51-100,Active,https://behncke.de/,info@behncke.de,+49 511 70835-0,,,,,,,,,"Design, Manufacturing, Science and Engineering, Software","CAD, Manufacturing, Mechanical Engineering",,,,,80906,USD,80906,,,"Hanover, Niedersachsen, Germany",$1M to $10M,1920-01-01,year,,https://www.linkedin.com/company/behncke-gruppe/
Ultimate Events,https://www.crunchbase.com/organization/ultimate-events,101-250,Active,https://www.ue-mn.com,kmoore@ue-mn.com,+1  763 559 8368,,,,,,,,,"Commerce and Shopping, Design, Events, Media and Entertainment, Professional Services, Software","CAD, Consulting, Events, Rental",,,,,168362,USD,168362,,,"Plymouth, North Carolina, United States",$1M to $10M,1972-01-01,year,,https://www.linkedin.com/company/ultimate-events-mn
Silicon Engineering Consultants Limited,https://www.crunchbase.com/organization/silicon-engineering-consultants-limited,51-100,Active,http://www.siliconec.co.nz,info@siliconec.co.nz,+642102967467,,,,,,,,,"Design, Other, Professional Services, Real Estate, Software","Architecture, B2B, CAD, Consulting",,,,,,,,,,"Auckland, Auckland, New Zealand",,2004-04-01,month,,https://www.linkedin.com/in/silicon-engineering-consultants-ltd-a5a166142/
Whitecode Consulting,https://www.crunchbase.com/organization/whitecode-consulting,51-100,Active,https://www.whitecode.co.uk/,,+44 1322 289 977,,,,,,,,,"Design, Hardware, Professional Services, Real Estate, Software","CAD, Construction, Consulting, Mechanical Design",,,,,265560,USD,265560,,,"Northfleet, Kent, United Kingdom",$1M to $10M,1994-01-01,year,,https://www.linkedin.com/company/whitecode-consulting-ltd/
Bryan Industries,https://www.crunchbase.com/organization/bryan-industries,51-100,Active,https://www.bryanindustries.com.au,admin@bryanindustries.com.au,+61 07 4959 1381,,,,,,,,,"Commerce and Shopping, Design, Manufacturing, Science and Engineering, Software","CAD, Chemical, Manufacturing, Rental",,,,,,,,,,"Mackay, Queensland, Australia",$1M to $10M,1996-01-01,year,,https://www.linkedin.com/company/bryan-industries-pty-ltd
Torrenza Mould,https://www.crunchbase.com/organization/torrenza-mould,101-250,Active,https://www.torrenzamould.com,info@torrenzamould.com,91-98256 96108,,,,,,,,,"Design, Manufacturing, Software","CAD, Industrial, Manufacturing",,,,,,,,,,"Ahmedabad, Gujarat, India",$1M to $10M,,,,https://www.linkedin.com/company/torrenza-mould-craft-pvt-ltd
Swansoft,https://www.crunchbase.com/organization/swansoft-7c08,101-250,Active,http://www.swansc.com/,support@swansc.com,86-25-51862150,,,,,,,,,"Design, Software","CAD, Simulation, Software",0,2,,Machines and machine tools,,,,,,"Nanjing, Jiangsu, China",,2006-01-01,day,,https://www.linkedin.com/company/斯沃
Aeroteck Design,https://www.crunchbase.com/organization/aeroteck-design,51-100,Active,http://www.aerotekdesign.co.uk/,info@aerotekdesign.co.uk,+44-117-941-5820,,,,,,,,,"Design, Hardware, Information Technology, Software","CAD, Information Technology, Mechanical Design",,,,,70295,USD,70295,,,"Bristol, Bristol, City of, United Kingdom",$1M to $10M,,,,
Suqun Group,https://www.crunchbase.com/organization/suqun-group,501-1000,Active,https://www.sq-corp.com,raymond.hu@sq-corp.com,+86 136 8086 4695,,,,,,,,,"Design, Hardware, Manufacturing, Software","3D Technology, CAD, Industrial, Manufacturing",,,,,,,,,,"Qishi, Guangdong, China",,2011-01-01,year,,https://www.linkedin.com/company/suqun-corporation
Geototal Pro,https://www.crunchbase.com/organization/geototal-pro,51-100,Active,https://geototal.com.pl/,biuro@geototal.com.pl,+48 914341167,,,,,,,,,"Design, Hardware, Other, Real Estate, Science and Engineering, Software","3D Technology, CAD, Construction, Infrastructure, Laser",,,,,,,,,,"Szczecin, Zachodniopomorskie, Poland",Less than $1M,2001-08-21,day,,
Acan Machine,https://www.crunchbase.com/organization/acan-machine,101-250,Active,https://www.acanmachine.com,acanmakine@gmail.com,+90 5326032288,,,,,,,,,"Design, Manufacturing, Science and Engineering, Software","CAD, Industrial, Manufacturing, Mechanical Engineering",,,,,,,,,,"Çorlu, Tekirdag, Turkey",$10M to $50M,2004-01-01,year,,https://www.linkedin.com/showcase/acan-briquetting-machine
Butterfield Signs,https://www.crunchbase.com/organization/butterfield-signs,101-250,Active,http://butterfieldsigns.com,enquiries@butterfieldsigns.co.uk,+44 0 1274 722 244,,,,,,,,,"Advertising, Design, Manufacturing, Sales and Marketing, Software","Advertising, CAD, Digital Signage, Graphic Design, Industrial Manufacturing, Manufacturing, Sales",,,,,914830,USD,914830,,,"Bradford, Bradford, United Kingdom",$10M to $50M,1927-01-01,year,,https://www.linkedin.com/company/butterfield-signs-ltd
Fablink Toolspec,https://www.crunchbase.com/organization/fablink-toolspec,51-100,Active,https://toolspec.co.uk,info@toolspec.co.uk,+44 01582 572 626,,,,,,,,,"Design, Manufacturing, Software","CAD, Industrial, Manufacturing",,,,,196353,USD,196353,,,"Luton, Bedfordshire, United Kingdom",$1M to $10M,1961-01-01,year,,https://www.linkedin.com/company/toolspec-manufacturing-ltd
Wenzhou Xingye Machinery Equipment Co.,https://www.crunchbase.com/organization/wenzhou-xingye-machinery-equipment-co,51-100,Active,https://www.duoqipacking.com,xingyemachinery@duoqi.com,+86 152 5771 8888,,,,,,,,,"Design, Manufacturing, Software","CAD, Industrial, Machinery Manufacturing, Manufacturing",,,,,,,,,,"Wenzhou, Zhejiang, China",,1988-01-01,year,,https://www.linkedin.com/company/wenzhou-xingye-machinery-equipment-co-ltd
Promho Energy,https://www.crunchbase.com/organization/promho-energy,51-100,Active,https://promho.com,admin@promho.com,+91 44 43210100,,,,,,,,,"Design, Manufacturing, Science and Engineering, Software","CAD, Industrial, Industrial Engineering",,,,,,,,,,"Chennai, Tamil Nadu, India",,2019-01-01,year,,https://www.linkedin.com/company/promho
R-Techno,https://www.crunchbase.com/organization/r-techno,251-500,Active,https://www.r-techno.co.jp,rt-info@r-techno.co.jp,+81 42 571 3891,,,,,,,,,"Design, Education, Other, Software","CAD, Commercial, Training",,,,,,,,,,"Kunitachi, Tokyo, Japan",,1995-04-01,month,,https://www.linkedin.com/company/r-techno-co--ltd-
Arsaatech Services,https://www.crunchbase.com/organization/arsaatech-services,101-250,Active,https://arsaatech.com,info@arsaatech.com,+91 9090822120,,,,,,,,,"Design, Education, Hardware, Information Technology, Professional Services, Software","CAD, Consumer Software, Hardware, Information Technology, Recruiting, Software, Training, Web Development",,,,,,,,,,"Bhubaneshwar, Orissa, India",$1M to $10M,2014-01-01,year,,https://www.linkedin.com/company/arsaatech-services-pvt-ltd
Kupron,https://www.crunchbase.com/organization/kupron,51-100,Active,https://kupron.nl,sales@kupron.nl,+31 46 452 7525,,,,,,,,,"Design, Manufacturing, Software","CAD, Manufacturing, Plastics and Rubber Manufacturing, Product Design",,,,,367517,USD,367517,,,"Sittard, Limburg, The Netherlands",$10M to $50M,1985-01-01,year,,https://www.linkedin.com/company/kupron-prototypes-b.v.
1Vorteil,https://www.crunchbase.com/organization/1vorteil,51-100,Active,https://1vorteil.com,contact@1vorteil.com,+91 9890814711,,,,,,,,,"Design, Manufacturing, Science and Engineering, Software","3D Printing, CAD, Civil Engineering",,,,,,,,,,"Pune, Maharashtra, India",$1M to $10M,2015-01-01,year,,https://www.linkedin.com/company/1vorteil
Ezy-Fit Engineering Group,https://www.crunchbase.com/organization/ezy-fit-engineering-group,51-100,Active,https://www.ezyfit.com.au,brad@ezyfiteng.com.au,+61 8 8281 0955,,,,,,,,,"Design, Government and Military, Information Technology, Manufacturing, Software","CAD, Manufacturing, Military",,,,,,,,,,"Salisbury, South Australia, Australia",$1M to $10M,1993-01-01,year,,https://www.linkedin.com/company/ezy-fit-engineering-group/
