Organization Name,Organization Name URL,Number of Employees,Operating Status,Website,Contact Email,Phone Number,Number of Portfolio Organizations,Number of Investments,Number of Lead Investments,Number of Diversity Investments,Accelerator Program Type,Accelerator Application Deadline,Accelerator Duration (in weeks),Number of Alumni,Industry Groups,Industries,IPqwery - Patents Granted,IPqwery - Trademarks Registered,IPqwery - Most Popular Patent Class,IPqwery - Most Popular Trademark Class,Aberdeen - IT Spend,Aberdeen - IT Spend Currency,Aberdeen - IT Spend Currency (in USD),Number of Private Notes,Tags,Headquarters Location,Estimated Revenue Range,Founded Date,Founded Date Precision,Top 5 Investors,LinkedIn
Riot Games,https://www.crunchbase.com/organization/riot-games,1001-5000,Active,http://www.riotgames.com,iletisim@riotgames.com,424-231-1111,19,24,7,2,,,,,"Consumer Electronics, Gaming, Hardware, Software","Computer, Developer Platform, PC Games, Video Games",36,243,Sports; Games; Amusements,Education; entertainment,100651340,USD,100651340,,,"Los Angeles, California, United States",$10B+,2006-01-01,year,"Tencent, HAX, Benchmark, FirstMark",http://www.linkedin.com/company/riot-games
Devon Energy Corporation,https://www.crunchbase.com/organization/devon-energy-corporation,10001+,Active,https://www.devonenergy.com,webinar@navexglobal.com,405-235-3611,1,1,1,,,,,,"Energy, Natural Resources, Software","Developer Platform, Energy, Oil and Gas",11,14,Earth Drilling; Mining,Scientific and technological services,492894893,USD,492894893,,,"Oklahoma City, Oklahoma, United States",$10B+,1971-01-01,year,,http://www.linkedin.com/company/6848
Veolia Environmental Solutions,https://www.crunchbase.com/organization/veolia-environmental-solutions,10001+,Active,https://www.veolia.com/fr,olivier.tridon@veolia.com,+33-1-71750000,,,,,,,,,"Energy, Information Technology, Other, Professional Services, Software, Sustainability","Developer Platform, Energy Management, Innovation Management, Management Information Systems, Service Industry, Waste Management",8,24,Testing,Advertising; business,1001646558,USD,1001646558,,,"Paris, Ile-de-France, France",$10B+,1853-12-14,day,,https://www.linkedin.com/company/veolia-environnement/
UI Bakery,https://www.crunchbase.com/organization/ui-bakery,11-50,Active,https://uibakery.io,hello@uibakery.io,+1 (415) 670-90-34,,,,,,,,,"Apps, Information Technology, Software","Apps, Developer Platform, Developer Tools, Information Services, Information Technology, Web Apps, Web Development",,,,,13915,USD,13915,,,"Lakewood, Colorado, United States",$10B+,2018-12-12,day,,https://www.linkedin.com/company/uibakery
Paramount Group,https://www.crunchbase.com/organization/paramount-group,5001-10000,Active,http://www.paramountgroup.biz/,info@paramountgroup.com,27 11 086 6800,,,,,,,,,"Design, Science and Engineering, Software","Aerospace, Developer Platform, Product Design",,,,,,,,,,"Gauteng, NA - South Africa, South Africa",$10B+,1994-01-01,year,,https://www.linkedin.com/company/paramount-group_2
PTC,https://www.crunchbase.com/organization/parametric-technology,5001-10000,Active,http://www.ptc.com,info@ptc.com,+1 (781) 370-5000,4,4,1,,,,,,"Design, Hardware, Information Technology, Internet Services, Software","3D Technology, CAD, Developer Platform, Enterprise Software, Information Technology, Internet of Things, Product Design, Software",117,74,Computing; Calculating,Scientific and electric apparatus and instruments,,,,,,"Boston, Massachusetts, United States",$1B to $10B,1985-01-01,year,"Rockwell Automation, Bosch Capital",http://www.linkedin.com/company/ptc
BioMarin Pharmaceutical,https://www.crunchbase.com/organization/biomarin-pharmaceutical,1001-5000,Active,https://www.biomarin.com,info@bmrn.nl,415-506-6700,,,,,,,,,"Biotechnology, Science and Engineering, Software","Biotechnology, Developer Platform",227,95,Medical Or Veterinary Science; Hygiene,"Pharmaceutical, veterinary and sanitary products",45491575,USD,45491575,,,"San Rafael, California, United States",$1B to $10B,1997-03-01,month,,http://www.linkedin.com/company/biomarin
Boosted Commerce,https://www.crunchbase.com/organization/boosted-commerce,51-100,Active,https://boostedcommerce.com/,acquisitions@boostedcommerce.com,,,,,,,,,,"Commerce and Shopping, Professional Services, Software","Business Development, Developer Platform, E-Commerce",,,,,92134,USD,92134,,,"Los Angeles, California, United States",$1B to $10B,2019-01-01,year,"25madison, Crosscut Ventures, Torch Capital, Spencer Rascoff, Marc Mezvinsky",https://www.linkedin.com/company/boostedcommerce/
Pocket Network,https://www.crunchbase.com/organization/pocket-network,51-100,Active,https://www.pokt.network,hola@pokt.network,,,,,,,,,,"Blockchain and Cryptocurrency, Financial Services, Information Technology, Other, Payments, Software","Blockchain, Cryptocurrency, Developer Platform, Infrastructure, IT Infrastructure, Software",0,0,,Scientific and technological services,466111,USD,466111,,,"Tampa, Florida, United States",$1B to $10B,2017-02-01,day,"Arrington XRP Capital, Borderless Capital, Decentral Park Capital, Mechanism Capital, Placeholder",https://www.linkedin.com/company/pocket-network/
Penumbra,https://www.crunchbase.com/organization/penumbra,5001-10000,Active,http://penumbrainc.com,info@penumbrainc.com,5107483232,,,,,,,,,"Biotechnology, Health Care, Science and Engineering, Software","Biotechnology, Developer Platform, Medical Device",,,,,29964051,USD,29964051,,,"Alameda, California, United States",$1B to $10B,2004-01-01,year,The Halo Fund,https://www.linkedin.com/company/penumbra-inc
Liberty Oilfield Services,https://www.crunchbase.com/organization/liberty-oilfield-services,501-1000,Active,https://www.libertyenergy.com/,sales@libertyfrac.com,303-515-2800,3,3,2,,,,,,"Energy, Natural Resources, Software, Sustainability","Developer Platform, Energy, Natural Resources, Oil and Gas",53,0,Earth Drilling; Mining,Building; repairs,187867866,USD,187867866,,,"Denver, Colorado, United States",$1B to $10B,2011-01-01,year,,https://www.linkedin.com/company/liberty-oilfield-services
Epic Games,https://www.crunchbase.com/organization/epic-games-2,1001-5000,Active,http://www.epicgames.com,pr@epicgames.com,(919) 854-0070,26,28,12,1,,,,,"Gaming, Media and Entertainment, Software","Developer Platform, Gaming, Metaverse, Software, Video Games",17,341,Computing; Calculating,Scientific and electric apparatus and instruments,276376950,USD,276376950,,,"Cary, North Carolina, United States",$1B to $10B,1991-01-01,year,"Fidelity, The Walt Disney Company, Stableton Financial, Tencent, AXiomatic",https://www.linkedin.com/company/epic-games
THQ Nordic,https://www.crunchbase.com/organization/nordic-games,51-100,Active,https://www.thqnordic.com/,lwingefors@thqnordic.com,43 720 51879 0,1,1,1,,,,,,"Gaming, Information Technology, Software","Developer Platform, Information Technology, Video Games",,,,,2738826,USD,2738826,,,"Vienna, Wien, Austria",$1B to $10B,2011-01-01,year,,https://www.linkedin.com/company/nordic-games-gmbh/
Unity,https://www.crunchbase.com/organization/unity-technologies,5001-10000,Active,https://unity.com,info@unity3d.com,+1 (415) 539-3162,2,2,1,,,,,,"Apps, Hardware, Media and Entertainment, Mobile, Software","Augmented Reality, Developer Platform, Metaverse, Mobile Apps, Virtual Reality",,,,,126083,USD,126083,,,"San Francisco, California, United States",$1B to $10B,2004-08-02,day,"Silver Lake, Thrive Capital, Sequoia Capital, DFJ Growth, Canada Pension Plan Investment Board",http://www.linkedin.com/company/unity-technologies
Radiant Entertainment,https://www.crunchbase.com/organization/radiant-entertainment,11-50,Active,http://www.radiant-entertainment.com/,contact@radiant-entertainment.com,,,,,,,,,,"Gaming, Software","Developer Platform, Gaming, PC Games",0,1,,Scientific and electric apparatus and instruments,457560,USD,457560,,,"Los Altos, California, United States",$1B to $10B,2013-01-01,year,"Andreessen Horowitz, General Catalyst, LVP",
GlobalLogic,https://www.crunchbase.com/organization/globallogic,10001+,Active,http://www.globallogic.com,privacy@globallogic.com,0911202585721,,,,,,,,,"Design, Information Technology, Software","Developer Platform, Information Technology, Product Design, Software",3,10,Electric Communication Technique,Scientific and technological services,445696280,USD,445696280,,,"San Jose, California, United States",$1B to $10B,2000-01-01,year,"Canada Pension Plan Investment Board, New Enterprise Associates, Peak XV Partners",http://www.linkedin.com/company/globallogic
Microsemi,https://www.crunchbase.com/organization/microsemi-corporation,5001-10000,Active,http://www.microsemi.com/,,(800)713-4113,2,3,2,,,,,,"Design, Hardware, Science and Engineering, Software","Developer Platform, Semiconductor, Web Design",206,33,Electric Communication Technique,Scientific and electric apparatus and instruments,102597854,USD,102597854,,,"Aliso Viejo, California, United States",$1B to $10B,1960-01-01,year,,https://www.linkedin.com/company/microsemi
GoTo Meeting,https://www.crunchbase.com/organization/gotomeeting,1001-5000,Active,https://www.goto.com/meeting,press@goto.com,617-279-2443,,,,,,,,,"Hardware, Information Technology, Internet Services, Messaging and Telecommunications, Software","Developer Platform, Software, Video Conferencing",13,48,Electric Communication Technique,Scientific and technological services,100305287,USD,100305287,,,"Boston, Massachusetts, United States",$1B to $10B,2004-01-01,year,,https://www.linkedin.com/company/goto
Barr Laboratories,https://www.crunchbase.com/organization/barr-laboratories,10001+,Closed,http://www.barrlabs.com/,,+972 3-914-8171,,,,,,,,,"Biotechnology, Health Care, Manufacturing, Science and Engineering, Software","Biotechnology, Developer Platform, Manufacturing, Pharmaceutical",,,,,323926111,USD,323926111,,,"Pomona, New York, United States",$1B to $10B,2003-01-01,year,,https://www.linkedin.com/company/5239
Mott MacDonald,https://www.crunchbase.com/organization/mott-macdonald-d436,5001-10000,Active,https://www.mottmac.com/hungary,albania@mottmac.com,+355 0 44 540 775,,,,,,,,,"Other, Professional Services, Software","Consulting, Developer Platform, Professional Services, Software",,,,,,,,,,"Tirana, Tirane, Albania",$1B to $10B,1902-01-01,year,,https://www.linkedin.com/company/mott-macdonald/
Studio Moderna,https://www.crunchbase.com/organization/studio-moderna,1001-5000,Active,http://www.studio-moderna.com,info@studio-moderna.com,41-91-966-95-44,,,,,,,,,"Commerce and Shopping, Internet Services, Software","Developer Platform, E-Commerce, Marketplace, Social Network",8,20,Land Vehicles For Travelling Otherwise Than On Rails,Vehicles,95241129,USD,95241129,,,"Cadempino, Ticino, Switzerland",$1B to $10B,1992-01-01,year,"Franklin Templeton, Insight Partners, JH Partners, General Atlantic",http://www.linkedin.com/company/22371
Ruralco Holdings,https://www.crunchbase.com/organization/ruralco-holdings,1001-5000,Closed,http://ruralco.com.au,asomann-crawford@ruralco.com.au,61 3 6235 1412,,,,,,,,,"Agriculture and Farming, Software","Agriculture, Developer Platform, Farming",0,6,,Clothing; footwear; headgear,,,,,,"Hobart Town, Tasmania, Australia",$1B to $10B,1865-01-01,year,,
Carsem,https://www.crunchbase.com/organization/carsem,5001-10000,Active,https://carsem.com,,+60 5 3123333,,,,,,,,,"Administrative Services, Data and Analytics, Design, Manufacturing, Software","Developer Platform, Manufacturing, Market Research, Packaging Services",,,,,,,,,,"Ipoh, Perak, Malaysia",$1B to $10B,1972-01-01,year,,https://www.linkedin.com/company/carsem/
campusCATALYST,https://www.crunchbase.com/organization/campuscatalyst,5001-10000,Active,https://www.campuscatalyst.uchicago.edu/,,,,,,,,,,,"Community and Lifestyle, Education, Other, Professional Services, Software","Communities, Consulting, Developer Platform, Education, Service Industry",,,,,815945,USD,815945,,,"Chicago, Illinois, United States",$1B to $10B,1890-01-01,year,,https://www.linkedin.com/company/uchicago
Comtech Telecommunications,https://www.crunchbase.com/organization/comtech-telecommunications,501-1000,Active,http://www.comtechtel.com,,6319627001,,,,,,,,,"Hardware, Information Technology, Manufacturing, Sales and Marketing, Software","Developer Platform, Information Technology, Manufacturing, Public Relations, Telecommunications",72,17,Electric Communication Technique,Scientific and electric apparatus and instruments,38834412,USD,38834412,,,"Melville, New York, United States",$500M to $1B,1967-01-01,year,"Magnetar Capital, U.S. Department of Defense, White Hat Capital Partners, 9-1-1 Association of Central Oklahoma Governments",http://www.linkedin.com/company/comtech-telecommunications-corp
Lynas Rare Earths Ltd,https://www.crunchbase.com/organization/lynas-corporation-ltd,501-1000,Active,https://www.lynasrareearths.com,general@lynascorp.com,+61 8 6241 3800,,,,,,,,,"Manufacturing, Natural Resources, Sales and Marketing, Software","Developer Platform, Manufacturing, Mining, Mining Technology, Precious Metals, Sales",4,4,,Chemical substances,,,,,,"Perth, Western Australia, Australia",$500M to $1B,1983-05-25,day,"Australian Government, Hancock Prospecting, Business.gov.au, JARE",https://www.linkedin.com/company/lynas-rare-earths-ltd
Animoca Brands,https://www.crunchbase.com/organization/animoca-brands-corporation,101-250,Active,https://www.animocabrands.com,press@animocabrands.com,+852 2534 0888,293,322,126,12,,,,,"Apps, Blockchain and Cryptocurrency, Gaming, Media and Entertainment, Other, Software","Apps, Blockchain, Casual Games, Developer Platform, Metaverse, Video Games",0,12,,Scientific and electric apparatus and instruments,,,,,,"Cyberport, Hong Kong Island, Hong Kong",$500M to $1B,2014-01-01,year,"Hashed, Ubisoft, Mirae Asset, ThunderCore, Outlier Ventures",https://www.linkedin.com/company/animoca-brands
Soft Machines,https://www.crunchbase.com/organization/soft-machines,51-100,Closed,http://smachines.com,smi-info@smachines.com,14089690378,,,,,,,,,"Hardware, Science and Engineering, Software","Developer Platform, Mechanical Engineering, Semiconductor",44,0,Computing; Calculating,,1588242,USD,1588242,,,"Santa Clara, California, United States",$500M to $1B,2006-01-01,year,"AMD, Samsung Electronics, Samsung Ventures, Russian Venture Company, OneAngstrom",http://www.linkedin.com/company/soft-machines
Infinite Computer Solutions,https://www.crunchbase.com/organization/infinite-computer-solutions,5001-10000,Active,https://www.infinite.com,corporate-marketing@infinite.com,+91 80 4193 0000,,,,,,,,,"Blockchain and Cryptocurrency, Data and Analytics, Hardware, Information Technology, Internet Services, Other, Professional Services, Science and Engineering, Software","Blockchain, Business Intelligence, Cloud Infrastructure, Consulting, Developer Platform, IT Infrastructure, Quality Assurance, Software, Software Engineering",3,5,,Scientific and technological services,39489343,USD,39489343,,,"Rockville, Maryland, United States",$500M to $1B,1999-01-01,year,,https://www.linkedin.com/company/infinite-computer-solutions
Finch,https://www.crunchbase.com/organization/finch,51-100,Active,http://www.finch.com,lee.roquet@finch.com,208-721-3428,,,,,,,,,"Commerce and Shopping, Data and Analytics, Information Technology, Sales and Marketing, Software","Business Information Systems, Business Intelligence, Developer Platform, Digital Marketing, E-Commerce, Marketing Automation, Social Media Marketing",0,3,,Advertising; business,,,,,,"Salt Lake City, Utah, United States",$500M to $1B,2009-07-01,day,Boathouse Capital,https://www.linkedin.com/company/finch-llc
DSI®,https://www.crunchbase.com/organization/data-systems-international,251-500,Active,https://www.dsiglobal.com/welcome/,info@dsiglobal.com,(800) 217-8030,,,,,,,,,"Apps, Internet Services, Mobile, Software, Transportation","Cloud Computing, Developer Platform, Enterprise Software, Mobile, Mobile Apps, PaaS, SaaS, Software, Supply Chain Management",3,11,Computing; Calculating,Scientific and technological services,68204537,USD,68204537,,,"Kansas City, Missouri, United States",$500M to $1B,1979-01-01,year,Quan Technology Fund,https://www.linkedin.com/company/data-systems-international-%C2%AE/
SHIFT,https://www.crunchbase.com/organization/shift-4,1001-5000,Active,http://www.shiftinc.jp/,info@shiftinc.jp,+81 120-142-117,3,3,,,,,,,"Information Technology, Privacy and Security, Professional Services, Science and Engineering, Software","Developer Platform, Enterprise Software, Network Security, Quality Assurance, Software, Software Engineering",,,,,,,,,,"Tokyo, Tokyo, Japan",$500M to $1B,2005-09-01,day,"Works Applications, Mitsui & Co, DNX Ventures, NTT DOCOMO Ventures, Mistletoe",https://www.linkedin.com/company/shiftincjp
Wuxi Hua Dong Heavy Machinery,https://www.crunchbase.com/organization/wuxi-hua-dong-heavy-machinery,501-1000,Active,http://www.hdhm.com/,web@hdhm.com,86 510 8562 8888,,,,,,,,,"Manufacturing, Science and Engineering, Software","Advanced Materials, Developer Platform, Manufacturing",,,,,,,,,,"Wuxi, Anhui, China",$500M to $1B,2004-01-01,year,"Vertex Ventures, JD Capital, Vertex Ventures China",https://www.linkedin.com/company/wuxi-huadong-heavy-machinery-co-ltd-
Docker,https://www.crunchbase.com/organization/docker,251-500,Active,https://www.docker.com,info@docker.com,(415) 941-0376,,,,,,,,,"Information Technology, Software","Developer Platform, Developer Tools, Information Technology, Software",0,41,,Scientific and electric apparatus and instruments,,,,,,"Palo Alto, California, United States",$100M to $500M,2013-10-01,month,"The Family, Vertex Ventures, AME Cloud Ventures, Trinity Ventures, Citi Ventures",https://www.linkedin.com/company/docker
OutSystems,https://www.crunchbase.com/organization/outsystems,1001-5000,Active,https://www.outsystems.com,info@outsystems.com,617 837 6840,,,,,,,,,"Data and Analytics, Information Technology, Software","Data Integration, Developer Platform, Developer Tools, DevOps, PaaS, SaaS, Software",0,1,,Scientific and technological services,24310761,USD,24310761,,,"Boston, Massachusetts, United States",$100M to $500M,2001-01-01,year,"Guidepost Growth Equity, Goldman Sachs, Canada Pension Plan Investment Board, GS Growth, Armilar Venture Partners",https://www.linkedin.com/company/outsystems
Aptean,https://www.crunchbase.com/organization/Aptean,1001-5000,Active,http://www.aptean.com,info@aptean.com,(855)411-2783,,,,,,,,,Software,"Developer Platform, Enterprise Software, Software",,,,,,,,,,"Indianapolis, Indiana, United States",$100M to $500M,1992-01-01,year,"TA Associates, Charlesbank Capital Partners, Insight Partners, Thoma Bravo, Vista Equity Partners",https://www.linkedin.com/company/aptean
Coveo,https://www.crunchbase.com/organization/coveo,251-500,Active,http://www.coveo.com/,info@coveo.com,(418) 263-1111,,,,,,,,,"Artificial Intelligence (AI), Data and Analytics, Information Technology, Internet Services, Science and Engineering, Software","Artificial Intelligence (AI), Developer Platform, Enterprise Software, Information Technology, Search Engine",5,5,,Scientific and technological services,6674159,USD,6674159,,,"Quebec, Quebec, Canada",$100M to $500M,2005-01-01,year,"BDC Venture Capital, Fonds de solidarité FTQ, Access Capital, Investissement Quebec, BDC Capital Corporation",http://www.linkedin.com/company/coveo/
Karma Automotive,https://www.crunchbase.com/organization/karma-automotive,501-1000,Active,https://www.karmaautomotive.com/,,949-629-7502,,,,,,,,,"Manufacturing, Software, Transportation","Automotive, Developer Platform, Manufacturing",175,55,Vehicles In General,Vehicles,5448263,USD,5448263,,,"Irvine, California, United States",$100M to $500M,2014-01-01,year,Northern Lights Foundation,https://www.linkedin.com/company/karma-automotive-llc
Identiv,https://www.crunchbase.com/organization/identiv,251-500,Active,http://www.identiv.com,info@identive-group.com,01524 840112,1,1,1,,,,,,"Hardware, Information Technology, Internet Services, Privacy and Security, Software","Cyber Security, Developer Platform, Hardware, Identity Management, Internet of Things, Network Security, NFC, RFID, Security",3,6,Computing; Calculating,Scientific and electric apparatus and instruments,8059703,USD,8059703,,,"Fremont, California, United States",$100M to $500M,1990-01-01,year,"Western Technology Investment, Mountain Partners, Reference Capital SA, Dr. Cornelius Boersch",http://www.linkedin.com/company/identiv
NEAR,https://www.crunchbase.com/organization/near-f896,51-100,Active,https://near.org/,hello@nearprotocol.com,,14,14,5,2,,,,,"Blockchain and Cryptocurrency, Information Technology, Other, Software","Blockchain, Developer Platform, Information Services, Information Technology, Software",,,,,,,,,,"San Francisco, California, United States",$100M to $500M,2017-01-01,year,"Hashed, Greenfield, Amber Group, Dragonfly, Three Arrows Capital",https://www.linkedin.com/company/near-protocol/
Apollo GraphQL,https://www.crunchbase.com/organization/apollo-3,101-250,Active,http://www.apollographql.com,team@apollographql.com,415-787-0532,,,,,,,,,Software,"Developer APIs, Developer Platform, Developer Tools, Enterprise Software, Open Source, Software",1,13,,Scientific and technological services,7561950,USD,7561950,,,"San Francisco, California, United States",$100M to $500M,2016-01-01,year,"DCVC, Neythri Futures Fund, Next47, Trinity Ventures, Andreessen Horowitz",https://www.linkedin.com/company/apollo-graphql
Spectranetics,https://www.crunchbase.com/organization/spectranetics,501-1000,Active,http://spectranetics.com/,careers@spnc.com,(719) 265-7518,,,,,,,,,"Health Care, Manufacturing, Software","Developer Platform, Health Care, Manufacturing, Medical, Medical Device",,,,,10066022,USD,10066022,,,"Colorado Springs, Colorado, United States",$100M to $500M,1980-01-01,year,"MidCap Financial, Novo Ventures, Silicon Valley Bank",http://www.linkedin.com/company/spectranetics
Immersive Labs,https://www.crunchbase.com/organization/immersive-labs-2,251-500,Active,https://immersivelabs.com,enquiries@immersivelabs.com,+44 20 3893 9101,,,,,,,,,"Information Technology, Privacy and Security, Software","Cyber Security, Developer Platform, Developer Tools, Network Security",0,0,Computing; Calculating,,17126815,USD,17126815,,,"Bristol, Bristol, City of, United Kingdom",$100M to $500M,2017-01-09,day,"Summit Partners, Goldman Sachs Asset Management, Goldman Sachs, Citi Ventures, Ten Eleven Ventures",https://www.linkedin.com/company/immersive-labs-limited
Copado,https://www.crunchbase.com/organization/copado,501-1000,Active,https://www.copado.com/,,,,,,,,,,,"Information Technology, Other, Software","Collaboration, Developer Platform, Developer Tools, DevOps, IT Management, Software",5,2,Computing; Calculating,Scientific and technological services,237458,USD,237458,,,"Chicago, Illinois, United States",$100M to $500M,2013-01-01,year,"Lead Edge Capital, Isai, IBM Ventures, Insight Partners, DG VENTURES",https://www.linkedin.com/company/copado-solutions-s.l/
Ourpalm,https://www.crunchbase.com/organization/ourpalm,5001-10000,Active,http://ourpalm.com,hr@ourpalm.com,86 10 6507 3699,8,8,4,,,,,,"Gaming, Mobile, Software","Developer Platform, Gaming, Mobile",0,6,,Scientific and electric apparatus and instruments,,,,,,"Beijing, Beijing, China",$100M to $500M,1996-06-10,day,"Tencent, Sequoia Capital China, GoldStone",https://www.linkedin.com/company/ourpalm-co-ltd
B-Soft,https://www.crunchbase.com/organization/b-soft,5001-10000,Closed,http://www.bsoft.com.cn,,0571-88217878,,,,,,,,,"Health Care, Information Technology, Software","Developer Platform, Enterprise Software, Health Care, Information Technology, Management Information Systems, Software",,,,,,,,,,"Hangzhou, Zhejiang, China",$100M to $500M,1997-01-01,year,"Philips, Intel Capital, Zhejiang Paradise, Zhejiang Venture Capital",https://www.linkedin.com/company/%E5%88%9B%E4%B8%9A%E8%BD%AF%E4%BB%B6%E8%82%A1%E4%BB%BD%E6%9C%89%E9%99%90%E5%85%AC%E5%8F%B8/about/
Petainer,https://www.crunchbase.com/organization/petainer,501-1000,Active,http://www.petainer.com/,enquiries@petainer.com,+49 172 5647623,,,,,,,,,"Administrative Services, Design, Manufacturing, Software","Developer Platform, Manufacturing, Packaging Services, Plastics and Rubber Manufacturing, Product Design",23,4,"Opening, Closing Or Cleaning Bottles, Jars Or Similar Containers","Rubber and plastic goods; packing, stopping and insulating materials",83681,USD,83681,,,"London, England, United Kingdom",$100M to $500M,1983-01-01,year,"Kohlberg Kravis Roberts, Alpina Partners, Next Wave Partners",https://www.linkedin.com/company/petainer
Sernova,https://www.crunchbase.com/organization/sernova,51-100,Active,http://sernova.com,info@sernova.com,1-877-299-4603,,,,,,,,,"Biotechnology, Health Care, Science and Engineering, Software","Biotechnology, Developer Platform, Health Care, Therapeutics",11,0,Medical Or Veterinary Science; Hygiene,,244668,USD,244668,,,"London, Ontario, Canada",$100M to $500M,1998-08-19,day,Gravitas Securities,https://www.linkedin.com/company/sernova-corp.
Survey Monkey,https://www.crunchbase.com/organization/survey-monkey,1001-5000,Active,https://surveymonkey.com,support@surveymonkey.com,,,,,,,,,,Software,"Developer Platform, SaaS, Software",,,,,46903050,USD,46903050,,,"San Mateo, California, United States",$100M to $500M,1998-01-01,year,,https://www.linkedin.com/company/surveymonkey/
Making Fun,https://www.crunchbase.com/organization/making-fun,11-50,Active,https://makingfun.com,contact@makingfun.com,5103945564,,,,,,,,,"Content and Publishing, Gaming, Media and Entertainment, Software","Developer Platform, Gaming, Publishing",0,9,,Scientific and electric apparatus and instruments,272993,USD,272993,,,"Oakland, California, United States",$100M to $500M,2009-01-01,year,,https://www.linkedin.com/company/making-fun-inc.
