Nexworld,https://www.crunchbase.com/organization/nexworld,51-100,Active,https://nexworld.fr/,contact@nexworld.fr,+33 1 40 54 32 90,,,,,,,,,"Information Technology, Internet Services, Professional Services, Real Estate, Software","Architecture, Consulting, Developer APIs, Information Technology, Internet of Things",,,,,,,,,,"Paris, Ile-de-France, France",$10M to $50M,2010-01-01,year,,https://www.linkedin.com/company/nexworld/
Engage MIS,https://www.crunchbase.com/organization/engage-mis,101-250,Active,https://engagesmis.com,info@engagesmis.com,+44 1935 403000,,,,,,,,,"Education, Information Technology, Software","Developer APIs, Education, Management Information Systems, Software",,,,,,,,,,"Yeovil, Somerset, United Kingdom",$10M to $50M,1987-01-01,year,,https://www.linkedin.com/company/double-first-ltd/
ClicTest,https://www.crunchbase.com/organization/clictest,101-250,Active,https://www.clictest.com,info@clictest.com,+44 208 090 2404,,,,,,,,,"Hardware, Information Technology, Internet Services, Other, Software","Cloud Infrastructure, Developer APIs, Information Technology, Small and Medium Businesses, Software",,,,,2601779,USD,2601779,,,"Hayes, Hillingdon, United Kingdom",$10M to $50M,2013-01-01,year,,https://www.linkedin.com/company/clictest/
Ken Cook,https://www.crunchbase.com/organization/ken-cook-04f1,11-50,Active,https://kencook.com,info@kencook.com,+1 414 466 6060,,,,,,,,,"Content and Publishing, Media and Entertainment, Professional Services, Software","Content Creators, Developer APIs, Printing, Translation Service",,,,,944674,USD,944674,,,"New Berlin, Wisconsin, United States",$10M to $50M,1944-01-01,year,,https://www.linkedin.com/company/kencookco/
Order Dragon,https://www.crunchbase.com/organization/order-dragon,11-50,Active,http://orderdragon.com,info@orderdragon.com,,,,,,,,,,"Commerce and Shopping, Financial Services, Internet Services, Payments, Software","Developer APIs, E-Commerce, Internet, Payments",,,,,,,,,,"London, England, United Kingdom",$10M to $50M,2014-07-09,day,,
OpenClove,https://www.crunchbase.com/organization/openclove,11-50,Closed,http://www.openclove.com,marketing@openclove.com,+1-469-713-6736,,,,,,,,,"Hardware, Information Technology, Internet Services, Media and Entertainment, Messaging and Telecommunications, Mobile, Software, Video","Cloud Computing, Communications Infrastructure, Developer APIs, Messaging, Mobile, Software, Video, VoIP",,,,,,,,,,"Frisco, Texas, United States",$10M to $50M,2010-01-01,year,,http://www.linkedin.com/company/openclove
Taxnexus,https://www.crunchbase.com/organization/taxnexus,1-10,Active,https://www.taxnexus.net,info@taxnexus.net,510-679-1900,,,,,,,,,"Community and Lifestyle, Financial Services, Food and Beverage, Health Care, Professional Services, Software","Accounting, Cannabis, Compliance, Developer APIs, Financial Services",,,,,349294,USD,349294,,,"Berkeley, California, United States",$10M to $50M,2018-04-09,day,,https://www.linkedin.com/company/18580728/
Logicon Systems,https://www.crunchbase.com/organization/logicon-systems,51-100,Active,https://logiconsystems.com/,info@logiconsystems.com,+44 20 37 93 25 72,,,,,,,,,"Information Technology, Internet Services, Professional Services, Sales and Marketing, Software, Transportation","Cloud Computing, CRM, Developer APIs, Innovation Management, Logistics, Software",,,,,1066477,USD,1066477,,,"Chessington, Surrey, United Kingdom",$10M to $50M,,,,
Cocoa Controls,https://www.crunchbase.com/organization/cocoa-controls,1-10,Active,https://www.cocoacontrols.com,info@cocoacontrols.com,,,,,,,,,,"Apps, Mobile, Platforms, Software","Apps, Developer APIs, iOS",,,,,,,,,,"Seattle, Washington, United States",$10M to $50M,,,,
High Ridge Futures,https://www.crunchbase.com/organization/high-ridge-futures,101-250,Active,http://www.highridgefutures.com/company/,clientservices@highridgefutures.com,1.312.453.8305,,,,,,,,,"Financial Services, Lending and Investments, Software","Developer APIs, Financial Services, Trading Platform",,,,,1512815,USD,1512815,,,"Chicago, Illinois, United States",$10M to $50M,,,,https://www.linkedin.com/in/richard-dematteo-ab104051/
AviationValues,https://www.crunchbase.com/organization/aviationvalues,51-100,Active,https://aviationvalues.com,info@aviationvalues.com,+44 20 0333 1104,,,,,,,,,"Data and Analytics, Software","Analytics, Database, Developer APIs",,,,,,,,,,"Salisbury, Wiltshire, United Kingdom",$10M to $50M,2019-01-01,year,,http://www.linkedin.com/company/vvaviation
Nomad,https://www.crunchbase.com/organization/epnomad,1-10,Active,https://epnomad.github.io/,erpreid@gmail.com,9252002003,,,,,,,,,"Artificial Intelligence (AI), Data and Analytics, Hardware, Science and Engineering, Software","Artificial Intelligence (AI), Computer Vision, Developer APIs, Machine Learning",,,,,,,,,,"Danville, California, United States",$10M to $50M,2016-01-01,year,,https://www.linkedin.com/company/15162340/
Brainforth,https://www.crunchbase.com/organization/brainforth,11-50,Active,https://brainforth.com,contacto@brainforth.com,+52 55 5014 9930,,,,,,,,,"Apps, Mobile, Software","Developer APIs, Mobile Apps, Software, Web Development",,,,,,,,,,"Mexico City, Distrito Federal, Mexico",$10M to $50M,2019-01-01,year,,https://www.linkedin.com/company/brainforth/
WeSuki,https://www.crunchbase.com/organization/wesuki,11-50,Active,https://www.wesuki.com,support@wesuki.com,+1 703 884 1234,,,,,,,,,"Information Technology, Professional Services, Software","Developer APIs, Information Services, Information Technology, Management Consulting, Software",,,,,561632,USD,561632,,,"Fairfax, Virginia, United States",$10M to $50M,2009-01-01,year,,https://www.linkedin.com/company/wesuki/
Side-Walk,https://www.crunchbase.com/organization/side-walk,11-50,Active,https://side-walk.dk/,hello@side-walk.dk,+45 7-196-1066,,,,,,,,,"Internet Services, Professional Services, Sales and Marketing, Software","Consulting, Developer APIs, Digital Marketing, SEO",,,,,,,,,,"Randers, Midtjylland, Denmark",$10M to $50M,2005-01-01,year,,https://www.linkedin.com/company/side-walk-dk/
CloudSpark,https://www.crunchbase.com/organization/cloudspark,1-10,Active,http://www.cloudspark.com.au,enquiries@cloudspark.com.au,+14154098137,,,,,,,,,"Internet Services, Mobile, Other, Platforms, Software","Android, B2B, Cloud Computing, Developer APIs, SaaS, Software, Web Development",,,,,,,,,,"Fawkner, Victoria, Australia",$10M to $50M,2010-06-01,day,,https://www.linkedin.com/company/cloud-spark
HexaLyze,https://www.crunchbase.com/organization/hexalyze,51-100,Active,https://hexalyze.com,info@hcsgroup.io,+92 02138888900,,,,,,,,,Software,"Developer APIs, Enterprise Resource Planning (ERP), Software, Web Development",,,,,,,,,,"Karachi, Sindh, Pakistan",$10M to $50M,2016-01-01,year,,https://www.linkedin.com/company/hexalyze
Voxeo Labs,https://www.crunchbase.com/organization/voxeo-labs,51-100,Closed,http://voxeolabs.com/,,,,,,,,,,,"Hardware, Other, Software","Communications Infrastructure, Developer APIs, Real Time",,,,,59144100,USD,59144100,,,"Menlo Park, California, United States",$10M to $50M,,,,
OpenSocial Foundation,https://www.crunchbase.com/organization/opensocial-foundation,11-50,Closed,http://OpenSocial.org,,,,,,,,,,,"Internet Services, Software","Developer APIs, Search Engine",,,,,,,,,,"Palo Alto, California, United States",$10M to $50M,2007-11-13,day,,
OSAM,https://www.crunchbase.com/organization/osam-d9a8,101-250,Active,https://osam.io,hello@osam.io,+84 024 22165050,,,,,,,,,"Information Technology, Internet Services, Software","Cloud Computing, Cloud Data Services, Cloud Management, Developer APIs",,,,,,,,,,"Hanoi, NA - Vietnam, Vietnam",$10M to $50M,2017-01-01,year,,https://www.linkedin.com/company/osam.io
Intersoft,https://www.crunchbase.com/organization/intersoft-9001,51-100,Active,https://www.intersoft.de/,info@intersoft.de,+49 40-808-1080,,,,,,,,,"Information Technology, Professional Services, Software","Consulting, Developer APIs, IT Infrastructure, Software",0,5,,Scientific and electric apparatus and instruments,,,,,,"Hamburg, Hamburg, Germany",$10M to $50M,1990-01-01,year,,https://www.linkedin.com/company/intersoft-ag/
YangbentongPIM,https://www.crunchbase.com/organization/yangbentongpim,,Active,https://yangbentong.com,hello@ivymobi.com,86-400-926-4236,,,,,,,,,"Information Technology, Software","Developer APIs, Information Technology",,,,,,,,,,"Beijing, Beijing, China",$10M to $50M,2013-01-01,year,,https://www.linkedin.com/company/%E6%A0%B7%E6%9C%AC%E9%80%9A
Yagna Technologies,https://www.crunchbase.com/organization/yagna-technologies,11-50,Active,http://yagna-tech.com,info@yagna-tech.com,91 81066 73536,,,,,,,,,"Apps, Design, Information Technology, Mobile, Sales and Marketing, Software","Developer APIs, Digital Marketing, Information Technology, Mobile Apps, UX Design",,,,,,,,,,"Hyderabad, Andhra Pradesh, India",$10M to $50M,,,,https://www.linkedin.com/company/yagna-technologies-private-limited
Creative Software Solutions,https://www.crunchbase.com/organization/creative-software-solutions-7178,11-50,Active,https://www.creativesoftwareinc.com,,+1 612 546 0527,,,,,,,,,"Design, Information Technology, Privacy and Security, Professional Services, Software","Developer APIs, Information Technology, Network Security, Outsourcing, Software, Web Design",,,,,370358,USD,370358,,,"Columbia, Maryland, United States",$10M to $50M,1999-01-01,year,,
Microquery,https://www.crunchbase.com/organization/microquery,101-250,Active,http://www.microquery.com,info@microquery.com,+44 0 20 3198 4455,,,,,,,,,"Data and Analytics, Information Technology, Software","Business Intelligence, Developer APIs, Information Technology, Software",,,,,1080109,USD,1080109,,,"London, England, United Kingdom",$10M to $50M,2010-01-01,year,,https://www.linkedin.com/company/microquery-limited/
Flexy,https://www.crunchbase.com/organization/flexy-9cb2,11-50,Active,https://www.flexy.com.br,atendimento@flexy.com.br,+55 4830252124,,,,,,,,,"Commerce and Shopping, Internet Services, Other, Software","B2B, Developer APIs, E-Commerce Platforms",,,,,,,,,,"Florianópolis, Santa Catarina, Brazil",$10M to $50M,2012-01-01,year,,https://www.linkedin.com/company/flexy-ecommerce
CyberPlat,https://www.crunchbase.com/organization/cyberplat,11-50,Closed,https://cyberplat.in,business@cyberplat.in,91 022 6687 4605,,,,,,,,,"Financial Services, Information Technology, Mobile, Payments, Software","Developer APIs, Information Technology, Mobile Payments, Software",,,,,,,,,,"Mumbai, Maharashtra, India",$10M to $50M,2009-01-01,year,,https://www.linkedin.com/company/cyberplat-india
Equipo TIC XXI,https://www.crunchbase.com/organization/equipo-tic-xxi,101-250,Active,https://www.equipo.es,equipo@equipo.es,+34 91 506 37 23,,,,,,,,,"Information Technology, Software","Developer APIs, Information Technology, IT Infrastructure, Software",,,,,,,,,,"Madrid, Distrito Especial, Colombia",$10M to $50M,2005-01-01,year,,https://www.linkedin.com/company/equipo-tic-xxi/
Hire Dedicated Programmers,https://www.crunchbase.com/organization/hire-dedicated-programmers,51-100,Active,https://hirededicatedprogrammers.com,info@hirededicatedprogrammers.com,919884064007,,,,,,,,,"Apps, Data and Analytics, Information Technology, Mobile, Software","Data Integration, Developer APIs, Developer Platform, Mobile Apps",,,,,,,,,,"Chennai, Tamil Nadu, India",$10M to $50M,2001-01-01,year,,https://www.linkedin.com/company/hirededicatedprogrammers-com
PlayShare,https://www.crunchbase.com/organization/playshare,1-10,Active,https://webcameron-playshare.appspot.com/,wm_disposable@outlook.com,,,,,,,,,,"Apps, Information Technology, Internet Services, Messaging and Telecommunications, Software","Developer APIs, File Sharing, Messaging, Software, Unified Communications, Video Chat, Web Apps",,,,,,,,,,"Atlanta, Georgia, United States",$10M to $50M,2018-08-13,day,,https://www.linkedin.com/company/playshare/
Parabolic Drugs,https://www.crunchbase.com/organization/parabolic-drugs,101-250,Active,https://parabolicdrugs.com/,,91 1762308635,,,,,,,,,"Health Care, Manufacturing, Software","Developer APIs, Manufacturing, Pharmaceutical",1,0,Organic Chemistry,,,,,,,"Chandigarh, Chandigarh, India",$10M to $50M,1996-01-01,day,,https://www.linkedin.com/company/parabolic-drugs/
Rocker,https://www.crunchbase.com/organization/rocker-5a28,1-10,Active,https://rocker.io,sales@rocker.io,+1 859-654-7625,,,,,,,,,"Apps, Information Technology, Mobile, Professional Services, Software","Consulting, Developer APIs, Information Technology, Mobile Apps, Risk Management, Web Apps",,,,,1404737,USD,1404737,,,"Lexington, Kentucky, United States",$10M to $50M,2015-01-01,year,,https://www.linkedin.com/company/rockerllc
Check Online,https://www.crunchbase.com/organization/check-online,1-10,Active,https://check-online.com.ua/,info@check-online.com.ua,+380 93-467-01-02,,,,,,,,,"Professional Services, Software","Consulting, Developer APIs, SaaS, Software",,,,,,,,,,"Kyiv, Kyyiv, Ukraine",$10M to $50M,2020-01-01,year,,https://www.linkedin.com/company/check-online/
Nutraplus India,https://www.crunchbase.com/organization/nutraplus-india,11-50,Active,http://nutraplusindia.com/,info@nutraplusindia.com,022-40140442,,,,,,,,,"Biotechnology, Manufacturing, Science and Engineering, Software","Biotechnology, Chemical, Developer APIs, Manufacturing",,,,,,,,,,"Mumbai, Maharashtra, India",$10M to $50M,1990-01-01,day,,https://www.linkedin.com/company/nutraplus-products-india-ltd
Valorise Telecom,https://www.crunchbase.com/organization/valorise-telecom,1-10,Active,http://valorisetelecom.com,infos@valorisetelecom.com,225 2244 0251,,,,,,,,,"Hardware, Internet Services, Messaging and Telecommunications, Software","Developer APIs, SMS, Telecommunications",,,,,,,,,,"Abidjan, Lagunes, Côte d'Ivoire",$10M to $50M,2007-01-01,year,,https://www.linkedin.com/company/valorise-telecom---ediattah-group
AVIAOK,https://www.crunchbase.com/organization/aviaok,101-250,Active,https://www.aviaok.com,info@aviaok.com,+7 863 431 17 70,,,,,,,,,"Manufacturing, Science and Engineering, Software","Aerospace, Developer APIs, Industrial Engineering, Manufacturing, Web Development",,,,,,,,,,"Taganrog, Rostov, Russian Federation",$10M to $50M,1998-01-01,year,,https://www.linkedin.com/company/aviaok-international
Quickbooks Connector,https://www.crunchbase.com/organization/quickbooks-connector,51-100,Active,https://www.quickbooksconnector.com,,,,,,,,,,,"Data and Analytics, Information Technology, Software","Data Integration, Developer APIs, Software",,,,,730145,USD,730145,,,"Brandon, Manitoba, Canada",$10M to $50M,,,,
Podcast Index,https://www.crunchbase.com/organization/podcast-index,1-10,Active,https://podcastindex.org,info@podcastindex.org,,,,,,,,,,"Apps, Media and Entertainment, Music and Audio, Software","Apps, Developer APIs, Developer Tools, Podcast",,,,,,,,,,"Port Townsend, Washington, United States",$10M to $50M,,,,https://www.linkedin.com/company/podcast-index
Salt Security,https://www.crunchbase.com/organization/saltsecurity,101-250,Active,https://salt.security,contact@salt.security,+1 (650) 254-6580,,,,,,,,,"Artificial Intelligence (AI), Data and Analytics, Information Technology, Privacy and Security, Science and Engineering, Software","Artificial Intelligence (AI), Cyber Security, Developer APIs, Machine Learning",1,1,Electric Communication Technique,Scientific and electric apparatus and instruments,2187967,USD,2187967,,,"Palo Alto, California, United States",$1M to $10M,2018-01-01,year,"Advent Technologies, Sequoia Capital, Y Combinator, CapitalG, DFJ Growth",https://www.linkedin.com/company/saltsecurity
Lob,https://www.crunchbase.com/organization/lob,101-250,Active,https://lob.com,support@lob.com,,,,,,,,,,"Administrative Services, Health Care, Sales and Marketing, Software, Transportation","Courier Service, Developer APIs, Health Care, Marketing, SaaS, Shipping, Software",7,2,Computing; Calculating,Scientific and electric apparatus and instruments,3066487,USD,3066487,,,"San Francisco, California, United States",$1M to $10M,2013-01-01,year,"Polaris Partners, Floodgate, Y Combinator, Frontline Ventures, Ludlow Ventures",http://www.linkedin.com/company/lob
Hasura,https://www.crunchbase.com/organization/hasura,101-250,Active,http://hasura.io/,suuport@hasura.io,,,,,,,,,,"Hardware, Internet Services, Software","Cloud Infrastructure, Developer APIs, Developer Tools, Open Source, Software",,,,,20121935,USD,20121935,,,"Bangalore, Karnataka, India",$1M to $10M,2017-01-01,year,"Nexus Venture Partners, Vertex Ventures, Lightspeed Venture Partners, Vertex Ventures US, STRIVE",https://www.linkedin.com/company/hasura/
M2P Fintech,https://www.crunchbase.com/organization/m2p-fintech,1001-5000,Active,https://www.m2pfintech.com,hello@m2pfintech.com,91 44-40554808,1,1,1,,,,,,"Financial Services, Mobile, Payments, Software","Developer APIs, Financial Services, FinTech, Mobile Payments, Payments",,,,,,,,,,"Chennai, Tamil Nadu, India",$1M to $10M,2014-01-01,year,"Visa, Flourish Ventures, Better Capital, Anicut Capital, Insight Partners",https://www.linkedin.com/company/m2pfintech/
Cequence Security,https://www.crunchbase.com/organization/cequence-security,101-250,Active,https://www.cequence.ai,info@cequence.ai,+1 650-437-6338,,,,,,,,,"Apps, Information Technology, Privacy and Security, Sales and Marketing, Software","App Discovery, Cloud Security, Cyber Security, Developer APIs, Network Security, Security, Software",12,2,Electric Communication Technique,Scientific and electric apparatus and instruments,,,,,,"Sunnyvale, California, United States",$1M to $10M,2014-01-01,year,"HarbourVest Partners, Telstra Ventures, Touchdown Ventures, TriplePoint Capital, Dell Technologies Capital",https://www.linkedin.com/company/cequence-security
DuploCloud,https://www.crunchbase.com/organization/duplocloud,51-100,Active,https://duplocloud.com,info@duplocloud.net,+1 866-830-6588,,,,,,,,,"Information Technology, Internet Services, Professional Services, Software","Cloud Computing, Compliance, Developer APIs, DevOps, IT Infrastructure, SaaS",,,,,,,,,,"San Jose, California, United States",$1M to $10M,2018-01-01,month,"StepStone Group, Westbridge Capital, Monta Vista Capital, Mayfield Fund",https://www.linkedin.com/company/duplocloud
Stream,https://www.crunchbase.com/organization/getstream-io,101-250,Active,https://getstream.io/,sales@getstream.io,,,,,,,,,,"Apps, Hardware, Information Technology, Internet Services, Messaging and Telecommunications, Mobile, Software","Communications Infrastructure, Developer APIs, Messaging, Mobile Apps, SaaS, Software",0,0,,Scientific and technological services,2269060,USD,2269060,,,"Boulder, Colorado, United States",$1M to $10M,2014-08-01,day,"Notable Capital, Techstars, Right Side Capital Management, Arthur Ventures, Social Starts",http://www.linkedin.com/company/getstream-io
Qloo,https://www.crunchbase.com/organization/qloo,11-50,Active,http://www.qloo.com,help@qloo.com,212 3003477,,,,,,,,,"Artificial Intelligence (AI), Commerce and Shopping, Data and Analytics, Design, Science and Engineering, Software","Artificial Intelligence (AI), Consumer Research, Developer APIs, Machine Learning, Personalization",1,2,Computing; Calculating,Scientific and technological services,527100,USD,527100,,,"New York, New York, United States",$1M to $10M,2012-01-01,year,"AXA Venture Partners, Eldridge Industries, Moderne Ventures, Jaws Ventures, Leonardo DiCaprio",https://www.linkedin.com/company/qloo
Lula,https://www.crunchbase.com/organization/lula,101-250,Active,https://www.lula.com,michael@lula.is,(786) 550-2218,,,,,,,,,"Financial Services, Software","Developer APIs, FinTech, Insurance",0,5,,Scientific and electric apparatus and instruments,138558,USD,138558,,,"Miami, Florida, United States",$1M to $10M,2020-08-01,month,"SoftBank, Flexport, Shrug Capital, Khosla Ventures, Karman Ventures (fka Moving Capital)",https://www.linkedin.com/company/lula
Solo.io,https://www.crunchbase.com/organization/solo-io,101-250,Active,https://www.solo.io,hello@solo.io,,,,,,,,,,"Apps, Internet Services, Software","Apps, Cloud Computing, Developer APIs, Internet, Software",0,1,,Scientific and electric apparatus and instruments,2205600,USD,2205600,,,"Cambridge, Massachusetts, United States",$1M to $10M,2017-09-01,month,"Haystack, WestWave Capital, Redpoint, True Ventures, Quiet Capital",https://www.linkedin.com/company/solo.io
Qredo,https://www.crunchbase.com/organization/qredo,101-250,Active,https://qredo.com/,info@qredo.com,+44 1394825764,3,3,,,,,,,"Blockchain and Cryptocurrency, Financial Services, Information Technology, Other, Payments, Privacy and Security, Software","Blockchain, Cryptocurrency, Cyber Security, Developer APIs, FinTech",1,2,Electric Communication Technique,Scientific and technological services,2525999,USD,2525999,,,"London, England, United Kingdom",$1M to $10M,2018-01-01,year,"Figment, Coinbase, Deribit, Quantstamp, Terra",https://www.linkedin.com/company/qredo
Symbl.ai,https://www.crunchbase.com/organization/rammer-ai,51-100,Active,https://symbl.ai,founders@symbl.ai,+1 408 660 0710,,,,,,,,,"Artificial Intelligence (AI), Data and Analytics, Information Technology, Science and Engineering, Software","Artificial Intelligence (AI), Developer APIs, Generative AI, Information Technology",,,,,486249,USD,486249,,,"Seattle, Washington, United States",$1M to $10M,2018-05-05,day,"Techstars, SkyDeck Berkeley, GreatPoint Ventures, TechNexus Venture Collaborative, Crosscut Ventures",https://www.linkedin.com/company/symblai/
Ribbon Health,https://www.crunchbase.com/organization/ribbonhealth,101-250,Active,http://www.ribbonhealth.com,founders@ribbonhealth.com,,,,,,,,,,"Artificial Intelligence (AI), Data and Analytics, Health Care, Mobile, Software","Analytics, Developer APIs, Health Care, mHealth, Predictive Analytics",,,,,670950,USD,670950,,,"New York, New York, United States",$1M to $10M,2016-01-01,year,"Andreessen Horowitz, Dorm Room Fund, General Catalyst, Core Innovation Capital, Rock Health Capital",https://www.linkedin.com/company/ribbonhealth/
Smartcar,https://www.crunchbase.com/organization/smartcar,101-250,Active,https://smartcar.com,hello@smartcar.com,+1 669 222 1144,,,,,,,,,"Financial Services, Software, Transportation","Automotive, Developer APIs, Electric Vehicle, InsurTech, Software",5,0,Computing; Calculating,,859500,USD,859500,,,"Mountain View, California, United States",$1M to $10M,2015-01-01,month,"Andreessen Horowitz, Energize Capital, New Enterprise Associates",https://www.linkedin.com/company/smartcar
Mechanical Orchard,https://www.crunchbase.com/organization/mechanical-orchard,11-50,Active,https://www.mechanical-orchard.com/,info@mechanical-orchard.com,+1 415 212-8709,,,,,,,,,"Information Technology, Internet Services, Software","Cloud Data Services, Developer APIs, DevOps, IT Infrastructure, Software",0,0,,Scientific and technological services,121360,USD,121360,,,"San Francisco, California, United States",$1M to $10M,2022-10-17,day,"Emergence, Industry Ventures, Bloomberg Beta, Webb Investment Network, Spider Capital",https://www.linkedin.com/company/mechanical-orchard
Privy,https://www.crunchbase.com/organization/privy-4265,11-50,Active,https://www.privy.io/,,,,,,,,,,,"Blockchain and Cryptocurrency, Information Technology, Internet Services, Privacy and Security, Software","Cyber Security, Developer APIs, Web3",0,1,,Advertising; business,,,,,,"New York, New York, United States",$1M to $10M,2021-01-01,year,"BlueYard Capital, Sequoia Capital, Archetype, Paradigm",https://www.linkedin.com/company/privyio
Flinks,https://www.crunchbase.com/organization/flinks,101-250,Active,https://flinks.com,,+1 800-610-8104,,,,,,,,,"Apps, Data and Analytics, Financial Services, Lending and Investments, Mobile, Software","Analytics, Asset Management, Banking, Big Data, Developer APIs, Financial Services, FinTech, Mobile Apps",2,1,,Scientific and technological services,571972,USD,571972,,,"Montréal, Quebec, Canada",$1M to $10M,2016-01-01,year,"National Bank of Canada, Inovia Capital, Luge Capital, Intact Ventures, Conconi Growth Partners",https://www.linkedin.com/company/flinkstech
Turnkey,https://www.crunchbase.com/organization/turnkey-c221,11-50,Active,https://www.turnkey.io/,,,,,,,,,,,"Blockchain and Cryptocurrency, Financial Services, Information Technology, Other, Payments, Privacy and Security, Software","Blockchain, Cryptocurrency, Cyber Security, Developer APIs",,,,,,,,,,"New York, New York, United States",$1M to $10M,2022-01-01,year,"Lightspeed Faction, Alchemy, Galaxy Digital, Gemini, Sequoia Capital",https://www.linkedin.com/company/turnkeyhq
Truv,https://www.crunchbase.com/organization/citadel-verifications-simplified,51-100,Active,https://www.truv.com/,team@citadelid.com,,,,,,,,,,"Data and Analytics, Financial Services, Information Technology, Software","Data Integration, Developer APIs, FinTech, Information Technology, Software",,,,,,,,,,"San Francisco, California, United States",$1M to $10M,2020-06-01,month,"Abstract Ventures, Soma Capital, Nyca Partners, Chapter One Ventures, Kleiner Perkins",https://www.linkedin.com/company/truvhq/
vivenu,https://www.crunchbase.com/organization/vivenu,101-250,Active,https://vivenu.com,,,,,,,,,,,"Events, Media and Entertainment, Other, Software","B2B, Developer APIs, Enterprise Software, Event Management, Events, SaaS, Ticketing",,,,,473592,USD,473592,,,"Düsseldorf, Nordrhein-Westfalen, Germany",$1M to $10M,2018-04-01,month,"redalpine, Activant Capital, Aurum Partners, Balderton Capital, Chris Schagen",https://www.linkedin.com/company/30145516
Kubecost,https://www.crunchbase.com/organization/kubecost,11-50,Active,https://kubecost.com/,team@kubecost.com,,,,,,,,,,"Information Technology, Software","Developer APIs, Information Technology, IT Infrastructure, Software",0,1,,Scientific and electric apparatus and instruments,,,,,,"San Francisco, California, United States",$1M to $10M,2019-01-01,year,"Afore Capital, Coatue, First Round Capital, Oldslip, Ben Porterfield",https://www.linkedin.com/company/stackwatch/
