Ibidex,https://www.crunchbase.com/organization/ibidex,1-10,Active,http://www.ibidex.com,info@ibidex.com,+44 20 7193 5805,,,,,,,,,"Gaming, Software","Developer Platform, Gaming, Video Games",,,,,,,,,,"London, England, United Kingdom",$1M to $10M,2014-08-01,day,,https://www.linkedin.com/company/ibidex
Mixamo,https://www.crunchbase.com/organization/mixamo,11-50,Active,http://mixamo.com,contact@mixamo.com,415-255-7455,,,,,,,,,"Commerce and Shopping, Software","Developer Platform, Online Auctions, Software",5,0,Computing; Calculating,,189549,USD,189549,,,"San Francisco, California, United States",$1M to $10M,2008-07-18,day,"Keynote Ventures, Granite Ventures",https://www.linkedin.com/company/mixamo
LifeCell,https://www.crunchbase.com/organization/lifecell,501-1000,Closed,http://www.lifecell.com,,9089471200,,,,,,,,,"Biotechnology, Health Care, Science and Engineering, Software","Biotechnology, Developer Platform, Therapeutics",251,52,Medical Or Veterinary Science; Hygiene,"Pharmaceutical, veterinary and sanitary products",9944324,USD,9944324,,,"Bridgewater, New Jersey, United States",$1M to $10M,1986-01-01,year,Essex Woodlands Healthcare Partners,
Pangea Mobile,https://www.crunchbase.com/organization/pangea-mobile,11-50,Active,http://pangeamobile.com/,accounts@pangeamobile.com,,,,,,,,,,"Gaming, Mobile, Software","Developer Platform, Gaming, Mobile",,,,,,,,,,"San Francisco, California, United States",$1M to $10M,2013-01-01,year,Jin Song Gao,https://www.linkedin.com/company/pangea-mobile
Anboto Labs,https://www.crunchbase.com/organization/anboto-labs,11-50,Active,https://anboto.xyz/,,,,,,,,,,,"Blockchain and Cryptocurrency, Financial Services, Lending and Investments, Other, Payments, Software","Blockchain, Cryptocurrency, Developer Platform, Trading Platform",,,,,,,,,,"Singapore, Central Region, Singapore",$1M to $10M,2021-11-23,day,"Mechanism Capital, XBTO Group, Ryze Labs, Kronos Research, Cherry Ventures",https://www.linkedin.com/company/anboto-labs/
Apphud,https://www.crunchbase.com/organization/apphud,11-50,Active,https://apphud.com,hi@apphud.com,,,,,,,,,,"Data and Analytics, Mobile, Other, Platforms, Software","Analytics, Developer Platform, Developer Tools, iOS, SaaS, Subscription Service",,,,,,,,,,"San Francisco, California, United States",$1M to $10M,2019-08-07,day,,https://linkedin.com/company/apphud
Infinity Games,https://www.crunchbase.com/organization/infinity-games,11-50,Active,https://infinitygames.io,support@infinitygames.io,,,,,,,,,,"Clothing and Apparel, Content and Publishing, Design, Gaming, Media and Entertainment, Software","Casual Games, Developer Platform, Fashion, Gaming, Publishing",0,1,,Scientific and electric apparatus and instruments,173476,USD,173476,,,"Odivelas, Beja, Portugal",$1M to $10M,2014-01-01,year,,https://www.linkedin.com/company/88infinity-games/
Resumedia,https://www.crunchbase.com/organization/resumedia,11-50,Active,https://resumedia.com/,hello@resumedia.com,+31 20-261-6731,,,,,,,,,"Science and Engineering, Software","Developer Platform, Developer Tools, Software, Software Engineering",,,,,151068,USD,151068,,,"Amsterdam, Noord-Holland, The Netherlands",$1M to $10M,,,,https://www.linkedin.com/company/resumediabv/
"Ningbo Jus Internet Technology Co., Ltd.",https://www.crunchbase.com/organization/ningbo-jus-internet-technology-co-ltd,11-50,Active,https://justalk.com/,support@justalk.com,,,,,,,,,,"Apps, Mobile, Software","Developer Platform, Enterprise Software, Mobile Apps, Software",0,8,,Scientific and electric apparatus and instruments,,,,,,"Ningbo, Zhejiang, China",$1M to $10M,2016-06-21,day,,http://linkedin.com/company/justalkapp
SuperPlanet Games,https://www.crunchbase.com/organization/superplanet-games,11-50,Active,https://www.superplanet.net,biz@superplanet.net,,,,,,,,,,"Gaming, Mobile, Platforms, Software","Android, Developer Platform, Gaming",,,,,,,,,,"Yeoksamdong, Seoul-t'ukpyolsi, South Korea",$1M to $10M,2016-01-01,year,Quad Ventures,
APIMatic,https://www.crunchbase.com/organization/apimatic,11-50,Active,http://apimatic.io,info@apimatic.io,,,,,,,,,,Software,"Developer APIs, Developer Platform, Enterprise Software, Software",0,0,Computing; Calculating,,,,,,,"Auckland, Auckland, New Zealand",$1M to $10M,2014-01-01,year,"New Zealand Venture Investment Fund, Global from Day One, Sparkbox Ventures, Chintaka Ranatunga",https://www.linkedin.com/company/apimatic-limited/
OpenJS Foundation,https://www.crunchbase.com/organization/open-js-foundation,11-50,Active,https://openjsf.org,info@openjsf.org,415 723 9709,,,,,,,,,"Administrative Services, Other, Social Impact, Software","Association, Developer Platform, Developer Tools, Non Profit, Project Management, Software",0,32,,Scientific and electric apparatus and instruments,77499,USD,77499,,,"San Francisco, California, United States",$1M to $10M,2015-02-01,day,,https://www.linkedin.com/company/openjs-foundation/
CyDex Pharmaceuticals,https://www.crunchbase.com/organization/cydex-pharmaceuticals,11-50,Active,http://www.captisol.com/,cdinfo@cydexpharma.com,877-575-5593,,,,,,,,,"Biotechnology, Health Care, Science and Engineering, Software","Biotechnology, Developer Platform, Pharmaceutical",83,13,Medical Or Veterinary Science; Hygiene,Chemical substances,126662,USD,126662,,,"San Diego, California, United States",$1M to $10M,1993-01-01,year,,https://www.linkedin.com/company/cydex-pharmaceuticals-inc-/
Altostra,https://www.crunchbase.com/organization/altostra,11-50,Active,https://www.altostra.com,info@altostra.com,,,,,,,,,,"Hardware, Information Technology, Internet Services, Software","Cloud Computing, Cloud Infrastructure, Cloud Management, Developer Platform, Developer Tools, Software",,,,,,,,,,"Palo Alto, California, United States",$1M to $10M,2019-07-01,day,"Google for Startups, UpWest, WestWave Capital",https://www.linkedin.com/company/altostra/
FINOS,https://www.crunchbase.com/organization/finos-foundation,1-10,Active,https://www.finos.org/,info@finos.org,+1 (650) 665-9773,,,,,,,,,"Financial Services, Information Technology, Lending and Investments, Software","Banking, Developer Platform, Finance, Financial Services, FinTech, Information Technology, Software, Web Development",,,,,251998,USD,251998,,,"Burlingame, California, United States",$1M to $10M,2018-04-24,day,,https://www.linkedin.com/company/finosfoundation
Nethopper.io,https://www.crunchbase.com/organization/nethopper-io,11-50,Active,https://www.nethopper.io,nethopper@nethopper.io,+1 (617) 819-8009,,,,,,,,,"Information Technology, Internet Services, Software","Cloud Management, Developer Platform, DevOps, SaaS",,,,,,,,,,"Boston, Massachusetts, United States",$1M to $10M,2021-10-27,day,,https://www.linkedin.com/company/72204784/admin/
Lodestar,https://www.crunchbase.com/organization/lodestar-ae84,11-50,Active,https://www.lodestar.ai,info@lodestar.ai,,,,,,,,,,"Artificial Intelligence (AI), Data and Analytics, Hardware, Science and Engineering, Software","Artificial Intelligence (AI), Computer Vision, Developer Platform, Machine Learning, Software",1,0,,Scientific and electric apparatus and instruments,,,,,,"San Jose, California, United States",$1M to $10M,2019-08-01,month,,https://www.linkedin.com/company/lodestar-ai
Inc-Query,https://www.crunchbase.com/organization/inc-query,51-100,Active,https://www.inc-query.com/,info@inc-query.com,,,,,,,,,,"Data and Analytics, Design, Other, Sales and Marketing, Software","Developer Platform, Market Research, Professional Services, Public Relations, Software",0,4,,Scientific and technological services,281163,USD,281163,,,"Chicago, Illinois, United States",$1M to $10M,2016-01-01,year,,https://www.linkedin.com/company/inc-query
ION Design,https://www.crunchbase.com/organization/ion-design,1-10,Active,http://iondesign.com/,hello@iondesign.com,(201) 313-5553,,,,,,,,,"Design, Health Care, Software","Developer Platform, Medical Device, Product Design",,,,,,,,,,"Edgewater, New Jersey, United States",$1M to $10M,1994-01-01,year,,https://www.linkedin.com/company/ion-design-
Screenly,https://www.crunchbase.com/organization/screenly-inc,11-50,Active,https://www.screenly.io,support@screenly.io,,,,,,,,,,"Sales and Marketing, Software","Developer Platform, Developer Tools, Digital Signage",,,,,325124,USD,325124,,,"San Francisco, California, United States",$1M to $10M,2011-01-01,year,,https://www.linkedin.com/company/screenly-inc
Armasight,https://www.crunchbase.com/organization/armasight,11-50,Active,http://armasight.com,info@armasight.com,4803934882,,,,,,,,,"Consumer Goods, Manufacturing, Science and Engineering, Software","Aerospace, Developer Platform, Eyewear, Manufacturing",,,,,82105,USD,82105,,,"South San Francisco, California, United States",$1M to $10M,2011-01-01,year,,https://www.linkedin.com/company/flir-systems
Automorph,https://www.crunchbase.com/organization/automorph,1-10,Active,https://www.automorph.com,,,,,,,,,,,"Artificial Intelligence (AI), Data and Analytics, Manufacturing, Science and Engineering, Software","Artificial Intelligence (AI), Developer APIs, Developer Platform, Developer Tools, Industrial Automation, Machine Learning, Software",,,,,,,,,,"London, England, United Kingdom",$1M to $10M,2017-01-01,month,Zeroth.AI,https://www.linkedin.com/company/automorph
Gopher,https://www.crunchbase.com/organization/gopher-3,,Closed,https://www.gopher.email/,john@example.com,,,,,,,,,,"Apps, Information Technology, Internet Services, Messaging and Telecommunications, Software","Developer Platform, Email, Web Apps",,,,,,,,,,"San Jose, California, United States",$1M to $10M,1991-01-01,year,Y Combinator,
Outspark,https://www.crunchbase.com/organization/outspark,11-50,Closed,http://www.outspark.com,info@outspark.com,,,,,,,,,,"Community and Lifestyle, Gaming, Internet Services, Software","Communities, Developer Platform, Gaming, Internet, Leisure, Online Games, Video Games",0,2,,Education; entertainment,,,,,,"San Francisco, California, United States",$1M to $10M,2007-01-01,year,"Tencent, DCM Ventures, Altos Ventures, Syncom Venture Partners, SBI Asset Management",
Scorrers Football,https://www.crunchbase.com/organization/scorrers,11-50,Active,http://www.scorrers.com,ivan@scorrers.com,+44 207 729 6442,,,,,,,,,"Content and Publishing, Media and Entertainment, Software","Developer Platform, Digital Entertainment, Publishing",,,,,62485,USD,62485,,,"London, England, United Kingdom",$1M to $10M,2015-11-11,day,"Ivan Ilecic, Ivan Rakitic, Anthony Webb, Philip Milton",https://www.linkedin.com/company/inscorre
uCertify,https://www.crunchbase.com/organization/ucertify,101-250,Active,https://www.ucertify.com/,support@ucertify.com,415-763-6300,,,,,,,,,"Education, Software","Developer Platform, E-Learning, EdTech",0,1,,Scientific and electric apparatus and instruments,287391,USD,287391,,,"Livermore, California, United States",$1M to $10M,2004-01-01,year,,https://www.linkedin.com/company/ucertify-com/
Encision,https://www.crunchbase.com/organization/encision,51-100,Active,http://encision.com,info@encison.com,3034442693,,,,,,,,,"Biotechnology, Health Care, Manufacturing, Science and Engineering, Software","Biotechnology, Developer Platform, Health Care, Manufacturing, Medical Device",,,,,290503,USD,290503,,,"Boulder, Colorado, United States",$1M to $10M,1991-01-01,year,,https://www.linkedin.com/company/encision
Elementary,https://www.crunchbase.com/organization/elementary,1-10,Active,http://elementary.io/,press@elementaryos.org,,,,,,,,,,"Consumer Electronics, Design, Hardware, Software","Computer, Developer Platform, Product Design, Software",,,,,119633,USD,119633,,,"Seneca, South Carolina, United States",$1M to $10M,2007-09-01,day,,
Stable|Kernel,https://www.crunchbase.com/organization/stable-kernel-atlanta-georgia,51-100,Active,https://stablekernel.com/,socialmedia@stablekernel.com,844-673-7225,,,,,,,,,"Apps, Data and Analytics, Information Technology, Media and Entertainment, Mobile, Platforms, Software","Analytics, Developer Platform, Digital Media, iOS, IT Management, Mobile Apps, Software",,,,,472592,USD,472592,,,"Atlanta, Georgia, United States",$1M to $10M,2013-01-01,year,,https://www.linkedin.com/company/stable-kernel/
Flexagon,https://www.crunchbase.com/organization/flexagon,11-50,Active,https://flexagon.com,info@flexagon.com,(408)334-9467,,,,,,,,,"Apps, Information Technology, Software","Apps, Developer Platform, DevOps, Information Technology, Software",0,1,,Scientific and electric apparatus and instruments,229390,USD,229390,,,"Green Bay, Wisconsin, United States",$1M to $10M,2013-01-01,year,,https://www.linkedin.com/company/flexagon
Storms,https://www.crunchbase.com/organization/storms,11-50,Active,https://storms.com/,benjamin.pommeraud@insead.edu,,,,,,,,,,"Gaming, Software","Developer Platform, Gaming, Video Games",0,2,,Scientific and electric apparatus and instruments,,,,,,"Singapore, Central Region, Singapore",$1M to $10M,2019-01-01,year,"Singtel, SK Telecom, Advanced Info Service, EDB New Ventures",https://www.linkedin.com/company/storms
Lucid Games,https://www.crunchbase.com/organization/lucid-games,11-50,Active,http://www.lucidgames.co.uk/,info@lucidgames.co.uk,,,,,,,,,,"Gaming, Software","Developer Platform, Gaming, Video Games",,,,,500892,USD,500892,,,"Liverpool, Liverpool, United Kingdom",$1M to $10M,2011-01-01,year,,https://www.linkedin.com/company/lucid-games-ltd
Teknowledge Software,https://www.crunchbase.com/organization/teknowledge-software-2,11-50,Active,https://teksmobile.com/,,+91 98604 03329,,,,,,,,,"Apps, Mobile, Software","Developer Platform, Enterprise Software, Mobile Apps, Software",,,,,568016,USD,568016,,,"Kolkata, West Bengal, India",$1M to $10M,2006-06-05,day,,https://www.linkedin.com/company/teknowledge-llc
Datastreamer,https://www.crunchbase.com/organization/datastreamer,11-50,Active,https://www.datastreamer.io/,,,,,,,,,,,"Data and Analytics, Information Technology, Software","Big Data, Business Intelligence, Data Integration, Data Mining, Developer Platform, Information Technology, Software, Text Analytics",,,,,,,,,,"George Town, Midland, Cayman Islands",$1M to $10M,2021-01-01,year,,https://www.linkedin.com/company/datastreamer/
LightTag,https://www.crunchbase.com/organization/lighttag,1-10,Active,https://lighttag.io,SALES@LIGHTTAG.IO,,,,,,,,,,"Artificial Intelligence (AI), Data and Analytics, Information Technology, Science and Engineering, Software","Analytics, Artificial Intelligence (AI), Developer Platform, Developer Tools, Information Technology, Machine Learning, Software",,,,,,,,,,"Berlin, Berlin, Germany",$1M to $10M,2018-01-01,year,,https://www.linkedin.com/company/lighttag/
Applozic,https://www.crunchbase.com/organization/applozic-inc,11-50,Active,https://www.applozic.com,contact@applozic.com,1(310)909-7458,,,,,,,,,"Apps, Hardware, Information Technology, Internet Services, Messaging and Telecommunications, Mobile, Platforms, Software","Android, Apps, Communications Infrastructure, Developer APIs, Developer Platform, Developer Tools, iOS, SaaS, Software, Video Chat",,,,,295515,USD,295515,,,"San Francisco, California, United States",$1M to $10M,2019-12-01,month,,https://www.linkedin.com/company/applozic
Flaire,https://www.crunchbase.com/organization/flaire,1-10,Active,https://www.flaire.nl,info@flaire.nl,+31 0 85 001 4321,,,,,,,,,"Apps, Information Technology, Mobile, Platforms, Software","Android, Developer Platform, Information Technology, iOS, Mobile Apps, Software, Windows",,,,,64112,USD,64112,,,"Zoetermeer, Zuid-Holland, The Netherlands",$1M to $10M,2002-01-01,year,,https://www.linkedin.com/company/flaire/
Particle,https://www.crunchbase.com/organization/particle,11-50,Closed,http://www.particlebrand.com,info@particularplace.com,,,,,,,,,,"Mobile, Software","Developer Platform, Mobile, Web Development",,,,,2042138,USD,2042138,,,"San Francisco, California, United States",$1M to $10M,2008-02-22,day,,
Deep Silver,https://www.crunchbase.com/organization/deep-silver,251-500,Active,http://www.deepsilver.com,info@deepsilver.com,+441256385200,,,,,,,,,"Gaming, Media and Entertainment, Software, Video","Developer Platform, Gaming, PC Games, Video, Video Games",,,,,,,,,,"Larkspur, California, United States",$1M to $10M,2010-02-18,day,,http://www.linkedin.com/company/31150
Five Faces,https://www.crunchbase.com/organization/five-faces,11-50,Active,http://www.fivefaces.com.au/,sales@fivefaces.com.au,+611300550267,,,,,,,,,"Health Care, Information Technology, Sales and Marketing, Software","Developer Platform, Digital Signage, Health Care, Information Services, Information Technology, Software",1,0,Photography; Cinematography; Electrography,,,,,,,"Darra, Queensland, Australia",$1M to $10M,2008-01-01,year,,https://www.linkedin.com/company-beta/3535560/
Appivo,https://www.crunchbase.com/organization/appivo,1-10,Active,http://www.appivo.com,info@appivo.com,+1.415.857.5282,,,,,,,,,"Apps, Internet Services, Mobile, Software","Cloud Computing, Developer Platform, Mobile Apps, SaaS, Software",,,,,,,,,,"Örebro, Orebro Lan, Sweden",$1M to $10M,2015-03-01,month,,https://www.linkedin.com/company/appivo
Nerd Kingdom,https://www.crunchbase.com/organization/nerd-kingdom,11-50,Closed,http://nerdkingdom.com,info@nerdkingdom.com,818-774-0235,,,,,,,,,"Gaming, Software","Developer Platform, PC Games, Video Games",,,,,,,,,,"Irving, Texas, United States",$1M to $10M,2012-01-01,year,,
Lowdownapp Ltd,https://www.crunchbase.com/organization/lowdownapp-ltd,51-100,Closed,http://www.lowdownapp.co,info@lowdownapp.co,,,,,,,,,,"Apps, Information Technology, Internet Services, Messaging and Telecommunications, Mobile, Software","Apps, Developer Platform, Information Technology, Internet, Meeting Software, Mobile",,,,,,,,,,"London, England, United Kingdom",$1M to $10M,2013-07-26,day,"Angels Den, Oxygen Accelerator",http://www.linkedin.com/company/3512619
Platypus Technology,https://www.crunchbase.com/organization/platypus-technology,11-50,Active,http://www.platypustech.com/,,(608)237-1270,,,,,,,,,"Biotechnology, Hardware, Science and Engineering, Software","Biotechnology, Developer Platform, Developer Tools, Flash Storage",,,,,121272,USD,121272,,,"Madison, Wisconsin, United States",$1M to $10M,2000-01-01,year,"The Carlyle Group, JAFCO Asia, Mitsubishi UFJ Financial Group, National Science Foundation, Technology Venture Partners",https://www.linkedin.com/company/834850?trk=tyah&trkInfo=tas%3Aplatypus%20tech%2Cidx%3A1-1-1
Blackfire.io,https://www.crunchbase.com/organization/blackfire-io,11-50,Active,https://blackfire.io,,,,,,,,,,,"Apps, Data and Analytics, Privacy and Security, Software","Analytics, Developer Platform, Developer Tools, Security, Software, Web Apps, Web Development",,,,,431279,USD,431279,,,"Paris, Ile-de-France, France",$1M to $10M,2014-01-01,year,,https://www.linkedin.com/company/blackfire-io
JDS Development Group,https://www.crunchbase.com/organization/jds-development-group,501-1000,Active,http://jdsdevelopment.com,info@jdsdevelopment.com,(212) 974-2844,,,,,,,,,"Financial Services, Real Estate, Software","Developer Platform, Real Estate, Real Estate Investment",,,,,20360026,USD,20360026,,,"New York, New York, United States",$1M to $10M,1940-01-10,day,,https://www.linkedin.com/company/jds-development-group
MentorPitch,https://www.crunchbase.com/organization/mentorpitch,11-50,Closed,http://www.mentorpitch.com,,,,,,,,,,,"Information Technology, Software","Developer Platform, Information Services, Information Technology, SaaS",,,,,,,,,,"Dublin, Dublin, Ireland",$1M to $10M,2014-01-01,year,"NDRC, EASME - EU Executive Agency for SMEs",
Ubifun,https://www.crunchbase.com/organization/ubifun,11-50,Active,https://www.ubifun.com,marketing@ubifun.com,+82 1566 0759,,,,,,,,,"Gaming, Mobile, Software","Developer Platform, Gaming, Mobile",4,1,Computing; Calculating,Scientific and electric apparatus and instruments,,,,,,"Seoul, Seoul-t'ukpyolsi, South Korea",$1M to $10M,2002-01-01,year,,
InstantDB,https://www.crunchbase.com/organization/instantdb,11-50,Active,https://www.instantdb.com/,,,,,,,,,,,"Data and Analytics, Information Technology, Science and Engineering, Software","Database, Developer Platform, Information Technology, Software, Software Engineering",,,,,311227,USD,311227,,,"New York, New York, United States",$1M to $10M,1997-07-01,day,"Y Combinator, Pioneer Fund",
Mobulous Technologies Pvt Ltd,https://www.crunchbase.com/organization/mobulous-technologies-pvt-ltd,51-100,Active,https://www.mobulous.com/,info@mobulous.com,+1(302) 451-9403,,,,,,,,,"Information Technology, Internet Services, Mobile, Platforms, Real Estate, Software","Android, Developer Platform, Information Technology, Internet, iOS, Real Estate, Software, Web Development",,,,,442038,USD,442038,,,"Noida, Uttar Pradesh, India",$1M to $10M,2013-09-06,day,,https://in.linkedin.com/company/mobulous
Evestra,https://www.crunchbase.com/organization/evestra,11-50,Active,http://evestra.com,cpackenius@evestra.com,2106733322,,,,,,,,,"Biotechnology, Health Care, Science and Engineering, Software","Biotechnology, Developer Platform, Pharmaceutical",31,2,Organic Chemistry,"Pharmaceutical, veterinary and sanitary products",144568,USD,144568,,,"San Antonio, Texas, United States",$1M to $10M,2007-01-01,year,,https://www.linkedin.com/company/evestra-inc.
Signmark Productions,https://www.crunchbase.com/organization/signmark-productions,1-10,Active,http://www.signmarkproductions.com,info@signmarkproductions.com,,,,,,,,,,"Education, Media and Entertainment, Software","Developer Platform, Language Learning, Media and Entertainment",,,,,594610,USD,594610,,,"Kerava, Southern Finland, Finland",$1M to $10M,2009-01-01,year,EASME - EU Executive Agency for SMEs,https://www.linkedin.com/company/signmark-productions/
Scout APM,https://www.crunchbase.com/organization/scout-apm,11-50,Active,https://scoutapm.com,support@scoutapm.com,,,,,,,,,,"Information Technology, Software","Developer Platform, Information Technology, Software",,,,,194515,USD,194515,,,"Denver, Colorado, United States",$1M to $10M,2008-01-01,year,,https://www.linkedin.com/company/scout
BeMyApp,https://www.crunchbase.com/organization/bemyapp,51-100,Active,https://www.bemyapp.com/,hello@bemyapp.com,4154620333,,,,,,,,,"Events, Financial Services, Lending and Investments, Media and Entertainment, Professional Services, Software, Travel and Tourism","Accounting, Developer Platform, Event Management, Event Promotion, Events, Hospitality, Incubators",,,,,152242,USD,152242,,,"San Francisco, California, United States",$1M to $10M,2013-01-01,year,,https://www.linkedin.com/company/bemyapp
OpenShift,https://www.crunchbase.com/organization/openshift,101-250,Active,https://www.openshift.com,openshift@redhat.com,+18887334281,,,,,,,,,"Apps, Software","Apps, Developer Platform, Software",,,,,752521,USD,752521,,,"Raleigh, North Carolina, United States",$1M to $10M,2010-02-01,day,,
Endtest,https://www.crunchbase.com/organization/endtest,11-50,Active,https://endtest.io,contact@endtest.io,,,,,,,,,,"Apps, Hardware, Information Technology, Internet Services, Mobile, Professional Services, Software","Cloud Infrastructure, Developer Platform, Developer Tools, Enterprise Software, Information Technology, Mobile Apps, Quality Assurance, Software, Web Development",,,,,340266,USD,340266,,,"Dover, Delaware, United States",$1M to $10M,2019-07-01,month,,https://www.linkedin.com/company/endtest/
Unibot,https://www.crunchbase.com/organization/unibot-bf66,1-10,Active,https://unibot.ai,20hello@unibot.ai,380961027237,,,,,,,,,"Information Technology, Software","Chatbot, Developer Platform, Information Technology, Software",,,,,,,,,,"Kyiv, Kyyiv, Ukraine",$1M to $10M,2016-01-01,day,,https://www.linkedin.com/company/unibotai/about/
Accipiter Systems,https://www.crunchbase.com/organization/accipiter-systems,11-50,Active,http://www.accipitersystems.com,information@accipitersystems.com,4122530623,,,,,,,,,"Hardware, Software","Communications Infrastructure, Developer Platform, Software",,,,,86666,USD,86666,,,"Wexford, Pennsylvania, United States",$1M to $10M,2002-01-01,year,,https://www.linkedin.com/company/accipiter-systems
Green Horse Games,https://www.crunchbase.com/organization/green-horse-games,1-10,Active,http://www.greenhorsegames.com,,400723564775,,,,,,,,,"Community and Lifestyle, Gaming, Internet Services, Software","Communities, Developer Platform, Gaming, Internet, Online Games, Video Games",0,9,,Scientific and electric apparatus and instruments,,,,,,"Bucharest, Bucuresti, Romania",$1M to $10M,2013-05-30,day,"3TS Capital Partners, Malin-Iulian Stefanescu",https://www.linkedin.com/company/green-horse-games
Sofomo,https://www.crunchbase.com/organization/sofomo-734e,11-50,Active,http://www.sofomo.com,piotr.schumacher@sofomo.com,+1 415 244 6460,,,,,,,,,"Information Technology, Software","Developer Platform, Information Services, Software",,,,,385810,USD,385810,,,"Wroclaw, Dolnoslaskie, Poland",$1M to $10M,2007-01-01,year,,https://www.linkedin.com/company/sofomo/
DARA BioSciences,https://www.crunchbase.com/organization/dara-biosciences,11-50,Closed,http://darabio.com,info@darabio.com,9198610239,,,,,,,,,"Biotechnology, Health Care, Science and Engineering, Software","Biotechnology, Developer Platform, Oncology, Pharmaceutical",16,0,Medical Or Veterinary Science; Hygiene,,40933,USD,40933,,,"Raleigh, North Carolina, United States",$1M to $10M,2002-01-01,year,Plough Penny Partners,https://www.linkedin.com/company/dara-biosciences/
7Factor Software,https://www.crunchbase.com/organization/7factor,51-100,Active,https://www.7factor.io,hello@7factor.io,+1 678 769 5906,,,,,,,,,"Information Technology, Internet Services, Software","Cloud Data Services, Developer Platform, DevOps, Software",,,,,,,,,,"Atlanta, Georgia, United States",$1M to $10M,2016-01-01,year,,https://www.linkedin.com/company/7factor-software/
