Bonitasoft,https://www.crunchbase.com/organization/bonitasoft,51-100,Active,https://www.bonitasoft.com,marketing@bonitasoft.com,,,,,,,,,,"Artificial Intelligence (AI), Data and Analytics, Information Technology, Internet Services, Science and Engineering, Software","Artificial Intelligence (AI), Business Process Automation (BPA), Developer Platform, Developer Tools, Information Technology, Internet, Machine Learning, Open Source, Software",0,16,,Scientific and electric apparatus and instruments,2654022,USD,2654022,,,"Grenoble, Rhone-Alpes, France",$10M to $50M,2009-06-01,month,"Bpifrance, Ventech, Auriga Partners, Serena",https://www.linkedin.com/company/bonitasoft/
Firaxis Games,https://www.crunchbase.com/organization/firaxis-games,51-100,Active,http://www.firaxis.com/,webmaster@firaxis.com,410-891-3001,,,,,,,,,"Gaming, Software","Developer Platform, Gaming, PC Games, Software, Video Games",,,,,1847172,USD,1847172,,,"Sparks, Nevada, United States",$10M to $50M,1996-01-01,year,,https://www.linkedin.com/company/firaxis-games
Synerzip,https://www.crunchbase.com/organization/synerzip,251-500,Active,http://synerzip.com/,contact@synerzip.com,(469)374-0500,,,,,,,,,"Administrative Services, Apps, Design, Information Technology, Mobile, Professional Services, Software","Consulting, Developer Platform, Enterprise Software, Human Resources, Information Technology, Mobile Apps, Product Design, Software",,,,,,,,,,"Dallas, Texas, United States",$10M to $50M,2004-01-01,year,,https://www.linkedin.com/company/synerzip
iHub,https://www.crunchbase.com/organization/ihub,11-50,Active,http://www.ihub.co.ke/,info@ihub.co.ke,+254798985410,12,12,12,,,,,,"Education, Financial Services, Information Technology, Lending and Investments, Other, Professional Services, Science and Engineering, Software","Association, Business Development, Developer Platform, Education, Incubators, Information Technology, STEM Education",,,,,,,,,,"Nairobi, Nairobi Area, Kenya",$10M to $50M,2010-03-03,day,,https://www.linkedin.com/company/ihub-nairobi
Playdemic,https://www.crunchbase.com/organization/playdemic,51-100,Active,http://www.playdemic.com,hello@playdemic.com,44 1625 530 934,,,,,,,,,"Gaming, Sales and Marketing, Software","Brand Marketing, Developer Platform, Gaming",,,,,1632723,USD,1632723,,,"Wilmslow, Cheshire, United Kingdom",$10M to $50M,2010-01-01,year,"The North West Fund, AXM Venture Capital",https://www.linkedin.com/company/playdemic-limited
Sequentum,https://www.crunchbase.com/organization/sequentum,51-100,Active,http://www.sequentum.com,info@sequentum.com,866-594-6019,,,,,,,,,"Data and Analytics, Information Technology, Internet Services, Professional Services, Software","Big Data, Cloud Data Services, Consulting, Data Integration, Data Mining, Developer Platform, IT Management, SaaS, Software",,,,,,,,,,"New York, New York, United States",$10M to $50M,2017-05-16,day,WorldQuant Ventures LLC,https://in.linkedin.com/company/sequentum
Intland Software,https://www.crunchbase.com/organization/intland-software,51-100,Active,https://intland.com/,info@intland.com,(+49) 711-2195-420,,,,,,,,,"Hardware, Information Technology, Professional Services, Science and Engineering, Software","Compliance, Developer Platform, Developer Tools, DevOps, Embedded Software, Embedded Systems, Quality Assurance, Risk Management, Software, Software Engineering",,,,,1769737,USD,1769737,,,"Stuttgart, Baden-Wurttemberg, Germany",$10M to $50M,1999-01-01,year,,http://www.linkedin.com/company/intland-software
"IT Labs, LLC",https://www.crunchbase.com/organization/it-labs-llc,251-500,Active,http://www.it-labs.com,contact@it-labs.com,1 800 920 4892,,,,,,,,,"Information Technology, Professional Services, Software","Consulting, Developer Platform, Information Technology",,,,,2891338,USD,2891338,,,"Palm Beach Gardens, Florida, United States",$10M to $50M,2005-01-01,month,,https://www.linkedin.com/company/it-labs
ComponentSource,https://www.crunchbase.com/organization/componentsource,101-250,Active,https://www.componentsource.com/,info@componentsource.com,+0008004401455,,,,,,,,,"Other, Software","Developer Platform, Product Management, Software",,,,,,,,,,"Woodstock, Georgia, United States",$10M to $50M,1995-01-01,year,3i Group,https://www.linkedin.com/company/componentsource
Beat Saber,https://www.crunchbase.com/organization/beat-games-beat-saber,11-50,Active,http://beatsaber.com/,,,,,,,,,,,"Gaming, Hardware, Software","Developer Platform, PC Games, Virtual Reality",,,,,212518,USD,212518,,,"Prague, Hlavni mesto Praha, Czech Republic",$10M to $50M,2018-01-01,year,The Venture Reality Fund/VRF,https://www.linkedin.com/company/beat-games-beat-saber/
Game-U,https://www.crunchbase.com/organization/game-u,51-100,Active,https://www.game-u.com,email@game-u.com,908 968 4294,,,,,,,,,"Design, Gaming, Hardware, Media and Entertainment, Science and Engineering, Software, Video","Animation, Developer Platform, Graphic Design, Online Games, Robotics",0,2,,Education; entertainment,1097208,USD,1097208,,,"Flemington, New Jersey, United States",$10M to $50M,2012-01-01,year,,https://www.linkedin.com/company/game-u/
Zeus,https://www.crunchbase.com/organization/zeus,11-50,Closed,http://www.zeus.com/index.html,info@zeus.com,+1 (415) 247-8800,,,,,,,,,"Apps, Software","Developer Platform, Software, Web Apps",,,,,778683,USD,778683,,,"Cambridge, Cambridgeshire, United Kingdom",$10M to $50M,1995-01-01,year,"Molten Ventures, Scottish Equity Partners, Cross Atlantic Capital Partners",https://www.linkedin.com/company/zeus-technology
Hart,https://www.crunchbase.com/organization/hart,11-50,Active,https://www.hart.com/,hello@hart.com,,,,,,,,,,"Data and Analytics, Health Care, Information Technology, Software","Data Integration, Developer Platform, Health Care",3,1,,Building; repairs,,,,,,"Costa Mesa, California, United States",$10M to $50M,2012-01-01,year,Palisades Growth,https://www.linkedin.com/company/hart-solution
Mobilous,https://www.crunchbase.com/organization/mobilous,11-50,Active,http://www.mobilous.com,info@mobilous.com,(408) 960-5985,,,,,,,,,"Apps, Mobile, Professional Services, Software","Business Development, Developer Platform, Developer Tools, Enterprise Software, Mobile, Mobile Apps, Software",,,,,,,,,,"San José Casas Caídas, Jalisco, Mexico",$10M to $50M,2011-01-01,year,,http://www.linkedin.com/company/mobilous
ESPert,https://www.crunchbase.com/organization/espert,1-10,Active,http://espert.co,hello@espert.co,,,,,,,,,,"Information Technology, Internet Services, Software","Developer Platform, Information Technology, Internet of Things",,,,,,,,,,"Singapore, Central Region, Singapore",$10M to $50M,2015-11-01,month,,
NanoPrecision Holding Company,https://www.crunchbase.com/organization/nanoprecision-holding-company,1-10,Active,,,,,,,,,,,,"Manufacturing, Science and Engineering, Software","Developer Platform, Manufacturing, Nanotechnology",,,,,,,,,,"Santa Monica, California, United States",$10M to $50M,2007-01-01,year,,
Biodel,https://www.crunchbase.com/organization/biodel,11-50,Active,http://www.biodel.com,cstmail@continentalstock.com,2037965003,,,,,,,,,"Biotechnology, Health Care, Science and Engineering, Software","Biotechnology, Developer Platform, Health Care",18,1,Medical Or Veterinary Science; Hygiene,"Pharmaceutical, veterinary and sanitary products",,,,,,"Danbury, Connecticut, United States",$10M to $50M,2003-01-01,year,"OrbiMed, Great Point Partners",http://www.linkedin.com/company/biodel-inc.
CorePharma,https://www.crunchbase.com/organization/corepharma-llc,501-1000,Active,http://www.corepharma.com/,inquiries@impaxlabs.com,(732) 868-1091,,,,,,,,,"Health Care, Manufacturing, Software","Developer Platform, Manufacturing, Pharmaceutical",0,2,,"Pharmaceutical, veterinary and sanitary products",108518,USD,108518,,,"Middlesex, New Jersey, United States",$10M to $50M,1998-01-01,year,,https://www.linkedin.com/company/corepharma-llc
CPS Technologies,https://www.crunchbase.com/organization/cps-technologies,51-100,Active,https://cpstechnologysolutions.com/,marko@alsic.com,(508) 222-0220,,,,,,,,,"Administrative Services, Consumer Electronics, Hardware, Manufacturing, Science and Engineering, Software","Advanced Materials, Developer Platform, Electronics, Manufacturing, Packaging Services",,,,,2008875,USD,2008875,,,"Norton, Massachusetts, United States",$10M to $50M,1984-01-01,year,Massachusetts Manufacturing Accelerator,https://www.linkedin.com/in/grant-bennett-436b099
RayBiotech,https://www.crunchbase.com/organization/raybiotech,101-250,Active,http://www.raybiotech.com/,info@raybiotech.com,1(888)494-8555,,,,,,,,,"Biotechnology, Science and Engineering, Software","Biotechnology, Developer Platform, Life Science",1,0,Biochemistry; Beer; Spirits; Wine; Vinegar; Microbiology; Enzymology; Mutation Or Genetic Engineering,,2426076,USD,2426076,,,"Norcross, Georgia, United States",$10M to $50M,2001-01-01,year,,https://www.linkedin.com/company/raybiotech-inc.
GS1,https://www.crunchbase.com/organization/gs1,51-100,Active,http://www.gs1.org/,info@gs1india.org,+911126168720,,,,,,,,,"Other, Social Impact, Software, Transportation","Developer Platform, Non Profit, Supply Chain Management",0,29,,Scientific and technological services,141840,USD,141840,,,"Brussels, Brussels Hoofdstedelijk Gewest, Belgium",$10M to $50M,1974-01-01,year,,https://www.linkedin.com/company/gs1/
Lobe,https://www.crunchbase.com/organization/lobe,1-10,Active,https://www.lobe.ai,info@lobe.ai,,,,,,,,,,"Artificial Intelligence (AI), Data and Analytics, Science and Engineering, Software","Artificial Intelligence (AI), Developer Platform, Developer Tools, Machine Learning, Software",,,,,2984,USD,2984,,,"San Jose, California, United States",$10M to $50M,2016-01-01,year,,https://www.linkedin.com/company/lobeai/
IT Glue,https://www.crunchbase.com/organization/it-glue,51-100,Active,https://www.itglue.com,,1(604)449-2240,,,,,,,,,"Consumer Electronics, Hardware, Information Technology, Software","Computer, Developer Platform, Document Management, Information Technology, Software",,,,,1318706,USD,1318706,,,"Vancouver, British Columbia, Canada",$10M to $50M,2013-01-01,year,Top Down,https://www.linkedin.com/company/it-glue
DiscoveRX,https://www.crunchbase.com/organization/discoverx,51-100,Active,http://www.discoverx.com,info@discoverx.com,5109799389,,,,,,,,,"Biotechnology, Manufacturing, Science and Engineering, Software","Biotechnology, Developer Platform, Manufacturing",13,3,Testing,Scientific and technological services,2037818,USD,2037818,,,"Fremont, Missouri, United States",$10M to $50M,2000-01-01,year,"Alta Partners, Morgan Stanley Expansion Capital, Skyline Ventures, Blue Sky Angels",https://www.linkedin.com/company/eurofinsdiscoverx
Mainstream Data,https://www.crunchbase.com/organization/mainstream-data,51-100,Active,http://mainstreamdata.com,info@mainstreamdata.com,18015842831,,,,,,,,,"Financial Services, Media and Entertainment, Software","Asset Management, Content Creators, Developer Platform",0,1,,Scientific and electric apparatus and instruments,763786,USD,763786,,,"Salt Lake City, Utah, United States",$10M to $50M,1985-01-01,year,New Enterprise Associates,https://www.linkedin.com/company/mainstream-data
Cloud Chamber,https://www.crunchbase.com/organization/cloud-chamber,251-500,Active,https://www.cloudchamberstudios.com,,,,,,,,,,,"Consumer Electronics, Gaming, Hardware, Media and Entertainment, Software","Computer, Developer Platform, Media and Entertainment, Video Games",,,,,,,,,,"Montréal, Quebec, Canada",$10M to $50M,2019-01-01,year,,https://www.linkedin.com/company/cloudchamber/
Gaming1,https://www.crunchbase.com/organization/gaming1,1001-5000,Active,http://www.gaming1.com,info@gaming1.com,32-4 228 32 00,,,,,,,,,"Gaming, Software","Developer Platform, Gaming",0,125,,Scientific and electric apparatus and instruments,,,,,,"Grâce-berleur, Liege, Belgium",$10M to $50M,2011-03-21,day,,https://www.linkedin.com/company/gaming1
Fidlar Technologies,https://www.crunchbase.com/organization/fidlar-technologies,51-100,Active,http://fidlar.com,support@fidlar.com,+1 800 747 4600,,,,,,,,,"Information Technology, Software","Developer Platform, Information Technology, Software",,,,,1103667,USD,1103667,,,"Davenport, Iowa, United States",$10M to $50M,1854-01-01,year,,https://www.linkedin.com/company/fidlar-technologies/
Club Prophet,https://www.crunchbase.com/organization/club-prophet-systems,101-250,Active,https://www.clubprophet.com,sales@clubprophet.com,1 800-793-1872,,,,,,,,,"Consumer Electronics, Hardware, Information Technology, Internet Services, Software, Sports","Cloud Data Services, Computer, Developer Platform, Golf, Software, Telecommunications",,,,,2668661,USD,2668661,,,"Oakmont, Pennsylvania, United States",$10M to $50M,1993-01-01,year,,https://www.linkedin.com/company/club-prophet-systems
Aurachain™,https://www.crunchbase.com/organization/aurachain,101-250,Active,https://aurachain.ch/,marketing@aurachain.ch,+41 41 662 26 88,,,,,,,,,"Information Technology, Software","Developer Platform, Enterprise Software, Information Technology, PaaS, Software",,,,,1033609,USD,1033609,,,"Zürich, Zurich, Switzerland",$10M to $50M,2009-01-01,year,,https://www.linkedin.com/company/aurachain
GuestCentric Systems,https://www.crunchbase.com/organization/guestcentric,11-50,Active,http://www.guestcentric.com,marketing@guestcentric.com,+351 21 036 0900,,,,,,,,,"Design, Software, Travel and Tourism","Developer Platform, Travel, Web Design",,,,,485685,USD,485685,,,"Stamford, Connecticut, United States",$10M to $50M,2006-01-01,year,"Portugal Ventures, Ask Capital, ChangePartners, Turismo Capital",https://www.linkedin.com/company/guestcentric-systems
Foreworth,https://www.crunchbase.com/organization/foreworth,11-50,Active,https://www.foreworth.com/,hello@foreworth.com,,,,,,,,,,"Professional Services, Software","Consulting, Developer Platform, Developer Tools, SaaS, Software",0,2,,Scientific and electric apparatus and instruments,1331322,USD,1331322,,,"Madrid, Madrid, Spain",$10M to $50M,2018-05-04,day,,https://www.linkedin.com/company/foreworth/
FileMaker,https://www.crunchbase.com/organization/filemaker,501-1000,Active,http://www.filemaker.com,filemaker_pr@filemaker.com,(408)987-7000,,,,,,,,,"Consumer Electronics, Hardware, Information Technology, Internet Services, Software","Cloud Computing, Computer, Developer Platform, Information Services, Information Technology, Software",0,1,,Scientific and technological services,,,,,,"Santa Clara, California, United States",$10M to $50M,1998-02-02,day,,https://www.linkedin.com/company/163801
Ibeo Automotive,https://www.crunchbase.com/organization/ibeo-automotive,251-500,Active,http://www.ibeo-as.com,info@ibeo-as.com,+49402986760,,,,,,,,,"Hardware, Software, Transportation","Automotive, Autonomous Vehicles, Developer Platform, Sensor",36,18,Testing,Scientific and electric apparatus and instruments,1357270,USD,1357270,,,"Hamburg, Hamburg, Germany",$10M to $50M,1998-01-01,year,AAC Technologies,https://www.linkedin.com/company/ibeo-automotive-systems-gmbh
EMA Design Automation,https://www.crunchbase.com/organization/ema-design-automation,51-100,Active,http://www.ema-eda.com/,info@ema-eda.com,(800) 813-7494,,,,,,,,,"Design, Education, Manufacturing, Software","CAD, Developer Platform, Manufacturing, Training",0,9,,Scientific and electric apparatus and instruments,1232366,USD,1232366,,,"Rochester, New York, United States",$10M to $50M,1989-01-01,year,,http://www.linkedin.com/company/ema-design-automation
Snail Games,https://www.crunchbase.com/organization/snail-games-usa,51-100,Active,https://snail.com,,+1 310 928 7429,,,,,,,,,"Content and Publishing, Gaming, Media and Entertainment, Software","Developer Platform, Gaming, Publishing",,,,,3775338,USD,3775338,,,"Culver City, California, United States",$10M to $50M,2009-01-01,year,,https://www.linkedin.com/company/snail-games-usa
Keylent,https://www.crunchbase.com/organization/keylent,101-250,Active,https://www.keylent.com/,contact@keylent.com,+ 1 401 864 6498,,,,,,,,,"Information Technology, Internet Services, Software","Cloud Computing, Developer APIs, Developer Platform, DevOps",,,,,390373,USD,390373,,,"Wilmington, Delaware, United States",$10M to $50M,2010-01-01,year,,https://www.linkedin.com/company/keylent-inc/?originalSubdomain=in
Cirruspath,https://www.crunchbase.com/organization/cirruspath,51-100,Active,https://www.cirrusinsight.com/,sales@cirruspath.com,(844)287-0950,,,,,,,,,"Information Technology, Sales and Marketing, Software","CRM, Developer Platform, Sales, Software",,,,,987621,USD,987621,,,"Irvine, California, United States",$10M to $50M,2011-01-01,year,,https://www.linkedin.com/company/cirruspath
NASK,https://www.crunchbase.com/organization/nask-ae59,51-100,Active,https://nask.world,,+1 703 715 7909,,,,,,,,,"Data and Analytics, Hardware, Software","Analytics, Developer Platform, Satellite Communication, Software",,,,,1181210,USD,1181210,,,"Fairfax, Virginia, United States",$10M to $50M,2000-01-01,year,,https://www.linkedin.com/company/n-ask
Fanrock,https://www.crunchbase.com/organization/fanrock,11-50,Active,https://www.fanrock.com,,,,,,,,,,,"Information Technology, Software","Developer APIs, Developer Platform, Developer Tools, Information Technology, Software",,,,,792393,USD,792393,,,"San Francisco, California, United States",$10M to $50M,2013-07-02,day,,https://www.linkedin.com/company/fanrock/
RedBlink,https://www.crunchbase.com/organization/redblink,101-250,Active,http://www.redblink.com,hr@redblink.com,+1 (415) 779-2793,,,,,,,,,"Design, Information Technology, Internet Services, Software","Cloud Management, Developer Platform, Software, UX Design, Web Development",,,,,1086075,USD,1086075,,,"Danville, California, United States",$10M to $50M,2008-01-01,year,,https://www.linkedin.com/company/redblink-private-limited/
Massively Parallel Technologies,https://www.crunchbase.com/organization/massively-parallel-technologies,11-50,Active,http://massivelyparallel.com,cmt@massivelyparallel.com,303-926-8444,,,,,,,,,"Consumer Electronics, Hardware, Information Technology, Software","Computer, Developer Platform, Enterprise Software, Information Technology, Software",41,1,Computing; Calculating,Scientific and electric apparatus and instruments,1321098,USD,1321098,,,"Boulder, Colorado, United States",$10M to $50M,1999-01-01,year,,http://www.linkedin.com/company/massively-parallel-technologies
Donnerwood Media,https://www.crunchbase.com/organization/donnorwood-media,51-100,Closed,http://www.donnerwood.com,info@donnerwood.com,14153484001,,,,,,,,,"Gaming, Media and Entertainment, Software","Developer Platform, Media and Entertainment, Online Games",,,,,461718,USD,461718,,,"San Francisco, California, United States",$10M to $50M,2005-01-01,year,"Battery Ventures, TransCosmos",
Fall Damage Studio AB,https://www.crunchbase.com/organization/fall-damage-studio-ab,51-100,Active,https://www.falldamagestudio.com/,info@falldamagestudio.com,,,,,,,,,,"Gaming, Software","Developer Platform, Gaming",0,0,,Scientific and electric apparatus and instruments,231150,USD,231150,,,"Stockholm, Stockholms Lan, Sweden",$10M to $50M,2016-05-05,day,,https://www.linkedin.com/company/fall-damage/
SwiftChat,https://www.crunchbase.com/organization/swiftchat-c0ec,101-250,Active,https://www.swiftchat.io,support@swiftchat.io,+1 646 801 9992,,,,,,,,,"Apps, Software","Apps, Developer Platform, Software, Web Apps",,,,,,,,,,"Southlake, Texas, United States",$10M to $50M,2018-01-01,year,RMIT Activator,https://www.linkedin.com/company/swiftchatio/
Motifworks,https://www.crunchbase.com/organization/motifworks,51-100,Active,https://www.motifworks.com/,info@motifworks.com,443-424-2340,,,,,,,,,"Data and Analytics, Design, Information Technology, Internet Services, Software","Cloud Computing, Cloud Data Services, Data Visualization, Developer Platform, Information Technology",,,,,326687,USD,326687,,,"Towson, Maryland, United States",$10M to $50M,2010-01-01,year,,https://www.linkedin.com/company/motifworks/
Quadrant Software,https://www.crunchbase.com/organization/quadrant-software,51-100,Active,http://www.quadrantsoftware.com,support@quadrantsoftware.com,800-258-3399,,,,,,,,,"Consumer Electronics, Data and Analytics, Hardware, Information Technology, Software","Business Intelligence, Computer, Data Management, Developer Platform, Document Management, Enterprise Software, Information Technology, Software",,,,,,,,,,"Mansfield, Massachusetts, United States",$10M to $50M,1990-01-01,year,,https://www.linkedin.com/company/quadrant-software
Lesta Studio,https://www.crunchbase.com/organization/lesta-studio,251-500,Active,https://lesta.ru,studio@lesta.ru,,,,,,,,,,"Gaming, Media and Entertainment, Software, Video","Developer Platform, Gaming, TV Production, Video, Video Games",,,,,,,,,,"Sankt-peterburg, Saint Petersburg City, Russian Federation",$10M to $50M,1991-01-01,year,,https://www.linkedin.com/company/wargaming-net-lesta-studio
Red Ant,https://www.crunchbase.com/organization/red-ant,51-100,Active,https://www.redant.com,enquiries@redant.com,+44 (0)845 459 3333,,,,,,,,,"Apps, Artificial Intelligence (AI), Commerce and Shopping, Data and Analytics, Hardware, Mobile, Software","Developer Platform, Enterprise Software, Machine Learning, Mobile, Mobile Apps, Retail, Retail Technology, Software",,,,,2436525,USD,2436525,,,"London, England, United Kingdom",$10M to $50M,1999-01-01,year,,https://www.linkedin.com/company/red-ant_65131
Trendy Entertainment,https://www.crunchbase.com/organization/trendy-entertainment,51-100,Active,http://trendyent.com,feedback@trendyent.com,904-535-4544,,,,,,,,,"Gaming, Software","Developer Platform, Gaming, Video Games",0,1,,Scientific and electric apparatus and instruments,,,,,,"Gainesville, Florida, United States",$10M to $50M,2009-01-01,year,,https://www.linkedin.com/in/marcobusse
Therapeutic Proteins,https://www.crunchbase.com/organization/therapeutic-proteins,51-100,Closed,http://theraproteins.com,,312-235-3600,,,,,,,,,"Biotechnology, Health Care, Science and Engineering, Software","Biotechnology, Developer Platform, Therapeutics",,,,,,,,,,"Deerfield, Illinois, United States",$10M to $50M,2003-01-01,year,,
Altaro,https://www.crunchbase.com/organization/altaro-software-2,101-250,Active,http://www.altaro.com/,david@altaro.com,919 251 6279,,,,,,,,,"Hardware, Information Technology, Software","Developer Platform, Enterprise Software, Flash Storage, Information Technology, Software",,,,,1983947,USD,1983947,,,"Raleigh, North Carolina, United States",$10M to $50M,2009-01-01,year,,https://www.linkedin.com/company/altaro/
Third Sector Intelligence,https://www.crunchbase.com/organization/third-sector-intelligence,11-50,Active,https://team3si.com,info@team3si.com,+1-206-957-8587,,,,,,,,,"Artificial Intelligence (AI), Data and Analytics, Information Technology, Science and Engineering, Software","Analytics, Data Integration, Data Management, Data Mining, Developer Platform, Intelligent Systems, Software",,,,,465802,USD,465802,,,"Seattle, Washington, United States",$10M to $50M,2012-01-01,year,,https://www.linkedin.com/company/3si/
Somoto,https://www.crunchbase.com/organization/somoto,51-100,Active,https://www.somoto.com,marketing@somotoinc.com,,,,,,,,,,"Information Technology, Software","Developer Platform, Enterprise Software, Information Technology",3,0,Computing; Calculating,,,,,,,"Tel Aviv, Tel Aviv, Israel",$10M to $50M,2009-07-01,day,Kaedan Capital,http://www.linkedin.com/company/somoto-inc
Axoft,https://www.crunchbase.com/organization/axoft-51c1,251-500,Active,https://axoft.com,info@axoft.com,+54 11 5031 8264,,,,,,,,,"Information Technology, Software","Developer Platform, Enterprise Resource Planning (ERP), IT Management, Software",,,,,,,,,,"Buenos Aires, Distrito Federal, Argentina",$10M to $50M,1988-01-01,year,,https://www.linkedin.com/company/axoft/
AMA XpertEye,https://www.crunchbase.com/organization/ama-edbe,51-100,Active,https://www.amaxperteye.com,contact.fr@amaxperteye.com,+33 223 441 339,,,,,,,,,"Financial Services, Hardware, Information Technology, Other, Software","Augmented Reality, Business Information Systems, Developer Platform, Information Technology, InsurTech, Professional Services, Software, Technical Support",,,,,468397,USD,468397,,,"Rennes, Bretagne, France",$10M to $50M,2014-01-01,year,,https://www.linkedin.com/company/amaxperteye/
AdMobius,https://www.crunchbase.com/organization/admobius,11-50,Closed,http://www.admobius.com,info@lotame.com,6502452021,,,,,,,,,"Advertising, Mobile, Sales and Marketing, Software","Advertising, Developer Platform, Mobile",,,,,,,,,,"San Mateo, California, United States",$10M to $50M,2011-07-01,day,"Storm Ventures, Opus Capital",
Apache,https://www.crunchbase.com/organization/apache-2,1-10,Active,http://apache.co.uk/,hello@apache.co.uk,441707274903,,,,,,,,,"Advertising, Consumer Electronics, Hardware, Media and Entertainment, Sales and Marketing, Software, Video","Advertising, Augmented Reality, Developer Platform, Electronics, Software, Video, Virtual Reality",0,1,,"Bleaching, cleaning, polishing, scouring and abrasive preparations; cosmetics",175832,USD,175832,,,"Saint Albans, Hertford, United Kingdom",$10M to $50M,1991-01-01,year,,https://www.linkedin.com/company/apache-solutions-ltd
4mation Technologies,https://www.crunchbase.com/organization/4mation-technologies,51-100,Active,http://www.4mation.com.au,info@4mation.com.au,+61 2 9213 1300,,,,,,,,,"Design, Professional Services, Software","Developer Platform, Enterprise Software, Outsourcing, Software, Web Design, Web Development",,,,,,,,,,"Sydney, New South Wales, Australia",$10M to $50M,2001-09-11,day,,https://www.linkedin.com/company/4mation-technologies-pty-ltd
