ammune.ai,https://www.crunchbase.com/organization/l7-defense,11-50,Active,https://www.ammune.ai,office@l7defense.com,,,,,,,,,,"Artificial Intelligence (AI), Consumer Electronics, Data and Analytics, Hardware, Information Technology, Privacy and Security, Science and Engineering, Software","Artificial Intelligence (AI), Cloud Security, Computer, Cyber Security, Developer APIs, Machine Learning, Network Security, Security",0,1,,Scientific and technological services,,,,,,"Be'er Sheva, HaDarom, Israel",$1M to $10M,2015-07-01,day,"VentureOut, TRUMPF Venture, Quick Heal Technologies, EASME - EU Executive Agency for SMEs, Incubit Technology Ventures",https://www.linkedin.com/company/ammune
Resurface Labs,https://www.crunchbase.com/organization/resurface-io,1-10,Active,https://resurface.io,info@resurface.io,720-804-0324,,,,,,,,,Software,"Developer APIs, Software",,,,,,,,,,"Boulder, Colorado, United States",$1M to $10M,2019-05-14,day,"SaaS Ventures, Service Provider Capital, FirstMile Ventures, Village Global, Alerion Ventures",https://www.linkedin.com/company/resurfaceio
Vibrant Corporation,https://www.crunchbase.com/organization/vibrant-corporation,11-50,Active,http://www.vibrantndt.com,,(505) 314-1488,,,,,,,,,"Science and Engineering, Software","Aerospace, Developer APIs, Developer Tools",22,0,Testing,Scientific and electric apparatus and instruments,299450,USD,299450,,,"Albuquerque, New Mexico, United States",$1M to $10M,1991-01-01,year,"Advantage Capital, New Mexico Economic Development Department, Verge Fund",http://www.linkedin.com/company/2979457
Pin Payments,https://www.crunchbase.com/organization/pin-payments,1-10,Active,http://pinpayments.com,support@pinpayments.com,+61 3 9028 2548,,,,,,,,,"Financial Services, Payments, Professional Services, Software","Accounting, Developer APIs, Payments",,,,,,,,,,"Melbourne, Victoria, Australia",$1M to $10M,2011-11-01,day,"VentureOut, Chris Hitchen, Vix Investments",https://www.linkedin.com/company/3784650
Commerce.js,https://www.crunchbase.com/organization/chec,1-10,Active,https://commercejs.com,devan@commercejs.com,,,,,,,,,,"Apps, Commerce and Shopping, Hardware, Internet Services, Software","Apps, Cloud Infrastructure, Developer APIs, Developer Tools, E-Commerce",,,,,282166,USD,282166,,,"Vancouver, British Columbia, Canada",$1M to $10M,2017-05-25,day,"Alumni Ventures, Correlation Ventures, Palm Drive Capital, AngelPad, Interlace Ventures",https://www.linkedin.com/company/chec-chec-commerce-inc.-/
PassKit,https://www.crunchbase.com/organization/passkit,11-50,Active,https://PassKit.com,support@passkit.com,852 5804 9280,,,,,,,,,"Consumer Electronics, Financial Services, Hardware, Information Technology, Internet Services, Mobile, Payments, Sales and Marketing, Software","Consumer Electronics, CRM, Developer APIs, Internet, Internet of Things, Marketing Automation, Mobile, Mobile Payments",,,,,,,,,,"Hong Kong, Hong Kong Island, Hong Kong",$1M to $10M,2012-12-04,day,Vectr,http://www.linkedin.com/company/passkit
BlueID GmbH,https://www.crunchbase.com/organization/baimos-technologies,1-10,Active,https://www.blueid.net,info@blueid.net,49 89 54 84 23 40,,,,,,,,,"Apps, Privacy and Security, Real Estate, Software","Apps, Developer APIs, Security, Smart Building, Smart Cities, Software",2,12,Electric Communication Technique,Scientific and electric apparatus and instruments,,,,,,"Munich, Bayern, Germany",$1M to $10M,2006-01-01,year,"Bayern Kapital, eCAPITAL ENTREPRENEURIAL PARTNERS, HTGF | High-Tech Gruenderfonds, Berendsen, HCS Beteiligungsgesellschaft",http://www.linkedin.com/company/baimos-technologies-gmbh
MessengerPeople,https://www.crunchbase.com/organization/messengerpeople,51-100,Active,http://www.messengerpeople.com,sales@MessengerPeople.com,+49089416173180,,,,,,,,,"Apps, Information Technology, Internet Services, Messaging and Telecommunications, Mobile, Other, Software","Apps, B2B, Developer APIs, Information Services, Information Technology, Messaging, Mobile, SaaS, Small and Medium Businesses, Software",0,2,,Scientific and electric apparatus and instruments,1221368,USD,1221368,,,"Munich, Bayern, Germany",$1M to $10M,2015-04-01,month,"HTGF | High-Tech Gruenderfonds, Müller Medien, Wessel Management, Haas New Media",https://www.linkedin.com/company/messengerpeople/
Zabo,https://www.crunchbase.com/organization/zabo,1-10,Active,https://zabo.com,contact@zabo.com,,,,,,,,,,"Blockchain and Cryptocurrency, Financial Services, Payments, Software","Bitcoin, Cryptocurrency, Developer APIs, Finance, Financial Services, FinTech, Personal Finance",,,,,131863,USD,131863,,,"Dallas, Texas, United States",$1M to $10M,2018-01-01,year,"Digital Currency Group, Capital Factory, Castle Island Ventures, CoinShares, Moonshots Capital",https://www.linkedin.com/company/zaboapi
Feature Labs,https://www.crunchbase.com/organization/feature-labs,11-50,Closed,https://www.featurelabs.com/,contact@featurelabs.com,,,,,,,,,,"Artificial Intelligence (AI), Data and Analytics, Manufacturing, Science and Engineering, Software","Artificial Intelligence (AI), Developer APIs, Developer Tools, Industrial Automation, Software",,,,,135503100,USD,135503100,,,"Boston, Massachusetts, United States",$1M to $10M,2015-01-01,year,"Script Capital, First Star Ventures, Flybridge",https://www.linkedin.com/company/featurelabs/
re.alto energy,https://www.crunchbase.com/organization/re-alto-energy,11-50,Active,https://realto.io/,poppy.blautzik@realto.io,015253765355,,,,,,,,,"Commerce and Shopping, Energy, Software, Sustainability","Developer APIs, Energy, Marketplace, Renewable Energy",,,,,255956,USD,255956,,,"Brussels, Brussels Hoofdstedelijk Gewest, Belgium",$1M to $10M,2019-08-05,day,Elia System Operator,https://www.linkedin.com/company/re-alto/
XQ Message,https://www.crunchbase.com/organization/xq-message,11-50,Active,https://xqmsg.com/,brian@xqmsg.com,6463194232,,,,,,,,,"Government and Military, Hardware, Information Technology, Internet Services, Messaging and Telecommunications, Privacy and Security, Professional Services, Real Estate, Software, Transportation","Compliance, Developer APIs, Internet of Things, Logistics, Messaging, National Security, Security, Smart Cities, Software, Telecommunications",,,,,,,,,,"Oakland, California, United States",$1M to $10M,2019-02-01,day,TCap Private Equity,https://www.linkedin.com/company/xqmsg/
NextPax,https://www.crunchbase.com/organization/nextpax-com,11-50,Active,http://www.nextpax.com,sales@nextpax.com,+31 (0)85-060 01 05,,,,,,,,,"Commerce and Shopping, Community and Lifestyle, Internet Services, Real Estate, Software, Travel and Tourism","Developer APIs, E-Commerce, E-Commerce Platforms, Leisure, Property Management, SaaS, Travel, Web Development",,,,,502496,USD,502496,,,"Almere, Flevoland, The Netherlands",$1M to $10M,2006-11-01,day,,https://www.linkedin.com/company/nextpax-com-bv
Solvio,https://www.crunchbase.com/organization/solvio-ai,11-50,Active,https://trysolvio.ai,hello@trysolvio.ai,+918498828187,,,,,,,,,"Artificial Intelligence (AI), Data and Analytics, Education, Hardware, Internet Services, Other, Science and Engineering, Software","Artificial Intelligence (AI), B2B, Computer Vision, Developer APIs, EdTech, Education, Internet, Machine Learning, Natural Language Processing, SaaS",,,,,,,,,,"Bangalore, Karnataka, India",$1M to $10M,2019-10-09,day,"100X.VC, Ministry of Electronics and Information Technology - MeitY",https://www.linkedin.com/company/solvio-ai
Finverse,https://www.crunchbase.com/organization/finverse-technologies,1-10,Active,https://www.finverse.com/,info@finverse.com,,,,,,,,,,"Financial Services, Lending and Investments, Software","Banking, Developer APIs, Finance, Financial Services, FinTech, Software",,,,,,,,,,"Admiralty, Hong Kong Island, Hong Kong",$1M to $10M,2020-01-01,year,"SixThirty, Golden Gate Ventures, FEBE Ventures, Venturra",https://www.linkedin.com/company/finverse
Cavirin Systems,https://www.crunchbase.com/organization/cavirin-systems,51-100,Active,http://www.cavirin.com,info@cavirin.com,(408)200-3544,,,,,,,,,"Information Technology, Internet Services, Privacy and Security, Professional Services, Software","Cloud Computing, Cloud Security, Compliance, Developer APIs, DevOps, Security, Software",1,1,Computing; Calculating,Scientific and technological services,3075945,USD,3075945,,,"Santa Clara, California, United States",$1M to $10M,2012-08-10,day,SRA Holdings,https://www.linkedin.com/company/cavirin-systems-inc-/
Quantivly,https://www.crunchbase.com/organization/quantivly,1-10,Active,https://www.quantivly.com,info@quantivly.com,,,,,,,,,,"Data and Analytics, Design, Hardware, Health Care, Information Technology, Software","Analytics, Computer Vision, Data Integration, Data Visualization, Developer APIs, Health Care, Medical",,,,,,,,,,"Boston, Massachusetts, United States",$1M to $10M,2019-05-01,month,"One Way Ventures, Nina Capital, National Science Foundation, Lair East Labs, Walnut Venture Associates",https://www.linkedin.com/company/quantivly
iCommunity,https://www.crunchbase.com/organization/icommunity-426c,11-50,Active,https://icommunity.io/en,hello@icommunity.io,,,,,,,,,,"Blockchain and Cryptocurrency, Commerce and Shopping, Data and Analytics, Hardware, Health Care, Information Technology, Other, Software, Transportation","Blockchain, Data Integration, Developer APIs, Developer Platform, Developer Tools, Electronic Health Record (EHR), Logistics, Retail Technology, SaaS, Software",,,,,280060,USD,280060,,,"Madrid, Madrid, Spain",$1M to $10M,2019-03-25,day,"Demium, ENISA, Centre for the Development of Industrial Technology (CDTI), Desafia, Hackquarters",https://www.linkedin.com/company/icommunity-baas/
Luwjistik,https://www.crunchbase.com/organization/luwjistik,11-50,Active,https://luwjistik.us,connect@luwjistik.us,,,,,,,,,,"Software, Transportation","Developer APIs, Logistics, SaaS, Supply Chain Management",,,,,,,,,,"Singapore, Central Region, Singapore",$1M to $10M,2021-07-01,month,"MDI Ventures, East Ventures, Global Founders Capital, Trihill Capital, Arise",https://www.linkedin.com/company/luwjistik
Bitext,https://www.crunchbase.com/organization/bitext,11-50,Active,http://www.bitext.com,info@bitext.com,,,,,,,,,,"Artificial Intelligence (AI), Data and Analytics, Internet Services, Science and Engineering, Software","Artificial Intelligence (AI), Chatbot, Developer APIs, Machine Learning, Natural Language Processing, Semantic Search, Software, Text Analytics",,,,,956604,USD,956604,,,"San Francisco, California, United States",$1M to $10M,2007-12-20,day,"Inveready, EASME - EU Executive Agency for SMEs",https://www.linkedin.com/company/bitext
Kiwi.ai,https://www.crunchbase.com/organization/kiwi-wearable-technologies,11-50,Closed,http://www.kiwi.ai,info@kiwi.ai,,,,,,,,,,"Artificial Intelligence (AI), Consumer Electronics, Data and Analytics, Hardware, Internet Services, Science and Engineering, Software","Analytics, Artificial Intelligence (AI), Computer, Developer APIs, Internet of Things, Machine Learning, Software, Wearables",,,,,,,,,,"Toronto, Ontario, Canada",$1M to $10M,2013-05-20,day,"Creative Destruction Lab (CDL), FounderFuel",https://www.linkedin.com/company/kiwidotai/
Daily.co,https://www.crunchbase.com/organization/pluot,11-50,Active,https://daily.co,help@daily.co,961.885.7279,1,1,,,,,,,"Hardware, Information Technology, Internet Services, Media and Entertainment, Messaging and Telecommunications, Music and Audio, Software, Video","Audio, Communication Hardware, Developer APIs, Developer Platform, Information Services, Information Technology, Software, Video, Video Chat",,,,,633300,USD,633300,,,"Mountain View, California, United States",$1M to $10M,2015-01-01,year,"Block, Inc., Haystack, Compound, Scribble Ventures, Freestyle Capital",https://www.linkedin.com/company/dailyco
AIQA Technologies,https://www.crunchbase.com/organization/aiqa,1-10,Active,http://aiqa.tech,contact@aiqa.tech,,,,,,,,,,"Artificial Intelligence (AI), Data and Analytics, Professional Services, Science and Engineering, Software","Artificial Intelligence (AI), Developer APIs, Developer Tools, Machine Learning, Quality Assurance, SaaS, Software",,,,,89941,USD,89941,,,"Warszawa, Mazowieckie, Poland",$1M to $10M,2019-03-01,day,,https://www.linkedin.com/company/aiqa-tech/
Clarify,https://www.crunchbase.com/organization/clarify-inc,1-10,Closed,http://Clarify.IO,support@clarify.io,646-513-4234,,,,,,,,,"Content and Publishing, Data and Analytics, Hardware, Software","Big Data, Content Delivery Network, Developer APIs, Enterprise Software, Software, Telecommunications",,,,,,,,,,"Austin, Texas, United States",$1M to $10M,2011-01-01,year,"Techstars, Right Side Capital Management, Playfair Capital, Silverton Partners, Social Starts",http://www.linkedin.com/company/clarify-inc
Evercontact,https://www.crunchbase.com/organization/evercontact,11-50,Closed,https://www.evercontact.com,sales@evercontact.com,,,,,,,,,,"Artificial Intelligence (AI), Data and Analytics, Information Technology, Internet Services, Messaging and Telecommunications, Software","Developer APIs, Email, Information Technology, Natural Language Processing, SaaS, Software",,,,,328924,USD,328924,,,"New York, New York, United States",$1M to $10M,2014-01-01,day,"AXA Venture Partners, Bleu Capital, Aurinvest, Florian Seroussi",https://www.linkedin.com/company/one-more-company-inc/
WeCashUp,https://www.crunchbase.com/organization/infinity-space,11-50,Active,https://www.wecashup.com,developers@wecashup.com,,,,,,,,,,"Financial Services, Mobile, Payments, Software","Developer APIs, FinTech, Mobile, Mobile Payments, Payments",2,1,Computing; Calculating,Scientific and electric apparatus and instruments,103327,USD,103327,,,"Marseille, Provence-Alpes-Cote d'Azur, France",$1M to $10M,2015-03-24,day,,https://www.linkedin.com/company/wecashup
CULQI,https://www.crunchbase.com/organization/culqi,11-50,Active,https://www.culqi.com,contacto@culqi.com,(511)705-0500,,,,,,,,,"Financial Services, Lending and Investments, Payments, Software","Credit Cards, Developer APIs, Payments, Software",,,,,,,,,,"Lima, Lima, Peru",$1M to $10M,2013-01-01,year,"Wayra, AVP Ventures, Krealo, Startup Peru",http://www.linkedin.com/company/culqi
CHOOOSE,https://www.crunchbase.com/organization/chooose,11-50,Active,https://chooose.today,,,,,,,,,,,"Apps, Software, Sustainability","CleanTech, Developer APIs, Enterprise Applications, Enterprise Software, Software",0,5,,Advertising; business,878088,USD,878088,,,"Oslo, Oslo, Norway",$1M to $10M,2018-01-01,day,"Amadeus, Katapult, Contrarian Ventures, GenZero, Vinyl Capital",https://www.linkedin.com/company/chooose
Tuned Global,https://www.crunchbase.com/organization/tuned-global,11-50,Active,http://www.tunedglobal.com,info@tunedglobal.com,+61390445300,,,,,,,,,"Apps, Content and Publishing, Internet Services, Media and Entertainment, Mobile, Music and Audio, Software, Video","Apps, Audiobooks, Content, Developer APIs, Internet Radio, Mobile Apps, Music, Music Streaming, Podcast, Video Streaming",1,0,Electric Communication Technique,,,,,,,"Melbourne, Victoria, Australia",$1M to $10M,2010-01-01,year,"Artesian VC, Exto Partners",http://www.linkedin.com/company/tunedglobal
SYNQ,https://www.crunchbase.com/organization/synq,11-50,Closed,https://www.synq.fm/,stian@synq.fm,+47 971 66 755,,,,,,,,,"Advertising, Content and Publishing, Data and Analytics, Media and Entertainment, Sales and Marketing, Software, Video","Big Data, Developer APIs, Film Production, TV Production, Video, Video Advertising, Video on Demand, Video Streaming",,,,,,,,,,"Palo Alto, California, United States",$1M to $10M,2014-03-01,day,"Newmark Capital, Kjeller Innovation, Akershus Technology Fund, Per Hove",https://www.linkedin.com/company/synq-fm
LinkApi,https://www.crunchbase.com/organization/linkapi,51-100,Closed,http://www.linkapi.solutions,communication@linkapi.com.br,+55 11 4118-2901,,,,,,,,,"Apps, Commerce and Shopping, Data and Analytics, Information Technology, Software","Data Integration, Developer APIs, E-Commerce, Enterprise Applications, PaaS, SaaS, Software",,,,,,,,,,"São Paulo, Sao Paulo, Brazil",$1M to $10M,2017-03-01,day,"Cassis Capital, Wayra Mexico",https://www.linkedin.com/company/linkapi
Pachyderm,https://www.crunchbase.com/organization/pachyderm,11-50,Active,https://www.pachyderm.com,founders@pachyderm.io,,,,,,,,,,"Artificial Intelligence (AI), Data and Analytics, Science and Engineering, Software","Analytics, Artificial Intelligence (AI), Big Data, Developer APIs, Machine Learning, Open Source, SaaS",0,4,,Scientific and technological services,89463,USD,89463,,,"San Francisco, California, United States",$1M to $10M,2014-01-01,year,"Soma Capital, DCVC, Caffeinated Capital, Y Combinator, M12 - Microsoft's Venture Fund",https://www.linkedin.com/company/pachyderm-inc-
Meilisearch,https://www.crunchbase.com/organization/meilisearch,11-50,Active,https://www.meilisearch.com/,bonjour@meilisearch.com,,,,,,,,,,"Internet Services, Software","Cloud Computing, Developer APIs, Developer Tools, Open Source, SaaS, Search Engine, Semantic Search, Software, Vertical Search",,,,,,,,,,"Paris, Ile-de-France, France",$1M to $10M,2018-11-25,day,"Seedcamp, Mango Capital, Felicis, Kima Ventures, CRV",https://www.linkedin.com/company/13016868/
Moesif,https://www.crunchbase.com/organization/moesif,11-50,Active,https://www.moesif.com,support@moesif.com,,,,,,,,,,"Artificial Intelligence (AI), Data and Analytics, Software","Analytics, Developer APIs, Developer Tools, Predictive Analytics",4,2,Computing; Calculating,Scientific and technological services,120289,USD,120289,,,"San Francisco, California, United States",$1M to $10M,2017-01-01,year,"Alchemist Accelerator, Heavybit, iSeed Ventures, Silicon Badia, Merus Capital",https://www.linkedin.com/company/moesif/
Protonet,https://www.crunchbase.com/organization/protonet,11-50,Active,https://protonet.com/,team@protonet.info,(925)242-2441,,,,,,,,,"Hardware, Information Technology, Internet Services, Other, Privacy and Security, Software","Cloud Computing, Cloud Infrastructure, Collaboration, Communications Infrastructure, Developer APIs, File Sharing, Identity Management, SaaS",,,,,677755,USD,677755,,,"San Francisco, California, United States",$1M to $10M,2012-01-01,year,"Y Combinator, Zillionize, Kevin Mahaffey, Lynett Capital, Inncubator Investments",https://www.linkedin.com/company/protonet-gmbh/
Covalent,https://www.crunchbase.com/organization/covalent-92e3,11-50,Active,https://www.covalenthq.com/,contact@covalenthq.com,(909) 340-1369,,,,,,,,,"Blockchain and Cryptocurrency, Data and Analytics, Design, Financial Services, Information Technology, Other, Payments, Software","Blockchain, Cryptocurrency, Data Integration, Data Visualization, Database, Developer APIs, Ethereum, FinTech, Information Technology, Software",,,,,405233,USD,405233,,,"Vancouver, British Columbia, Canada",$1M to $10M,2018-03-01,day,"Hashed, Figment, Creative Destruction Lab (CDL), LedgerPrime, Moonbeam Network",https://www.linkedin.com/company/covalenthq/
Yhat,https://www.crunchbase.com/organization/yhat,11-50,Closed,http://yhathq.com,info@yhathq.com,718 855 2107,,,,,,,,,"Artificial Intelligence (AI), Data and Analytics, Information Technology, Science and Engineering, Software","Analytics, Artificial Intelligence (AI), Developer APIs, Enterprise Software, Information Technology, Machine Learning, Predictive Analytics, SaaS, Software",,,,,,,,,,"Brooklyn, New York, United States",$1M to $10M,2013-01-01,year,"Soma Capital, Y Combinator, boldstart ventures, Ignition Partners, Contour Venture Partners",http://www.linkedin.com/company/3176802
CloudRail,https://www.crunchbase.com/organization/cloudrail,1-10,Active,http://cloudrail.com/,info@cloudrail.com,+4962148345965,,,,,,,,,"Information Technology, Internet Services, Software","Cloud Data Services, Developer APIs, Software",,,,,108790,USD,108790,,,"Mannheim, Baden-Wurttemberg, Germany",$1M to $10M,2013-09-01,day,"Ulrich Turck Family Office, Leonardo Venture, Rheinland-Pfalz Fonds, BWM GmbH",http://www.linkedin.com/company/cloudrail
Virgil Security,https://www.crunchbase.com/organization/virgil-security,11-50,Active,http://virgilsecurity.com,support@virgilsecurity.com,+1-571-348-4601,,,,,,,,,"Information Technology, Internet Services, Privacy and Security, Software","Cloud Security, Cyber Security, Developer APIs, Developer Platform, Developer Tools, Internet of Things, Network Security, Software",,,,,451109,USD,451109,,,"Manassas, Virginia, United States",$1M to $10M,2014-01-01,year,"RedSeal, Bloomberg Beta, NextGen Venture Partners, Blu Venture Investors, Charge Ventures",http://www.linkedin.com/company/virgil-security-inc-
Lang API,https://www.crunchbase.com/organization/lang-api,11-50,Closed,https://www.rutterapi.com/,support@langapi.co,+1 (732) 379-8839,,,,,,,,,"Apps, Mobile, Professional Services, Software","Developer APIs, Mobile Apps, Translation Service",,,,,,,,,,"San Francisco, California, United States",$1M to $10M,2019-01-01,year,"Y Combinator, Pioneer Fund",https://www.linkedin.com/company/rutter/about/
Devtron,https://www.crunchbase.com/organization/devtron-labs,51-100,Active,http://devtron.ai,,,,,,,,,,,"Information Technology, Software","Developer APIs, Developer Platform, DevOps, Information Technology, Software",,,,,,,,,,"Del Mar, California, United States",$1M to $10M,2019-01-01,year,"Leo Capital, Insight Partners",https://www.linkedin.com/company/devtron-labs
HAAS Alert,https://www.crunchbase.com/organization/haasalert,11-50,Active,http://www.haasalert.com,info@haasalert.com,833-433-4227,,,,,,,,,"Data and Analytics, Government and Military, Information Technology, Mobile, Navigation and Mapping, Real Estate, Software, Transportation","Autonomous Vehicles, Big Data, Data Integration, Developer APIs, Mobile, Navigation, Public Safety, SaaS, Smart Cities, Transportation",0,6,,Scientific and technological services,196135,USD,196135,,,"Chicago, Illinois, United States",$1M to $10M,2015-03-15,day,"Techstars, Volition Capital, Right Side Capital Management, Third Sphere, TechNexus Venture Collaborative",https://www.linkedin.com/company/haasalert/
RhodeCode,https://www.crunchbase.com/organization/rhodecode,11-50,Active,https://rhodecode.com,info@rhodecode.com,(415) 813-2063,,,,,,,,,"Information Technology, Privacy and Security, Science and Engineering, Software","Cyber Security, Developer APIs, Enterprise Software, Information Technology, IT Management, Open Source, SaaS, Security, Software, Software Engineering",0,3,,Scientific and electric apparatus and instruments,274219,USD,274219,,,"Berlin, Berlin, Germany",$1M to $10M,2013-07-15,day,"Molten Ventures, Earlybird Venture Capital",http://www.linkedin.com/company/rhodecode
Muzooka,https://www.crunchbase.com/organization/muzooka,11-50,Active,http://www.muzooka.com,hello@muzooka.com,,,,,,,,,,"Content and Publishing, Data and Analytics, Internet Services, Media and Entertainment, Music and Audio, Software, Video","Database, Developer APIs, Music, Social Media, Video Streaming",,,,,190794,USD,190794,,,"Southlake, Texas, United States",$1M to $10M,2012-01-01,year,,http://www.linkedin.com/company/muzooka
Rebel,https://www.crunchbase.com/organization/rebelmail,11-50,Active,https://www.salesforce.com,hi@rebelmail.com,,,,,,,,,,"Commerce and Shopping, Information Technology, Internet Services, Messaging and Telecommunications, Sales and Marketing, Software","Developer APIs, E-Commerce, Email, Email Marketing",1,0,Computing; Calculating,,,,,,,"New York, New York, United States",$1M to $10M,2013-01-01,year,"boldstart ventures, Sinai Capital Partners, Gary Vaynerchuk, Montauk Ventures, BoxGroup",
BiiLabs,https://www.crunchbase.com/organization/biilabs,1-10,Active,https://biilabs.io/,service@biilabs.io,,,,,,,,,,"Blockchain and Cryptocurrency, Financial Services, Information Technology, Mobile, Other, Payments, Software, Transportation","Automotive, Blockchain, Developer APIs, Information Technology, Mobile Payments, PaaS, Payments",,,,,,,,,,"Taipei, T'ai-pei, Taiwan",$1M to $10M,2017-11-01,month,"Particle Accelerator Limited (ParticleX), Taiwan Startup Stadium, National Development Fund of Taiwan Government, ARM IoT Capital",https://www.linkedin.com/company/27162788/
BreezoMeter,https://www.crunchbase.com/organization/breezometer,101-250,Active,http://www.breezometer.com,support@breezometer.com,,,,,,,,,,"Artificial Intelligence (AI), Data and Analytics, Science and Engineering, Software","Artificial Intelligence (AI), Big Data, Developer APIs, Software",1,0,Computing; Calculating,,,,,,,"Haifa, Hefa, Israel",$1M to $10M,2014-02-16,day,"Entrée Capital, Fortissimo Capital, Hella Ventures, Goldacre, SeedIL Ventures",http://www.linkedin.com/company/breezometer
Wevo,https://www.crunchbase.com/organization/wevo-d18c,51-100,Active,https://www.wevo.io,comercial@wevo.com.br,55 11 4239-9200,,,,,,,,,"Apps, Data and Analytics, Information Technology, Software","Data Integration, Developer APIs, Enterprise Applications, Enterprise Software, Information Technology, PaaS, SaaS, Software",,,,,,,,,,"São Caetano Do Sul, Sao Paulo, Brazil",$1M to $10M,2012-07-02,day,"CVENTURES, Cileneu jose peres nunes",https://www.linkedin.com/company/wevo
Nexosis,https://www.crunchbase.com/organization/nexosis,1-10,Active,http://www.nexosis.com,info@nexosis.com,1(800)681-7903,,,,,,,,,"Artificial Intelligence (AI), Data and Analytics, Software","Big Data, Developer APIs, Developer Tools, Machine Learning, Predictive Analytics, SaaS, Software",,,,,296518,USD,296518,,,"Boston, Massachusetts, United States",$1M to $10M,2015-02-25,day,"Techstars, Inovia Capital, Target, Right Side Capital Management, Rev1 Ventures",https://www.linkedin.com/company/nexosis/?originalSubdomain=ph
