Professional Document Services,https://www.crunchbase.com/organization/professional-document-services,51-100,Active,https://www.professionaldocumentservicesinc.com,info@professionaldocumentservicesinc.com,1 888-362-2679,,,,,,,,,"Information Technology, Professional Services, Software","Document Management, Legal",,,,,464422,USD,464422,,,"Moorpark, California, United States",$1M to $10M,1997-01-01,year,,https://www.linkedin.com/company/prodoc-professional-document-services-inc.
Royal Impact Certification,https://www.crunchbase.com/organization/royal-impact-certification,51-100,Active,https://ricliso.com,info@ricliso.com,+91 0120 4113893,,,,,,,,,"Information Technology, Professional Services, Software","Compliance, Document Management, Legal, Management Consulting",,,,,,,,,,"Noida, Uttar Pradesh, India",$1M to $10M,2011-01-01,year,,https://www.linkedin.com/company/royal-impact-certification-ltd/
Carbon Graphics Group,https://www.crunchbase.com/organization/carbon-graphics-group,101-250,Active,https://www.carbongraphicsgroup.com/,calg@carbongraphicsgroup.com,+1 403-266-5954,,,,,,,,,"Design, Information Technology, Manufacturing, Software","3D Printing, Document Management, Graphic Design",,,,,,,,,,"Calgary, Alberta, Canada",$1M to $10M,1979-01-01,year,,https://www.linkedin.com/company/carbon-graphics-group/
TBFiles,https://www.crunchbase.com/organization/tbfiles,51-100,Active,https://tbfiles.com,info@tbfiles.com,+351 219 362 920,,,,,,,,,"Hardware, Information Technology, Manufacturing, Science and Engineering, Software","Document Management, Industrial, Robotics",,,,,248160,USD,248160,,,"Queluz De Baixo, Lisboa, Portugal",$1M to $10M,2003-01-01,year,,https://www.linkedin.com/company/tbfiles-gestao-documental
Les Notaires du Quai Voltaire,https://www.crunchbase.com/organization/les-notaires-du-quai-voltaire,51-100,Active,https://www.lnqv.fr,contact@lnqv.fr,+33 1 42 60 34 62,,,,,,,,,"Administrative Services, Information Technology, Professional Services, Software","Document Management, Document Preparation, Legal",,,,,61701,USD,61701,,,"Paris, Ile-de-France, France",$1M to $10M,1587-01-01,year,,https://www.linkedin.com/company/lnqv-notaires-quai-voltaire/
Gedak,https://www.crunchbase.com/organization/gedak,101-250,Active,http://www.gedak.de,info@gedak.de,49 (0) 2152 / 9940-0,,,,,,,,,"Information Technology, Software","Document Management, Information Technology, Software",,,,,,,,,,"Kempen, Nordrhein-Westfalen, Germany",$1M to $10M,1982-01-01,day,,https://www.linkedin.com/company/gedak-gmbh
System Data Center,https://www.crunchbase.com/organization/system-data-center,251-500,Active,https://www.sdcnet.it/,,+39 06 52357643,,,,,,,,,"Information Technology, Software","Document Management, Information Technology, Software",,,,,96465,USD,96465,,,"Roma, Lazio, Italy",$1M to $10M,1973-01-01,year,,https://www.linkedin.com/company/sdc-system-data-center-spa/
I-SITE,https://www.crunchbase.com/organization/i-site-c055,51-100,Active,https://www.i-site.co.jp,,089-970-3838,,,,,,,,,"Administrative Services, Health Care, Information Technology, Software","Document Management, Health Care, Human Resources, Information Technology",,,,,,,,,,"Matsuyama, Ehime, Japan",$1M to $10M,2005-11-01,day,,https://www.linkedin.com/company/%EF%BC%88%E6%A0%AA%EF%BC%89%E3%82%A2%E3%82%A4%E3%82%B5%E3%82%A4%E3%83%88/
Geminys,https://www.crunchbase.com/organization/geminys,51-100,Active,https://geminys.com,info@geminys.com,+34 943 309 102,,,,,,,,,"Administrative Services, Information Technology, Manufacturing, Other, Software","Document Management, Industrial, Knowledge Management",,,,,479782,USD,479782,,,"San Sebastian, Pais Vasco, Spain",$1M to $10M,1999-01-01,year,,https://www.linkedin.com/company/geminys
SafeboxIQ,https://www.crunchbase.com/organization/safeboxiq-inc,51-100,Active,https://safeboxiq.com,info@safeboxiq.com,+1 877 351 4647,,,,,,,,,"Data and Analytics, Hardware, Information Technology, Software","Data Center, Data Management, Document Management, Software",,,,,,,,,,"San Francisco, California, United States",$1M to $10M,2011-01-01,year,,https://www.linkedin.com/company/safeboxiq
UCS Business Solutions,https://www.crunchbase.com/organization/ucs-business-solutions,51-100,Active,https://www.ucsbs.in,ram@ucsbs.in,+91 9884024046,,,,,,,,,"Hardware, Information Technology, Other, Professional Services, Software","Customer Service, Data Storage, Document Management",,,,,,,,,,"Chrompet, Tamil Nadu, India",$1M to $10M,1996-01-01,year,,https://www.linkedin.com/company/ucs-business-solutions-pvt-ltd/
CNI,https://www.crunchbase.com/organization/cni,101-250,Active,https://www.cnispa.it,info@cnispa.it,39-06 69337570,,,,,,,,,"Administrative Services, Information Technology, Software","Archiving Service, Document Management, Information Technology",0,1,,Machines and machine tools,268532,USD,268532,,,"Rome, Lazio, Italy",$1M to $10M,1974-01-01,day,,https://www.linkedin.com/company/cni-s.p.a./
Viisan Technology,https://www.crunchbase.com/organization/viisan-technology,251-500,Closed,http://www.viisan.com/en,info@viisan.com,400-081-9236,,,,,,,,,"Consumer Electronics, Education, Hardware, Information Technology, Internet Services, Messaging and Telecommunications, Science and Engineering, Software","Consumer Electronics, Document Management, Education, Software Engineering, Video Conferencing",0,3,,Scientific and electric apparatus and instruments,,,,,,"Beijing, Beijing, China",$1M to $10M,2013-01-01,year,,https://www.linkedin.com/company/74708573/admin/
The Wilson Group,https://www.crunchbase.com/organization/the-wilson-group,101-250,Active,https://thewilsongroup.com/,info@thewilsongroup.com,+1 412-586-7191,,,,,,,,,"Commerce and Shopping, Content and Publishing, Hardware, Information Technology, Media and Entertainment, Software","Document Management, Printing, Retail Technology, Software",,,,,613364,USD,613364,,,"Pittsburgh, Pennsylvania, United States",$1M to $10M,2011-01-01,year,,https://www.linkedin.com/company/the-wilson-group-llc-kw23/
Corporación Everest,https://www.crunchbase.com/organization/corporacion-everest,101-250,Active,http://www.corpeverest.com,info@corpeverest.com,+34 93 712 04 04,,,,,,,,,"Commerce and Shopping, Information Technology, Software, Sustainability, Transportation","Document Management, Rental, Transportation, Waste Management",,,,,246939,USD,246939,,,"Sabadell, Catalonia, Spain",$1M to $10M,1964-01-01,year,,https://www.linkedin.com/company/10046989
Ecoh Tech,https://www.crunchbase.com/organization/ecoh-tech,101-250,Active,https://www.ecohtech.com.br,contato@ecohtech.com.br,+55 11 2361 9456,,,,,,,,,"Information Technology, Professional Services, Software","Consulting, Document Management, Information Technology, IT Infrastructure",,,,,,,,,,"São Francisco De Paula, Minas Gerais, Brazil",$1M to $10M,2009-01-01,year,,https://www.linkedin.com/company/ecoh-tech
Orogenic Resources,https://www.crunchbase.com/organization/orogenic-resources,101-250,Active,https://orogenic.com.my/,orsb@orogenic.com.my,+603-51317525,,,,,,,,,"Data and Analytics, Financial Services, Hardware, Information Technology, Software","Asset Management, Data Management, Data Storage, Database, Document Management",,,,,,,,,,"Shah Alam, Selangor, Malaysia",$1M to $10M,1993-01-01,year,,https://www.linkedin.com/company/orogenic-resources/
ANF Autoridad de Certificación,https://www.crunchbase.com/organization/anf-autoridad-de-certificación,101-250,Active,https://anf.es,ventas@anf.es,+34 932 66 16 14,,,,,,,,,"Information Technology, Media and Entertainment, Privacy and Security, Professional Services, Software, Video","Broadcasting, Consulting, Document Management, E-Signature",0,1,,Telecommunications,,,,,,"Barcelona, Catalonia, Spain",$1M to $10M,,,,https://www.linkedin.com/company/anf-autoridad-de-certificaci-n
Newbury Data,https://www.crunchbase.com/organization/newbury-data,51-100,Active,https://newburydata.co.uk,sales@newburydata.co.uk,+44 01606 593 424,,,,,,,,,"Consumer Electronics, Hardware, Information Technology, Mobile, Software","Document Management, Electronics, Mobile Devices, RFID, Software",,,,,164711,USD,164711,,,"Winsford, Cheshire, United Kingdom",$1M to $10M,1974-01-01,year,,https://www.linkedin.com/company/newbury-data/
Instacheck,https://www.crunchbase.com/organization/instacheck-a59b,101-250,Active,https://www.theinstacheck.com,info@theinstacheck.com,+91 8420444341,,,,,,,,,"Information Technology, Other, Professional Services, Software, Transportation","Document Management, Product Management, Quality Assurance, Shipping",,,,,,,,,,"Kolkata, West Bengal, India",$1M to $10M,,,,https://www.linkedin.com/company/theinstacheck
GAAIA,https://www.crunchbase.com/organization/gaaia,51-100,Active,https://gaaia.mx,soluciones@gaaia.mx,+52 899 946 81 27,,,,,,,,,"Administrative Services, Financial Services, Information Technology, Software","Asset Management, Document Management, Document Preparation",,,,,,,,,,"Reynosa Tamaulipas, Distrito Federal, Mexico",$1M to $10M,2014-01-01,year,,https://www.linkedin.com/company/gaaia--gestion-avanzada-de-activo-inform%C3%A1ticos-y-administrativos
Fast Business Line,https://www.crunchbase.com/organization/fast-business-line,51-100,Active,https://fastbusinessline.ae,info@fastbusinessline.ae,+971 52 938 4102,,,,,,,,,"Information Technology, Professional Services, Software","Document Management, Legal, Translation Service",,,,,,,,,,"Deira, Dubai, United Arab Emirates",$1M to $10M,2000-01-01,year,,https://www.linkedin.com/company/fastbusinessline/
Apporya,https://www.crunchbase.com/organization/apporya,51-100,Active,https://www.apporya.org,sales@apporya.org,+91 98434 37410,,,,,,,,,"Content and Publishing, Data and Analytics, Information Technology, Media and Entertainment, Professional Services, Software","Analytics, Consulting, Document Management, Publishing",,,,,,,,,,"Nagercoil, Tamil Nadu, India",$1M to $10M,2017-01-01,year,,https://www.linkedin.com/company/apporya
FS Records management,https://www.crunchbase.com/organization/fs-records-management,51-100,Active,https://www.fsrms.com,info@fsrms.com,+91 96870 03881,,,,,,,,,"Administrative Services, Information Technology, Professional Services, Software, Transportation","Consulting, Document Management, Document Preparation, Information Technology, Warehousing",,,,,,,,,,"Surat, Gujarat, India",$1M to $10M,2013-01-01,year,,https://www.linkedin.com/company/fs-records-management-services-private-limited
Docusource,https://www.crunchbase.com/organization/docusource,10001+,Active,http://www.docusource.com,docu.source@yahoo.com,562-447-2600,,,,,,,,,"Information Technology, Professional Services, Software","Consulting, Document Management, Software",0,1,,Advertising; business,,,,,,"Cerritos, California, United States",$1M to $10M,1990-01-01,year,,https://www.linkedin.com/company/docusource-llc
Datec Networks & Printer Solutions,https://www.crunchbase.com/organization/datec-networks-printer-solutions,101-250,Active,https://datec-gmbh.de,info@datec-gmbh.de,+49 03765 797 0,,,,,,,,,"Information Technology, Science and Engineering, Software","Document Management, Software, Software Engineering",,,,,,,,,,"Sachsen, Bayern, Germany",$1M to $10M,1995-01-01,year,,https://www.linkedin.com/company/datec-netzwerke-druckerl%C3%B6sungen-gmbh/
The Treadstone Group,https://www.crunchbase.com/organization/the-treadstone-group,51-100,Active,https://treadstonegroup.com/,,1-704-489-8663,,,,,,,,,"Information Technology, Software","Document Management, Information Services, Information Technology",0,3,,Legal services,181141,USD,181141,,,"Denver, North Carolina, United States",$1M to $10M,2002-01-01,day,,https://www.linkedin.com/company/the-treadstone-group-inc-/about/
Grupo Palermo,https://www.crunchbase.com/organization/grupo-palermo,101-250,Active,https://www.grupopalermo.pe,contacto@grupopalermo.pe,+51-44-206-020,,,,,,,,,"Information Technology, Manufacturing, Professional Services, Software","3D Printing, Consulting, Document Management, Information Technology, IT Management",,,,,,,,,,"Trujillo, La Libertad, Peru",$1M to $10M,1996-01-01,year,,https://www.linkedin.com/company/grupo-palermo-srl/
Ritsugyosya,https://www.crunchbase.com/organization/ritsugyosya,51-100,Active,https://rgsg.jp,info@rgsg.jp,076-423-2948,,,,,,,,,"Advertising, Consumer Goods, Information Technology, Sales and Marketing, Software","Advertising, Consumer Goods, Document Management, Outdoor Advertising, Sales",,,,,,,,,,"Toyama-shi, Toyama, Japan",$1M to $10M,1946-06-01,day,,https://www.linkedin.com/company/%EF%BC%88%E6%A0%AA%EF%BC%89%E7%AB%8B%E6%A5%AD%E7%A4%BE/
Paszkiewicz Court Reporting & Records Retrieval,https://www.crunchbase.com/organization/paszkiewicz-court-reporting-records-retrieval,51-100,Active,https://spreporting.com/,information@spreporting.com,+1 855-595-3577,,,,,,,,,"Hardware, Information Technology, Internet Services, Messaging and Telecommunications, Professional Services, Software","Document Management, Legal, Video Conferencing",,,,,,,,,,"Glen Carbon, Illinois, United States",$1M to $10M,2013-01-01,year,,https://www.linkedin.com/company/spreporting/
FlexWorkflow,https://www.crunchbase.com/organization/flexworkflow,51-100,Active,https://www.flexworkflow.com,info@FlexWorkflow.com,+852 3950 6350,,,,,,,,,"Information Technology, Software","Document Management, Information Technology, Software",,,,,,,,,,"Kwai Tsing, New Territories, Hong Kong",$1M to $10M,1987-01-01,year,,https://www.linkedin.com/company/flexworkflow-limited
Arxivar,https://www.crunchbase.com/organization/arxivar,101-250,Active,http://www.arxivar.it,info@abletech.it,39-0309650688,,,,,,,,,"Information Technology, Software","Document Management, Enterprise Software, Software",,,,,,,,,,"Montichiari, Lombardia, Italy",$1M to $10M,2002-12-24,day,,https://www.linkedin.com/company/able-tech-srl-arxivar
Boomerang Global,https://www.crunchbase.com/organization/boomerang-global,51-100,Active,https://boomerang-global.com,info@boomerang-global.com,1 602.751.8023,,,,,,,,,"Administrative Services, Health Care, Information Technology, Payments, Software","Billing, Document Management, Health Care, Software, Staffing Agency",,,,,726750,USD,726750,,,"Chandler, Arizona, United States",$1M to $10M,2006-01-01,year,,https://www.linkedin.com/company/boomerang-global
Colvatel,https://www.crunchbase.com/organization/colvatel,1001-5000,Active,https://www.colvatel.com,contactenos@colvatel.com,601-438-70-00,,,,,,,,,"Hardware, Information Technology, Software","Communications Infrastructure, Document Management, Information and Communications Technology (ICT), Telecommunications",,,,,,,,,,"Bogotá, Distrito Especial, Colombia",$1M to $10M,1992-12-01,month,,https://www.linkedin.com/company/colvatel
Ecc Technology,https://www.crunchbase.com/organization/ecc-technology,101-250,Active,http://www.ecctechservices.com/,support@ecctechservices.com,949-900-3463,,,,,,,,,"Information Technology, Internet Services, Messaging and Telecommunications, Software","Cloud Computing, Document Management, VoIP",,,,,270161,USD,270161,,,"Irvine, California, United States",$1M to $10M,2005-01-01,day,,https://www.linkedin.com/company/ecctechnology-services
Quadient Graphic,https://www.crunchbase.com/organization/quadient-graphic,5001-10000,Active,https://graphics.quadient.no/,service.no@quadient.com,+47 22 90 14 00,,,,,,,,,"Administrative Services, Design, Information Technology, Software","Document Management, Document Preparation, Graphic Design",,,,,,,,,,"Oslo, Oslo, Norway",$1M to $10M,1924-01-01,year,,https://www.linkedin.com/company/quadient/about/
Certifica Empreendedor,https://www.crunchbase.com/organization/certifica-empreendedor,51-100,Active,https://certificaempreendedor.com.br,contato@certificaempreendedor.com.br,+55 17 2786 1737,,,,,,,,,"Information Technology, Software","Document Management, Information Technology",,,,,,,,,,"São José do Rio Prêto, Sao Paulo, Brazil",$1M to $10M,,,,https://www.linkedin.com/company/certifica-empreendedor/
AFLOBEI,https://www.crunchbase.com/organization/aflobei,101-250,Active,http://www.aflobei.pt,aflobei@aflobei.pt,+351 272 325 741,,,,,,,,,"Agriculture and Farming, Information Technology, Other, Software","Association, Document Management, Forestry",,,,,,,,,,"Castelo, Porto, Portugal",$1M to $10M,,,,https://www.linkedin.com/company/aflobei
Virtus Group​,https://www.crunchbase.com/organization/virtus-cd3b,501-1000,Active,https://www.virtusgroupkw.com/,Hello@VirtusHolding.com,+965 2220 6528,,,,,,,,,"Education, Hardware, Information Technology, Software","Data Center, Document Management, Information Technology, Training",,,,,,,,,,"Kuwait, Al Kuwayt, Kuwait",$1M to $10M,1977-01-01,year,,https://www.linkedin.com/company/virtus-trading/
LOGGED,https://www.crunchbase.com/organization/logged,51-100,Active,https://www.logged.com.br,comercial@logged.com.br,55 (31) 3691-6001,,,,,,,,,"Information Technology, Internet Services, Software","Cloud Storage, Document Management, Software",,,,,,,,,,"Sabará, Minas Gerais, Brazil",$1M to $10M,2004-01-01,year,,https://www.linkedin.com/company/logged-logistica
OPGK,https://www.crunchbase.com/organization/opgk,51-100,Active,https://www.opgk.olsztyn.pl/,opgk@opgk.olsztyn.pl,+48  89 527 27 53,,,,,,,,,"Content and Publishing, Data and Analytics, Hardware, Information Technology, Media and Entertainment, Navigation and Mapping, Software","Document Management, Geospatial, GPS, Mapping Services, Printing",,,,,,,,,,"Olsztyn, Warminsko-Mazurskie, Poland",$1M to $10M,1946-01-01,year,,
Certing,https://www.crunchbase.com/organization/certing,51-100,Active,https://www.certing.org,certingsrl@legalmail.it,+39 06 842 428 30,,,,,,,,,"Administrative Services, Information Technology, Professional Services, Software","Compliance, Document Management, Document Preparation",,,,,483554,USD,483554,,,"Valmontone, Lazio, Italy",$1M to $10M,1998-01-01,year,,https://www.linkedin.com/company/certing-srl
Genesis Business Consultancy India,https://www.crunchbase.com/organization/genesis-business-consultancy-india,251-500,Active,https://genesisbci.com,info@genesisbci.com,+91 8652 656 565,,,,,,,,,"Administrative Services, Artificial Intelligence (AI), Data and Analytics, Information Technology, Professional Services, Science and Engineering, Software","Artificial Intelligence (AI), Call Center, Data Management, Document Management, Outsourcing",,,,,,,,,,"Mumbai, Maharashtra, India",$1M to $10M,2014-07-01,month,,https://www.linkedin.com/company/genesisbci/
DiGi One,https://www.crunchbase.com/organization/digi-one,51-100,Active,https://www.digi-one.eu/en/,info@digi-one.eu,+39 0744 61221,,,,,,,,,"Information Technology, Payments, Privacy and Security, Sales and Marketing, Software","Billing, Digital Signage, Document Management, E-Signature, Information Technology",,,,,196253,USD,196253,,,"Rome, Lazio, Italy",$1M to $10M,2003-01-01,year,,https://www.linkedin.com/company/digi-one-srl
Sincronica,https://www.crunchbase.com/organization/sincronica,51-100,Active,https://sincronica.com.br,suporte@sincronica.com.br,55 11 4620-0023,,,,,,,,,"Information Technology, Software","Document Management, Information Technology, Software",,,,,,,,,,"Osasco, Sao Paulo, Brazil",$1M to $10M,2000-01-01,year,,https://www.linkedin.com/company/sincronica-sa
RSRS,https://www.crunchbase.com/organization/rsrs,101-250,Active,https://www.recordsolutions.ca/,info@rsrs.com,+1-888-563-3732,,,,,,,,,"Health Care, Information Technology, Media and Entertainment, Software","Digital Media, Document Management, Health Care, Medical",,,,,249948,USD,249948,,,"Toronto, Ontario, Canada",$1M to $10M,1997-01-01,year,,https://www.linkedin.com/company/record-storage-and-retrieval-services-rsrs-/
InfPro IT Solutions,https://www.crunchbase.com/organization/infpro-it-solutions-1623,51-100,Active,https://translogica.net/,office@translogica.net,+49 831-995-933-00,,,,,,,,,"Information Technology, Software","Document Management, Information Technology, Software",,,,,208489,USD,208489,,,"Innsbruck, Tirol, Austria",$1M to $10M,2004-01-01,year,,https://www.linkedin.com/company/translogica-gmbh/?originalSubdomain=de
Omnia CC,https://www.crunchbase.com/organization/omnia-cc,51-100,Active,https://www.omniacc.es,info@omniacc.es,+34 911051000,,,,,,,,,"Administrative Services, Information Technology, Internet Services, Messaging and Telecommunications, Other, Professional Services, Software","Call Center, Customer Service, Document Management, Messaging",,,,,284786,USD,284786,,,"Madrid, Madrid, Spain",$1M to $10M,2019-01-01,year,,https://www.linkedin.com/company/omnia-cc
Grupo G Trigueiro,https://www.crunchbase.com/organization/grupo-g-trigueiro,51-100,Active,https://www.gtrigueiro.com.br,contato@gtrigueiro.com.br,+55 84 4006 5767,,,,,,,,,"Commerce and Shopping, Information Technology, Software","Document Management, Information Technology, Rental",,,,,,,,,,"Natal, Tocantins, Brazil",$1M to $10M,1989-01-01,year,,https://www.linkedin.com/company/grupogtrigueiro
Metecon,https://www.crunchbase.com/organization/metecon,51-100,Active,http://www.metecon.de,info@metecon.de,49-621-12346900,,,,,,,,,"Health Care, Information Technology, Professional Services, Software","Consulting, Document Management, Health Care, Medical, Medical Device",1,0,Physical Or Chemical Processes Or Apparatus In General,,,,,,,"Mannheim, Baden-Wurttemberg, Germany",$1M to $10M,1999-09-09,day,,https://www.linkedin.com/company/metecon-gmbh/
Inteslar,https://www.crunchbase.com/organization/inteslar,51-100,Active,https://www.inteslar.com,info@inteslar.com,+971 4 358 2344,,,,,,,,,"Data and Analytics, Information Technology, Software","Business Intelligence, Document Management, Information Technology, Software",,,,,,,,,,"Dubai, Dubai, United Arab Emirates",$1M to $10M,2003-01-01,year,,https://www.linkedin.com/company/inteslar-software-solutions/
eLicense,https://www.crunchbase.com/organization/elicense,51-100,Active,http://elicense.com,sales@elicense.com,1-781-449-7601,,,,,,,,,"Information Technology, Privacy and Security, Software","Document Management, Information Services, Security, Software",,,,,,,,,,"Holiday, Florida, United States",$1M to $10M,,,,
Informetica Consulting,https://www.crunchbase.com/organization/informetica-consulting,101-250,Active,https://www.informeticons.com,marketing@informeticons.com,+39 045 485 7630,,,,,,,,,"Information Technology, Professional Services, Software","Consulting, Document Management, Information Technology, Software",,,,,163969,USD,163969,,,"San Martino Buon Albergo, Veneto, Italy",$1M to $10M,2005-01-01,year,,https://www.linkedin.com/company/informetica-consulting-s.r.l./
AMETRAS ecm,https://www.crunchbase.com/organization/ametras-ecm,51-100,Active,https://ametras-ecm.com,contact@ametras.ro,+40 356 111 043,,,,,,,,,"Hardware, Information Technology, Software","Data Center, Document Management, Software",,,,,,,,,,"Timisoara, Timis, Romania",$1M to $10M,,,,https://www.linkedin.com/company/ametras-ecm
Licking County Library,https://www.crunchbase.com/organization/licking-county-library,51-100,Active,https://www.lickingcountylibrary.org,info@lickingcountylibrary.org,+1-740-349-5500,,,,,,,,,"Content and Publishing, Education, Information Technology, Media and Entertainment, Software","Books, Document Management, E-Learning, EBooks, Education",,,,,516000,USD,516000,,,"Newark, Ohio, United States",$1M to $10M,1908-01-01,year,,
Expert Data,https://www.crunchbase.com/organization/expert-data-03cc,51-100,Active,https://www.expertdata.com.mx,info@expertdata.com.mx,+52 81 2090 9900,,,,,,,,,"Information Technology, Software","Document Management, Information Technology, IT Infrastructure",,,,,,,,,,"Santa Catarina, Nuevo Leon, Mexico",$1M to $10M,2003-07-28,day,,https://www.linkedin.com/company/expert-data-sc
Sumitec,https://www.crunchbase.com/organization/sumitec,51-100,Active,https://sumitec.hn,comunicaciones@sumitec.hn,+504-9454-0872,,,,,,,,,"Information Technology, Software","Document Management, Information Technology, Software",,,,,,,,,,"Tegucigalpa, Francisco Morazan, Honduras",$1M to $10M,1987-01-01,year,,https://www.linkedin.com/company/sumitec/
North Central Sight Services,https://www.crunchbase.com/organization/north-central-sight-services,101-250,Active,https://www.ncsight.org,ncss@ncsight.org,+1 570 323 9401,,,,,,,,,"Health Care, Information Technology, Other, Social Impact, Software","Document Management, Non Profit, Rehabilitation",0,1,,Basic staples,161698,USD,161698,,,"Williamsport, Pennsylvania, United States",$1M to $10M,1957-01-01,year,,https://www.linkedin.com/company/ncsight/
SAZ Labs,https://www.crunchbase.com/organization/saz-labs,51-100,Active,http://sazlabs.com,info@sazlabs.com,1-732-997-0070,,,,,,,,,"Information Technology, Software","Document Management, Information Technology, Software",,,,,482391,USD,482391,,,"Princeton, New Jersey, United States",$1M to $10M,2008-01-01,year,,https://www.linkedin.com/company/saz-labs-inc-
Omniadoc,https://www.crunchbase.com/organization/omniadoc,101-250,Active,http://www.omniadoc.it/,info@omniadoc.it,39 0432 522349,,,,,,,,,"Administrative Services, Information Technology, Professional Services, Software","Archiving Service, Consulting, Document Management, Software",,,,,,,,,,"Parma, Emilia-Romagna, Italy",$1M to $10M,2014-01-01,day,,https://www.linkedin.com/company/omniadoc-spa/
Quality Sistema Certifications and Inspections,https://www.crunchbase.com/organization/quality-sistema-certifications-and-inspections,51-100,Active,https://sistemacerts.org,sistemacerts@gmail.com,+91 63 9001 9004,,,,,,,,,"Information Technology, Professional Services, Software","Consulting, Document Management, Quality Assurance",,,,,,,,,,"Lucknow, Uttar Pradesh, India",$1M to $10M,,,,https://www.linkedin.com/company/quality-sistema/
