ChartLogic,https://www.crunchbase.com/organization/chartlogic,51-100,Active,http://www.chartlogic.com,sales@chartlogic.com,+1 801 365 1800,,,,,,,,,"Health Care, Information Technology, Payments, Software","Billing, Document Management, Electronic Health Record (EHR), Health Care, Information Services, Medical, Software",,,,,1157137,USD,1157137,,,"Salt Lake City, Utah, United States",$10M to $50M,1994-01-01,year,,https://www.linkedin.com/company/chartlogic-inc-
Aspose,https://www.crunchbase.com/organization/aspose,101-250,Active,https://www.aspose.com,support@aspose.com,+61 2 8006 6987,,,,,,,,,"Administrative Services, Content and Publishing, Information Technology, Media and Entertainment, Other, Software","Document Management, Document Preparation, EBooks, Presentations, Project Management, Software",0,2,,Scientific and technological services,,,,,,"Lane Cove, New South Wales, Australia",$10M to $50M,2002-01-01,year,,https://www.linkedin.com/company/aspose
ACOM Solutions,https://www.crunchbase.com/organization/acom-solutions,51-100,Active,https://acom.com,sales@acom.com,+1 562 424 7899,1,1,,,,,,,"Financial Services, Information Technology, Payments, Software","Document Management, FinTech, Information Technology, Payments, Software",0,2,,Insurance; financial affairs,1483024,USD,1483024,,,"Long Beach, California, United States",$10M to $50M,1983-03-01,day,,https://www.linkedin.com/company/acom-solutions-inc
Wrench Solutions,https://www.crunchbase.com/organization/wrench-solutions,101-250,Active,http://www.wrenchsp.com/,getinfo@wrenchsp.com,+1800 1036 925,,,,,,,,,"Administrative Services, Energy, Information Technology, Natural Resources, Other, Professional Services, Real Estate, Science and Engineering, Software","Civil Engineering, Document Management, Information Technology, Oil and Gas, Project Management, Quality Assurance, Real Estate, SaaS, Software",,,,,,,,,,"Bangalore, Karnataka, India",$10M to $50M,1994-01-01,year,,https://www.linkedin.com/company/wrench-solutions-pvt-ltd/
IntelliChief,https://www.crunchbase.com/organization/intellichief,51-100,Active,http://www.intellichief.com,sales@intellichief.com,(813) 971-9500,,,,,,,,,"Data and Analytics, Hardware, Information Technology, Other, Software","Analytics, Business Intelligence, CMS, Data Storage, Document Management, Enterprise Resource Planning (ERP), Information Technology, Real Time, SaaS, Software",,,,,640084,USD,640084,,,"Tampa, Florida, United States",$10M to $50M,2005-01-01,year,,https://www.linkedin.com/company/intellichief-llc
Northwoods Consulting Partners,https://www.crunchbase.com/organization/northwoods-efba,101-250,Active,https://www.teamnorthwoods.com/,info@teamnorthwoods.com,614-781-7800,,,,,,,,,"Community and Lifestyle, Content and Publishing, Data and Analytics, Government and Military, Information Technology, Media and Entertainment, Professional Services, Software","Children, Consulting, Data Integration, Document Management, EBooks, Enterprise Software, Government, GovTech, Information Technology, Software",0,4,,Scientific and technological services,2100933,USD,2100933,,,"Dublin, Ohio, United States",$10M to $50M,2003-01-01,year,,https://www.linkedin.com/company/northwoods/
Axispoint,https://www.crunchbase.com/organization/axispoint,101-250,Active,http://www.axispoint.com/,info@axispoint.com,(212)920-2600,1,1,,,,,,,"Information Technology, Other, Software","Document Management, Information Technology, Professional Services, Software",0,1,,Scientific and technological services,1199343,USD,1199343,,,"New York, New York, United States",$10M to $50M,1994-01-01,year,,https://www.linkedin.com/company/axispoint
Trade Technologies,https://www.crunchbase.com/organization/trade-technologies-inc,101-250,Active,http://tradetechnologies.com,support@tradetechnologies.com,281.890.9194,,,,,,,,,"Financial Services, Hardware, Information Technology, Internet Services, Payments, Professional Services, Software","Consulting, Document Management, Electronic Design Automation (EDA), Financial Services, Information Technology, Insurance, Legal, Online Portals, Payments, Software",,,,,1648324,USD,1648324,,,"Austin, Texas, United States",$10M to $50M,1999-01-01,year,,https://www.linkedin.com/company/trade-technologies-inc-/
Financial Statement Services Inc.,https://www.crunchbase.com/organization/fssi-financial-statement-services-inc,101-250,Active,https://www.fssi-ca.com/,info@fssi-ca.com,714-436-3300,,,,,,,,,"Content and Publishing, Information Technology, Media and Entertainment, Sales and Marketing, Software","Direct Marketing, Document Management, Email Marketing, Information Technology, Printing",,,,,1698246,USD,1698246,,,"Santa Ana, California, United States",$10M to $50M,1980-01-01,year,,https://www.linkedin.com/company/fssi---financial-statement-services-inc
Ecrion Software,https://www.crunchbase.com/organization/ecrion-software,101-250,Active,https://www.ecrion.com/,info@ecrion.com,866-418-3838,,,,,,,,,"Hardware, Information Technology, Other, Professional Services, Software","Consumer Software, Customer Service, Data Center Automation, Document Management, Software",0,1,,Scientific and electric apparatus and instruments,1534728,USD,1534728,,,"Rockville, Maryland, United States",$10M to $50M,2002-01-01,year,,https://www.linkedin.com/company/ecrion-software/
One Legal,https://www.crunchbase.com/organization/one-legal-llc,101-250,Active,https://www.onelegal.com/,sales@onelegal.com,(800) 938-8815,,,,,,,,,"Information Technology, Professional Services, Software, Transportation","Document Management, Legal, Legal Tech, Logistics, Software",,,,,2175236,USD,2175236,,,"Petaluma, California, United States",$10M to $50M,1990-01-01,year,,https://www.linkedin.com/company/one-legal-llc/
"Nationwide Title Clearing, Inc",https://www.crunchbase.com/organization/nationwide-title-clearing-2,501-1000,Active,http://www.nwtc.com/,nwtc.info@nwtc.com,(800)346-9152,,,,,,,,,"Administrative Services, Financial Services, Information Technology, Other, Software","Document Management, Document Preparation, Financial Services, Professional Services",0,3,,Scientific and technological services,7398972,USD,7398972,,,"Palm Harbor, Florida, United States",$10M to $50M,1991-01-01,year,,https://www.linkedin.com/company/83504
Kefron,https://www.crunchbase.com/organization/kefron,101-250,Active,https://www.kefron.com/,,+44 (0)118 997 7380,,,,,,,,,"Information Technology, Internet Services, Software","Cloud Data Services, Document Management, Information Technology",,,,,4094257,USD,4094257,,,"Woodley, Wokingham, United Kingdom",$10M to $50M,1989-01-01,year,,https://www.linkedin.com/company/kefron/
Enjoin,https://www.crunchbase.com/organization/enjoin,51-100,Active,https://www.enjoincdi.com,info@enjoincdi.com,+1 980 395 4606,,,,,,,,,"Administrative Services, Education, Health Care, Information Technology, Other, Software","Document Management, Document Preparation, Education, Health Care, Peer to Peer",,,,,1804569,USD,1804569,,,"Collierville, Tennessee, United States",$10M to $50M,2011-01-01,year,,https://www.linkedin.com/company/enjoin/
MedOptions,https://www.crunchbase.com/organization/medoptions,251-500,Closed,https://www.medoptionsinc.com,info@medoptionsinc.com,800-370-3651,,,,,,,,,"Health Care, Information Technology, Payments, Software","Billing, Document Management, Health Care",,,,,,,,,,"Old Saybrook, Connecticut, United States",$10M to $50M,1996-01-01,year,,https://www.linkedin.com/company/medoptions
Nordis Technologies,https://www.crunchbase.com/organization/nordis-technologies,101-250,Active,https://www.nordistechnologies.com/,help@nordistechnologies.com,702-331-3048,,,,,,,,,"Content and Publishing, Information Technology, Internet Services, Media and Entertainment, Other, Payments, Sales and Marketing, Software, Travel and Tourism","Billing, CRM, Document Management, Hospitality, Information Technology, Internet, Internet of Things, Printing, Service Industry, Software",,,,,2208540,USD,2208540,,,"Coral Springs, Florida, United States",$10M to $50M,1989-01-01,year,,https://www.linkedin.com/company/nordis-direct
Experian Data Quality,https://www.crunchbase.com/organization/experian-data-quality,501-1000,Active,https://www.edq.com,dataquality.info@experian.com,+1 888 727 8822,,,,,,,,,"Data and Analytics, Information Technology, Software","Data Management, Document Management, SaaS, Software",,,,,810390,USD,810390,,,"Boston, Massachusetts, United States",$10M to $50M,2000-01-01,year,,https://www.linkedin.com/company/experian-data-quality
Transputec,https://www.crunchbase.com/organization/transputec,51-100,Active,http://www.transputec.com,smarketing@transputec.com,44 20 8584 1400,,,,,,,,,"Information Technology, Internet Services, Software","Cloud Computing, Document Management, Enterprise Software, Information Technology, Software, Web Hosting",,,,,1984386,USD,1984386,,,"London, England, United Kingdom",$10M to $50M,1984-01-01,year,,http://www.linkedin.com/company/transputec-ltd
CV-Library,https://www.crunchbase.com/organization/cv-library,101-250,Active,https://www.cv-library.co.uk/,admin@cv-library.co.uk,4401252810995,,,,,,,,,"Information Technology, Professional Services, Software","Career Planning, Document Management, Recruiting, Social Recruiting",,,,,1309841,USD,1309841,,,"Fleet, Hampshire, United Kingdom",$10M to $50M,2000-01-01,year,,https://www.linkedin.com/company/cv-library
Scan-Optics,https://www.crunchbase.com/organization/scan-optics,51-100,Active,http://scanoptics.com,,8559562144,,,,,,,,,"Consumer Electronics, Hardware, Information Technology, Science and Engineering, Software","Computer, Consumer Electronics, Document Management, Robotics, Software",,,,,2103170,USD,2103170,,,"Manchester, Connecticut, United States",$10M to $50M,1968-01-01,year,,https://www.linkedin.com/company/scan-optics
INNOVEX,https://www.crunchbase.com/organization/innovex-23f8,101-250,Closed,https://www.innovex.tech/,info@innovex.co,+1 401 232 7000,,,,,,,,,"Information Technology, Internet Services, Messaging and Telecommunications, Professional Services, Software","Cloud Management, Consulting, Document Management, Information Technology, Software, VoIP",,,,,,,,,,"Lincoln, Rhode Island, United States",$10M to $50M,1961-01-01,year,,https://www.linkedin.com/company/innovex-tech
Vereco,https://www.crunchbase.com/organization/vereco,101-250,Active,http://vereco.com,,(949) 371-9991,,,,,,,,,"Health Care, Information Technology, Software","Document Management, Health Care",,,,,1152932,USD,1152932,,,"Laguna Niguel, California, United States",$10M to $50M,2011-01-01,year,Stella Point Capital,https://www.linkedin.com/company/vereco-inc.
Arena Group,https://www.crunchbase.com/organization/arena-group,251-500,Active,https://www.arenagroup.net,info@arenagroup.net,+44 344-863-8000,,,,,,,,,"Information Technology, Software","Document Management, Information Technology, IT Management",,,,,,,,,,"Wakefield, Wakefield, United Kingdom",$10M to $50M,1991-01-01,year,,https://www.linkedin.com/company/arena-group/
BGL Corporate,https://www.crunchbase.com/organization/bgl-corporate,51-100,Active,https://www.bglcorp.com,info@bglcorp.com.au,1(300)654-401,,,,,,,,,"Information Technology, Professional Services, Software","Compliance, Consulting, Document Management, Information Technology, Software",,,,,,,,,,"Brighton, South Australia, Australia",$10M to $50M,1983-01-01,year,,https://www.linkedin.com/company-beta/218580/
Archiva,https://www.crunchbase.com/organization/archiva-group-23a8,101-250,Active,https://www.archivagroup.com/,sales@archivagroup.it,+39 045 288 00 00,,,,,,,,,"Information Technology, Other, Professional Services, Software","Consulting, Document Management, Information Services, Information Technology, IT Management, Professional Services",0,1,,Scientific and electric apparatus and instruments,,,,,,"Verona, Veneto, Italy",$10M to $50M,1998-01-01,year,,https://www.linkedin.com/company/archiva
Quadrant Software,https://www.crunchbase.com/organization/quadrant-software,51-100,Active,http://www.quadrantsoftware.com,support@quadrantsoftware.com,800-258-3399,,,,,,,,,"Consumer Electronics, Data and Analytics, Hardware, Information Technology, Software","Business Intelligence, Computer, Data Management, Developer Platform, Document Management, Enterprise Software, Information Technology, Software",,,,,,,,,,"Mansfield, Massachusetts, United States",$10M to $50M,1990-01-01,year,,https://www.linkedin.com/company/quadrant-software
Automated Business Solutions,https://www.crunchbase.com/organization/automated-business-solutions-inc,51-100,Active,https://www.absne.com,contactus@absne.com,+1 800 794 2679,,,,,,,,,"Consumer Electronics, Content and Publishing, Hardware, Information Technology, Internet Services, Media and Entertainment, Sales and Marketing, Software","Cloud Data Services, Computer, Consumer Electronics, Document Management, Information Services, Information Technology, Printing, Sales, Software",,,,,980816,USD,980816,,,"Warwick, Rhode Island, United States",$10M to $50M,1992-01-01,year,,https://www.linkedin.com/company/automated-business-solutions-inc-
Med Communications,https://www.crunchbase.com/organization/med-communications-e69f,101-250,Active,https://medcommunications.com,info@medcomminc.com,+1 877-477-0977,,,,,,,,,"Health Care, Information Technology, Professional Services, Software","Consulting, Document Management, Health Care, Medical, Pharmaceutical",,,,,2804250,USD,2804250,,,"Memphis, Tennessee, United States",$10M to $50M,1998-01-01,year,,https://www.linkedin.com/company/med-communications-inc-/
Unified Group Services,https://www.crunchbase.com/organization/unified-group-services,101-250,Active,https://www.unifiedgrp.com,info@unifiedgrp.com,+1 765 608 6680,,,,,,,,,"Administrative Services, Financial Services, Information Technology, Software","Document Management, Document Preparation, Insurance, Office Administration",,,,,1512971,USD,1512971,,,"Anderson, Indiana, United States",$10M to $50M,1996-01-01,year,,https://www.linkedin.com/company/unified-group-services
WorldView,https://www.crunchbase.com/organization/worldview-ltd,51-100,Active,http://worldviewltd.com,info@worldviewltd.com,+1 (402) 330-0210,,,,,,,,,"Information Technology, Software","Document Management, Information Technology, Software",0,1,,Scientific and technological services,1232400,USD,1232400,,,"Omaha, Nebraska, United States",$10M to $50M,2001-01-01,year,,https://www.linkedin.com/company/worldviewltd/
GoAnywhere by HelpSystems,https://www.crunchbase.com/organization/linoma-software,1001-5000,Active,https://www.goanywhere.com,linoma.sales@helpsystems.com,(800) 949-4696,,,,,,,,,"Data and Analytics, Information Technology, Other, Privacy and Security, Software","Business Intelligence, Cloud Security, Collaboration, Cyber Security, Document Management, Enterprise Software, File Sharing, Information Technology, Security, Software",,,,,1014472,USD,1014472,,,"Ashland, Nebraska, United States",$10M to $50M,1994-01-01,year,,https://www.linkedin.com/company/115439/
CASO,https://www.crunchbase.com/organization/caso,51-100,Active,https://caso.com/,,888-719-0065,,,,,,,,,"Information Technology, Software","Document Management, Information Technology, Software",,,,,897536,USD,897536,,,"San Antonio, Texas, United States",$10M to $50M,1994-01-01,day,,https://www.linkedin.com/company/caso-inc/
Ford Office Technologies,https://www.crunchbase.com/organization/ford-office-technologies,51-100,Active,https://www.fordtech.com,info@fordtech.com,+1-800-633-3673,,,,,,,,,"Content and Publishing, Hardware, Information Technology, Media and Entertainment, Software, Transportation","Data Storage, Document Management, Information Technology, IT Management, Printing, Software, Supply Chain Management",0,1,,Scientific and electric apparatus and instruments,1027603,USD,1027603,,,"Connellsville, Pennsylvania, United States",$10M to $50M,1991-01-01,year,,https://www.linkedin.com/company/ford-office-technologies
EasyPost,https://www.crunchbase.com/organization/easypost-cbf5,101-250,Active,https://www.easypost.eu,info@easypost.eu,32 50 69 86 11,,,,,,,,,"Administrative Services, Information Technology, Software","Business Information Systems, Document Management, Facilities Support Services, Software",,,,,706649,USD,706649,,,"Ghent, Oost-Vlaanderen, Belgium",$10M to $50M,,,,https://www.linkedin.com/company/easypost-belgium
ONEIL,https://www.crunchbase.com/organization/oneil,251-500,Active,https://www.oneil.com/,contactus@oneil.com,(937) 865-0800,,,,,,,,,"Education, Government and Military, Information Technology, Other, Science and Engineering, Software","Aerospace, Commercial, Document Management, E-Learning, Information Services, Military, Software",0,1,,Scientific and electric apparatus and instruments,,,,,,"Miamisburg, Ohio, United States",$10M to $50M,1947-07-01,day,,https://www.linkedin.com/company/oneil
American Retrieval,https://www.crunchbase.com/organization/american-retrieval,51-100,Active,https://www.americanretrieval.com/,,888-972-9901,,,,,,,,,"Hardware, Health Care, Information Technology, Software","Data Storage, Document Management, Electronic Health Record (EHR)",,,,,1087322,USD,1087322,,,"Plymouth, Minnesota, United States",$10M to $50M,1993-01-01,year,,https://www.linkedin.com/company/american-retrieval/
e-Boks,https://www.crunchbase.com/organization/e-boks,51-100,Active,https://www.e-boks.dk,DPO-team@e-boks.dk,+45 70 21 24 00,,,,,,,,,"Data and Analytics, Information Technology, Internet Services, Software","Business Intelligence, Document Management, Online Portals",,,,,,,,,,"Hellerup, Hovedstaden, Denmark",$10M to $50M,2001-01-01,year,,http://www.linkedin.com/company/e-boks-as
Seldat Technology Services,https://www.crunchbase.com/organization/seldat-technology-services,251-500,Closed,https://tech.seldatinc.com,tech@seldatinc.com,908-315-5979,,,,,,,,,"Administrative Services, Commerce and Shopping, Information Technology, Internet Services, Manufacturing, Science and Engineering, Software, Transportation","Document Management, E-Commerce Platforms, Industrial Automation, Information Technology, Logistics, Software, Staffing Agency, Supply Chain Management, Transportation, Warehousing",,,,,1931726,USD,1931726,,,"South Plainfield, New Jersey, United States",$10M to $50M,2006-01-01,year,,https://www.linkedin.com/company/seldat-tech/
Imagetec,https://www.crunchbase.com/organization/imagetec,51-100,Active,http://www.imagetec.com,Marketing@imagetec.com,815-759-6000,,,,,,,,,"Hardware, Information Technology, Other, Professional Services, Software, Sustainability","Consulting, Document Management, GreenTech, Hardware, Small and Medium Businesses, Software",0,2,,Scientific and technological services,1551028,USD,1551028,,,"Mchenry, Illinois, United States",$10M to $50M,1992-01-01,year,,https://www.linkedin.com/company/imagetec/
BelWo,https://www.crunchbase.com/organization/belwo,51-100,Active,http://www.BelWo.com,customerservice@belwo.com,518 276 6797,,,,,,,,,"Information Technology, Professional Services, Software","Consulting, Document Management, Information Technology, Software, Web Development",,,,,1470167,USD,1470167,,,"Dallas, Texas, United States",$10M to $50M,2002-01-01,year,,https://www.linkedin.com/company/belwo-inc
Across Systems,https://www.crunchbase.com/organization/across-systems,51-100,Active,http://www.across.net,international@across.net,49 7248 925 425,,,,,,,,,"Administrative Services, Data and Analytics, Hardware, Information Technology, Media and Entertainment, Other, Science and Engineering, Software","Business Intelligence, Content, Document Management, Information Technology, Knowledge Management, Robotics, Software",,,,,1868295,USD,1868295,,,"Glendale, California, United States",$10M to $50M,2005-01-01,year,,http://www.linkedin.com/company/across-systems-gmbh
Rev1 Energy,https://www.crunchbase.com/organization/rev1-energy,101-250,Active,https://www.rev1energy.com/,info@rev1.co,+1 813-657-2404,,,,,,,,,"Administrative Services, Energy, Information Technology, Other, Professional Services, Software","Compliance, Consulting, Document Management, Energy, Project Management, Quality Assurance",,,,,1581814,USD,1581814,,,"Tampa, Florida, United States",$10M to $50M,2001-01-01,year,,https://www.linkedin.com/company/rev1/
PlusOne Solutions,https://www.crunchbase.com/organization/plusone-solutions,51-100,Active,http://www.plusonesolutions.net,sales@plusonesolutions.net,407-359-5929,,,,,,,,,"Education, Financial Services, Information Technology, Software","Document Management, Financial Services, Training",0,6,,Legal services,460170,USD,460170,,,"Orlando, Florida, United States",$10M to $50M,2005-01-01,year,Tamiami Angel Funds,https://www.linkedin.com/company/plusone-solutions
Southwest Solutions Group,https://www.crunchbase.com/organization/southwest-solutions-group,101-250,Active,http://www.southwestsolutions.com,info@southwestsolutions.com,(972) 250-2229,,,,,,,,,"Administrative Services, Hardware, Information Technology, Manufacturing, Privacy and Security, Professional Services, Real Estate, Science and Engineering, Software","Archiving Service, Consulting, Document Management, Industrial Automation, Manufacturing, RFID, Security, Self-Storage",0,2,,"Transport, packaging and storing",2998511,USD,2998511,,,"Lewisville, Texas, United States",$10M to $50M,1969-01-01,year,,http://www.linkedin.com/company/71269
ConDoc,https://www.crunchbase.com/organization/condoc,51-100,Active,https://www.condoc.com,support@condoc.com,+1 800 715 1809,,,,,,,,,"Administrative Services, Apps, Information Technology, Mobile, Other, Real Estate, Software","Apps, Construction, Document Management, Mobile Apps, Project Management, Software",0,1,,Scientific and technological services,,,,,,"Boise, Idaho, United States",$10M to $50M,2014-01-01,year,,https://www.linkedin.com/company/condoc/
International Litigation Services,https://www.crunchbase.com/organization/international-litigation-services,101-250,Active,https://ilsteam.com/,sales@ilsteam.com,+1 888 313 4843,,,,,,,,,"Government and Military, Information Technology, Internet Services, Professional Services, Software","Consulting, Document Management, Ediscovery, Government, Legal",,,,,,,,,,"Irvine, California, United States",$10M to $50M,1988-01-01,year,,https://www.linkedin.com/company/international-litigation-services/
BMI Imaging Systems,https://www.crunchbase.com/organization/bmi-imaging-systems,51-100,Active,https://bmiimaging.com/,info@bmiimaging.com,4087364397,,,,,,,,,"Consumer Electronics, Data and Analytics, Hardware, Information Technology, Media and Entertainment, Software","Consumer Electronics, Content, Document Management, Hardware, Image Recognition, Software",,,,,5471400,USD,5471400,,,"Sunnyvale, California, United States",$10M to $50M,1958-01-01,year,,https://www.linkedin.com/company/bmiimaging
The Advance Group,https://www.crunchbase.com/organization/the-advance-group,51-100,Active,https://www.theadvancegrp.com/,,+1-877-273-6480,,,,,,,,,"Consumer Goods, Information Technology, Manufacturing, Other, Real Estate, Software, Transportation","Commercial, Document Management, Fast-Moving Consumer Goods, Furniture, Industrial, Transportation",,,,,1231608,USD,1231608,,,"Long Island City, New York, United States",$10M to $50M,1979-01-01,year,,https://www.linkedin.com/company/the-advance-group
Century Business Technologies,https://www.crunchbase.com/organization/century-business-technologies,51-100,Active,https://www.centuryks.com/,,785-267-4555,,,,,,,,,"Apps, Content and Publishing, Information Technology, Media and Entertainment, Mobile, Software","Document Management, Mobile Apps, Printing, Software, Web Apps",,,,,2523843,USD,2523843,,,"Topeka, Kansas, United States",$10M to $50M,1981-01-01,day,,https://www.linkedin.com/company/centurykansas
netlogx,https://www.crunchbase.com/organization/netlogx,51-100,Active,https://netlogx.com,information@netlogx.com,(317) 536-6046,,,,,,,,,"Administrative Services, Data and Analytics, Government and Military, Information Technology, Other, Professional Services, Software","Application Performance Management, Consulting, Document Management, Government, Information Technology, Management Consulting, Professional Services, Project Management, Risk Management",0,1,,Advertising; business,2783009,USD,2783009,,,"Indianapolis, Indiana, United States",$10M to $50M,1998-01-01,year,,https://www.linkedin.com/company/netlogx/
Tokium,https://www.crunchbase.com/organization/tokium,251-500,Active,https://www.keihi.com/company/,pr@tokium.jp,,,,,,,,,,"Financial Services, Information Technology, Software","Document Management, FinTech, Software",,,,,,,,,,"Tokyo, Tokyo, Japan",$10M to $50M,2012-01-01,year,,https://www.linkedin.com/company/beartail/
Datafied,https://www.crunchbase.com/organization/datafied,51-100,Active,https://www.datafied.com,,800-765-7510,,,,,,,,,"Data and Analytics, Information Technology, Software","Data Management, Document Management, Information Technology",,,,,1502774,USD,1502774,,,"Anaheim, California, United States",$10M to $50M,1993-01-01,day,,https://www.linkedin.com/company/datafied-pvt-ltd
Express Imaging Services,https://www.crunchbase.com/organization/express-imaging-services,101-250,Active,https://www.eiscallcenter.com/eis/,info@expressimagingservices.com,+1-888-846-8804,,,,,,,,,"Health Care, Information Technology, Software","Document Management, Electronic Health Record (EHR), Information Services",,,,,70415,USD,70415,,,"Torrance, California, United States",$10M to $50M,1999-01-01,year,,https://www.linkedin.com/company/express-imaging-services-inc
NordLocker,https://www.crunchbase.com/organization/nordlocker,101-250,Active,http://nordlocker.com,,,,,,,,,,,"Hardware, Information Technology, Privacy and Security, Software","Data Storage, Document Management, Security",,,,,,,,,,"Panama City, Panama, Panama",$10M to $50M,2019-01-01,day,,https://www.linkedin.com/company/nordlocker/
