AeroCentury,https://www.crunchbase.com/organization/aerocentury,1-10,Active,http://www.aerocentury.com/,info@aerocentury.com,1-650-340-1888,,,,,,,,,"Financial Services, Media and Entertainment, Professional Services, Real Estate, Sales and Marketing, Software, Transportation","Air Transportation, Consulting, Leasing, Metaverse, Property Management, Sales",0,1,,"Transport, packaging and storing",1007241,USD,1007241,,,"Palo Alto, California, United States",$1M to $10M,1997-01-01,day,,https://www.linkedin.com/company/aerocentury-corp/
Imperium Empires,https://www.crunchbase.com/organization/imperium-empires,11-50,Active,https://imperiumempires.com,,,,,,,,,,,"Blockchain and Cryptocurrency, Financial Services, Media and Entertainment, Other, Payments, Software","Blockchain, Cryptocurrency, Metaverse",,,,,,,,,,"Central and Western, Hong Kong Island, Hong Kong",$1M to $10M,2021-01-01,year,"Colony Lab, Three Arrows Capital, Avalanche, A&T Capital, Colony Capital",https://www.linkedin.com/company/imperium-empires
MindDust Labs,https://www.crunchbase.com/organization/minddust-labs,1-10,Active,https://solve4all.wixsite.com/minddustlabs,,,,,,,,,,,"Artificial Intelligence (AI), Consumer Electronics, Data and Analytics, Gaming, Hardware, Health Care, Internet Services, Media and Entertainment, Navigation and Mapping, Software","Field-Programmable Gate Array (FPGA), GPS, Health Diagnostics, Internet of Things, Medical Device, Metaverse, MMO Games, Predictive Analytics, Wearables",,,,,,,,,,"San Francisco, California, United States",$1M to $10M,1980-01-01,year,Kris Kitchen,https://www.linkedin.com/company/minddustlabs
NFT Oasis,https://www.crunchbase.com/organization/nft-oasis,1-10,Active,https://www.nftoasis.co/,,,,,,,,,,,"Blockchain and Cryptocurrency, Media and Entertainment, Other, Software","Blockchain, Metaverse",,,,,,,,,,"San Francisco, California, United States",$1M to $10M,2021-03-01,month,"Mechanism Capital, Lemniscap, The LAO, Flamingo DAO, Intellectus Partners",https://www.linkedin.com/company/nft-oasis
Rehuman,https://www.crunchbase.com/organization/rehuman,1-10,Active,https://rehuman.com,hello@rehuman.com,,,,,,,,,,"Blockchain and Cryptocurrency, Financial Services, Information Technology, Media and Entertainment, Other, Payments, Privacy and Security, Software","Blockchain, Cryptocurrency, Identity Management, Metaverse",,,,,308477,USD,308477,,,"Toronto, Ontario, Canada",$1M to $10M,2019-01-01,year,,https://www.linkedin.com/company/rehuman
Embright Infotech,https://www.crunchbase.com/organization/embright-infotech,11-50,Active,https://embrightinfotech.com/,mail@embrightinfotech.com,91 9895496049,,,,,,,,,"Hardware, Media and Entertainment, Software","Augmented Reality, Metaverse, Software, Virtual Reality",1,0,Medical Or Veterinary Science; Hygiene,,,,,,,"Bengaluru, Karnataka, India",$1M to $10M,2017-05-18,day,"JioGenNext, IIMK Live",https://www.linkedin.com/company/embrightinfotech/
DGT Network,https://www.crunchbase.com/organization/dgt-network,11-50,Active,https://dgt.world,,,,,,,,,,,"Blockchain and Cryptocurrency, Data and Analytics, Financial Services, Information Technology, Internet Services, Media and Entertainment, Other, Payments, Software","Blockchain, Business Intelligence, Data Integration, Enterprise Software, Financial Services, FinTech, Internet, Metaverse, Transaction Processing, Web3",,,,,,,,,,"Toronto, Ontario, Canada",$1M to $10M,2017-09-01,day,,https://www.linkedin.com/company/dgt-network
Marie Zélie,https://www.crunchbase.com/organization/marie-zelie,1-10,Active,https://mariezelie.com/,k.zietarski@mariezelie.com,+48604896269,,,,,,,,,"Blockchain and Cryptocurrency, Clothing and Apparel, Commerce and Shopping, Community and Lifestyle, Design, Financial Services, Internet Services, Media and Entertainment, Other, Payments, Software","Blockchain, Cryptocurrency, E-Commerce, Fashion, Lifestyle, Metaverse, Retail, Web3",0,1,,Leather and imitations of leather,,,,,,"Gdansk, Pomorskie, Poland",$1M to $10M,2017-04-26,day,Krzysztof Ziętarski,https://www.linkedin.com/company/marie-z%C3%A9lie/?originalSubdomain=pl
Launch House,https://www.crunchbase.com/organization/launch-house,11-50,Active,https://www.launchhouse.com/,admin@launchhouse.co,(216) 255-3070,2,2,,,,,,,"Community and Lifestyle, Financial Services, Lending and Investments, Media and Entertainment, Software","Communities, Media and Entertainment, Metaverse, Venture Capital",,,,,143550,USD,143550,,,"Highland, Ohio, United States",$1M to $10M,2020-07-25,day,"Andreessen Horowitz, Day One Ventures, Michael Ovitz, Balaji Srinivasan, Graph Ventures",https://www.linkedin.com/company/launch-house-inc/
HitPiece,https://www.crunchbase.com/organization/hitpiece,1-10,Active,https://www.hitpiece.com,hello@hitpiece.com.,,,,,,,,,,"Blockchain and Cryptocurrency, Financial Services, Media and Entertainment, Music and Audio, Other, Payments, Software","Blockchain, Cryptocurrency, Metaverse, Music",,,,,,,,,,"Provo, Utah, United States",$1M to $10M,2021-01-01,year,"Pelion Venture Partners, Rick Ross, Jacob Canady",https://www.linkedin.com/company/hitpiece
Hologo World,https://www.crunchbase.com/organization/hologo-world,11-50,Active,https://hologo.world/,eedham@hologo.world,+9607771144,,,,,,,,,"Consumer Electronics, Education, Hardware, Media and Entertainment, Science and Engineering, Software","Augmented Reality, Consumer Electronics, EdTech, Education, Metaverse, Primary Education, Robotics, Secondary Education, STEM Education, Virtual Reality",,,,,143229,USD,143229,,,"Newark, Delaware, United States",$1M to $10M,2018-02-03,day,Islanders Education Pvt Ltd,https://www.linkedin.com/company/13714221
Voltaku,https://www.crunchbase.com/organization/voltaku,1-10,Active,https://voltaku.com/,hello@voltaku.com,,,,,,,,,,"Gaming, Hardware, Media and Entertainment, Software","Augmented Reality, Gaming, Media and Entertainment, Metaverse, Virtual Reality",,,,,70291,USD,70291,,,"Los Angeles, California, United States",$1M to $10M,2020-02-01,month,"Epic Games, Xsolla, David Ko, Zachary Smith, Alston Gardner",https://www.linkedin.com/company/voltaku/
Arcade2earn,https://www.crunchbase.com/organization/arcade2earn,11-50,Active,https://www.arcade2earn.io,marketing@arcade2earn.io,,,,,,,,,,"Blockchain and Cryptocurrency, Gaming, Media and Entertainment, Other, Software","Blockchain, Gaming, Metaverse",,,,,,,,,,"New Castle, Delaware, United States",$1M to $10M,2021-01-01,year,"Rainmaker Games, PARSIQ, KuCoin, Good Games Guild, Non-Fungible Labs",https://www.linkedin.com/company/arcade2earn
bem.builders,https://www.crunchbase.com/organization/bem-builders,1-10,Active,http://bem.builders/,contact@bem.builders,,,,,,,,,,"Advertising, Blockchain and Cryptocurrency, Internet Services, Media and Entertainment, Sales and Marketing, Software","Advertising, Metaverse, Web3",,,,,340817,USD,340817,,,"Paris, Ile-de-France, France",$1M to $10M,2020-01-01,year,"Keyrus, Karot Capital, Younicorns",https://www.linkedin.com/company/bem-builders
Musixen,https://www.crunchbase.com/organization/musixen,11-50,Active,http://www.musixen.com,cagribozay@musixen.com,00905497958474,,,,,,,,,"Internet Services, Media and Entertainment, Music and Audio, Software","Media and Entertainment, Metaverse, Music, Music Streaming",,,,,,,,,,"Istanbul, Istanbul, Turkey",$1M to $10M,2020-02-05,day,"Re-Pie Asset Management, Plug and Play, Platform XIT",https://www.linkedin.com/company/musixen/?viewAsMember=true
Alter,https://www.crunchbase.com/organization/facemoji,11-50,Closed,http://alter.xyz/,hello@alter.xyz,,,,,,,,,,"Apps, Artificial Intelligence (AI), Blockchain and Cryptocurrency, Commerce and Shopping, Data and Analytics, Hardware, Internet Services, Media and Entertainment, Science and Engineering, Software","3D Technology, Apps, Artificial Intelligence (AI), Computer Vision, Metaverse, Social Media, Virtual Goods, Web3",,,,,517994,USD,517994,,,"New York, New York, United States",$1M to $10M,2017-03-09,day,"Betaworks, X (formerly Twitter), General Catalyst, Curious Capital, Spacecadet Ventures",https://www.linkedin.com/company/alterxyz
ForeQuest,https://www.crunchbase.com/organization/forequest,11-50,Active,http://www.forequest.co.uk,rt@forequest.co.uk,,,,,,,,,,"Advertising, Financial Services, Hardware, Lending and Investments, Media and Entertainment, Mobile, Other, Sales and Marketing, Social Impact, Software","Augmented Reality, Cause Marketing, Impact Investing, Metaverse, Mobile, Mobile Advertising, Outdoor Advertising, Social Impact",1,1,,Scientific and electric apparatus and instruments,151290,USD,151290,,,"Milano, Lombardia, Italy",$1M to $10M,2020-02-01,month,,https://www.linkedin.com/company/forequest
VRYNT,https://www.crunchbase.com/organization/vrynt,11-50,Active,https://vrynt.io/,,,,,,,,,,,"Media and Entertainment, Software",Metaverse,,,,,,,,,,"New Canaan, Connecticut, United States",$1M to $10M,2021-01-01,year,"Jaycen Joshua, Steve Miller",https://www.linkedin.com/company/vrynt/
Martian Republic,https://www.crunchbase.com/organization/martian-republic,1-10,Active,https://www.martianrepublic.io,,,,,,,,,,,"Blockchain and Cryptocurrency, Financial Services, Gaming, Hardware, Media and Entertainment, Payments, Software","Cryptocurrency, Gaming, Metaverse, Virtual Reality",,,,,,,,,,"Singapore, Central Region, Singapore",$1M to $10M,2021-07-01,month,East Naga Capital,https://www.linkedin.com/company/martianrepublic
Gaze Coin,https://www.crunchbase.com/organization/gaze-coin,1-10,Active,https://www.gazecoin.io,support@gazecoin.io,,,,,,,,,,"Blockchain and Cryptocurrency, Information Technology, Media and Entertainment, Other, Software","Blockchain, Information Services, Information Technology, Metaverse",,,,,,,,,,"Sydney, New South Wales, Australia",$1M to $10M,2017-01-01,year,,https://www.linkedin.com/company/gaze-coin/
FoggyStar,https://www.crunchbase.com/organization/foggystar,11-50,Active,https://foggystar.com/,support@foggystar.com,+61 2 8005 1646,,,,,,,,,"Gaming, Media and Entertainment, Software, Travel and Tourism","Casino, Gaming, Metaverse",,,,,,,,,,"Saltcoats, North Ayrshire, United Kingdom",$1M to $10M,2016-01-01,year,,
WizSchool,https://www.crunchbase.com/organization/wizschool,11-50,Active,https://wizschool.io,info@wizschool.io,82 2-6358-2019,,,,,,,,,"Apps, Artificial Intelligence (AI), Data and Analytics, Education, Media and Entertainment, Science and Engineering, Software","Apps, Artificial Intelligence (AI), EdTech, Education, Metaverse, Software",2,0,Computing; Calculating,Scientific and electric apparatus and instruments,,,,,,"Yeoksamdong, Seoul-t'ukpyolsi, South Korea",$1M to $10M,2018-09-04,day,"Spring Camp, Capstone Partners, NH Investment & Securities, YG PLUS, Daekyo Investment",https://www.linkedin.com/company/wizschool-inc
Kryptomon,https://www.crunchbase.com/organization/kryptomon,11-50,Active,https://Kryptomon.co,partnerships@kryptomon.co,,,,,,,,,,"Blockchain and Cryptocurrency, Financial Services, Gaming, Hardware, Media and Entertainment, Other, Payments, Software","Augmented Reality, Blockchain, Cryptocurrency, Gaming, Metaverse",0,1,,Scientific and electric apparatus and instruments,,,,,,"Amsterdam, Noord-Holland, The Netherlands",$1M to $10M,2021-08-01,day,"PLAYSTUDIOS, Alumni Ventures, Griffin Gaming Partners, Tal Ventures, NFX",https://www.linkedin.com/company/73212275
Stably Corporation,https://www.crunchbase.com/organization/stably,11-50,Active,https://www.stably.io,info@stably.io,,,,,,,,,,"Blockchain and Cryptocurrency, Financial Services, Internet Services, Media and Entertainment, Other, Payments, Software","Blockchain, FinTech, Metaverse, Payments, Web3",0,2,,Insurance; financial affairs,630300,USD,630300,,,"Seattle, Washington, United States",$1M to $10M,2018-02-15,day,"500 Global, BEENEXT, Paul Stahura, Tony Chen, Randy Hana",https://www.linkedin.com/company/stably
Chillchat,https://www.crunchbase.com/organization/chillchat,11-50,Active,http://www.chillchat.me,info@chillchat.me,,,,,,,,,,"Blockchain and Cryptocurrency, Financial Services, Gaming, Media and Entertainment, Payments, Software","Cryptocurrency, Gaming, Metaverse",,,,,,,,,,"Bangkok, Krung Thep, Thailand",$1M to $10M,2019-01-01,year,"Orange DAO, Animoca Brands, GuildFi, Snackclub, Avocado Guild",https://www.linkedin.com/company/chillchat/
The Net VR,https://www.crunchbase.com/organization/the-net-vr,1-10,Active,http://thenetvr.com,Kyle@thenetvr.com,5036796199,,,,,,,,,"Apps, Community and Lifestyle, Content and Publishing, Internet Services, Media and Entertainment, Software, Video","Apps, Internet, Metaverse, Social, Social Media, Software, Video Streaming",,,,,,,,,,"Hillsboro, Oregon, United States",$1M to $10M,2019-09-13,day,,https://www.linkedin.com/company/the-net-vr/
KattGatt,https://www.crunchbase.com/organization/kattgatt,11-50,Active,http://www.kattgatt.com/,,,,,,,,,,,"Media and Entertainment, Real Estate, Software","Metaverse, Real Estate",,,,,,,,,,"Shenzhen, Guangdong, China",$1M to $10M,2017-01-01,year,,
ZELF,https://www.crunchbase.com/organization/zelf,11-50,Closed,http://zelf.co/,invest@zelf.co,,,,,,,,,,"Apps, Financial Services, Media and Entertainment, Payments, Software","Apps, Financial Services, FinTech, Metaverse, Transaction Processing",,,,,,,,,,"Wilmington, Delaware, United States",$1M to $10M,2019-07-01,month,"Chris Adelsbach, 3VC, Polymorphic Capital, Chris Murphy, Baboon.VC",https://www.linkedin.com/company/zelfco/
FromLabs,https://www.crunchbase.com/organization/fromlabs-pte-ltd,11-50,Active,http://www.fromlabs.com,info@fromlabs.com,,,,,,,,,,"Apps, Education, Gaming, Information Technology, Media and Entertainment, Mobile, Software","Education, Enterprise Software, Gamification, Information Technology, Metaverse, Mobile Apps, Software",0,1,,Scientific and electric apparatus and instruments,,,,,,"Singapore, Central Region, Singapore",$1M to $10M,2012-11-01,month,,https://www.linkedin.com/company/von-der-volks-pte-ltd/
Croquet,https://www.crunchbase.com/organization/croquet-corporation,11-50,Active,https://croquet.io,info@croquet.io,,,,,,,,,,"Media and Entertainment, Software","Metaverse, Software",,,,,,,,,,"Los Angeles, California, United States",$1M to $10M,2018-05-05,day,"SIP Global Partners, ARKN Ventures",https://www.linkedin.com/company/croquet-corporation/
NFT Tech,https://www.crunchbase.com/organization/nft-technologies,1-10,Active,https://www.nfttech.com,invest@nfttech.com,+1(604)123-4567,12,12,2,,,,,,"Blockchain and Cryptocurrency, Financial Services, Information Technology, Media and Entertainment, Other, Payments, Software","Blockchain, Cryptocurrency, FinTech, Information Technology, Metaverse, Software",,,,,,,,,,"Vancouver, Alberta, Canada",$1M to $10M,2016-01-01,year,,https://www.linkedin.com/company/nfttechnologies
Lamina1,https://www.crunchbase.com/organization/lamina1,11-50,Active,https://www.lamina1.com/,,,1,1,,,,,,,"Blockchain and Cryptocurrency, Information Technology, Media and Entertainment, Other, Software","Blockchain, Information Technology, Metaverse",,,,,,,,,,"Seattle, Washington, United States",$1M to $10M,2022-01-01,year,"Hiro Capital, PALcapital",https://www.linkedin.com/company/lamina1
Avaturn (formerly in3D),https://www.crunchbase.com/organization/in3d-69d5,11-50,Active,https://avaturn.me,hello@avaturn.me,,,,,,,,,,"Gaming, Hardware, Media and Entertainment, Software","3D Technology, Computer Vision, Gaming, Metaverse",,,,,,,,,,"Tel Aviv, Tel Aviv, Israel",$1M to $10M,2019-01-01,year,"Alchemist Accelerator, XTX Ventures, Wayne Chang, Jeff Seibert, Chang Corporation",https://www.linkedin.com/company/avaturn/
Webaverse,https://www.crunchbase.com/organization/webaverse,11-50,Active,https://webaverse.ai/,hello@webaverse.ai,9174261206,,,,,,,,,"Artificial Intelligence (AI), Data and Analytics, Gaming, Internet Services, Media and Entertainment, Science and Engineering, Software","Artificial Intelligence (AI), Gaming, Internet, Metaverse, Open Source, Software",,,,,,,,,,"Wilmington, Delaware, United States",$1M to $10M,2020-12-15,day,,https://www.linkedin.com/company/webaverse
MAP Esports Network Inc.,https://www.crunchbase.com/organization/map-esports-network-inc,11-50,Active,https://www.mapesports.net,sales@mapesports.net,+1 214 763 1134,,,,,,,,,"Apps, Information Technology, Media and Entertainment, Software","Apps, Information Technology, Metaverse",0,1,,Education; entertainment,443456,USD,443456,,,"Grapevine, Texas, United States",$1M to $10M,2020-03-15,day,,https://www.linkedin.com/groups/12316423/
Engines of Fury,https://www.crunchbase.com/organization/engines-of-fury,11-50,Active,https://www.eof.gg,,,,,,,,,,,"Blockchain and Cryptocurrency, Financial Services, Media and Entertainment, Other, Payments, Software","Bitcoin, Blockchain, Cryptocurrency, Metaverse",,,,,,,,,,"London, England, United Kingdom",$1M to $10M,2022-01-01,year,"Foresight Ventures, Momentum 6, NewTribe Capital, Founderheads,",https://www.linkedin.com/company/engines-of-fury
Bigthinx,https://www.crunchbase.com/organization/bigthinx,11-50,Active,https://bigthinx.com,info@bigthinx.com,,,,,,,,,,"Artificial Intelligence (AI), Clothing and Apparel, Commerce and Shopping, Data and Analytics, Design, Media and Entertainment, Science and Engineering, Software","Artificial Intelligence (AI), E-Commerce, Fashion, Machine Learning, Metaverse, Software",,,,,,,,,,"Middletown, Delaware, United States",$1M to $10M,2015-10-08,day,JioGenNext,https://www.linkedin.com/company/bigthinxai
QORPO,https://www.crunchbase.com/organization/qorpo,51-100,Active,https://qorpo.world,info@qorpo.co,,,,,,,,,,"Blockchain and Cryptocurrency, Financial Services, Gaming, Media and Entertainment, Other, Payments, Software","Blockchain, Cryptocurrency, Gaming, Metaverse, Virtual Currency",,,,,,,,,,"Dubai, Dubai, United Arab Emirates",$1M to $10M,2019-01-01,year,,https://www.linkedin.com/company/qorpoco
InnerSloth,https://www.crunchbase.com/organization/innersloth,1-10,Active,https://www.innersloth.com/,OxfordHouseShop411@gmail.com,(661) 360-9936,,,,,,,,,"Commerce and Shopping, Education, Media and Entertainment, Software","E-Commerce, Education, Metaverse, Software",,,,,97385,USD,97385,,,"Redmond, Washington, United States",$1M to $10M,2014-01-01,year,,https://www.linkedin.com/company/innersloth
Groove Jones,https://www.crunchbase.com/organization/groove-jones,51-100,Active,http://www.groovejones.com,whois@groovejones.com,214-749-0094,,,,,,,,,"Advertising, Apps, Commerce and Shopping, Community and Lifestyle, Education, Hardware, Internet Services, Media and Entertainment, Other, Sales and Marketing, Software","3D Technology, Advertising, Apps, Education, Internet, Metaverse, Professional Services, Retail, Service Industry, Virtual World",0,3,,Education; entertainment,766541,USD,766541,,,"Dallas, Texas, United States",$1M to $10M,2015-10-01,day,,https://www.linkedin.com/company/groovejones
Roomza,https://www.crunchbase.com/organization/roomza,11-50,Active,https://www.roomza.com,support@roomza.com,844-476-6692,,,,,,,,,"Media and Entertainment, Other, Software, Travel and Tourism","Hotel, Metaverse, Subscription Service, Travel, Travel Accommodations",,,,,139461,USD,139461,,,"New York, New York, United States",$1M to $10M,2020-07-07,day,Dream Ventures,https://www.linkedin.com/company/roomza
Metaverse,https://www.crunchbase.com/organization/metaverse,501-1000,Active,https://mvs.org/,,,2,2,1,,,,,,"Blockchain and Cryptocurrency, Financial Services, Media and Entertainment, Other, Payments, Software","Blockchain, Cryptocurrency, Metaverse",,,,,,,,,,"Shanghai, Shanghai, China",$1M to $10M,2016-01-01,year,Chain Capital,
ChainGuardians,https://www.crunchbase.com/organization/chainguardians-c50d,11-50,Active,https://chainguardians.io,support@chainguardians.io,,2,2,1,,,,,,"Artificial Intelligence (AI), Blockchain and Cryptocurrency, Data and Analytics, Financial Services, Gaming, Media and Entertainment, Other, Payments, Science and Engineering, Software","Artificial Intelligence (AI), Blockchain, Cryptocurrency, Gaming, Metaverse, Virtual Currency",,,,,,,,,,"Hong Kong, Hong Kong Island, Hong Kong",$1M to $10M,2019-01-01,year,"Animoca Brands, OKX Ventures, Morningstar Ventures, MV Global, Genblock Capital",https://www.linkedin.com/company/chainguardians
MetaVerse Green Exchange,https://www.crunchbase.com/organization/metaverse-green-exchange,11-50,Active,https://www.mvgx.com/,contact@mvgx.com,+65 6993 0182,,,,,,,,,"Blockchain and Cryptocurrency, Financial Services, Lending and Investments, Media and Entertainment, Other, Software","Blockchain, Financial Exchanges, FinTech, Metaverse",2,0,Computing; Calculating,,,,,,,"Singapore, Central Region, Singapore",$1M to $10M,2018-01-01,year,,https://www.linkedin.com/company/metaversegreen/
Sensorium,https://www.crunchbase.com/organization/sensorium-c99b,51-100,Active,https://sensoriumxr.com/,info@sensoriumxr.com,,,,,,,,,,"Artificial Intelligence (AI), Blockchain and Cryptocurrency, Data and Analytics, Gaming, Hardware, Internet Services, Media and Entertainment, Science and Engineering, Software","Artificial Intelligence (AI), Augmented Reality, Digital Entertainment, Gaming, Media and Entertainment, Metaverse, Social Media, Software, Virtual Reality, Web3",0,10,,Games; toys; sports equipment,,,,,,"Zug, Zug, Switzerland",$1M to $10M,2018-09-21,day,,https://linkedin.com/company/sensorium-corporation
InfiniteWorld,https://www.crunchbase.com/organization/infiniteworld,1-10,Active,https://infinite.world,hello@infinite.world,,1,1,,,,,,,"Blockchain and Cryptocurrency, Information Technology, Internet Services, Media and Entertainment, Other, Sales and Marketing, Software","Blockchain, Digital Marketing, Information Technology, Marketing, Metaverse, Web3",,,,,178852,USD,178852,,,"Miami, Florida, United States",$1M to $10M,2020-01-01,year,"Keiretsu Capital, zVentures",https://www.linkedin.com/company/infiniteworld/
Altava Group,https://www.crunchbase.com/organization/altava,11-50,Active,https://altava.com,solutions@altava.com,+82 2 3442 2121,,,,,,,,,"Clothing and Apparel, Community and Lifestyle, Design, Gaming, Hardware, Information Technology, Media and Entertainment, Software","Fashion, Gamification, Gaming, Information Technology, Metaverse, Software, Virtual Reality, Virtual World",0,0,,Scientific and electric apparatus and instruments,,,,,,"Singapore, Central Region, Singapore",$1M to $10M,2018-01-01,year,"Alpha Capital, TruePNL, Kudos Ventures",https://www.linkedin.com/company/altava
Xerago,https://www.crunchbase.com/organization/xerago,251-500,Active,https://www.xerago.com/,marketing@xerago.com,1(650)753-0050,,,,,,,,,"Information Technology, Media and Entertainment, Sales and Marketing, Software","Information Technology, Marketing, Metaverse",,,,,241613,USD,241613,,,"Foster City, California, United States",$1M to $10M,2002-06-01,day,,http://www.linkedin.com/company/xerago
Hyperbeam,https://www.crunchbase.com/organization/hyperbeam,1-10,Active,https://hyperbeam.com/,founders@hyperbeam.com,,,,,,,,,,"Media and Entertainment, Software",Metaverse,,,,,65569,USD,65569,,,"Claymont, Delaware, United States",$1M to $10M,2020-02-01,month,"Y Combinator, Pioneer Fund",https://www.linkedin.com/company/hyperbeam-api
BlockTech Brew,https://www.crunchbase.com/organization/dappbrew,101-250,Active,https://blocktechbrew.com/,business@blocktechbrew.com,+971 55 473 8790,,,,,,,,,"Artificial Intelligence (AI), Blockchain and Cryptocurrency, Data and Analytics, Information Technology, Internet Services, Media and Entertainment, Other, Science and Engineering, Software","Artificial Intelligence (AI), Blockchain, Information Technology, Metaverse, Software, Web Development, Web3",,,,,,,,,,"Chandigarh, Chandigarh, India",$1M to $10M,2013-08-24,day,,https://www.linkedin.com/company/blocktechbrew/
RisingMax,https://www.crunchbase.com/organization/risingmax-inc,251-500,Active,https://risingmax.com/,idea@risingmax.com,+1 (917) 451-3717,,,,,,,,,"Apps, Blockchain and Cryptocurrency, Financial Services, Information Technology, Media and Entertainment, Mobile, Other, Payments, Privacy and Security, Software","Blockchain, Cryptocurrency, Cyber Security, Information Technology, Metaverse, Mobile Apps, Software, Web Development",,,,,345513,USD,345513,,,"New York, New York, United States",$1M to $10M,2020-07-12,day,,https://www.linkedin.com/company/38153179/admin/
The Gang,https://www.crunchbase.com/organization/the-gang-f773,101-250,Active,https://thegang.io,contact@thegang.io,,,,,,,,,,"Gaming, Media and Entertainment, Software","Gaming, Metaverse, Online Games, PC Games, Software",,,,,,,,,,"Stockholm, Stockholms Lan, Sweden",$1M to $10M,2019-01-01,year,,https://www.linkedin.com/company/the-gang-sweden
VRdirect,https://www.crunchbase.com/organization/viond,11-50,Active,https://www.vrdirect.com/,contact@vrdirect.com,,,,,,,,,,"Apps, Hardware, Information Technology, Media and Entertainment, Software","Information Technology, Metaverse, SaaS, Software, Virtual Reality, Web Apps",0,4,Computing; Calculating,Scientific and electric apparatus and instruments,327336,USD,327336,,,"Munich, Bayern, Germany",$1M to $10M,2018-01-01,month,"GoBeyond, SEK Ventures, Marcus Englert, BayBG Venture Capital, Heinz-Werner Nienstedt",https://www.linkedin.com/company/vrdirect
RFOX,https://www.crunchbase.com/organization/redfox-labs,51-100,Active,https://www.rfox.com/,partnerships@rfox.com,,,,,,,,,,"Blockchain and Cryptocurrency, Financial Services, Hardware, Information Technology, Internet Services, Media and Entertainment, Other, Payments, Software","Bitcoin, Blockchain, Cryptocurrency, Information Technology, Internet, Metaverse, Virtual Reality",,,,,,,,,,"Dubai, Dubai, United Arab Emirates",$1M to $10M,2018-01-01,year,,https://www.linkedin.com/company/rfox-official/
