Cyberlab,https://www.crunchbase.com/organization/cyberlab-e0ab,11-50,Active,https://cyberlabindia.com,contact@cyberlabindia.com,"+91-8687-777-786 ,+91-8700877787",,,,,,,,,"Apps, Information Technology, Media and Entertainment, Mobile, Professional Services, Sales and Marketing, Software","Business Development, Consulting, DevOps, Digital Marketing, Enterprise Resource Planning (ERP), Metaverse, Mobile Apps, Software, Web Apps, Web Development",,,,,,,,,,"Delhi, Delhi, India",Less than $1M,2011-11-30,day,,https://www.linkedin.com/company/cyberlab-business-services
Institute of Digital Fashion,https://www.crunchbase.com/organization/institute-of-digital-fashion,1-10,Active,https://institute-digital.fashion,info@institure-digital.fashion,,,,,,,,,,"Clothing and Apparel, Commerce and Shopping, Community and Lifestyle, Consumer Electronics, Content and Publishing, Design, Hardware, Media and Entertainment, Software","3D Technology, Collectibles, Creative Agency, Fashion, Metaverse, Virtual Reality, Virtual World, Wearables",,,,,,,,,,"London, England, United Kingdom",Less than $1M,2020-01-01,year,,https://www.linkedin.com/company/the-institute-of-digital-fashion/
SDNA Tech,https://www.crunchbase.com/organization/sdna-tech,101-250,Active,https://sdnatech.com/,info@sdnatech.com,+44 20813 39192,,,,,,,,,"Apps, Blockchain and Cryptocurrency, Design, Information Technology, Media and Entertainment, Mobile, Other, Software","Blockchain, Information Technology, Metaverse, Mobile Apps, Web Design, Web Development",,,,,,,,,,"Croydon, Croydon, United Kingdom",Less than $1M,2010-07-16,day,,https://www.linkedin.com/company/sdna-tech/
BizzTech,https://www.crunchbase.com/organization/bizztech,11-50,Active,https://www.bizztech.io,Contact@bizztech.io,719-360-1255,,,,,,,,,"Blockchain and Cryptocurrency, Community and Lifestyle, Hardware, Internet Services, Media and Entertainment, Other, Software","3D Technology, B2B, Metaverse, SaaS, Software, Virtual Reality, Virtual World, Web3",,,,,279702,USD,279702,,,"Austin, Texas, United States",Less than $1M,2018-01-01,year,,https://www.linkedin.com/company/bizztech
AccuChain Inc.,https://www.crunchbase.com/organization/accuchain-inc,1-10,Active,https://www.accuchain.com/,maura@accuchain.com,415-894-2188,,,,,,,,,"Administrative Services, Blockchain and Cryptocurrency, Media and Entertainment, Other, Software","B2B, B2C, Blockchain, Human Resources, Metaverse, Software",,,,,81093,USD,81093,,,"San Jose, California, United States",Less than $1M,2019-10-27,day,Vertex Partners,https://www.linkedin.com/company/accuchain/
hubinit,https://www.crunchbase.com/organization/hubinit,101-250,Active,https://www.hubinit.tech,eric@hubinit.tech,+31638672878,,,,,,,,,"Administrative Services, Artificial Intelligence (AI), Blockchain and Cryptocurrency, Community and Lifestyle, Data and Analytics, Financial Services, Hardware, Information Technology, Media and Entertainment, Other, Payments, Science and Engineering, Software","Artificial Intelligence (AI), Blockchain, Developer Platform, Human Resources, Information Technology, Metaverse, Payments, Virtual Reality, Virtual World",,,,,157112,USD,157112,,,"Amsterdam, Noord-Holland, The Netherlands",Less than $1M,2022-04-01,day,,https://www.linkedin.com/company/hubinit/
Knoxlabs,https://www.crunchbase.com/organization/knoxlabs,1-10,Active,http://knoxlabs.com,hello@knoxlabs.com,,,,,,,,,,"Commerce and Shopping, Consumer Electronics, Financial Services, Hardware, Manufacturing, Media and Entertainment, Mobile, Payments, Software","Augmented Reality, E-Commerce, Electronics, Hardware, Manufacturing, Metaverse, Mobile Payments, Software, Virtual Reality",,,,,94222,USD,94222,,,"Glendale, California, United States",Less than $1M,2014-06-30,day,,https://www.linkedin.com/company/knoxlabs
MetaMuto,https://www.crunchbase.com/organization/metamuto,1-10,Active,https://metamuto.com/,Danish@metamuto.com,923214319297,,,,,,,,,"Blockchain and Cryptocurrency, Media and Entertainment, Other, Software","Blockchain, Metaverse",,,,,,,,,,"Lahore, Punjab, Pakistan",Less than $1M,2022-01-01,year,,https://www.linkedin.com/company/metamuto/
The Ohzone,https://www.crunchbase.com/organization/the-ohzone,1-10,Active,https://www.theohzoneinc.com/,info@theohzoneinc.com,,,,,,,,,,"Blockchain and Cryptocurrency, Clothing and Apparel, Commerce and Shopping, Consumer Goods, Financial Services, Gaming, Hardware, Media and Entertainment, Other, Payments, Software","3D Technology, Augmented Reality, Blockchain, Cryptocurrency, E-Commerce, Metaverse, Online Games, Retail Technology, Shoes, Virtual Reality",,,,,50032,USD,50032,,,"Sunnyvale, California, United States",Less than $1M,2014-06-01,month,,https://www.linkedin.com/company/the-ohzone-inc-/
Iconic Engine,https://www.crunchbase.com/organization/iconic-engine,11-50,Active,https://www.iconicengine.com/,info@iconicengine.com,,,,,,,,,,"Content and Publishing, Gaming, Media and Entertainment, Software, Video","Casual Games, Content, Digital Entertainment, Metaverse, Video Streaming",,,,,171196,USD,171196,,,"Marina, California, United States",Less than $1M,2018-08-01,month,,https://www.linkedin.com/company/iconicengine/
Warlands,https://www.crunchbase.com/organization/warlands,11-50,Active,https://warlands.io/,contact@warlands.io,,,,,,,,,,"Gaming, Media and Entertainment, Software, Sports","eSports, Gaming, Metaverse, Online Games, Software",,,,,,,,,,"Alicante, Comunidad Valenciana, Spain",Less than $1M,2021-01-01,year,,https://www.linkedin.com/company/warlands-corp-nft/
Hypomo,https://www.crunchbase.com/organization/hypomo,1-10,Active,https://ld.hypomo.com,hello@hypomo.com,+44 20 3475 2038,,,,,,,,,"Financial Services, Media and Entertainment, Real Estate, Software","Financial Services, FinTech, Metaverse, Real Estate, Real Estate Investment",,,,,,,,,,"London, England, United Kingdom",Less than $1M,2017-03-01,month,"MKB Fintechlab, Valeria Rosati, David Graydon",https://www.linkedin.com/company/hypotekarna/
NeuroSync Laboratories,https://www.crunchbase.com/organization/neurosync,1-10,Active,https://neurosyncvr.com,office@neurosyncvr.com,409-771-3258,,,,,,,,,"Consumer Electronics, Hardware, Media and Entertainment, Software","Consumer Electronics, Hardware, Media and Entertainment, Metaverse, Virtual Reality",1,0,"Furniture,Domestic Articles Or Appliances; Coffee Mills; Spice Mills",Scientific and electric apparatus and instruments,,,,,,"Galveston, Texas, United States",Less than $1M,2019-07-25,day,,https://www.linkedin.com/company/neurosync-laboratories
Apocalypse Studios,https://www.crunchbase.com/organization/apocalypse-studios,11-50,Active,https://apocalypse333.com/,,,,,,,,,,,"Consumer Electronics, Gaming, Hardware, Media and Entertainment, Software","Computer, Metaverse, PC Games, Video Games",,,,,,,,,,"Saint Catharines, Ontario, Canada",Less than $1M,2018-01-01,year,Tyr Ventures,https://www.linkedin.com/company/apocalypse-studios-inc/about/
Emojam,https://www.crunchbase.com/organization/emojam,1-10,Active,https://www.emojam.com/,contact@emojam.com,,,,,,,,,,"Apps, Information Technology, Internet Services, Media and Entertainment, Messaging and Telecommunications, Mobile, Software","Messaging, Metaverse, Mobile, Mobile Apps",0,1,,Scientific and electric apparatus and instruments,114888,USD,114888,,,"Los Angeles, California, United States",Less than $1M,2016-01-01,year,,http://www.linkedin.com/company/emojam
Meta Ruffy,https://www.crunchbase.com/organization/meta-ruffy,11-50,Active,https://metaruffy.io,info@metaruffy.io,,,,,,,,,,"Blockchain and Cryptocurrency, Financial Services, Media and Entertainment, Other, Payments, Software","Blockchain, Cryptocurrency, Digital Entertainment, Metaverse",0,4,,Scientific and electric apparatus and instruments,,,,,,"Dubai, Dubai, United Arab Emirates",Less than $1M,2022-01-01,year,,https://www.linkedin.com/company/meta-ruffy
Neon DAO,https://www.crunchbase.com/organization/neon-dao,1-10,Active,https://neondao.xyz/,,,10,11,,,,,,,"Blockchain and Cryptocurrency, Media and Entertainment, Other, Software","Ethereum, Metaverse",,,,,,,,,,"Washington, District of Columbia, United States",Less than $1M,,,ConsenSys Mesh,
Augmind,https://www.crunchbase.com/organization/augmind,11-50,Active,https://www.augmind.me/,info@augmind.me,,,,,,,,,,"Design, Hardware, Media and Entertainment, Software","3D Technology, Augmented Reality, Media and Entertainment, Metaverse, Product Design, Virtual Reality",,,,,,,,,,"Herzliya, Tel Aviv, Israel",Less than $1M,2019-01-01,year,BuiltUp Ventures,https://www.linkedin.com/company/augmind/?viewAsMember=true
Webllisto,https://www.crunchbase.com/organization/webllisto-technologies-pvt-ltd,11-50,Active,https://webllisto.com,hr@webllisto.com,+91 95898 49623,,,,,,,,,"Blockchain and Cryptocurrency, Design, Information Technology, Media and Entertainment, Sales and Marketing, Software","Information Technology, Marketing, Metaverse, Smart Contracts, Software, Web Design, Web Development",,,,,,,,,,"Lucknow, Uttar Pradesh, India",Less than $1M,2016-01-01,year,,https://www.linkedin.com/company/webllisto/
trember,https://www.crunchbase.com/organization/trember,11-50,Active,https://trember.com,info@trember.com,,,,,,,,,,"Hardware, Information Technology, Internet Services, Media and Entertainment, Messaging and Telecommunications, Software","Meeting Software, Metaverse, Software, Video Conferencing",,,,,,,,,,"Berlin, Berlin, Germany",Less than $1M,2019-01-01,year,,https://www.linkedin.com/company/trember
neARabl,https://www.crunchbase.com/organization/nearabl,1-10,Active,http://nearabl.com,hello@nearabl.com,,,,,,,,,,"Artificial Intelligence (AI), Data and Analytics, Design, Events, Hardware, Information Technology, Internet Services, Media and Entertainment, Navigation and Mapping, Other, Science and Engineering, Software, Travel and Tourism","Artificial Intelligence (AI), Augmented Reality, Data Visualization, Events, Infrastructure, Location Based Services, Metaverse, Software, Tourism",,,,,,,,,,"New York, New York, United States",Less than $1M,2021-11-01,month,,https://www.linkedin.com/company/nearabl-inc
Influencio,https://www.crunchbase.com/organization/influencio,251-500,Active,https://www.influencio.io/,,,,,,,,,,,"Advertising, Blockchain and Cryptocurrency, Financial Services, Media and Entertainment, Payments, Sales and Marketing, Software","Advertising, Cryptocurrency, Metaverse",,,,,140809,USD,140809,,,"Stockholm, Stockholms Lan, Sweden",Less than $1M,2021-01-01,year,,https://www.linkedin.com/company/influencioofficial
Hapz Software Solutions Pvt. Ltd,https://www.crunchbase.com/organization/hapz-games,11-50,Active,https://www.hapzsoft.com,Info@hapzsoft.com,+919315799088,,,,,,,,,"Artificial Intelligence (AI), Data and Analytics, Design, Gaming, Hardware, Information Technology, Media and Entertainment, Science and Engineering, Software","Analytics, Artificial Intelligence (AI), Augmented Reality, Data Visualization, Gamification, Machine Learning, Metaverse, Online Games, PC Games, Virtual Reality",,,,,,,,,,"Noida, Uttar Pradesh, India",Less than $1M,2019-10-24,day,,https://www.linkedin.com/company/hapzsoft
Bary.ai,https://www.crunchbase.com/organization/bary-ai,11-50,Active,https://bary.ai/,Mathias@bary.ai,,,,,,,,,,"Apps, Blockchain and Cryptocurrency, Financial Services, Internet Services, Media and Entertainment, Other, Payments, Professional Services, Software","Blockchain, Business Development, Consulting, Cryptocurrency, Metaverse, Software, Web Apps, Web3",,,,,,,,,,"Tel Aviv, Tel Aviv, Israel",Less than $1M,2021-11-01,day,,https://www.linkedin.com/company/bary-ai/
Fernhill Corp,https://www.crunchbase.com/organization/fernhill,1-10,Active,https://fernhillcorp.com/,info@fernhillcorp.com,,,,,,,,,,"Blockchain and Cryptocurrency, Financial Services, Internet Services, Media and Entertainment, Other, Payments, Software","Blockchain, Cryptocurrency, Metaverse, Software, Web3",,,,,,,,,,"Las Vegas, Nevada, United States",Less than $1M,1997-04-07,day,,https://www.linkedin.com/company/fernhill-corp
VRetail,https://www.crunchbase.com/organization/vretail,1-10,Active,https://vretail.io,support@vretail.io,,,,,,,,,,"Commerce and Shopping, Community and Lifestyle, Hardware, Internet Services, Media and Entertainment, Software","E-Commerce Platforms, Metaverse, SaaS, Virtual Reality, Virtual World, Web Development",,,,,,,,,,"Phoenix, Arizona, United States",Less than $1M,2022-01-01,year,,
gotmy,https://www.crunchbase.com/organization/gotmy,11-50,Active,https://gotmy.com,hello@gotmy.com,+1 (786) 453-7535,,,,,,,,,"Apps, Events, Gaming, Hardware, Information Technology, Internet Services, Media and Entertainment, Messaging and Telecommunications, Mobile, Music and Audio, Software","Apps, Content Creators, Events, Gaming, Metaverse, Mobile Apps, Music, Ticketing, Video Chat, Video Conferencing",0,1,,Scientific and electric apparatus and instruments,113391,USD,113391,,,"Miami, Florida, United States",Less than $1M,2018-05-15,day,,https://www.linkedin.com/company/gotmy
iVirtual Technologies Inc.,https://www.crunchbase.com/organization/ivirtual-technologies-inc,1-10,Active,https://ivirtual.com/,hello@ivirtual.ca,905-464-6047,,,,,,,,,"Commerce and Shopping, Hardware, Information Technology, Media and Entertainment, Privacy and Security, Sales and Marketing, Software","E-Commerce, Marketing, Metaverse, Personalization, Privacy, Social CRM, Virtual Reality, Virtualization",,,,,257090,USD,257090,,,"Toronto, Ontario, Canada",Less than $1M,2018-09-03,day,,https://www.linkedin.com/company/ivirtual-technologies/?viewAsMember=true
Relictum Pro,https://www.crunchbase.com/organization/relictum-pro,11-50,Active,https://relictum.pro/,support@relictum.pro,,,,,,,,,,"Blockchain and Cryptocurrency, Internet Services, Media and Entertainment, Other, Software","Blockchain, Metaverse, Software, Web3",,,,,,,,,,"Singapore, Central Region, Singapore",Less than $1M,2019-01-01,day,,https://www.linkedin.com/company/relicrum-pro
limbo music,https://www.crunchbase.com/organization/limbomusic,11-50,Active,https://limbomusic.com/,info@limbomusic.com,,,,,,,,,,"Apps, Blockchain and Cryptocurrency, Information Technology, Internet Services, Media and Entertainment, Music and Audio, Other, Science and Engineering, Software","Blockchain, Independent Music, Information Technology, Metaverse, Music Label, Podcast, SaaS, Software Engineering, Web Apps, Web3",0,1,,Education; entertainment,,,,,,"Madrid, Madrid, Spain",Less than $1M,2020-05-08,day,,https://www.linkedin.com/company/limbomusic/
TokenSociety,https://www.crunchbase.com/organization/tokensociety,1-10,Active,https://www.tokensociety.io,,,1,1,1,,,,,,"Blockchain and Cryptocurrency, Financial Services, Media and Entertainment, Other, Payments, Software","Blockchain, Cryptocurrency, Metaverse",,,,,81130,USD,81130,,,"San Francisco, California, United States",Less than $1M,2018-01-01,year,,
Senrama Interactive,https://www.crunchbase.com/organization/senrama-interactive,1-10,Active,https://www.senrama.com,hello@senrama.com,,,,,,,,,,"Artificial Intelligence (AI), Data and Analytics, Information Technology, Media and Entertainment, Science and Engineering, Software","Artificial Intelligence (AI), Content, Content Creators, Digital Entertainment, Information Technology, Media and Entertainment, Metaverse",,,,,,,,,,,Less than $1M,2022-11-07,day,,
W3 development,https://www.crunchbase.com/organization/w3-development,1-10,Active,https://w3-development.de/,info@w3-development.de,49-7531-921-55-55,,,,,,,,,"Apps, Blockchain and Cryptocurrency, Information Technology, Internet Services, Media and Entertainment, Software","Apps, Information Technology, Metaverse, Web Development, Web3",,,,,,,,,,"Konstanz, Baden-Wurttemberg, Germany",Less than $1M,2016-01-01,day,Lakeside Invest & Consult,https://www.linkedin.com/company/w3-development-gmbh/
Interco.ai,https://www.crunchbase.com/organization/interco-ai,11-50,Active,https://www.interco.ai,bernard@interco.ai,512-593-8479,,,,,,,,,"Artificial Intelligence (AI), Blockchain and Cryptocurrency, Data and Analytics, Hardware, Internet Services, Media and Entertainment, Science and Engineering, Software","Artificial Intelligence (AI), Augmented Reality, Machine Learning, Metaverse, Software, Virtual Reality, Web3",,,,,108059,USD,108059,,,"Austin, Texas, United States",Less than $1M,2018-12-18,day,,https://www.linkedin.com/company/interco-industries
FluentT,https://www.crunchbase.com/organization/fluentt,1-10,Active,http://fluentt.ai/,fluentt88@fluentt.ai,82 1066021795,,,,,,,,,"Artificial Intelligence (AI), Data and Analytics, Hardware, Information Technology, Media and Entertainment, Science and Engineering, Software","3D Technology, Artificial Intelligence (AI), Enterprise Software, Information Technology, Metaverse",,,,,,,,,,"Seoul, Seoul-t'ukpyolsi, South Korea",Less than $1M,2021-01-01,year,"SparkLabs Accelerator, Korea Investment Accelerator",https://www.linkedin.com/company/%EC%A3%BC%EC%8B%9D%ED%9A%8C%EC%82%AC-%ED%94%8C%EB%A3%A8%EC%96%B8%ED%8A%B8/
Oodles Blockchain,https://www.crunchbase.com/organization/oodles-blockchain,101-250,Active,https://blockchain.oodles.io/,marketing.blockchain@oodles.io,+91 8800013930,,,,,,,,,"Blockchain and Cryptocurrency, Financial Services, Media and Entertainment, Other, Payments, Software","Blockchain, Cryptocurrency, FinTech, Metaverse, Smart Contracts",,,,,,,,,,"Gurgaon, Haryana, India",Less than $1M,2009-04-01,month,,https://www.linkedin.com/company/blockchainoodles/
Era7: Game of Truth,https://www.crunchbase.com/organization/era7-game-of-truth,501-1000,Active,https://www.era7.io,,,,,,,,,,,"Apps, Blockchain and Cryptocurrency, Financial Services, Gaming, Media and Entertainment, Mobile, Other, Payments, Software","Blockchain, Cryptocurrency, Gaming, Metaverse, Mobile Apps",,,,,,,,,,"Yongsan, Seoul-t'ukpyolsi, South Korea",Less than $1M,,,,
Lazy Horse Race Club,https://www.crunchbase.com/organization/lazy-horse-race-club,1-10,Active,https://www.lazyhorseraceclub.com/,,,,,,,,,,,"Apps, Gaming, Media and Entertainment, Software","Apps, Gaming, Media and Entertainment, Metaverse",0,0,,Scientific and electric apparatus and instruments,,,,,,"Lyles, Tennessee, United States",Less than $1M,2022-01-01,year,,
neuno,https://www.crunchbase.com/organization/neuno,1-10,Active,https://neuno.io,info@neuno.io,,,,,,,,,,"Commerce and Shopping, Gaming, Hardware, Media and Entertainment, Sales and Marketing, Software","3D Technology, Digital Marketing, E-Commerce, Gaming, Metaverse",,,,,,,,,,"Milan, Lombardia, Italy",Less than $1M,2019-01-01,year,,https://www.linkedin.com/company/neuno
Leap Astra,https://www.crunchbase.com/organization/leap-astra,1-10,Active,https://leapastra.com,kokkytau@icloud.com,,,,,,,,,,"Blockchain and Cryptocurrency, Education, Gaming, Hardware, Information Technology, Internet Services, Media and Entertainment, Software","Augmented Reality, EdTech, Edutainment, Gaming, Information Technology, Metaverse, Software, Virtual Reality, Web3",,,,,,,,,,"Johannesburg, NA - South Africa, South Africa",Less than $1M,2022-11-01,day,,
The Last World,https://www.crunchbase.com/organization/new-project,11-50,Active,https://thelastworld.io,contact@thelastworld.io,+84 913210901,,,,,,,,,"Media and Entertainment, Software","Art, Media and Entertainment, Metaverse",,,,,,,,,,"Hong Kong, Hong Kong Island, Hong Kong",Less than $1M,2021-01-01,year,,
PatchXR,https://www.crunchbase.com/organization/patchxr,11-50,Active,https://patchxr.com/,melo@patchxr.com,+41787676624,,,,,,,,,"Hardware, Media and Entertainment, Music and Audio, Software","Augmented Reality, Digital Entertainment, Metaverse, Music, Musical Instruments, Software, Virtual Reality",,,,,48856,USD,48856,,,"Volketswil, Zurich, Switzerland",Less than $1M,2020-12-20,day,"Startup Wise Guys, Serpentine Ventures",https://www.linkedin.com/company/patch-xr/
Metaverses,https://www.crunchbase.com/organization/metaverses,11-50,Active,http://www.metaverses.eu,info@metaverses.eu,31 (0)85 401 2281,,,,,,,,,"Data and Analytics, Financial Services, Information Technology, Media and Entertainment, Software","Data Integration, Finance, Information Technology, Metaverse",,,,,,,,,,"Zoetermeer, Zuid-Holland, The Netherlands",Less than $1M,2015-01-01,day,,https://www.linkedin.com/company/metaverses-b-v-/
Sonic Bloom,https://www.crunchbase.com/organization/sonic-bloom,1-10,Active,http://sonicbloom.io/sonicbloom,contact@sonicbloomgames.com,,,,,,,,,,"Media and Entertainment, Music and Audio, Software","Digital Media, Media and Entertainment, Metaverse, Music",3,0,Computing; Calculating,,163141,USD,163141,,,"Cambridge, Massachusetts, United States",Less than $1M,2014-07-01,month,MassChallenge,https://www.linkedin.com/company/sonic-bloom-llc/
Feeding Edge,https://www.crunchbase.com/organization/feeding-edge,1-10,Active,http://www.feedingedge.co.uk,epredator@feedingedge.co.uk,,,,,,,,,,"Education, Internet Services, Manufacturing, Media and Entertainment, Software","3D Printing, EdTech, Education, Enterprise Software, Metaverse, Social Media",,,,,188085,USD,188085,,,"Southampton, Southampton, United Kingdom",Less than $1M,2009-02-01,day,,https://www.linkedin.com/in/epredator
Stimulus,https://www.crunchbase.com/organization/stimulus-e54f,1-10,Active,http://stimulusvr.com,info@stimulusvr.com,,,,,,,,,,"Hardware, Media and Entertainment, Software","Metaverse, Virtual Reality",,,,,,,,,,"Delaware City, Delaware, United States",Less than $1M,2021-01-01,year,,https://www.linkedin.com/company/dca-immersive-content-studio/?originalSubdomain=in
Dot Digital Philippines,https://www.crunchbase.com/organization/dot-digital,11-50,Active,https://dotdigitalph.com,info@dotdigitalph.com,,,,,,,,,,"Advertising, Internet Services, Media and Entertainment, Sales and Marketing, Software","Advertising, Digital Marketing, Metaverse, SEO",,,,,,,,,,"Manila, Manila, Philippines",Less than $1M,2018-10-08,day,,https://www.linkedin.com/company/dotdigitalph
Senler Media,https://www.crunchbase.com/organization/senler-media,1-10,Active,https://www.senlermedia.com,metin@senlermedia.com,+41 79 712 08 16,,,,,,,,,"Advertising, Design, Internet Services, Media and Entertainment, Sales and Marketing, Software","Advertising, Graphic Design, Marketing, Metaverse, Social Media",,,,,,,,,,"Zürich, Zurich, Switzerland",Less than $1M,2018-01-01,year,,https://www.linkedin.com/company/senlermedia
Dessun,https://www.crunchbase.com/organization/dessun,,Active,https://www.dessun.jp/,,,,,,,,,,,"Events, Information Technology, Media and Entertainment, Professional Services, Software","Advice, Events, Information Technology, Metaverse, Recruiting",,,,,,,,,,"Saga, Saga, Japan",Less than $1M,2020-07-27,day,,
Metabirds,https://www.crunchbase.com/organization/metabirds,1-10,Active,http://metabirds.com/,info@metabirds.com,075-744-0983,,,,,,,,,"Hardware, Information Technology, Media and Entertainment, Software","Information Technology, Metaverse, Software, Virtual Reality",,,,,,,,,,"Kyoto, Kyoto, Japan",Less than $1M,2006-06-02,day,,
AvaCon,https://www.crunchbase.com/organization/avacon-76c4,1-10,Active,https://www.avacon.org,info@avacon.org,+1 774 654 0010,,,,,,,,,"Events, Media and Entertainment, Other, Social Impact, Software","Event Management, Events, Metaverse, Non Profit",,,,,172364,USD,172364,,,"Rehoboth, Massachusetts, United States",Less than $1M,2010-01-01,year,,https://www.linkedin.com/company/avacon-inc.
Wildman,https://www.crunchbase.com/organization/wildman,,Active,https://wildman.co.jp/,,050-5435-4162,,,,,,,,,"Blockchain and Cryptocurrency, Gaming, Internet Services, Media and Entertainment, Other, Professional Services, Software","Blockchain, Consulting, Gaming, Metaverse, Web3",,,,,,,,,,"Tokyo, Tokyo, Japan",Less than $1M,2018-07-01,month,,
Spacebot Industries,https://www.crunchbase.com/organization/spacebot-industries,1-10,Active,https://www.spacebotindustries.com,,(734) 926-9724,,,,,,,,,"Administrative Services, Design, Information Technology, Internet Services, Media and Entertainment, Messaging and Telecommunications, Other, Software","Email, Metaverse, Project Management, Web Design, Web Development, Web Hosting",,,,,29712,USD,29712,,,"Ann Arbor, Michigan, United States",Less than $1M,2010-01-01,year,,
Metaverse Concept,https://www.crunchbase.com/organization/metaverse-concept,1-10,Active,http://metaverseconcept.com,,,,,,,,,,,"Hardware, Media and Entertainment, Software","3D Technology, Metaverse",,,,,,,,,,"Ferrand, Limousin, France",Less than $1M,2012-01-01,year,,https://www.linkedin.com/company/metaverse-concept
Frontera Azul,https://www.crunchbase.com/organization/frontera-azul,1-10,Active,http://frontera-azul.com,,,,,,,,,,,"Education, Media and Entertainment, Software","Education, Metaverse",,,,,,,,,,"Holton, Kansas, United States",Less than $1M,2002-01-01,year,,https://www.linkedin.com/company/frontera-azul-systems-sl
Jenaka Group,https://www.crunchbase.com/organization/jenaka-group,11-50,Active,https://jenaka.co.id,info.jenakacreative@gmail.com,+62 851 7237 7261,,,,,,,,,"Apps, Information Technology, Media and Entertainment, Mobile, Professional Services, Software","Consulting, Information Technology, Metaverse, Mobile Apps",,,,,,,,,,"Jakarta, Jakarta Raya, Indonesia",Less than $1M,2020-01-01,year,,https://www.linkedin.com/company/jenaka-creative
Project Ave,https://www.crunchbase.com/organization/project-ave,1-10,Active,http://p-ave.com,clemens@p-ave.com,+49 17635677647,,,,,,,,,"Design, Gaming, Hardware, Media and Entertainment, Professional Services, Software, Video","3D Technology, Animation, Consulting, Gaming, Graphic Design, Metaverse, Web Design, Web Development",,,,,,,,,,"Berlin, Berlin, Germany",Less than $1M,2020-01-01,year,,https://www.linkedin.com/company/aveworld
