Metasense,https://www.crunchbase.com/organization/metasense-35fd,11-50,Active,https://metasense.one/,,,,,,,,,,,"Media and Entertainment, Software",Metaverse,,,,,89420,USD,89420,,,"Braga, Braga, Portugal",,2022-01-01,year,Luduson Entertainment,https://www.linkedin.com/company/metasense1
MageCosmos,https://www.crunchbase.com/organization/magecosmos,11-50,Active,https://magecosmos.live,contact@dengxianvr.com,206-707-8933,,,,,,,,,"Community and Lifestyle, Gaming, Hardware, Media and Entertainment, Software","Metaverse, Online Games, Social, Virtual Reality",,,,,,,,,,"Beijing, Beijing, China",,2019-08-16,day,"Meitu, Shunwei Capital",https://www.linkedin.com/company/30211651
TheNFTProject,https://www.crunchbase.com/organization/thenftproject,11-50,Active,https://thenftproject.io/,Info@thenftproject.io,678-740-2655,,,,,,,,,"Blockchain and Cryptocurrency, Financial Services, Internet Services, Media and Entertainment, Payments, Software","Cryptocurrency, Metaverse, Non-Fungible Token (NFT), Software, Web3",,,,,,,,,,"Atlanta, Georgia, United States",,2021-01-05,day,,https://www.linkedin.com/company/the-nft-project-company/
Peertol,https://www.crunchbase.com/organization/peertol,1-10,Active,https://peertol.com,alex@peertol.com,4146904606,,,,,,,,,"Blockchain and Cryptocurrency, Information Technology, Media and Entertainment, Other, Software","Blockchain, Information Technology, Metaverse",,,,,,,,,,"San Francisco, California, United States",,2021-09-01,day,Edge Case Capital Partners,https://www.linkedin.com/company/peertol
Plutoview,https://www.crunchbase.com/organization/plutoview,1-10,Active,https://plutoview.com/,support@plutoview.com,,,,,,,,,,"Media and Entertainment, Other, Software","B2B, Collaboration, Developer APIs, Metaverse, Software",,,,,,,,,,"Boston, Massachusetts, United States",,2020-04-27,day,"Startup Wise Guys, Plug and Play",https://www.linkedin.com/company/plutoviewhq/
Sizey,https://www.crunchbase.com/organization/sizey,1-10,Active,https://sizey.ai,johan@sizey.ai,,,,,,,,,,"Artificial Intelligence (AI), Clothing and Apparel, Commerce and Shopping, Data and Analytics, Design, Information Technology, Media and Entertainment, Science and Engineering, Software","Artificial Intelligence (AI), E-Commerce, Fashion, Information Technology, Machine Learning, Metaverse, Software",1,2,Computing; Calculating,Scientific and electric apparatus and instruments,31144,USD,31144,,,"Espoo, Southern Finland, Finland",,2014-09-15,day,,https://www.linkedin.com/company/sizey/
Compendium Finance,https://www.crunchbase.com/organization/compendium-finance,1-10,Active,https://compendium.finance,support@compendium.finance,,,,,,,,,,"Financial Services, Media and Entertainment, Software","FinTech, Metaverse",,,,,82463,USD,82463,,,,,2020-01-01,year,"TokenInsight, PetRock Capital, Solanium, Axia8 Ventures, Krypital Group",https://www.linkedin.com/company/compendium-fi
CryptoSmartlife,https://www.crunchbase.com/organization/crypto-smartlife,11-50,Active,https://cryptosmartlife.com/,vishnutad@cryptosmartlife.com,,,,,,,,,,"Artificial Intelligence (AI), Blockchain and Cryptocurrency, Data and Analytics, Financial Services, Media and Entertainment, Payments, Science and Engineering, Software","Artificial Intelligence (AI), Cryptocurrency, Financial Services, FinTech, Metaverse",,,,,,,,,,"Singapore, Central Region, Singapore",,2021-08-27,day,"Xeno Capital, SG Angels",https://www.linkedin.com/company/crypto-smartlife/
Infinite Reality,https://www.crunchbase.com/organization/infinite-reality-d5f5,101-250,Active,https://theinfinitereality.com,Press@theinfinitereality.com,,,,,,,,,,"Blockchain and Cryptocurrency, Internet Services, Media and Entertainment, Software","Media and Entertainment, Metaverse, Web3",1,3,Education; Cryptography; Display; Advertising; Seals,Scientific and technological services,181138,USD,181138,,,"Norwalk, Connecticut, United States",,2019-01-01,year,,https://www.linkedin.com/company/theinfinitereality
Moovy,https://www.crunchbase.com/organization/moovy-ad34,1-10,Active,https://moovy.io,info@moovy.io,,,,,,,,,,"Blockchain and Cryptocurrency, Financial Services, Gaming, Media and Entertainment, Other, Payments, Software","Blockchain, Cryptocurrency, Gaming, Metaverse",,,,,,,,,,"Umm Al Qawain, Umm Al Quwain, United Arab Emirates",,2022-07-12,day,BBSoft,https://www.linkedin.com/company/moovy-io
Hypersonic Laboratories,https://www.crunchbase.com/organization/hypersonic-laboratories,11-50,Active,https://hypersoniclaboratories.com/,contact@helixmetaverse.com,,,,,,,,,,"Community and Lifestyle, Financial Services, Gaming, Lending and Investments, Media and Entertainment, Software","Gamification, Metaverse, Software, Venture Capital, Virtual World",0,0,,Scientific and electric apparatus and instruments,,,,,,"Los Angeles, California, United States",,2019-08-01,month,"GSR, Scott Belsky, Alex Chung, Samsung NEXT, Play Ventures",
Unbound,https://www.crunchbase.com/organization/game-lounge-8e19,11-50,Active,https://theunbound.io,contact@theunbound.io,,,,,,,,,,"Blockchain and Cryptocurrency, Community and Lifestyle, Gaming, Hardware, Media and Entertainment, Other, Software","Blockchain, Metaverse, Online Games, Social, Virtual Reality",,,,,,,,,,"Dubai, Dubai, United Arab Emirates",,2021-12-21,day,,https://www.linkedin.com/company/theunboundio
Life Festa,https://www.crunchbase.com/organization/life-festa,11-50,Active,https://lifefesta.com,contact@lifefesta.com,+82 2 2038 0232,,,,,,,,,"Hardware, Information Technology, Media and Entertainment, Software","3D Technology, Augmented Reality, Information Technology, Metaverse",,,,,,,,,,"Seoul, Seoul-t'ukpyolsi, South Korea",,2020-01-01,year,"Kona Venture Partners, Korea Credit Guarantee Fund",https://www.linkedin.com/company/lifefesta/
Element Black,https://www.crunchbase.com/organization/element-black,11-50,Active,https://www.element.black,support@element.black,,,,,,,,,,"Blockchain and Cryptocurrency, Internet Services, Media and Entertainment, Music and Audio, Other, Software","Blockchain, Media and Entertainment, Metaverse, Music, Web3",,,,,,,,,,"Virgin, Utah, United States",,2018-01-01,year,"Magnus Capital, Old Fashion Research, Klover Capital, Boxmining, Crypto Daku",
Dux Cripto,https://www.crunchbase.com/organization/dux-cripto,51-100,Active,https://duxdao.io/,,,,,,,,,,,"Blockchain and Cryptocurrency, Financial Services, Gaming, Internet Services, Media and Entertainment, Payments, Software","Cryptocurrency, Gaming, Metaverse, Web3",,,,,,,,,,"Brazil, Saint George, Trinidad and Tobago",,2020-01-01,year,"Animoca Brands, Old Fashion Research",https://www.linkedin.com/company/dux-cripto/
Fortune Unicorn Club,https://www.crunchbase.com/organization/fortune-unicorn-club,1-10,Active,https://fortuneunicorn.club,,,,,,,,,,,"Blockchain and Cryptocurrency, Community and Lifestyle, Hardware, Internet Services, Media and Entertainment, Software","3D Technology, Augmented Reality, Communities, Metaverse, Web3",,,,,,,,,,"San Francisco, California, United States",,2022-01-01,year,,
IMPRESSO,https://www.crunchbase.com/organization/impresso-labs,11-50,Active,https://www.impressoapp.com,smartcv@impressolabs.io,+41 22 575-3399,,,,,,,,,"Administrative Services, Blockchain and Cryptocurrency, Financial Services, Information Technology, Internet Services, Media and Entertainment, Other, Payments, Privacy and Security, Professional Services, Software","Blockchain, Career Planning, Cryptocurrency, Human Resources, Identity Management, Metaverse, Recruiting, Social Media, Social Network, Social Recruiting",,,,,259285,USD,259285,,,"Lausanne, Vaud, Switzerland",,2019-10-01,day,Sam Lim,https://www.linkedin.com/company/impresso/
Lectron,https://www.crunchbase.com/organization/lectron-7863,1-10,Active,https://lectron.com,,,,,,,,,,,"Blockchain and Cryptocurrency, Gaming, Internet Services, Media and Entertainment, Software","Casual Games, Console Games, Gamification, Metaverse, MMO Games, Online Games, PC Games, Semantic Web, Video Games, Web3",,,,,,,,,,"New York, New York, United States",,2019-01-01,year,,https://www.linkedin.com/company/lectroninc
Scrye,https://www.crunchbase.com/organization/magnet-5505,1-10,Active,https://scrye.ai/,rssd4@scrye.ai,,,,,,,,,,"Blockchain and Cryptocurrency, Gaming, Hardware, Internet Services, Media and Entertainment, Other, Software","Augmented Reality, Blockchain, Computer Vision, Gamification, Gaming, Metaverse, Software, Web3",,,,,1878474,USD,1878474,,,"Washington, District of Columbia, United States",,2017-07-01,month,"Brinc, Animoca Brands",https://www.linkedin.com/company/scrye
Deverse World,https://www.crunchbase.com/organization/deverse-world,1-10,Active,https://www.deverse.world,,,,,,,,,,,"Blockchain and Cryptocurrency, Gaming, Internet Services, Media and Entertainment, Other, Software","Blockchain, Metaverse, Online Games, Software, Web3",,,,,,,,,,"Singapore, Central Region, Singapore",,2022-01-01,year,"Jinwoo Park, Thuc Vu",https://www.linkedin.com/company/deverse-world/
Reel Mood,https://www.crunchbase.com/organization/reel-mood,1-10,Active,https://www.reelmood.com,info@reelmood.com,,,,,,,,,,"Blockchain and Cryptocurrency, Content and Publishing, Financial Services, Internet Services, Media and Entertainment, Music and Audio, Other, Payments, Software, Video","Blockchain, Cryptocurrency, Metaverse, Music Streaming, Video Streaming, Web3",,,,,,,,,,"Los Angeles, California, United States",,2021-03-03,day,,https://www.linkedin.com/company/reel-mood/
NINFA,https://www.crunchbase.com/organization/ninfa,1-10,Active,https://ninfa.io/,investors@ninfa.io,,,,,,,,,,"Blockchain and Cryptocurrency, Commerce and Shopping, Media and Entertainment, Other, Software","Blockchain, Marketplace, Metaverse",,,,,50850,USD,50850,,,"Milan, Lombardia, Italy",,2021-11-09,day,,https://www.linkedin.com/company/ninfa-labs/about/
BetaMars,https://www.crunchbase.com/organization/betamars,,Active,http://www.betamars.io/web/home,,,,,,,,,,,"Blockchain and Cryptocurrency, Media and Entertainment, Other, Software","Blockchain, Metaverse",,,,,,,,,,"Grand Cayman, Midland, Cayman Islands",,2021-01-01,year,"Pluto Capital, BIP32 Ventures",
Owens NFT,https://www.crunchbase.com/organization/owens-nft,11-50,Active,https://www.owensnft.com,,,,,,,,,,,"Blockchain and Cryptocurrency, Commerce and Shopping, Financial Services, Internet Services, Media and Entertainment, Other, Payments, Software","Blockchain, Cryptocurrency, Finance, Marketplace, Metaverse, Web3",,,,,,,,,,"San Jose, California, United States",,2020-01-01,year,Tykhe Block Ventures,https://www.linkedin.com/company/84896269/
Dydata.io,https://www.crunchbase.com/organization/dydata-io,,Active,http://www.dydata.io/,biz@dyclub.org,027-87523896,,,,,,,,,"Commerce and Shopping, Data and Analytics, Design, Information Technology, Media and Entertainment, Software","Big Data, Data Visualization, E-Commerce, Metaverse",,,,,,,,,,"Wuhan, Hubei, China",,2015-04-15,day,"PreAngel, Z Ventures Group, Wuhan Optics Valley Elite Investment Management, Philip Kotler",
Cyan,https://www.crunchbase.com/organization/cyan-9ccd,1-10,Active,https://www.usecyan.com/,,,,,,,,,,,"Financial Services, Media and Entertainment, Software","Financial Services, Metaverse",,,,,,,,,,"San Francisco, California, United States",,2021-01-01,year,"The Sandbox, Animoca Brands, OpenSea, Yield Guild Games Southeast Asia, gumi Cryptos Capital (gCC)",https://www.linkedin.com/company/usecyan/ 
New East Art,https://www.crunchbase.com/organization/new-east-art,,Active,https://neweastart.com/,info@meum.me,,,,,,,,,,"Artificial Intelligence (AI), Data and Analytics, Media and Entertainment, Science and Engineering, Software","Art, Artificial Intelligence (AI), Media and Entertainment, Metaverse",,,,,,,,,,"Seoul, Seoul-t'ukpyolsi, South Korea",,2020-09-01,month,"New Paradigm Investment, Hanyang University, Korea Institute of Startup & Entrepreneurship Development, Korea Arts Management Service",
HUGE CORPORATION,https://www.crunchbase.com/organization/mrkt,11-50,Active,https://HUGE.xyz,info@HUGE.xyz,,,,,,,,,,"Blockchain and Cryptocurrency, Hardware, Media and Entertainment, Other, Software","Augmented Reality, Blockchain, Metaverse",0,2,,Scientific and electric apparatus and instruments,47200,USD,47200,,,"New York, New York, United States",,2017-07-07,day,,https://www.linkedin.com/company/hugecorp/
iRocket AR,https://www.crunchbase.com/organization/irocket-ar,11-50,Active,https://irocket.io/,info@irocket.io,,,,,,,,,,"Blockchain and Cryptocurrency, Financial Services, Gaming, Media and Entertainment, Mobile, Payments, Software","Cryptocurrency, Gaming, Metaverse, Mobile",,,,,,,,,,"London, England, United Kingdom",,2021-08-22,day,,https://www.linkedin.com/company/irocket
Mindpass,https://www.crunchbase.com/organization/mindpass,1-10,Active,https://www.mindpass.io/,jake@mindpassco.com,,,,,,,,,,"Hardware, Information Technology, Internet Services, Media and Entertainment, Other, Privacy and Security, Software","3D Technology, B2B, B2C, Cyber Security, Enterprise Software, Information Technology, Internet, Metaverse, Software",0,2,,Scientific and technological services,123605,USD,123605,,,"Boulder, Colorado, United States",,2019-01-01,year,"Boomtown Accelerators, UPC Renewables, Right Side Capital Management",https://www.linkedin.com/company/mindpassco/about/
TACIUM,https://www.crunchbase.com/organization/tacium,11-50,Active,https://tacium.com/,,,,,,,,,,,"Blockchain and Cryptocurrency, Gaming, Media and Entertainment, Other, Software","Blockchain, Gaming, Metaverse, Software",,,,,,,,,,"Tel Aviv, Tel Aviv, Israel",,2021-09-01,day,"MVST:MG, Metavest Capital, On Yavin",https://www.linkedin.com/company/tacium/
Alife Virtual Metaverse,https://www.crunchbase.com/organization/sorin-base-inc,11-50,Active,https://www.alifevirtual.com,sorintodys@sorinbase.com,+4 072-260-6166,,,,,,,,,"Artificial Intelligence (AI), Community and Lifestyle, Data and Analytics, Education, Gaming, Media and Entertainment, Science and Engineering, Software","Artificial Intelligence (AI), Education, Machine Learning, Metaverse, Online Games, SaaS, Simulation, Software, Virtual World",,,,,,,,,,"Bucharest, Bucuresti, Romania",,2014-05-10,day,,https://www.linkedin.com/company/alife-virtual-metaverse
ConLab Company,https://www.crunchbase.com/organization/conlab-company,11-50,Active,http://www.conlabcompany.com,contact@conlabco.com,+82 070 4195 3552,,,,,,,,,"Media and Entertainment, Sales and Marketing, Software","Content, Content Creators, Content Marketing, Metaverse",,,,,,,,,,"Seoul, Seoul-t'ukpyolsi, South Korea",,2020-01-01,year,"Industrial Bank of Korea, Gaia Venture Partners, Crowdy",
ShowMeta,https://www.crunchbase.com/organization/showmeta,51-100,Active,https://showmeta.io/,contact@showmeta.io,,,,,,,,,,"Blockchain and Cryptocurrency, Financial Services, Internet Services, Media and Entertainment, Other, Payments, Software","Blockchain, Cryptocurrency, Metaverse, Virtual Currency, Web3",,,,,203996,USD,203996,,,,,2023-01-01,month,,
The Mars,https://www.crunchbase.com/organization/the-mars,11-50,Active,https://marslabs.co,,,,,,,,,,,"Blockchain and Cryptocurrency, Financial Services, Gaming, Media and Entertainment, Other, Payments, Software","Blockchain, Cryptocurrency, Metaverse, Video Games",1,0,Generation; Conversion Or Distribution Of Electric Power,,,,,,,"Seoul, Seoul-t'ukpyolsi, South Korea",,2021-01-01,year,DWF Labs,https://www.linkedin.com/company/the-mars-metaverse-platform
LBM Solutions,https://www.crunchbase.com/organization/lbm-solutions,101-250,Active,https://lbmsolutions.in,info@lbmsolutions.in,91-8448443318,,,,,,,,,"Blockchain and Cryptocurrency, Information Technology, Media and Entertainment, Other, Software","Blockchain, Information Technology, Metaverse, Software, Web Development",,,,,,,,,,"Mohali, Punjab, India",,2021-03-20,day,vivek singh,https://www.linkedin.com/company/lbm-solutions/
Kuvaka Tech,https://www.crunchbase.com/organization/threeway-studio,11-50,Active,https://www.kuvaka.io/,connect@kuvaka.io,+91-9977104518,,,,,,,,,"Blockchain and Cryptocurrency, Information Technology, Internet Services, Media and Entertainment, Other, Software","Blockchain, Information Services, Information Technology, IT Management, Metaverse, Software, Web3",,,,,,,,,,"Bhopal, Madhya Pradesh, India",,2022-01-25,day,,https://www.linkedin.com/company/kuvaka/
AyokenLabs,https://www.crunchbase.com/organization/ayokenlabs,1-10,Active,https://www.ayokenlabs.com/,hello@ayoken.com,,,,,,,,,,"Blockchain and Cryptocurrency, Media and Entertainment, Other, Software","Blockchain, Metaverse, Non-Fungible Token (NFT)",,,,,,,,,,"London, England, United Kingdom",,2021-01-01,year,"Founders Factory Africa, CryptoLeague, Kon Ventures, R9C Ventures, Maximus Ventures",https://www.linkedin.com/company/ayoken
aurea.uniVRsity,https://www.crunchbase.com/organization/aurea-univrsity,11-50,Active,https://aurea.university/,hello@aurea.university,+4934568557874,,,,,,,,,"Community and Lifestyle, Education, Hardware, Media and Entertainment, Other, Software","3D Technology, EdTech, Higher Education, Metaverse, Software, Universities, Virtual Reality, Virtual World",,,,,,,,,,"Halle, Sachsen-Anhalt, Germany",,2018-01-01,year,,https://www.linkedin.com/company/aurea-univrsity
Nexus Verse,https://www.crunchbase.com/organization/nexus-verse,11-50,Active,https://nexusverse.io/,info@nexusverse.io,,,,,,,,,,"Blockchain and Cryptocurrency, Media and Entertainment, Other, Software","Blockchain, Metaverse",,,,,,,,,,"Anchorage, Alaska, United States",,2023-04-21,day,,
The Kingdom,https://www.crunchbase.com/organization/the-kingdom-4d51,1-10,Active,https://thekingdom.com,,,,,,,,,,,"Blockchain and Cryptocurrency, Financial Services, Media and Entertainment, Other, Payments, Software","Blockchain, Cryptocurrency, Metaverse",,,,,,,,,,"América, Managua, Nicaragua",,2022-01-01,month,"3Commas, Chiron, Alameda Research, Infinity Ventures Crypto, Shima Capital",
Cointime,https://www.crunchbase.com/organization/cointime,11-50,Closed,https://www.cointime.com/,,,,,,,,,,,"Blockchain and Cryptocurrency, Financial Services, Internet Services, Media and Entertainment, Other, Payments, Software","Blockchain, Cryptocurrency, Digital Media, Metaverse, Web3",,,,,,,,,,"Singapore, Central Region, Singapore",,2017-01-01,day,,
Monkey Kingdom,https://www.crunchbase.com/organization/monkey-kingdom,11-50,Active,https://monkeykingdom.io,info@monkeykingdom.io,,,,,,,,,,"Blockchain and Cryptocurrency, Financial Services, Gaming, Media and Entertainment, Other, Payments, Software","Blockchain, Cryptocurrency, Gaming, Metaverse",0,0,,Scientific and electric apparatus and instruments,,,,,,"Hong Kong, Hong Kong Island, Hong Kong",,2021-01-01,year,Alameda Research,https://www.linkedin.com/company/monkeykingdom
ShipReality,https://www.crunchbase.com/organization/shipreality,1-10,Active,http://www.shipreality.com/,info@shiprealiy.com,,,,,,,,,,"Media and Entertainment, Software, Transportation","Metaverse, Shipping, Software",,,,,,,,,,"Athens, Attiki, Greece",,2018-07-12,day,"Creative Destruction Lab (CDL), Katapult Ocean",https://www.linkedin.com/company/18721970/admin/
Metaisland™,https://www.crunchbase.com/organization/metaisland,1-10,Active,https://metaisland.gg,nikko@metaisland.gg,+66 0640340616,,,,,,,,,"Blockchain and Cryptocurrency, Financial Services, Media and Entertainment, Payments, Software","Cryptocurrency, Metaverse",,,,,,,,,,"Pattaya, Chon Buri, Thailand",,2021-04-07,day,,https://www.linkedin.com/in/nicolaschoukroun/
CLOS3T,https://www.crunchbase.com/organization/clos3t,1-10,Active,https://www.clos3t.io,amandine@clos3t.io,,,,,,,,,,"Blockchain and Cryptocurrency, Clothing and Apparel, Design, Internet Services, Media and Entertainment, Other, Software","Blockchain, Fashion, Metaverse, Web3",,,,,,,,,,"Paris, Ile-de-France, France",,2022-04-12,day,"Frst, Fabric Ventures",https://www.linkedin.com/company/clos3t/
Bloometa,https://www.crunchbase.com/organization/bloometa,1-10,Active,https://bloometa.com,contact@bloometa.com,,,,,,,,,,"Commerce and Shopping, Gaming, Media and Entertainment, Software","Casual Games, Console Games, Gaming, Marketplace, Metaverse",,,,,,,,,,"Paris, Ile-de-France, France",,2021-01-01,year,The Blox,https://www.linkedin.com/company/bloometa
WebWrap Inc,https://www.crunchbase.com/organization/webwrap-inc,1-10,Active,https://cryptowrap.co/,Info@WebWrap.com,3179001128,,,,,,,,,"Apps, Blockchain and Cryptocurrency, Commerce and Shopping, Internet Services, Media and Entertainment, Mobile, Other, Software","Blockchain, Consumer Reviews, Internet, Metaverse, Mobile Apps, Social Network, Software",,,,,,,,,,"Indianapolis, Indiana, United States",,2019-03-19,day,,https://www.linkedin.com/company/75515544
DeFiHorse,https://www.crunchbase.com/organization/defihorse,,Active,https://defihorse.com/,hello@defihorse.com,,,,,,,,,,"Media and Entertainment, Software",Metaverse,,,,,,,,,,"Mahé, Beau Vallon, Seychelles",,2021-01-01,year,"Avocado Guild, Poolz Finance, Exnetwork Capital, BullPerks, COINCU",
PSI-G,https://www.crunchbase.com/organization/psi-g,1-10,Active,https://www.psi-g.io/,,,,,,,,,,,"Apps, Artificial Intelligence (AI), Blockchain and Cryptocurrency, Data and Analytics, Gaming, Hardware, Health Care, Internet Services, Media and Entertainment, Science and Engineering, Software","3D Technology, Apps, Artificial Intelligence (AI), Augmented Reality, Gaming, Mental Health, Metaverse, Non-Fungible Token (NFT), Web3",,,,,241654,USD,241654,,,,,2022-06-06,day,,
Iron Sail,https://www.crunchbase.com/organization/iron-sail,,Active,https://ironsail.io,ahoy@ironsail.io,,,,,,,,,,"Blockchain and Cryptocurrency, Gaming, Media and Entertainment, Other, Software","Blockchain, Gaming, Metaverse",,,,,93562,USD,93562,,,,,,,Infinity Ventures Crypto,
Orderinbox,https://www.crunchbase.com/organization/orderinbox,1-10,Active,https://www.orderinbox.com,hello@orderinbox.com,,,,,,,,,,"Blockchain and Cryptocurrency, Commerce and Shopping, Community and Lifestyle, Financial Services, Internet Services, Lending and Investments, Media and Entertainment, Other, Payments, Software","Blockchain, Cryptocurrency, E-Commerce, Internet, Metaverse, Non-Fungible Token (NFT), Social, Social Media, Trading Platform",,,,,,,,,,"Vancouver, British Columbia, Canada",,2019-03-01,month,,https://www.linkedin.com/company/orderinbox
Virtual Beings,https://www.crunchbase.com/organization/virtual-beings,1-10,Active,https://www.virtualbeings.co,yz@virtualbeings.co,,,,,,,,,,"Gaming, Internet Services, Media and Entertainment, Software","Gaming, Internet, Metaverse, Software, Video Games",,,,,,,,,,"Paris, Ile-de-France, France",,2016-01-01,year,Startup Wise Guys,https://www.linkedin.com/company/virtualbeings/
Metabloqs,https://www.crunchbase.com/organization/metabloqs,11-50,Active,https://www.metabloqs.com,marc-andre.schauwecker@metabloqs.com,,,,,,,,,,"Events, Hardware, Media and Entertainment, Other, Software","3D Technology, Events, Media and Entertainment, Metaverse, Real Time, Virtual Reality",,,,,,,,,,"Lucerne, Luzern, Switzerland",,2021-01-01,year,,https://www.linkedin.com/company/metabloqs
XSight,https://www.crunchbase.com/organization/xsight,1-10,Active,https://www.xsight.online/,sergey.kozyrev@xsight.online,,,,,,,,,,"Apps, Hardware, Media and Entertainment, Mobile, Software","Apps, Augmented Reality, Metaverse, Mobile Apps",,,,,,,,,,"Mosman, New South Wales, Australia",,2023-01-11,day,Youbi Capital,https://www.linkedin.com/company/xsight-mobile/
Safeverse,https://www.crunchbase.com/organization/safeverse,1-10,Active,https://zyenalabs.io/#safeverse,,,,,,,,,,,"Education, Media and Entertainment, Software","Education, Metaverse, Training",,,,,57581,USD,57581,,,"Ingolstadt, Bayern, Germany",,2021-01-01,year,"Gains Associates, Seedthrift Ventures, Encrypted Investments, Uptrend",https://www.linkedin.com/company/safeversefromzyenalabs/
Cross-Metaverse Avatars,https://www.crunchbase.com/organization/cross-metaverse-avatars,1-10,Active,https://crossmetaverseavatars.com,Kt@crossmetaverseavatars.com,,,,,,,,,,"Artificial Intelligence (AI), Data and Analytics, Gaming, Hardware, Media and Entertainment, Science and Engineering, Software","3D Technology, Artificial Intelligence (AI), Gaming, Metaverse",,,,,,,,,,"Atlanta, Georgia, United States",,2022-01-01,year,,https://www.linkedin.com/company/cross-metaverse-avatars-llc
Keyspace Studio INC.,https://www.crunchbase.com/organization/keyspace-studio-inc,1-10,Active,https://www.keyspace.studio/,info@keyspace.studio,678.517.9652,,,,,,,,,"Blockchain and Cryptocurrency, Internet Services, Media and Entertainment, Software","Internet, Metaverse, SaaS, Software, Web3",,,,,,,,,,"Atlanta, Georgia, United States",,2022-05-01,month,,https://www.linkedin.com/company/keyspace-studio/?viewAsMember=true
Nova Film Technology,https://www.crunchbase.com/organization/nova-film-technology,251-500,Active,http://www.novafilm.com.cn/,iInfo@novafilm.cn,010-5709 7666,,,,,,,,,"Hardware, Media and Entertainment, Software, Video","Film, Metaverse, TV, Virtual Reality",,,,,,,,,,"Haidian, Beijing, China",,2012-05-29,day,Tsing-Yuan Capital,https://www.linkedin.com/company/nova-film-technology
Ophyer,https://www.crunchbase.com/organization/ophyer,11-50,Active,https://www.ophyer.com,yizhe.han@ophyer.com,,,,,,,,,,"Advertising, Media and Entertainment, Other, Sales and Marketing, Software","Advertising, Consumer, Content Marketing, Media and Entertainment, Metaverse",,,,,,,,,,"Beijing, Beijing, China",,2008-03-19,day,Tsing Ventures,https://www.linkedin.com/company/%E5%8C%97%E4%BA%AC%E6%8E%8C%E4%B8%AD%E9%A3%9E%E5%A4%A9%E7%A7%91%E6%8A%80%E8%82%A1%E4%BB%BD%E6%9C%89%E9%99%90%E5%85%AC%E5%8F%B8
ThunderLands,https://www.crunchbase.com/organization/thunderlands,11-50,Active,https://tl.games,,,,,,,,,,,"Media and Entertainment, Software",Metaverse,,,,,,,,,,"Tórtola, Castilla-La Mancha, Spain",,,,"Infinity Ventures Crypto, Afford.Capital, Sergei Kovalev",
