Doximity,https://www.crunchbase.com/organization/doximity,501-1000,Active,https://www.doximity.com,support@doximity.com,650-200-3901,,,,,,,,,"Apps, Health Care, Internet Services, Mobile, Software","Health Care, Internet, Medical, Mobile Apps, Software",6,11,Electric Communication Technique,Scientific and technological services,47487300,USD,47487300,,,"San Francisco, California, United States",$100M to $500M,1993-03-01,day,"Employee Stock Option Fund, Morgan Stanley, Emergence, T. Rowe Price, Canvas Ventures",https://www.linkedin.com/company/doximity
Kualitatem,https://www.crunchbase.com/organization/kualitatem,101-250,Active,https://www.kualitatem.com,info@kualitatem.com,(415) 644-5060,,,,,,,,,"Apps, Information Technology, Mobile, Professional Services, Software","Consulting, Information Technology, Mobile Apps, Software",,,,,18445139,USD,18445139,,,"New York, New York, United States",$100M to $500M,2009-01-01,year,,http://www.linkedin.com/company/kualitatem-inc-
TestDevLab,https://www.crunchbase.com/organization/testdevlab,501-1000,Active,http://www.testdevlab.com/,info@testdevlab.com,+37125423562,1,1,,,,,,,"Apps, Data and Analytics, Design, Information Technology, Mobile, Privacy and Security, Professional Services, Software","Mobile Apps, Penetration Testing, Quality Assurance, Software, Test and Measurement, Usability Testing, Web Development",,,,,,,,,,"Riga, Riga, Latvia",$100M to $500M,2011-11-30,day,,https://www.linkedin.com/company/testdevlab-ltd
OSSCube,https://www.crunchbase.com/organization/osscube-solutions,251-500,Closed,http://www.osscube.com,pr@osscube.com,(281)323-8192,,,,,,,,,"Apps, Information Technology, Internet Services, Mobile, Professional Services, Sales and Marketing, Software","Cloud Computing, Consulting, CRM, Enterprise Software, Information Technology, Mobile, Mobile Apps, Software, Web Development",,,,,,,,,,"Houston, Texas, United States",$100M to $500M,2006-06-01,day,,http://www.linkedin.com/company/osscube
DESTINY,https://www.crunchbase.com/organization/destiny-122f,1001-5000,Active,https://www.destiny.be/,sales@destiny.be,32-2 401 97 00,,,,,,,,,"Apps, Hardware, Mobile, Software","Mobile Apps, Telecommunications",0,2,,Telecommunications,7556467,USD,7556467,,,"Zaventem, Vlaams-Brabant, Belgium",$100M to $500M,2008-09-02,day,,https://www.linkedin.com/company/destiny-n-v-/
UNFCU,https://www.crunchbase.com/organization/unfcu,501-1000,Active,https://www.unfcu.org/,email@unfcu.com,+1 347-686-6000,,,,,,,,,"Apps, Financial Services, Lending and Investments, Mobile, Payments, Professional Services, Software","Accounting, Finance, Financial Exchanges, Financial Services, Mobile Apps, Payments",0,4,,Insurance; financial affairs,12259834,USD,12259834,,,"New York, New York, United States",$100M to $500M,1947-01-01,day,,https://www.linkedin.com/company/unfcu/
Tempo Assist,https://www.crunchbase.com/organization/tempo-participacoes,1001-5000,Active,http://www.tempoassist.com.br,,55 11 4208-8000,,,,,,,,,"Administrative Services, Apps, Financial Services, Health Care, Mobile, Real Estate, Software","Facilities Support Services, Health Care, Home Services, Insurance, Mobile Apps",,,,,,,,,,"Barueri, Sao Paulo, Brazil",$100M to $500M,2007-01-01,year,,https://www.linkedin.com/company/tempo-assist/
VISIT FLORIDA,https://www.crunchbase.com/organization/visit-florida,101-250,Active,http://visitflorida.com,partner@visitflorida.org,850-488-5607,,,,,,,,,"Advertising, Apps, Mobile, Sales and Marketing, Software","Advertising, Marketing, Mobile Apps",,,,,5160065,USD,5160065,,,"Tallahassee, Florida, United States",$100M to $500M,1996-01-01,year,,https://www.linkedin.com/company/visit-florida
ASPG,https://www.crunchbase.com/organization/react,51-100,Active,http://aspg.com,aspgdaw@smfutil.com,1 (239) 649-1548,,,,,,,,,"Apps, Information Technology, Mobile, Privacy and Security, Software","Apps, Enterprise Software, Information Technology, Mobile Apps, Security, Software",,,,,849663,USD,849663,,,"Naples, Florida, United States",$100M to $500M,1986-01-01,year,,https://www.linkedin.com/company/advanced-software-products-group-inc-
Arcadia,https://www.crunchbase.com/organization/arcadia-inc,251-500,Active,https://arcadia.spb.ru/,info@arcadia.spb.ru,+7 812 610 5955,,,,,,,,,"Apps, Hardware, Information Technology, Mobile, Professional Services, Science and Engineering, Software","Consulting, Information Technology, Mobile Apps, Outsourcing, Robotics, Software, Web Development",,,,,460093,USD,460093,,,"Saint Petersburg, Saint Petersburg City, Russian Federation",$100M to $500M,1993-03-09,day,,https://www.linkedin.com/company/arcadia
Ojas Innovative Technologies,https://www.crunchbase.com/organization/ojas-innovative-technologies,251-500,Active,https://www.ojas-it.com/,sales@ojas-it.com,+1 (310) 227 5909,,,,,,,,,"Apps, Information Technology, Mobile, Software","Information Services, Information Technology, Mobile Apps, Software, Web Apps",,,,,13163912,USD,13163912,,,"Valencia, California, United States",$100M to $500M,2011-01-01,year,,https://www.linkedin.com/company/ojas-innovative-technologies/
BPAY,https://www.crunchbase.com/organization/bpay-451b,51-100,Active,https://bpay.com.au/,,,,,,,,,,,"Apps, Financial Services, Mobile, Payments, Software","Financial Services, Mobile Apps, Mobile Payments, Payments",2,0,Computing; Calculating,,,,,,,"Sydney, New South Wales, Australia",$100M to $500M,1997-01-01,year,,https://www.linkedin.com/company/bpaygroup/
Nar,https://www.crunchbase.com/organization/nar,51-100,Active,http://www.narcade.com,zippro@gmail.com,,,,,,,,,,"Apps, Content and Publishing, Internet Services, Media and Entertainment, Mobile, Software","Internet, Mobile Apps, Publishing, Software",,,,,,,,,,"Istanbul, Istanbul, Turkey",$100M to $500M,2011-09-28,day,,http://www.linkedin.com/company/nar-net
Baker Goertz,https://www.crunchbase.com/organization/baker-goertz,1001-5000,Active,https://www.baeckergoertz.de,info@baeckergoertz.de,+49 621 538220,,,,,,,,,"Apps, Education, Food and Beverage, Mobile, Software","Apps, Bakery, Confectionery, Education, Food and Beverage, Mobile Apps, Restaurants, Snack Food",,,,,6914349,USD,6914349,,,"Ludwigshafen Am Rhein, Rheinland-Pfalz, Germany",$100M to $500M,1963-01-01,year,FSN Capital Partners,https://www.linkedin.com/company/b%C3%A4cker-g%C3%B6rtz-gmbh
QuickSeries Publishing,https://www.crunchbase.com/organization/quickseries-publishing,101-250,Active,https://www.quickseries.com/,info-fb@quickseries.com,+1 800-361-4653,,,,,,,,,"Apps, Content and Publishing, Media and Entertainment, Mobile, Software","Mobile Apps, Publishing",0,6,,Education; entertainment,,,,,,"Lauderdale, Mississippi, United States",$100M to $500M,1998-01-01,day,,https://www.linkedin.com/company/quickseries-publishing-inc-/
Syntax,https://www.crunchbase.com/organization/syntax-inc,51-100,Active,http://www.syntaxinc.com,,6516411572,,,,,,,,,"Apps, Mobile, Platforms, Software","iOS, Mobile Apps, Software",,,,,123144,USD,123144,,,"Saint Paul, Minnesota, United States",$100M to $500M,1982-01-01,year,,https://www.linkedin.com/company/syntax-inc/
Cubedots,https://www.crunchbase.com/organization/cubedots,51-100,Active,https://www.cubedots.com/,info@cubedots.com,+44 20 7993 5080,,,,,,,,,"Apps, Hardware, Information Technology, Mobile, Real Estate, Sales and Marketing, Software","3D Technology, Information Services, Information Technology, Marketing, Mobile Apps, Real Estate, Sales",,,,,5051997,USD,5051997,,,"London, England, United Kingdom",$100M to $500M,2014-01-01,year,,https://www.linkedin.com/company/cubedots/
Metro Indonesia,https://www.crunchbase.com/organization/metro-indonesia,1001-5000,Active,http://metroindonesia.com/,contact@metroindonesia.com,+622157998000,,,,,,,,,"Apps, Commerce and Shopping, Hardware, Mobile, Software","Mobile Apps, Retail, Retail Technology",,,,,,,,,,"Jakarta, Jakarta Raya, Indonesia",$100M to $500M,1991-01-01,day,,https://www.linkedin.com/company/pt.-metropolitan-retailmart
AP Emissions Technologies,https://www.crunchbase.com/organization/ap-exhaust,501-1000,Active,http://www.apexhaust.com/,tech.line@apemissions.com,1(800)277-2787,,,,,,,,,"Apps, Consumer Electronics, Consumer Goods, Hardware, Manufacturing, Mobile, Software, Transportation","Automotive, Consumer Electronics, Consumer Goods, Manufacturing, Mobile Apps",0,64,,Machines and machine tools,2473785,USD,2473785,,,"Goldsboro, North Carolina, United States",$100M to $500M,1927-01-01,year,,https://www.linkedin.com/company/ap-exhaust-technologies
Airnow,https://www.crunchbase.com/organization/airnow,251-500,Active,https://airnowplc.com/,hello@airnowplc.com,,,,,,,,,,"Apps, Data and Analytics, Mobile, Sales and Marketing, Software","App Discovery, App Marketing, Application Performance Management, Apps, Mobile Apps, SaaS",5,2,Computing; Calculating,Scientific and electric apparatus and instruments,571567,USD,571567,,,"London, England, United Kingdom",$100M to $500M,2010-01-01,year,Asher Delug,https://www.linkedin.com/company/airnowplc/
TransitLink,https://www.crunchbase.com/organization/transitlink,101-250,Active,https://www.transitlink.com.sg,feedback@transitlink.com.sg,+65-6236-6666,,,,,,,,,"Apps, Mobile, Other, Software, Transportation","Infrastructure, Mobile Apps, Transportation",,,,,,,,,,"Singapore, Central Region, Singapore",$100M to $500M,1987-01-01,year,,https://www.linkedin.com/company/transitlink
Carbagas,https://www.crunchbase.com/organization/carbagas,251-500,Active,https://www.carbagas.ch,info@carbagas.ch,+41 31 950 50 50,,,,,,,,,"Apps, Commerce and Shopping, Energy, Mobile, Natural Resources, Software","Mobile Apps, Oil and Gas, Wholesale",2,0,Testing,,,,,,,"Gümligen, Bern, Switzerland",$100M to $500M,1893-01-01,year,,https://www.linkedin.com/company/carbagas-air-liquide/
Vanda,https://www.crunchbase.com/organization/vanda,101-250,Active,https://www.joinvanda.com,support@joinvanda.com,+1 513 205 8022,,,,,,,,,"Apps, Mobile, Professional Services, Software","Employment, Mobile Apps, Recruiting, SaaS, Software",0,2,,Scientific and electric apparatus and instruments,5597769,USD,5597769,,,"Covington, Kentucky, United States",$100M to $500M,2014-01-01,year,,https://www.linkedin.com/company/vanda
Onyx,https://www.crunchbase.com/organization/onyx,51-100,Active,http://onyxla.co,hello@onyxagency.co,+1 (424) 281-7768,,,,,,,,,"Apps, Design, Mobile, Software","Mobile Apps, Software, Web Design, Web Development",0,1,,Education; entertainment,,,,,,"Los Angeles, Huila, Colombia",$100M to $500M,2014-06-01,day,,https://www.linkedin.com/company/onyx-agency
Entrata India,https://www.crunchbase.com/organization/entrata-india,501-1000,Active,https://www.entrata.in,careers.in@entrata.com,+91 9028208877,,,,,,,,,"Apps, Mobile, Software","Mobile Apps, Software, Web Development",,,,,,,,,,"Pune, Maharashtra, India",$100M to $500M,2007-01-01,year,,https://www.linkedin.com/company/entrata-india
National Bank of Malawi,https://www.crunchbase.com/organization/national-bank-of-malawi,1001-5000,Active,https://natbank.co.mw/,,265 1 820 622,,,,,,,,,"Apps, Financial Services, Lending and Investments, Mobile, Software","Banking, Financial Services, Mobile Apps",,,,,,,,,,"Blantyre, Blantyre, Malawi",$100M to $500M,1971-01-01,year,,https://www.linkedin.com/company/national-bank-of-malawi/about/
Pernix Solutions,https://www.crunchbase.com/organization/pernix-solutions,101-250,Active,https://www.pernix-solutions.com,info@pernix-solutions.com,708-690-1497,,,,,,,,,"Apps, Information Technology, Mobile, Other, Software","Information Technology, Mobile Apps, Professional Services, Software",,,,,,,,,,"Cartago, Cartago, Costa Rica",$100M to $500M,2009-01-01,year,,https://www.linkedin.com/company/pernix-solutions/
SKYSITE,https://www.crunchbase.com/organization/skysite,1001-5000,Active,https://www.skysite.com/,info@skysite.com,8447597483,,,,,,,,,"Administrative Services, Apps, Information Technology, Mobile, Other, Real Estate, Software","Archiving Service, Building Maintenance, Collaboration, Construction, Document Management, Mobile Apps, Project Management, Real Time, SaaS, Software",0,4,,Scientific and electric apparatus and instruments,30711473,USD,30711473,,,"San Ramon, California, United States",$100M to $500M,2015-01-02,day,,https://www.linkedin.com/company/skysite
SaM Solutions,https://www.crunchbase.com/organization/sam-solutions-58c3,501-1000,Active,https://www.sam-solutions.com,vertrieb@sam-solutions.de,+49 8105 399 050,,,,,,,,,"Apps, Mobile, Professional Services, Science and Engineering, Software","Mobile Apps, Quality Assurance, Software Engineering",,,,,20929095,USD,20929095,,,"Gilching, Bayern, Germany",$100M to $500M,1993-01-01,year,,https://www.linkedin.com/company/sam-solutions
SSTech System,https://www.crunchbase.com/organization/sstech-system,51-100,Active,https://www.sstechsystem.com/,info@sstechsystem.com,+918780064339,,,,,,,,,"Apps, Design, Mobile, Software","Mobile Apps, Software, UX Design, Web Apps, Web Design, Web Development",,,,,,,,,,"Ahmedabad, Gujarat, India",$100M to $500M,2011-01-01,day,,https://www.linkedin.com/company/7789317/
SKOK Chmielewskiego,https://www.crunchbase.com/organization/skok-chmielewskiego,1001-5000,Active,https://www.skokchmielewskiego.pl,list@skokchmielewskiego.pl,(81) 446 30 00,,,,,,,,,"Apps, Financial Services, Mobile, Payments, Software","Finance, Financial Services, Mobile Apps, Mobile Payments",,,,,12892916,USD,12892916,,,"Lublin, Lubelskie, Poland",$100M to $500M,1994-01-01,year,,https://www.linkedin.com/company/skok-im-z-chmielewskiego
Tonga Communications Corporation,https://www.crunchbase.com/organization/tonga-communications-corporation,101-250,Active,https://www.tcc.to,customerservice@tcc.to,+676-800-222,,,,,,,,,"Apps, Hardware, Internet Services, Messaging and Telecommunications, Mobile, Software","Internet, Mobile Apps, Telecommunications, Wired Telecommunications",,,,,,,,,,"Nukalofa, Tongatapu, Tonga",$100M to $500M,1978-07-01,month,,https://www.linkedin.com/company/tonga-communications-corporation/
TEAM STRIKER TACTICS,https://www.crunchbase.com/organization/team-striker-tactics,501-1000,Active,http://mink1231.wix.com/strikertactics,,,,,,,,,,,"Apps, Commerce and Shopping, Gaming, Mobile, Platforms, Software, Sports","Apps, Collectibles, Gaming, iOS, Mobile, Mobile Apps, Sports",,,,,,,,,,"New York, New York, United States",$100M to $500M,2006-01-01,year,,https://www.linkedin.com/company/wix-com
Ordu Büyükşehir Belediyesi,https://www.crunchbase.com/organization/ordu-büyükşehir-belediyesi,501-1000,Active,https://ordu.bel.tr,ordu@ordu.bel.tr,+90 444 10 52,,,,,,,,,"Apps, Community and Lifestyle, Government and Military, Mobile, Software","Government, Mobile Apps, Social",,,,,,,,,,"Turkey, North Carolina, United States",$100M to $500M,,,,https://www.linkedin.com/company/ordu-b%C3%BCy%C3%BCk%C5%9Fehir-belediyesi
Stadtwerke Remscheid,https://www.crunchbase.com/organization/stadtwerke-remscheid,101-250,Active,https://www.stadtwerke-remscheid.de/,info@stadtwerke-remscheid.de,+49-2191-16 40,,,,,,,,,"Apps, Content and Publishing, Information Technology, Internet Services, Media and Entertainment, Mobile, Software, Transportation","Information Services, Mobile Apps, News, Online Portals, Transportation",0,1,,Common metals and their alloys; ores,340472,USD,340472,,,"Remscheid, Nordrhein-Westfalen, Germany",$100M to $500M,1892-01-01,year,,https://www.linkedin.com/company/stadtwerke-remscheid-gmbh
TopNetwork,https://www.crunchbase.com/organization/topnetwork,501-1000,Active,https://www.topnetwork.it,info.top@top-network.it,+39 06 3209531,,,,,,,,,"Apps, Information Technology, Mobile, Other, Professional Services, Software","Consulting, Information Technology, Infrastructure, Mobile Apps",0,2,,Scientific and electric apparatus and instruments,7162635,USD,7162635,,,"Roma, Lazio, Italy",$100M to $500M,2003-01-01,year,,https://www.linkedin.com/company/topnetwork-s-p-a-
Tuyap,https://www.crunchbase.com/organization/tuyap,501-1000,Active,https://tuyap.com.tr/,tuyap@tuyap.com.tr,+90 212 867 11 00,,,,,,,,,"Administrative Services, Apps, Events, Media and Entertainment, Mobile, Software, Sports","Events, Mobile Apps, Sports, Trade Shows",0,1,,Advertising; business,,,,,,"Büyükçekmece, Istanbul, Turkey",$100M to $500M,1979-06-28,day,,https://www.linkedin.com/company/tuyapfuarcilikgrubu/
Passolig,https://www.crunchbase.com/organization/passolig,1001-5000,Active,https://www.passolig.com.tr,aktifbank@hs03.kep.tr,90 212 340 80 00,,,,,,,,,"Apps, Financial Services, Lending and Investments, Mobile, Payments, Software","Credit Cards, Debit Cards, Finance, Financial Services, Mobile Apps",,,,,,,,,,"Istanbul, Istanbul, Turkey",$100M to $500M,2013-01-01,year,,
Svea Taxi Alliance,https://www.crunchbase.com/organization/svea-taxi-alliance,1001-5000,Active,https://www.sveataxi.se,salj@taxistockholm.se,+46 40 13 80 00,,,,,,,,,"Apps, Mobile, Software, Transportation","Mobile Apps, Taxi Service, Transportation",,,,,29889,USD,29889,,,"Stockholm, Stockholms Lan, Sweden",$100M to $500M,2008-01-01,year,,https://www.linkedin.com/company/svea-taxi-allians
Sorovale,https://www.crunchbase.com/organization/sorovale,501-1000,Active,https://sorovale.com.br,,55 0800 773 5600,,,,,,,,,"Apps, Financial Services, Mobile, Payments, Software","Finance, Financial Services, Mobile Apps, Payments",,,,,,,,,,"São Paulo, Sao Paulo, Brazil",$100M to $500M,2008-01-01,year,,https://www.linkedin.com/company/sorovale-administradora-de-benefícios-e-convênios-s-a
Ecovale,https://www.crunchbase.com/organization/ecovale,501-1000,Active,https://www.ecovale.com.mx,,,,,,,,,,,"Apps, Financial Services, Mobile, Payments, Professional Services, Software","Consulting, Mobile Apps, Mobile Payments",,,,,,,,,,"Miguel Hidalgo, Distrito Federal, Mexico",$100M to $500M,2005-01-01,year,,https://www.linkedin.com/company/ecovale
Boticas y Salud,https://www.crunchbase.com/organization/boticas-y-salud,1001-5000,Active,https://boticasysalud.com/,servicioalcliente@boticasysalud.com,+51 16550000,,,,,,,,,"Apps, Health Care, Mobile, Software","Health Care, Mobile Apps, Pharmaceutical",,,,,,,,,,"Santiago De Surco, Lima, Peru",$100M to $500M,1998-01-01,year,,https://www.linkedin.com/company/boticasysalud/
Concept Eight,https://www.crunchbase.com/organization/concept-eight-8481,501-1000,Active,https://concepteight.com.au,guestrelations@concepteight.com.au,,,,,,,,,,"Apps, Food and Beverage, Mobile, Other, Sales and Marketing, Software","Franchise, Marketing, Mobile Apps, Restaurants",,,,,,,,,,"Melbourne, Victoria, Australia",$100M to $500M,1996-01-01,year,,https://www.linkedin.com/company/concept-eight
Harf Information Technology,https://www.crunchbase.com/organization/harf-information-technology,251-500,Active,http://www.harf.com/,,,,,,,,,,,"Apps, Information Technology, Mobile, Professional Services, Software","Consulting, Information Technology, Mobile Apps, Software, Web Apps",,,,,,,,,,"Cairo, Al Qahirah, Egypt",$100M to $500M,1997-01-01,year,,https://www.linkedin.com/company/harf-information-technology
Muzz Buzz,https://www.crunchbase.com/organization/muzz-buzz,501-1000,Active,https://australia.muzzbuzz.com,buzzy@muzzbuzz.com.au,+44 892778666,,,,,,,,,"Apps, Food and Beverage, Internet Services, Mobile, Software","Food and Beverage, Mobile Apps, Online Portals",,,,,,,,,,"Midland Junction, Western Australia, Australia",$100M to $500M,2004-01-01,year,,https://www.linkedin.com/company/muzz-buzz-franchising-pty-ltd
Renaissance IT,https://www.crunchbase.com/organization/renaissance-it,51-100,Active,http://www.renaissance-it.com,,91 80 4195 1999,,,,,,,,,"Apps, Information Technology, Mobile, Platforms, Software","Android, Apps, Information Technology, iOS, Mobile Apps, Software",,,,,,,,,,"Bangalore, Karnataka, India",$100M to $500M,1999-01-01,year,,https://www.linkedin.com/company/srit
cocoon library,https://www.crunchbase.com/organization/cocoon-library,1001-5000,Active,https://cocoon.apache.org/,,,,,,,,,,,"Apps, Education, Health Care, Mobile, Platforms, Software","Education, Health Care, iOS, Mobile, Mobile Apps",,,,,,,,,,"Forest Hill, Maryland, United States",$100M to $500M,1999-01-01,year,,https://www.linkedin.com/company/the-apache-software-foundation
Plusnet,https://www.crunchbase.com/organization/plusnet-1bc7,1001-5000,Active,https://www.plusnet.com.br,contato@plusnet.com.br,55 (45) 99946-2159,,,,,,,,,"Apps, Commerce and Shopping, Internet Services, Mobile, Software","E-Commerce Platforms, Internet, Mobile Apps",,,,,,,,,,"Cascavel, Sao Paulo, Brazil",$100M to $500M,1997-01-01,year,,https://www.linkedin.com/company/plusnet_2
The Seller,https://www.crunchbase.com/organization/the-seller,501-1000,Active,https://www.theseller.com.mx/ts/,info@theseller.com.mx,33 1202 1000,,,,,,,,,"Administrative Services, Apps, Data and Analytics, Mobile, Professional Services, Software","Apps, Business Intelligence, Human Resources, Mobile Apps, Recruiting, Software",,,,,,,,,,"Guadalajara, Jalisco, Mexico",$100M to $500M,2011-01-01,year,,https://www.linkedin.com/company/the-seller/?viewAsMember=true
QNH,https://www.crunchbase.com/organization/qnh,501-1000,Active,https://www.qnh.nl,info@ilionx.com,+31 088 05 90 500,,,,,,,,,"Apps, Information Technology, Mobile, Other, Professional Services, Software","Consulting, IT Management, Mobile Apps, Professional Services, Software",,,,,,,,,,"Utrecht, Utrecht, The Netherlands",$100M to $500M,2004-01-01,year,,https://www.linkedin.com/company/qnh/
Odamax,https://www.crunchbase.com/organization/odamax,1001-5000,Active,https://www.odamax.com,musterihizmetleri@odamax.com,+90 0850 955 4444,,,,,,,,,"Apps, Mobile, Software, Travel and Tourism","Mobile Apps, Travel, Travel Accommodations",,,,,,,,,,"Kadikoy, Istanbul, Turkey",$100M to $500M,2017-01-01,year,,https://www.linkedin.com/company/odamax
Oura,https://www.crunchbase.com/organization/Ōura,251-500,Active,http://ouraring.com,info@ouraring.com,,,,,,,,,,"Apps, Consumer Electronics, Hardware, Health Care, Mobile, Software","Health Care, Mobile Apps, Wearables",,,,,10375054,USD,10375054,,,"Oulu, Oulu, Finland",$50M to $100M,2013-01-01,year,"Alumni Ventures, Block, Inc., Gradient Ventures, TCG, Bold Capital Partners",https://www.linkedin.com/company/oura
Nearpod,https://www.crunchbase.com/organization/nearpod,251-500,Active,http://www.nearpod.com,marketing@nearpod.com,1 855-632-7763,,,,,,,,,"Apps, Education, Hardware, Mobile, Software","E-Learning, EdTech, Education, Mobile Apps, Skill Assessment, Software, Virtual Reality",0,3,,Scientific and technological services,5105308,USD,5105308,,,"Dania, Florida, United States",$50M to $100M,2012-01-01,year,"Reach Capital, Emerson Collective, Miami Angels, GSV Ventures, Storm Ventures",https://www.linkedin.com/company/nearpod
Sensor Tower,https://www.crunchbase.com/organization/sensor-tower,251-500,Active,http://sensortower.com,support@sensortower.com,(888) 285-6786,,,,,,,,,"Advertising, Apps, Data and Analytics, Design, Mobile, Platforms, Sales and Marketing, Software","Ad Targeting, Advertising, Analytics, Android, Big Data, Market Research, Mobile, Mobile Apps, Product Research",,,,,3727653,USD,3727653,,,"San Francisco, California, United States",$50M to $100M,2013-01-01,year,"Pear VC, Riverwood Capital, BDMI, AngelPad, Merus Capital",https://www.linkedin.com/company/sensor-tower
MyGate,https://www.crunchbase.com/organization/mygate-8248,501-1000,Active,https://mygate.com,contact@mygate.in,18001232084,,,,,,,,,"Apps, Information Technology, Mobile, Software","Apps, Information Services, Information Technology, Mobile Apps, Software",,,,,,,,,,"Bengaluru, Karnataka, India",$50M to $100M,2016-01-01,year,"Urban Company, Acko, Tencent, Prime Venture Partners, Tiger Global Management",https://www.linkedin.com/company/mygatein/
Sauce Labs,https://www.crunchbase.com/organization/sauce-labs,501-1000,Active,http://saucelabs.com,hello@saucelabs.com,(855) 677-0011,,,,,,,,,"Apps, Hardware, Information Technology, Internet Services, Mobile, Software","Cloud Infrastructure, Information Technology, Mobile Apps, Software, Web Development",14,6,Computing; Calculating,Scientific and electric apparatus and instruments,657154,USD,657154,,,"San Francisco, California, United States",$50M to $100M,2008-07-30,day,"TPG, Adams Street Partners, Riverwood Capital, Toba Capital, IVP",http://www.linkedin.com/company/sauce-labs
Nursa,https://www.crunchbase.com/organization/nursa,101-250,Active,https://nursa.com,hello@nursa.com,,,,,,,,,,"Administrative Services, Apps, Health Care, Mobile, Professional Services, Software","Health Care, Mobile Apps, Recruiting, Staffing Agency",0,1,,Scientific and technological services,9452400,USD,9452400,,,"Salt Lake City, Utah, United States",$50M to $100M,2018-01-01,year,"Drive Capital, Kickstart, Pelion Venture Partners",https://www.linkedin.com/company/nursaapp
Glooko,https://www.crunchbase.com/organization/glooko,101-250,Active,http://www.glooko.com,info@glooko.com,650-720-5310,1,1,,,,,,,"Apps, Health Care, Mobile, Software","Diabetes, Health Care, mHealth, Mobile Apps, SaaS",3,4,Medical Or Veterinary Science; Hygiene,Scientific and electric apparatus and instruments,2363100,USD,2363100,,,"Mountain View, California, United States",$50M to $100M,2010-11-01,day,"Intuit, Novo Nordisk, Mayo Clinic, Glooko, Medtronic",http://www.linkedin.com/company/glooko
Exotel,https://www.crunchbase.com/organization/exotel,501-1000,Active,https://exotel.com,hiring@exotel.in,+91 80 88 919888,,,,,,,,,"Apps, Artificial Intelligence (AI), Data and Analytics, Information Technology, Internet Services, Messaging and Telecommunications, Mobile, Sales and Marketing, Software","Cloud Data Services, CRM, Machine Learning, Messaging, Mobile Apps, SaaS, Software, Speech Recognition, Video Chat",2,0,Electric Communication Technique,,,,,,,"Bangalore, Karnataka, India",$50M to $100M,2011-01-01,year,"Blume Ventures, Steadview Capital, Mumbai Angels, A91 Partners, Binny Bansal",http://www.linkedin.com/company/exotel-techcom-private-limited
