Tecnomapas,https://www.crunchbase.com/organization/tecnomapas,51-100,Active,https://www.tecnomapas.com.br/,rh@tecnomapas.com.br,(65) 3648-3700,,,,,,,,,"Apps, Hardware, Information Technology, Internet Services, Mobile, Software","Cloud Data Services, Information Services, Information Technology, Mobile Apps, Remote Sensing",,,,,,,,,,"Cuiabá, Mato Grosso, Brazil",$1M to $10M,1996-01-01,year,,https://www.linkedin.com/company/tecnomapas/
Northway/Photomap/Remote Sensing.,https://www.crunchbase.com/organization/northway-photomap-remote-sensing,251-500,Active,https://www.northway-photomap.com,,(705) 730-6694,,,,,,,,,"Hardware, Information Technology, Other, Professional Services","Customer Service, Information Services, Professional Services, Remote Sensing",,,,,,,,,,"Barrie, Ontario, Canada",,2011-04-01,day,,https://www.linkedin.com/company/neat-taxi
Remote Sensing Applications Centre,https://www.crunchbase.com/organization/remote-sensing-applications-centre,101-250,Active,https://rsac.up.gov.in,director.rsac-up@gov.in,+91 8765977649,,,,,,,,,"Data and Analytics, Government and Military, Hardware, Information Technology, Natural Resources, Navigation and Mapping, Software, Sustainability","Government, GovTech, GPS, Image Recognition, Information Technology, Natural Resources, Remote Sensing",,,,,,,,,,"Lucknow, Uttar Pradesh, India",$1M to $10M,1982-05-01,month,,https://www.linkedin.com/company/remote-sensing-applications-center-uttar-pradesh
Scenario Automation,https://www.crunchbase.com/organization/scenario-automation,51-100,Active,https://www.scenarioautomation.com,scenario@scenarioautomation.com,+55 11 5535 2205,,,,,,,,,"Consumer Electronics, Hardware, Real Estate","Electronics, Remote Sensing, Smart Home",,,,,,,,,,"São Carlos Do Pinhal, Sao Paulo, Brazil",$1M to $10M,2000-01-01,year,,https://www.linkedin.com/company/scenario-automation/
AIOFM,https://www.crunchbase.com/organization/aiofm,501-1000,Active,http://www.aiofm.ac.cn/,aio@aiofm.ac.cn,86-0551-65591539,,,,,,,,,"Hardware, Science and Engineering","Laser, Remote Sensing, Sensor",,,,,,,,,,"Hefei, Anhui, China",,1970-01-01,day,,https://www.linkedin.com/company/%E4%B8%AD%E7%A7%91%E9%99%A2%E5%AE%89%E5%BE%BD%E5%85%89%E6%9C%BA%E6%89%80%E6%99%B6%E4%BD%93%E6%9D%90%E6%96%99%E5%AE%A4
Hiparc,https://www.crunchbase.com/organization/hiparc,51-100,Active,https://www.hiparc.com,,55 27 3505-4500,,,,,,,,,"Data and Analytics, Hardware, Navigation and Mapping","Geospatial, Mapping Services, Remote Sensing",,,,,,,,,,"Vila Velha, Espirito Santo, Brazil",,2004-01-01,year,,https://www.linkedin.com/company/hiparc-aerolevantamentos
ARESYS srl,https://www.crunchbase.com/organization/aresys-srl,51-100,Active,https://www.aresys.it,,,,,,,,,,,"Advertising, Hardware, Information Technology, Professional Services, Sales and Marketing, Software","Advertising, Consulting, Information Technology, Remote Sensing, Software, Telecommunications",,,,,,,,,,"Milano, Lombardia, Italy",$10M to $50M,2003-01-01,year,,https://www.linkedin.com/company/aresys-srl/
Yuwon Electronics Co.,https://www.crunchbase.com/organization/yuwon-electronics-co,101-250,Active,http://rcu.co.kr,sales@rcu.co.kr,+82 2 2068 7280,,,,,,,,,"Consumer Electronics, Hardware, Manufacturing","Electronics, Manufacturing, Remote Sensing",,,,,,,,,,"Seoul, Seoul-t'ukpyolsi, South Korea",$50M to $100M,2003-12-01,month,,https://www.linkedin.com/company/yuwon-electronics
Hope Technologies,https://www.crunchbase.com/organization/hope-technologies-f345,101-250,Active,https://hopeindia.com,jacob.p@hopeindia.com,91 96 63424573,,,,,,,,,"Design, Hardware, Information Technology, Software","3D Technology, CAD, Information Technology, Remote Sensing, Software",,,,,,,,,,"Bangalore, Karnataka, India",$1M to $10M,2011-01-01,year,,https://www.linkedin.com/company/hopetechnologies
Antesky Science Technology,https://www.crunchbase.com/organization/antesky-science-technology,51-100,Active,https://www.antesky.com,info@antesky.com,+86 29 88352448,,,,,,,,,"Hardware, Manufacturing","Manufacturing, Remote Sensing, Satellite Communication",,,,,,,,,,"Shijiazhuang, Hebei, China",$10M to $50M,1985-01-01,year,,https://www.linkedin.com/company/antesky-science-technology-inc-
