DiRWA,https://www.crunchbase.com/organization/dirwa,51-100,Active,https://www.dirwa.com,,,,,,,,,,,"Artificial Intelligence (AI), Information Technology, Professional Services, Software","Information Technology, Outsourcing, Robotic Process Automation (RPA), Software",,,,,307937,USD,307937,,,"San Justo, Buenos Aires, Argentina",,2017-01-01,year,,https://www.linkedin.com/company/dirwa-esp
NITCO,https://www.crunchbase.com/organization/nitco-e8fd,51-100,Active,https://www.nitcoinc.com/,yourdigitaltechnologypartner@nitcoinc.com,1 281-503-7002,,,,,,,,,"Artificial Intelligence (AI), Data and Analytics, Hardware, Information Technology, Science and Engineering, Software","Artificial Intelligence (AI), Information Technology, Machine Learning, Natural Language Processing, Robotic Process Automation (RPA), Robotics",,,,,714482,USD,714482,,,"Katy, Texas, United States",$1M to $10M,2008-01-01,year,,https://www.linkedin.com/company/nitcoincofficial
IT Lab,https://www.crunchbase.com/organization/it-lab-a909,51-100,Active,https://www.itlab.com.br,comercial@itlab.com.br,+55 11 3044 4068,,,,,,,,,"Artificial Intelligence (AI), Information Technology, Professional Services, Software","Information Technology, Outsourcing, Robotic Process Automation (RPA), Software, Web Development",,,,,,,,,,"Santo Amaro, Sao Paulo, Brazil",$10M to $50M,2007-01-01,year,,https://www.linkedin.com/company/it-lab-brasil
CEC Global Services DMCC,https://www.crunchbase.com/organization/cec-global-services-dmcc,501-1000,Active,https://cecglobal.net/,info@cecglobal.net,+971-56-394-0615,,,,,,,,,"Artificial Intelligence (AI), Data and Analytics, Hardware, Professional Services, Science and Engineering, Software","Artificial Intelligence (AI), Consulting, Outsourcing, Robotic Process Automation (RPA), Robotics, Software",,,,,,,,,,"Dubai, Dubai, United Arab Emirates",,2015-01-01,year,,https://www.linkedin.com/company/cecglobal/
Modern Agile Technologies,https://www.crunchbase.com/organization/modern-agile-technologies,51-100,Active,https://modernagiletech.com,info@modernagiletech.com,91 4048528882,,,,,,,,,"Administrative Services, Artificial Intelligence (AI), Professional Services, Software","Human Resources, Recruiting, Robotic Process Automation (RPA), Staffing Agency",,,,,,,,,,"Hyderabad, Andhra Pradesh, India",$10M to $50M,2017-01-01,year,,https://www.linkedin.com/company/modernagiletechnologies
BDA Solutions – Big Data & Analytics,https://www.crunchbase.com/organization/bda-solutions-big-data-analytics,101-250,Active,https://bdasolutions.com.br/,contato@bdasolutions.com.br,+55 11 3588 4708,,,,,,,,,"Artificial Intelligence (AI), Data and Analytics, Software","Analytics, Big Data, Robotic Process Automation (RPA), Software",,,,,,,,,,"São Paulo, Sao Paulo, Brazil",$10M to $50M,2014-04-01,month,,https://www.linkedin.com/company/bda-solutions
4Labs Technologies,https://www.crunchbase.com/organization/4labs-technologies,51-100,Active,https://4labsinc.com,info@4labsinc.com,1 (860) 705-3364,,,,,,,,,"Artificial Intelligence (AI), Information Technology, Software","IT Infrastructure, Robotic Process Automation (RPA), Software, Web Development",,,,,,,,,,"Des Moines, Iowa, United States",$1M to $10M,2019-01-01,year,,https://www.linkedin.com/company/4labstechnologies
Variedy,https://www.crunchbase.com/organization/variedy,101-250,Active,https://www.variedy.com,variedy_marketing@variedy.com,+1-949-449-3907,,,,,,,,,"Artificial Intelligence (AI), Hardware, Information Technology, Internet Services, Science and Engineering, Software","Cloud Computing, IT Infrastructure, Robotic Process Automation (RPA), Robotics, Software",,,,,507622,USD,507622,,,"Irvine, California, United States",Less than $1M,2009-01-01,year,,https://www.linkedin.com/company/variedy/
MxTechies,https://www.crunchbase.com/organization/mxtechies,51-100,Active,https://mxtechies.com,connect@mxtechies.com,+1 609 454 2535,,,,,,,,,"Artificial Intelligence (AI), Data and Analytics, Internet Services, Software","Analytics, Cloud Computing, Robotic Process Automation (RPA), Software",,,,,,,,,,"Lewes, Delaware, United States",,2017-01-01,year,,https://www.linkedin.com/company/mx-techies
BI Solutions Inc,https://www.crunchbase.com/organization/bi-solutions-inc,51-100,Active,https://bi-sol.com/index.html,,+1-469-287-5784,,,,,,,,,"Administrative Services, Artificial Intelligence (AI), Professional Services, Software","Consulting, Enterprise Resource Planning (ERP), Robotic Process Automation (RPA), Staffing Agency",,,,,357010,USD,357010,,,"Plano, Texas, United States",,2005-01-01,year,,https://www.linkedin.com/company/bi-solutions-inc/
Bot Ai Ml,https://www.crunchbase.com/organization/bot-ai-ml,251-500,Active,https://botaiml.com,sales@botaiml.com,91 80 2225 0073,,,,,,,,,"Artificial Intelligence (AI), Data and Analytics, Information Technology, Science and Engineering, Software","Artificial Intelligence (AI), Chatbot, Information Technology, Machine Learning, Robotic Process Automation (RPA)",,,,,,,,,,"Bengaluru, Karnataka, India",,,,,https://botaiml.com
NDIS,https://www.crunchbase.com/organization/ndis,251-500,Active,https://www.ndisol.jp,,81 3-5781-1770,,,,,,,,,"Artificial Intelligence (AI), Data and Analytics, Information Technology, Internet Services, Science and Engineering, Software","Artificial Intelligence (AI), Cloud Data Services, Enterprise Resource Planning (ERP), Information Technology, Robotic Process Automation (RPA)",,,,,,,,,,"Tokyo, Tokyo, Japan",$1M to $10M,1981-01-01,month,,
Flowing Rivers Technologies,https://www.crunchbase.com/organization/flowing-rivers-technologies,251-500,Active,https://frtlatam.com/,info@frtlatam.com,+502-2491-9800,,,,,,,,,"Artificial Intelligence (AI), Hardware, Professional Services, Software","Data Storage, Outsourcing, Robotic Process Automation (RPA), Software",,,,,,,,,,"Guatemala City, Guatemala, Guatemala",$10M to $50M,2015-01-01,year,,https://www.linkedin.com/company/flowingriverstech/
2CX,https://www.crunchbase.com/organization/2cx,251-500,Active,https://www.2cx.com.br,contato@2cx.com.br,+55 11 3320 7900,,,,,,,,,"Artificial Intelligence (AI), Hardware, Information Technology, Science and Engineering, Software","Information Technology, Robotic Process Automation (RPA), Robotics",,,,,,,,,,"São Paulo, Sao Paulo, Brazil",$1M to $10M,1997-01-01,year,,https://www.linkedin.com/company/2cognitivecustomer
IST - International Software Techniques S.A.,https://www.crunchbase.com/organization/ist-international-software-techniques-s-a,51-100,Active,https://www.ist.com.gr,info@ist.com.gr,+302107488678,,,,,,,,,"Apps, Artificial Intelligence (AI), Data and Analytics, Design, Information Technology, Internet Services, Mobile, Software","Big Data, Business Intelligence, Cloud Computing, Data Visualization, Database, DevOps, Information Technology, Mobile Apps, Robotic Process Automation (RPA), Web Development",,,,,,,,,,"Amaroúsion, Attiki, Greece",,1991-01-01,year,,https://www.linkedin.com/company/istgreece
Finalatix Technologies,https://www.crunchbase.com/organization/finalatix-technologies,101-250,Active,https://www.finalatix.com,contact@finalatix.com,44 20 8176 6722,,,,,,,,,"Artificial Intelligence (AI), Financial Services, Professional Services, Software","Consulting, Financial Services, FinTech, Robotic Process Automation (RPA), Software",,,,,,,,,,"London, England, United Kingdom",$1M to $10M,2017-01-01,year,,https://www.linkedin.com/company/finalatix
Cellere,https://www.crunchbase.com/organization/cellere,51-100,Active,https://cellere.com.br,marketing@cellereit.com.br,55 19 3131-4000,,,,,,,,,"Artificial Intelligence (AI), Information Technology, Software","Information Technology, Robotic Process Automation (RPA)",,,,,,,,,,"Campina, Sao Paulo, Brazil",,2004-01-01,day,,https://www.linkedin.com/company/cellereit/?originalSubdomain=pt
Plenus,https://www.crunchbase.com/organization/plenus-6196,51-100,Active,https://plenusmanutencao.com.br,plenus@plenusmanutencao.com.br,55 (35) 3713 3300,,,,,,,,,"Artificial Intelligence (AI), Manufacturing, Science and Engineering, Software","Industrial, Industrial Automation, Machinery Manufacturing, Manufacturing, Robotic Process Automation (RPA)",,,,,,,,,,"Poços De Caldas, Minas Gerais, Brazil",$1M to $10M,,,,https://www.linkedin.com/company/plenus-manutencao-industria-e-comercio
Solvexis Consulting,https://www.crunchbase.com/organization/solvexis-consulting,501-1000,Active,https://solvexis.co.in,info@solvexis.co.in,+91 9873353551,,,,,,,,,"Artificial Intelligence (AI), Information Technology, Internet Services, Software","Cloud Management, Information Technology, Robotic Process Automation (RPA)",,,,,,,,,,"Noida, Uttar Pradesh, India",$1M to $10M,2018-01-01,year,,https://www.linkedin.com/company/solvexis/
Luna Technologies,https://www.crunchbase.com/organization/luna-technologies-2f98,101-250,Active,https://luna.co.in,sales@luna.co.in,+91 022 61786100,,,,,,,,,"Artificial Intelligence (AI), Hardware, Manufacturing, Software","Hardware, Industrial, Robotic Process Automation (RPA)",,,,,,,,,,"Mumbai, Maharashtra, India",,,,,https://www.linkedin.com/company/lunatechnologiespvtltd
TechnomaX Systems,https://www.crunchbase.com/organization/technomax-systems,51-100,Active,https://technomaxsystems.com,info@technomaxsystems.com,+971 42156787,,,,,,,,,"Artificial Intelligence (AI), Data and Analytics, Education, Health Care, Information Technology, Internet Services, Manufacturing, Media and Entertainment, Professional Services, Science and Engineering, Software","Artificial Intelligence (AI), Content, Document Management, Education, Health Care, Manufacturing, Online Portals, Outsourcing, Robotic Process Automation (RPA), Training",,,,,,,,,,"Dubai, Dubai, United Arab Emirates",$1M to $10M,2015-01-01,year,,https://www.linkedin.com/company/technomax-systems
Enterprise Beta & Distributed Systems,https://www.crunchbase.com/organization/enterprise-beta-distributed-systems,101-250,Active,https://www.enterprisebds.com,info@theblueangle.com,+1 973 745 8596,,,,,,,,,"Artificial Intelligence (AI), Data and Analytics, Information Technology, Privacy and Security, Professional Services, Science and Engineering, Software","Artificial Intelligence (AI), Consulting, Cyber Security, Robotic Process Automation (RPA)",,,,,,,,,,"Chicago, Illinois, United States",$10M to $50M,2005-01-01,year,,https://www.linkedin.com/company/enterprise-business-and-data-solutions---ebds
HPA,https://www.crunchbase.com/organization/hpa,101-250,Active,http://hpa.services,,615.567-6335,,,,,,,,,"Artificial Intelligence (AI), Hardware, Information Technology, Science and Engineering, Software","Information Technology, Robotic Process Automation (RPA), Robotics",,,,,,,,,,"Brentwood, Tennessee, United States",,1999-01-01,year,,https://www.linkedin.com/company/hpa-a-cognizant-company
Translift,https://www.crunchbase.com/organization/translift,51-100,Active,https://transliftbr.com,,55 (11) 3199-6200,,,,,,,,,"Artificial Intelligence (AI), Manufacturing, Science and Engineering, Software","Industrial, Industrial Automation, Manufacturing, Robotic Process Automation (RPA)",,,,,,,,,,"São Bernardo Do Campo, Sao Paulo, Brazil",$10M to $50M,2006-01-01,year,,https://www.linkedin.com/company/translift-sistemas-de-movimenta-o-e-armazenagem-ltda
Unosys Solutions,https://www.crunchbase.com/organization/unosys-solutions,51-100,Active,https://www.unosysit.com,business@unosysit.com,+91 020 4678 0889,,,,,,,,,"Artificial Intelligence (AI), Information Technology, Professional Services, Science and Engineering, Software","Consulting, Enterprise Resource Planning (ERP), Information Technology, Robotic Process Automation (RPA), Software Engineering",,,,,,,,,,"Pune, Maharashtra, India",$1M to $10M,2012-01-01,year,,https://www.linkedin.com/company/unosys-solutions-pvt-ltd/
Hinfo Technologies,https://www.crunchbase.com/organization/hinfo-technologies,51-100,Active,https://hinfotechnologies.com,hr@hinfotechnologies.com,91 8667002741,,,,,,,,,"Artificial Intelligence (AI), Information Technology, Internet Services, Software","Cloud Management, Information Technology, Robotic Process Automation (RPA), Web Development",,,,,,,,,,"Madurai, Tamil Nadu, India",,,,,https://www.linkedin.com/company/hinfotechnologies/
Corpshore Solutions,https://www.crunchbase.com/organization/corpshore-solutions,1001-5000,Active,https://corpshore.solutions,info@corpshore.solutions,+1 866 531 5727,,,,,,,,,"Administrative Services, Artificial Intelligence (AI), Consumer Electronics, Data and Analytics, Hardware, Information Technology, Internet Services, Messaging and Telecommunications, Professional Services, Sales and Marketing, Science and Engineering, Software","Artificial Intelligence (AI), Big Data, Call Center, Computer, Consulting, Information Technology, Messaging, Outsourcing, Robotic Process Automation (RPA), Sales Automation",,,,,,,,,,"Toronto, Ontario, Canada",,,,,https://ca.linkedin.com/company/corpshore-solutions?trk=public_profile_position_image
Copernicus Consulting,https://www.crunchbase.com/organization/copernicus-consulting-e043,101-250,Active,https://copernicusworld.com/,info@copernicusworld.com,,,,,,,,,,"Apps, Artificial Intelligence (AI), Data and Analytics, Education, Information Technology, Mobile, Professional Services, Software","Business Intelligence, Consulting, E-Learning, Enterprise Applications, Information Technology, Mobile Apps, Robotic Process Automation (RPA)",,,,,,,,,,"Singapore, Central Region, Singapore",,2010-01-01,year,,https://www.linkedin.com/company/copernicusworld/
Sentient Minds,https://www.crunchbase.com/organization/sentient-minds,101-250,Active,http://www.sentientminds.com/index.php,info@sentientminds.com,+1 248-996-3595,,,,,,,,,"Artificial Intelligence (AI), Blockchain and Cryptocurrency, Data and Analytics, Hardware, Information Technology, Other, Science and Engineering, Software","Artificial Intelligence (AI), Blockchain, Information Technology, Machine Learning, Robotic Process Automation (RPA), Robotics",,,,,1167829,USD,1167829,,,"Farmington Hills, Michigan, United States",,,,,https://www.linkedin.com/company/sentientminds/
Palmer Group,https://www.crunchbase.com/organization/palmer-gruppe,251-500,Active,https://www.palmer-gruppe.de/,info@palmer-gruppe.de,+49-152-092-937-89,,,,,,,,,"Artificial Intelligence (AI), Information Technology, Professional Services, Sales and Marketing, Software","Consulting, Information Technology, Marketing, Robotic Process Automation (RPA), Software",,,,,,,,,,"Bavaria, Cundinamarca, Colombia",$1M to $10M,2006-01-01,year,,https://www.linkedin.com/company/palmer-gruppe
Amayztech,https://www.crunchbase.com/organization/amayztech,51-100,Active,https://www.amayztech.com,sales@amayztech.com,+1 307 264 3850,,,,,,,,,"Artificial Intelligence (AI), Data and Analytics, Information Technology, Other, Software","Analytics, Information Technology, Professional Services, Robotic Process Automation (RPA)",,,,,503918,USD,503918,,,"Sheridan, Wyoming, United States",$1M to $10M,,,,https://www.linkedin.com/company/amayztech
E2E,https://www.crunchbase.com/organization/e2e-e7ef,51-100,Active,https://e2etec.com.br,info@e2etec.com.br,(11) 4118-9580,,,,,,,,,"Artificial Intelligence (AI), Information Technology, Software","Information Technology, Robotic Process Automation (RPA)",,,,,,,,,,"Brasil, Sao Paulo, Brazil",,2002-01-01,year,,https://www.linkedin.com/company/end-to-end-technology/
VeloxTech Solutions,https://www.crunchbase.com/organization/veloxtech-solutions,51-100,Active,http://veloxtech.in,info@veloxtech.in,+91 040 48535888,,,,,,,,,"Artificial Intelligence (AI), Information Technology, Professional Services, Software","Consulting, Information Technology, Robotic Process Automation (RPA), Software",,,,,,,,,,"Secunderabad, Andhra Pradesh, India",$1M to $10M,2015-01-01,year,,https://linkedin.com/company/veloxtechsolutions
Rongzhi Information,https://www.crunchbase.com/organization/rongzhi-information,51-100,Active,https://www.infodator.com/,sales@infodator.com,+86 400-966-8005,,,,,,,,,"Artificial Intelligence (AI), Data and Analytics, Hardware, Manufacturing, Science and Engineering, Software","Artificial Intelligence (AI), Industrial Automation, Robotic Process Automation (RPA), Robotics, Software, Software Engineering",,,,,,,,,,"Huangpu, Shanghai, China",,2016-09-01,month,"UFIDA Software Co., Huatai Securities",https://www.linkedin.com/company/infodator/about/
AI LifeBOT,https://www.crunchbase.com/organization/ai-lifebot,101-250,Active,https://ailifebot.com,contact@ailifebot.com,+91 8126164780,,,,,,,,,"Artificial Intelligence (AI), Data and Analytics, Science and Engineering, Software","Artificial Intelligence (AI), Chatbot, Robotic Process Automation (RPA)",,,,,,,,,,"Gurgaon, Haryana, India",$1M to $10M,2014-01-01,year,,https://linkedin.com/company/ailifebot
Qmoniqs Software,https://www.crunchbase.com/organization/qmoniqs-software,51-100,Active,https://www.qmoniqs.com,reachus@qmoniqs.com,+91 87000 16281,,,,,,,,,"Artificial Intelligence (AI), Data and Analytics, Software","Data Management, Robotic Process Automation (RPA), Web Development",,,,,,,,,,"Gurgaon, Haryana, India",$1M to $10M,,,,https://www.linkedin.com/company/qmoniqs/
SynLogics Inc | Intelligent Process Automation Consulting Services,https://www.crunchbase.com/organization/synlogics-inc,51-100,Active,https://www.synlogics.com/,info@synlogics.com,(302) 440 0387,,,,,,,,,"Apps, Artificial Intelligence (AI), Data and Analytics, Hardware, Manufacturing, Mobile, Science and Engineering, Software","Artificial Intelligence (AI), Industrial Automation, Machine Learning, Mobile Apps, Robotic Process Automation (RPA), Robotics",,,,,670271,USD,670271,,,"Atlanta, Georgia, United States",,2016-01-23,day,,https://www.linkedin.com/company/synlogics
Surflex Technology,https://www.crunchbase.com/organization/surflex-technology,51-100,Active,https://surflextechnology.in/,info@surflextechnology.in,91 33 4007 6397,,,,,,,,,"Artificial Intelligence (AI), Internet Services, Professional Services, Software","Consulting, Enterprise Resource Planning (ERP), Internet of Things, Robotic Process Automation (RPA)",,,,,,,,,,"Kolkata, West Bengal, India",$1M to $10M,2010-01-01,year,,https://linkedin.com/company/surflex
Bright Curve IT Solutions,https://www.crunchbase.com/organization/bright-curve-it-solutions,101-250,Active,https://bright-curve.com,info@bright-curve.com,+91 88869 99500,,,,,,,,,"Artificial Intelligence (AI), Data and Analytics, Information Technology, Software","Business Intelligence, Data Management, Enterprise Resource Planning (ERP), Information Technology, Robotic Process Automation (RPA)",,,,,,,,,,"Hyderabad, Andhra Pradesh, India",$1M to $10M,,,,https://linkedin.com/company/bright-curve-it-solutions
CognitBotz Solutions,https://www.crunchbase.com/organization/cognitbotz-solutions,51-100,Active,https://www.cognitbotz.com,careers@CognitBotz.com,+91 9346575094,,,,,,,,,"Artificial Intelligence (AI), Data and Analytics, Education, Software","Machine Learning, Robotic Process Automation (RPA), Training",,,,,,,,,,"Hyderabad, Andhra Pradesh, India",$1M to $10M,2019-01-01,year,,https://www.linkedin.com/company/cognitbots
Campello,https://www.crunchbase.com/organization/campello,51-100,Active,https://www.campello.com.br,contato@campello.com.br,+55 31 3519 0700,,,,,,,,,"Artificial Intelligence (AI), Information Technology, Software","Information Technology, IT Infrastructure, Robotic Process Automation (RPA)",,,,,,,,,,"Nova Lima, Minas Gerais, Brazil",$1M to $10M,1983-01-01,year,,https://www.linkedin.com/company/campello-it
AgTech IT Services,https://www.crunchbase.com/organization/agtech-it-services,51-100,Active,https://agriculture.dev,,+49 176 32199461,,,,,,,,,"Artificial Intelligence (AI), Information Technology, Sales and Marketing, Software","CRM, Developer Tools, Enterprise Resource Planning (ERP), Robotic Process Automation (RPA)",,,,,,,,,,"Berlin, Berlin, Germany",$1M to $10M,2020-01-01,year,,https://www.linkedin.com/company/agtech-it-services-ug
Korea Scoring,https://www.crunchbase.com/organization/korea-scoring,51-100,Active,https://www.koreascoring.com/,ks@koreascoring.com,+82 2-3210-0797,,,,,,,,,"Artificial Intelligence (AI), Data and Analytics, Hardware, Information Technology, Professional Services, Science and Engineering, Software","Analytics, Chatbot, Consulting, Information Technology, Robotic Process Automation (RPA), Robotics",,,,,,,,,,"Yeoksamdong, Seoul-t'ukpyolsi, South Korea",$1M to $10M,2005-05-31,day,,https://www.linkedin.com/company/koreascoring
Skill Orbit,https://www.crunchbase.com/organization/skill-orbit,101-250,Active,http://skillorbit.com,info@skillorbit.com,92 21 34325907,,,,,,,,,"Apps, Artificial Intelligence (AI), Mobile, Software","Enterprise Resource Planning (ERP), Mobile Apps, Robotic Process Automation (RPA), Software",,,,,,,,,,"Karachi, Sindh, Pakistan",$1M to $10M,2015-01-01,day,,https://www.linkedin.com/company/skill-orbit
Apaar Information Systems,https://www.crunchbase.com/organization/apaar-information-systems,51-100,Active,https://www.apaarinfosystems.com,sales@apaarinfosystems.com,+91 72084 92494,,,,,,,,,"Artificial Intelligence (AI), Data and Analytics, Information Technology, Software","Analytics, Information Technology, Robotic Process Automation (RPA)",,,,,,,,,,"Mumbai, Maharashtra, India",$1M to $10M,2018-01-01,year,,https://www.linkedin.com/company/apaarinfosystems
Omnino Solutions,https://www.crunchbase.com/organization/omnino-solutions,51-100,Active,https://omninosolutions.com,contact.us@omninosolutions.com,+91 22 49706731,,,,,,,,,"Artificial Intelligence (AI), Data and Analytics, Science and Engineering, Software","Analytics, Artificial Intelligence (AI), Machine Learning, Robotic Process Automation (RPA)",,,,,,,,,,"Andheri, Maharashtra, India",$1M to $10M,2016-01-01,year,,https://www.linkedin.com/company/omnino-solutions-private-limited
TechnoForce IT Solutions,https://www.crunchbase.com/organization/technoforce-it-solutions,51-100,Active,https://www.technoforceit.com,info@technoforceit.com,+91 74282 36474,,,,,,,,,"Artificial Intelligence (AI), Data and Analytics, Information Technology, Software","Analytics, Information Technology, Robotic Process Automation (RPA)",,,,,,,,,,"Noida, Uttar Pradesh, India",,2022-01-01,year,,https://www.linkedin.com/company/technoforceit
Peoplebpo,https://www.crunchbase.com/organization/peoplebpo,501-1000,Active,https://peoplebpo.com,info@peoplebpo.com,+56 41 212 12 00,,,,,,,,,"Artificial Intelligence (AI), Information Technology, Professional Services, Sales and Marketing, Software","Consulting, CRM, Information Technology, Robotic Process Automation (RPA)",,,,,,,,,,"Concepcion, Bio-Bio, Chile",$1M to $10M,2012-01-01,year,,https://www.linkedin.com/company/peoplebpo/
Huaquejing Medical,https://www.crunchbase.com/organization/huaquejing-medical,51-100,Active,http://www.huaquejing.com/,huaquejing@qq.com,+86-0755-26603184,,,,,,,,,"Artificial Intelligence (AI), Data and Analytics, Health Care, Science and Engineering, Software","Artificial Intelligence (AI), Rehabilitation, Robotic Process Automation (RPA)",,,,,,,,,,"Shenzhen, Guangdong, China",,2019-01-01,year,Shenzhen Capital Group,
Accon.Tech,https://www.crunchbase.com/organization/accon-tech,101-250,Active,https://accon.tech,comercial@accon.tech,+55 24 98111 2517,,,,,,,,,"Artificial Intelligence (AI), Professional Services, Software, Transportation","Business Development, Logistics, Robotic Process Automation (RPA)",,,,,,,,,,"São Paulo, Sao Paulo, Brazil",Less than $1M,2019-01-01,year,,https://www.linkedin.com/company/accontech/
Soluttions,https://www.crunchbase.com/organization/soluttions,51-100,Active,http://www.soluttions.com.br,,+55 53 99701 0500,,,,,,,,,"Apps, Artificial Intelligence (AI), Data and Analytics, Mobile, Software","Big Data, Database, Machine Learning, Mobile Apps, Robotic Process Automation (RPA), Software",,,,,,,,,,"Curitiba, Parana, Brazil",$1M to $10M,2007-01-01,year,,https://www.linkedin.com/company/soluttions---solucao-em-tecnologia
Appian Infotech,https://www.crunchbase.com/organization/appian-infotech,51-100,Active,https://appianinfotech.com,info@appianinfotech.com,1-732-889-4818,,,,,,,,,"Artificial Intelligence (AI), Data and Analytics, Information Technology, Science and Engineering, Software","Analytics, Artificial Intelligence (AI), Information Technology, Robotic Process Automation (RPA)",,,,,140350,USD,140350,,,"Reston, Virginia, United States",$1M to $10M,2018-01-01,year,,https://www.linkedin.com/company/appian-infotech-inc
Universal Technology Solutions,https://www.crunchbase.com/organization/universal-technology-solutions,51-100,Active,https://www.uts-global.com,connect@uts-global.com,65-66364397,,,,,,,,,"Artificial Intelligence (AI), Information Technology, Software","Information Technology, Robotic Process Automation (RPA)",,,,,,,,,,"Singapore, Central Region, Singapore",,2007-01-01,year,,https://www.linkedin.com/company/universal-technology-solutions
Aadi Infotech,https://www.crunchbase.com/organization/aadi-infotech,251-500,Active,https://aaditech.com/,info@aaditech.com,022 41005539,,,,,,,,,"Apps, Artificial Intelligence (AI), Data and Analytics, Internet Services, Mobile, Sales and Marketing, Science and Engineering, Software","Artificial Intelligence (AI), Chatbot, Digital Marketing, Mobile Apps, Robotic Process Automation (RPA), Web Development, Web Hosting",,,,,,,,,,"Mumbai, Maharashtra, India",,,,,https://www.linkedin.com/in/aadi-infotech-38ab579a/?originalSubdomain=in
Shift Gear,https://www.crunchbase.com/organization/shift-gear,101-250,Active,https://shiftgear.be,contact@shiftgear.be,+32 04387 8626,,,,,,,,,"Artificial Intelligence (AI), Data and Analytics, Design, Information Technology, Software","IT Management, Robotic Process Automation (RPA), Software, Usability Testing",,,,,,,,,,"Brussels, Brussels Hoofdstedelijk Gewest, Belgium",,2008-01-01,year,,https://www.linkedin.com/company/shift-gear-belgium/
