Inspire for Solutions Development,https://www.crunchbase.com/organization/inspire-for-solutions-development,501-1000,Active,https://inspirejo.com,info@inspirejo.com,+962 6 516 0515,,,,,,,,,"Artificial Intelligence (AI), Information Technology, Professional Services, Software","Consulting, Information Technology, Robotic Process Automation (RPA)",,,,,,,,,,"Amman, Amman, Jordan",$1M to $10M,2014-01-01,year,,https://www.linkedin.com/company/inspire-for-solutions-development
Prematix Software Solution,https://www.crunchbase.com/organization/prematix-software-solution,51-100,Active,http://www.prematix.com,info@prematix.com,+91 9344644484,,,,,,,,,"Artificial Intelligence (AI), Data and Analytics, Science and Engineering, Software","Artificial Intelligence (AI), Robotic Process Automation (RPA), SaaS, Software, Web Development",,,,,,,,,,"Hosur, Tamil Nadu, India",$1M to $10M,2009-01-01,year,,https://www.linkedin.com/company/prematixsoftware
Xcel Hires Management Solutions,https://www.crunchbase.com/organization/xcel-hires-management-solutions,51-100,Active,http://xcelhires.com,info@xcelhires.com,+91 917 711 5519,,,,,,,,,"Administrative Services, Artificial Intelligence (AI), Software","Human Resources, Robotic Process Automation (RPA), Staffing Agency",,,,,,,,,,"Hyderabad, Andhra Pradesh, India",$1M to $10M,2010-01-01,year,,https://www.linkedin.com/company/xcel-hires/
Dongguan Lingxin Intelligent Technology Co.,https://www.crunchbase.com/organization/dongguan-lingxin-intelligent-technology-co,51-100,Active,https://www.cleverobot.com,andy@cleverobot.com,+86 137 98700447,,,,,,,,,"Artificial Intelligence (AI), Consumer Electronics, Hardware, Manufacturing, Real Estate, Science and Engineering, Software","Consumer Electronics, Electronics, Manufacturing, Robotic Process Automation (RPA), Robotics, Smart Home",,,,,,,,,,"Dongguan, Hebei, China",,2011-01-01,year,,https://www.linkedin.com/company/dongguan-lingxin-intelligent-technology-co-ltd
S.P. Engineers,https://www.crunchbase.com/organization/s-p-engineers-686a,51-100,Active,https://www.spengineerspune.com,sp_engineers@yahoo.co.in,+91 8956 321 653,,,,,,,,,"Artificial Intelligence (AI), Manufacturing, Software","Industrial, Industrial Manufacturing, Robotic Process Automation (RPA)",,,,,,,,,,"Pune, Maharashtra, India",$1M to $10M,2004-01-01,year,,https://www.linkedin.com/company/s-p-engineer-s
Normandia,https://www.crunchbase.com/organization/normandia,51-100,Active,https://www.normandia.ro,office@normandia.ro,+40 268 549 236,,,,,,,,,"Artificial Intelligence (AI), Commerce and Shopping, Hardware, Manufacturing, Science and Engineering, Software","Industrial Engineering, Manufacturing, Robotic Process Automation (RPA), Robotics, Wholesale",,,,,,,,,,"Brasov, Brasov, Romania",$10M to $50M,1992-01-01,year,,https://www.linkedin.com/company/normandia
Xtended IT Solutions,https://www.crunchbase.com/organization/xtended-it-solutions,101-250,Active,https://www.xtendedsol.com,info@xtendedsol.com,+91-9811132262,,,,,,,,,"Artificial Intelligence (AI), Data and Analytics, Information Technology, Internet Services, Science and Engineering, Software","Artificial Intelligence (AI), Chatbot, Cloud Data Services, Information Technology, Machine Learning, Robotic Process Automation (RPA)",,,,,,,,,,"New Delhi, Delhi, India",,2015-01-01,year,,https://www.linkedin.com/company/xtended-it-solutions-p-ltd/?originalSubdomain=in
Prime Robot,https://www.crunchbase.com/organization/prime-robot,51-100,Active,https://primerobot.com.br,,,,,,,,,,,"Artificial Intelligence (AI), Hardware, Manufacturing, Science and Engineering, Software","Industrial Automation, Robotic Process Automation (RPA), Robotics",,,,,,,,,,"Curitiba, Parana, Brazil",,,,,https://www.linkedin.com/company/prime-robot
Welink Technology Co.,https://www.crunchbase.com/organization/welink-technology-co,51-100,Active,https://we-link.tech,info@we-link.tech,+86 13328402520,,,,,,,,,"Artificial Intelligence (AI), Consumer Goods, Data and Analytics, Hardware, Science and Engineering, Software","Cleaning Products, Consumer Goods, Home Appliances, Intelligent Systems, Robotic Process Automation (RPA), Robotics",,,,,126848,USD,126848,,,"Dongguang, Guangdong, China",$1M to $10M,2014-01-01,year,,https://www.linkedin.com/company/lilin-international-group-limited
Tensei Philippines,https://www.crunchbase.com/organization/tensei-philippines,51-100,Active,https://www.tenseiph.com,info@tenseiph.com,+63 28634 9033,,,,,,,,,"Artificial Intelligence (AI), Internet Services, Real Estate, Software","Internet of Things, Robotic Process Automation (RPA), Smart Building",,,,,,,,,,"Makati, Manila, Philippines",$1M to $10M,2014-01-01,year,,https://www.linkedin.com/company/tensei-philippines-inc/
New Tokyo COM,https://www.crunchbase.com/organization/new-tokyo-com,51-100,Active,http://www.ntcom.co.jp/,haken_info@ntcom.co.jp,042-362-1211,,,,,,,,,"Administrative Services, Artificial Intelligence (AI), Professional Services, Software","Outsourcing, Recruiting, Robotic Process Automation (RPA), Staffing Agency",,,,,,,,,,"Fuchu, Tokyo, Japan",$1M to $10M,1974-09-01,day,,https://www.linkedin.com/company/%EF%BC%88%E6%A0%AA%EF%BC%89%E6%96%B0%E6%9D%B1%E4%BA%AC%E8%A8%88%E7%AE%97/
AlphaDatum,https://www.crunchbase.com/organization/alphadatum,51-100,Active,https://alpha-datum.com,info@alpha-datum.com,+1 551 574 4488,,,,,,,,,"Artificial Intelligence (AI), Data and Analytics, Software","Business Intelligence, Robotic Process Automation (RPA)",,,,,74535,USD,74535,,,"Newark, New Jersey, United States",,2000-01-01,year,,https://www.linkedin.com/company/alpha-datum
Enforce Technologies,https://www.crunchbase.com/organization/enforce-technologies,51-100,Active,https://enforcegs.com,info@enforcegs.com,+91 80 41512013,,,,,,,,,"Artificial Intelligence (AI), Information Technology, Software","Enterprise Resource Planning (ERP), Information Technology, Robotic Process Automation (RPA)",,,,,,,,,,"Bengaluru, Karnataka, India",,2014-01-01,year,,https://www.linkedin.com/company/enforce-technologies/
MAC Machine Tools and Automation,https://www.crunchbase.com/organization/mac-machine-tools-and-automation,51-100,Active,https://www.macindia.in,marcomm@macindia.in,+91 80 42038124,,,,,,,,,"Artificial Intelligence (AI), Data and Analytics, Manufacturing, Science and Engineering, Software","Artificial Intelligence (AI), Industrial Automation, Manufacturing, Robotic Process Automation (RPA)",,,,,,,,,,"Bengaluru, Karnataka, India",$1M to $10M,1991-01-01,year,,https://www.linkedin.com/company/mac-machine-tools-and-automation/
Vorttex,https://www.crunchbase.com/organization/vorttex,101-250,Active,https://vorttex.com.br,contato@vorttex.com.br,+55 11 2532 3449,,,,,,,,,"Artificial Intelligence (AI), Design, Professional Services, Sales and Marketing, Software","Consulting, Digital Signage, Robotic Process Automation (RPA), UX Design",,,,,,,,,,"São Paulo, Sao Paulo, Brazil",,2009-01-01,year,,https://www.linkedin.com/company/vorttex/
Enterprise Computing,https://www.crunchbase.com/organization/enterprise-computing,51-100,Active,https://entcomputing.com,devops@entcomputing.com,+233 50 604 5005,,,,,,,,,"Artificial Intelligence (AI), Data and Analytics, Information Technology, Software","Business Intelligence, Information Technology, Robotic Process Automation (RPA)",,,,,,,,,,"Accra, Greater Accra, Ghana",,2008-01-01,year,,https://www.linkedin.com/company/enterprise-computing-limited/
OpenMind Solutions,https://www.crunchbase.com/organization/openmind-solutions,51-100,Active,https://www.openmindsolutions.com,info@openmindsolutions.com,+1 732 447 5886,,,,,,,,,"Artificial Intelligence (AI), Blockchain and Cryptocurrency, Data and Analytics, Information Technology, Internet Services, Other, Science and Engineering, Software","Artificial Intelligence (AI), Blockchain, DevOps, Internet of Things, Robotic Process Automation (RPA)",,,,,57637,USD,57637,,,"Houston, Texas, United States",,,,,https://www.linkedin.com/company/openmind-solutions-llc/
RoboticaLabs,https://www.crunchbase.com/organization/roboticalabs,51-100,Active,https://roboticalabs.com,ia@roboticalaba.com,,,,,,,,,,"Artificial Intelligence (AI), Professional Services, Software","Business Process Automation (BPA), Consulting, Robotic Process Automation (RPA), Software",,,,,,,,,,"Delhi, Delhi, India",$1M to $10M,2020-01-01,year,,https://www.linkedin.com/company/roboticalabs
Shanghai FANUC Robot Co.,https://www.crunchbase.com/organization/shanghai-fanuc-robot-co,251-500,Active,https://www.shanghai-fanuc-robomachine.com.cn,,+86 400 820 0001,,,,,,,,,"Artificial Intelligence (AI), Commerce and Shopping, Hardware, Manufacturing, Science and Engineering, Software","Manufacturing, Robotic Process Automation (RPA), Robotics, Wholesale",,,,,,,,,,"Shanghai, Shanghai, China",$50M to $100M,1997-01-01,year,,https://www.linkedin.com/company/shanghai-fanuc-robotics-co.ltd
Dustor,https://www.crunchbase.com/organization/dustor,51-100,Active,https://dustor.com,support@dustor.com,+9122 5061 2700,,,,,,,,,"Artificial Intelligence (AI), Commerce and Shopping, Consumer Goods, Software","Cleaning Products, E-Commerce, Robotic Process Automation (RPA)",,,,,,,,,,"Kandivli, Maharashtra, India",,2020-01-01,year,,https://www.linkedin.com/company/dustor/
American Access Company,https://www.crunchbase.com/organization/american-access-company,251-500,Active,https://americanaccesscompany.com,customercareomaha@americafence.com,+1 402 896 6722,,,,,,,,,"Administrative Services, Artificial Intelligence (AI), Privacy and Security, Software","Physical Security, Robotic Process Automation (RPA), Security",,,,,,,,,,"Omaha, Nebraska, United States",$100M to $500M,1948-01-01,year,,https://www.linkedin.com/company/american-access-company
Vector Consulting,https://www.crunchbase.com/organization/vector-consulting,101-250,Active,https://www.vectorconsulting.com.br,comercial@vectorpg.com.br,55 11 3464 6300,,,,,,,,,"Artificial Intelligence (AI), Professional Services, Software, Transportation","Business Development, Management Consulting, Robotic Process Automation (RPA), Supply Chain Management",,,,,,,,,,"São Paulo, Sao Paulo, Brazil",,2003-01-01,year,,https://www.linkedin.com/company/vector-consulting-brasil
Zhengzhou KeHui Technology,https://www.crunchbase.com/organization/zhengzhou-kehui-technology,251-500,Active,https://www.zzkehui.com,info@zzkehui.com,+86 15633683072,,,,,,,,,"Artificial Intelligence (AI), Manufacturing, Science and Engineering, Software","Industrial Automation, Manufacturing, Robotic Process Automation (RPA)",,,,,,,,,,"Zhengzhou, Henan, China",$50M to $100M,1996-01-01,year,,https://www.linkedin.com/company/zhengzhou-kehui-technology-co-ltd/
Diverse Infotech,https://www.crunchbase.com/organization/diverse-infotech,101-250,Active,https://diverseinfotech.com/,sales@diverseinfotech.com,+91-124-405-2256,,,,,,,,,"Artificial Intelligence (AI), Data and Analytics, Information Technology, Internet Services, Mobile, Science and Engineering, Software","Artificial Intelligence (AI), Cloud Computing, Cloud Data Services, Cloud Management, Enterprise Resource Planning (ERP), Mobile, Robotic Process Automation (RPA), Software, Web Development",,,,,,,,,,"Haryana, Haryana, India",,2008-01-01,year,,https://www.linkedin.com/company/diverse-infotech-pvt-ltd-/
Quality Data,https://www.crunchbase.com/organization/quality-data,51-100,Active,https://qdata.com.co,info@qdata.com.co,+57 601 637 7060,,,,,,,,,"Artificial Intelligence (AI), Financial Services, Software","InsurTech, Robotic Process Automation (RPA), Software",,,,,,,,,,"Bogotá, Distrito Especial, Colombia",$1M to $10M,2002-01-01,year,,https://www.linkedin.com/company/quality-data-america
Delegateworks,https://www.crunchbase.com/organization/delegateworks,51-100,Active,https://www.delegateworks.com,,,,,,,,,,,"Artificial Intelligence (AI), Software","Enterprise Resource Planning (ERP), Robotic Process Automation (RPA), Software",,,,,,,,,,,$1M to $10M,2020-01-01,year,,https://www.linkedin.com/company/delegateworks
Technoprism,https://www.crunchbase.com/organization/technoprism-7817,101-250,Active,https://tecnoprism.com,info@tecnoprism.com,+91 063529 37566,,,,,,,,,"Artificial Intelligence (AI), Information Technology, Professional Services, Software","Consulting, Information Technology, Robotic Process Automation (RPA)",,,,,,,,,,"Vadodara, Gujarat, India",$1M to $10M,2021-01-01,year,,https://www.linkedin.com/company/tecnoprism
Hamasho,https://www.crunchbase.com/organization/hamasho,101-250,Active,https://www.hamashou.co.jp,,,,,,,,,,,"Artificial Intelligence (AI), Hardware, Manufacturing, Other, Science and Engineering, Software","Collaboration, Industrial Automation, Robotic Process Automation (RPA), Robotics",,,,,,,,,,"Osaka, Osaka, Japan",$1M to $10M,1963-07-01,day,,
DDI Technology,https://www.crunchbase.com/organization/ddi-technology-36de,51-100,Active,https://www.ddi-tech.com,,90 (212) 212 79 69,,,,,,,,,"Administrative Services, Artificial Intelligence (AI), Data and Analytics, Education, Information Technology, Other, Professional Services, Science and Engineering, Software","Artificial Intelligence (AI), Consulting, Outsourcing, Project Management, Robotic Process Automation (RPA), Technical Support, Training",,,,,,,,,,"Sariyer, Istanbul, Turkey",$10M to $50M,2003-01-01,year,,https://www.linkedin.com/company/ddi-teknoloji
Prima Integrasi Solusindo,https://www.crunchbase.com/organization/prima-integrasi-solusindo,51-100,Active,https://www.prima-solusindo.com,info@prima-solusindo.com,+ 62 21 5790 0880,,,,,,,,,"Apps, Artificial Intelligence (AI), Information Technology, Software","Apps, Business Process Automation (BPA), Information Technology, Robotic Process Automation (RPA)",,,,,,,,,,"Jakarta, Jakarta Raya, Indonesia",$1M to $10M,2006-01-01,year,,https://www.linkedin.com/company/pt-prima-integrasi-solusindo/
Metayb,https://www.crunchbase.com/organization/metayb,51-100,Active,http://www.metayb.ai,info@metayb.ai,+91 9361963901,,,,,,,,,"Artificial Intelligence (AI), Data and Analytics, Internet Services, Software","Analytics, Big Data, Internet of Things, Robotic Process Automation (RPA)",,,,,,,,,,"Chennai, Tamil Nadu, India",,2022-01-01,year,,http://www.linkedin.com/company/metayb
Orion Digital Solutions,https://www.crunchbase.com/organization/orion-digital-solutions,51-100,Active,https://www.orion360.com,info@orion360.com,+20 2 22909281,,,,,,,,,"Artificial Intelligence (AI), Data and Analytics, Information Technology, Professional Services, Science and Engineering, Software","Artificial Intelligence (AI), Consulting, Information Technology, Outsourcing, Robotic Process Automation (RPA)",,,,,,,,,,"Heliopolis, Al Qahirah, Egypt",$1M to $10M,2010-11-01,month,,https://www.linkedin.com/company/orion360
Robustmotion,https://www.crunchbase.com/organization/robustmotion,51-100,Active,http://www.rmaxis.com,overseas@rmaxis.com,133316309592,,,,,,,,,"Artificial Intelligence (AI), Hardware, Manufacturing, Science and Engineering, Software","Industrial Automation, Robotic Process Automation (RPA), Robotics",,,,,,,,,,"Foshan, Guangdong, China",,2018-05-16,day,,
Majestic IT,https://www.crunchbase.com/organization/majestic-it,51-100,Active,https://www.mitservicesinc.com,info@mitservicesinc.com,+1 561 258 9667,,,,,,,,,"Artificial Intelligence (AI), Information Technology, Professional Services, Software","Enterprise Resource Planning (ERP), Information Technology, Management Consulting, Quality Assurance, Robotic Process Automation (RPA), Software",,,,,,,,,,"Deerfield Beach, Florida, United States",$1M to $10M,2000-01-01,year,,https://www.linkedin.com/company/majesticit
4activeSystems,https://www.crunchbase.com/organization/4activesystems,51-100,Active,https://www.4activesystems.at,office@4a.at,+43 3842 45 106 600,,,,,,,,,"Apps, Artificial Intelligence (AI), Data and Analytics, Software","Apps, Robotic Process Automation (RPA), Test and Measurement",,,,,,,,,,"Traboch, Steiermark, Austria",$1M to $10M,2006-01-01,year,,https://www.linkedin.com/company/4activesystems
LQpay,https://www.crunchbase.com/organization/lqpay,51-100,Active,http://www.lqpay.ai,contact@lqpay.ai,+1 877 572 6682,,,,,,,,,"Artificial Intelligence (AI), Financial Services, Payments, Software","Financial Services, Payments, Robotic Process Automation (RPA), Software",,,,,,,,,,"Fort Lauderdale, Florida, United States",$1M to $10M,,,,https://www.linkedin.com/company/lqpay
BrainyMed,https://www.crunchbase.com/organization/brainymed,51-100,Active,https://brainymed.com,admin@brainymed.com,1-682-344-0264,,,,,,,,,"Artificial Intelligence (AI), Data and Analytics, Science and Engineering, Software","Artificial Intelligence (AI), Robotic Process Automation (RPA), Software",,,,,,,,,,"Odessa, Texas, United States",,2015-01-01,year,,https://www.linkedin.com/company/brainymed
Tria Software,https://www.crunchbase.com/organization/tria-software,51-100,Active,https://triasoftware.com.br,contato@triasoftware.com.br,+55 12 3206 0470,,,,,,,,,"Apps, Artificial Intelligence (AI), Software","Apps, Robotic Process Automation (RPA), Software",,,,,,,,,,"São José Dos Campos, Sao Paulo, Brazil",$1M to $10M,2018-01-01,year,,http://www.linkedin.com/company/triasoftware
Cornell Cup Robotics,https://www.crunchbase.com/organization/cornell-cup-robotics,101-250,Active,https://cornellcuprobotics.com,ccrt@cornell.edu,,,,,,,,,,"Artificial Intelligence (AI), Hardware, Manufacturing, Science and Engineering, Software","Embedded Systems, Manufacturing, Robotic Process Automation (RPA), Robotics",,,,,,,,,,"Ithaca, New York, United States",$10M to $50M,,,,https://www.linkedin.com/company/cornell-cup-robotics/
