Niu Fibra,https://www.crunchbase.com/organization/niu-fibra,101-250,Active,https://siteniu.niufibra.com.br,support@niufibra.com.br,+55 13 4009 9070,,,,,,,,,"Hardware, Internet Services","Internet, Satellite Communication, Telecommunications",,,,,,,,,,"Guarujá, Sao Paulo, Brazil",$1M to $10M,2016-01-01,year,,https://www.linkedin.com/company/niufibra
Calian Advanced Technologies,https://www.crunchbase.com/organization/sed-systems,251-500,Active,http://www.sedsystems.ca/,marketing@sedsystems.ca,1-306-931-3425,,,,,,,,,"Administrative Services, Consumer Electronics, Data and Analytics, Design, Hardware, Information Technology, Internet Services, Manufacturing, Media and Entertainment, Other, Science and Engineering, Video","Aerospace, Broadcasting, Computer, Electronics, Information Technology, Internet of Things, Manufacturing, Product Design, Project Management, Satellite Communication, Telecommunications, Test and Measurement",3,1,Electric Communication Technique,Scientific and electric apparatus and instruments,2981322,USD,2981322,,,"Saskatoon, Saskatchewan, Canada",$10M to $50M,1965-01-01,year,,https://www.linkedin.com/company/sed-systems/
Quicklink Communications,https://www.crunchbase.com/organization/quicklink-communications,51-100,Active,https://quicklinktele.com,info@quicklinktele.com,+1 949 818 2419,,,,,,,,,"Hardware, Information Technology, Internet Services, Privacy and Security","Cyber Security, Information Technology, Internet of Things, Satellite Communication, Telecommunications",,,,,,,,,,"Irvine, California, United States",$1M to $10M,1995-01-01,year,,https://www.linkedin.com/company/quicklink-llc
Tera Probe,https://www.crunchbase.com/organization/tera-probe,101-250,Active,http://www.teraprobe.com/,,,,,,,,,,,"Hardware, Navigation and Mapping","GPS, Optical Communication, Satellite Communication",3,12,Basic Electric Elements,Scientific and electric apparatus and instruments,,,,,,"Yokohama, Kanagawa, Japan",,2005-08-01,day,,https://www.linkedin.com/company/tera-probe-inc-6627-
Telespazio France,https://www.crunchbase.com/organization/telespazio-france,251-500,Active,https://www.telespazio.fr/,,+33 0 5 34 35 65 75,,,,,,,,,"Hardware, Science and Engineering","Aerospace, Satellite Communication, Telecommunications",0,2,,Telecommunications,,,,,,"Toulouse, Midi-Pyrenees, France",$100M to $500M,1991-01-01,year,,https://www.linkedin.com/company/telespazio-france/
Kwajalein Range Services,https://www.crunchbase.com/organization/kwajalein-range-services,1001-5000,Active,https://www.krsjv.com,pxempver@bechtel.com,+1 865 220 2000,,,,,,,,,"Hardware, Professional Services, Science and Engineering","Consulting, Marine Technology, Satellite Communication",,,,,6080592,USD,6080592,,,"Oak Ridge, Tennessee, United States",$100M to $500M,2002-01-01,year,,https://www.linkedin.com/company/krs-kwajalein-range-services-llc
Teltac Worldwide,https://www.crunchbase.com/organization/teltac-worldwide,51-100,Active,https://www.teltacworldwide.com,info@teltacworldwide.com,+961 1 787 332,,,,,,,,,"Hardware, Internet Services","Internet, Satellite Communication, Telecommunications",,,,,,,,,,"Beirut, Beyrouth, Lebanon",$10M to $50M,1994-01-01,year,,https://www.linkedin.com/company/teltac-world-wide
JSAT International,https://www.crunchbase.com/organization/jsat-international,51-100,Active,https://www.jsati.com/,,1 (202) 379-4400,,,,,,,,,"Hardware, Mobile","Communications Infrastructure, Mobile, Satellite Communication",,,,,213013,USD,213013,,,"Washington, District of Columbia, United States",,,,,https://www.linkedin.com/company/jsat-international-inc./about/
YesTrak,https://www.crunchbase.com/organization/yestrak,101-250,Active,https://yestrak.com/,support@yestrak.com,+1-800-620-5877,,,,,,,,,"Hardware, Information Technology, Internet Services, Software","Communications Infrastructure, Information Services, Internet, Satellite Communication, Software",,,,,1222821,USD,1222821,,,"Henderson, Nevada, United States",$10M to $50M,2013-01-01,year,,https://www.linkedin.com/company/yestrak/
Astyx Communication & Sensors,https://www.crunchbase.com/organization/astyx-communication-sensors,51-100,Active,http://www.astyx.net,info@astyx.de,+498960723685,,,,,,,,,"Hardware, Science and Engineering","Aerospace, Satellite Communication",,,,,,,,,,"Ottobrunn, Bayern, Germany",Less than $1M,1997-01-01,year,ZF Group,
GlobalSat,https://www.crunchbase.com/organization/globalsat,51-100,Active,https://web.globalsat.mx,ventas@globalsat.com.mx,+52 800 026 4728,,,,,,,,,"Hardware, Internet Services","Internet, Satellite Communication, Telecommunications",,,,,,,,,,"Tijuana, Baja California, Mexico",$10M to $50M,,,,https://www.linkedin.com/company/globalsat
Mobell Communications,https://www.crunchbase.com/organization/mobell-communications,101-250,Active,https://www.mobell.co.uk,ukinfo@mobell.co.uk,+44-1543426999,,,,,,,,,"Hardware, Mobile","Satellite Communication, Telecommunications, Wireless",,,,,1371705,USD,1371705,,,"Stafford, Staffordshire, United Kingdom",$1M to $10M,1989-01-01,year,,https://www.linkedin.com/company/mobell-communications-ltd/
World Link Communications,https://www.crunchbase.com/organization/world-link-communications,51-100,Active,https://wlnet.com/,,,,,,,,,,,Hardware,"Satellite Communication, Telecommunications",,,,,548096,USD,548096,,,"Framingham, Massachusetts, United States",$1M to $10M,1989-01-01,day,,https://www.linkedin.com/company/world-link-communications-inc-
Spectrum Communications,https://www.crunchbase.com/organization/spectrum-communications,101-250,Active,https://www.spectrum-communications.ca,,,,,,,,,,,"Hardware, Mobile","Satellite Communication, Telecommunications, Wireless",,,,,,,,,,"London, Ontario, Canada",,1979-01-01,day,,https://www.linkedin.com/company/spectrum-communications-ltd
Hisdesat Servicios Estrategicos,https://www.crunchbase.com/organization/hisdesat-servicios-estrategicos,51-100,Active,https://www.hisdesat.es,hisdesat@hisdesat.es,+34 91 449 01 49,,,,,,,,,"Hardware, Mobile","Satellite Communication, Telecommunications, Wireless",0,7,,Telecommunications,449004,USD,449004,,,"Madrid, Madrid, Spain",$1M to $10M,2001-01-01,year,,https://www.linkedin.com/company/hisdesat-servicios-estrategicos-s.a.
Hughes Telecomunicações do Brasil,https://www.crunchbase.com/organization/hughes-telecomunicações-do-brasil,101-250,Active,https://www.hughes.com.br/,LGPD@hughes.com.br,,,,,,,,,,"Hardware, Information Technology","Information Technology, Satellite Communication, Telecommunications",,,,,,,,,,"São Paulo, Sao Paulo, Brazil",,1968-01-01,year,,https://www.linkedin.com/company/hughes-do-brasil
Broadpoint,https://www.crunchbase.com/organization/broadpoint,51-100,Active,http://www.broadpointinc.com,customercare@broadpointinc.com,281-501-4700,,,,,,,,,"Hardware, Internet Services","Satellite Communication, Web Hosting",,,,,,,,,,"Webster, Texas, United States",$50M to $100M,1986-01-01,year,,https://www.linkedin.com/company/broadpoint
Data Terra,https://www.crunchbase.com/organization/data-terra,51-100,Active,https://www.data-terra.org,communication@data-terra.org,,,,,,,,,,"Hardware, Other","Infrastructure, Satellite Communication",,,,,,,,,,"Montpellier, Languedoc-Roussillon, France",$1M to $10M,,,,https://www.linkedin.com/company/dataterraorg
Jiangsu Broadcasting Cable Information Network,https://www.crunchbase.com/organization/jiangsu-broadcasting-cable-information-network,10001+,Active,http://www.jscnnet.com,JSCN@jscnnet.com,86-25-8318-7799,,,,,,,,,"Hardware, Media and Entertainment","Media and Entertainment, Satellite Communication",,,,,,,,,,"Nanjing, Jiangsu, China",,2008-07-10,day,,https://www.linkedin.com/company/江苏有线公司
China Academy of Space Technology,https://www.crunchbase.com/organization/china-academy-of-space-technology,10001+,Active,https://www.cast.cn,,+86 010 68746780,,,,,,,,,"Hardware, Manufacturing, Science and Engineering","Aerospace, Manufacturing, Satellite Communication",9,0,Electric Communication Technique,,,,,,,"Haidian, Beijing, China",$1M to $10M,1968-02-20,day,,https://www.linkedin.com/company/china-academy-of-space-technology/
Family Entertainment Television,https://www.crunchbase.com/organization/family-entertainment-television,51-100,Active,https://fetv.tv,info@fetv.tv,+1 574 291 8200,,,,,,,,,"Hardware, Media and Entertainment, Video","Broadcasting, Satellite Communication, TV Production",0,1,,Telecommunications,,,,,,"South Bend, Indiana, United States",,,,,https://www.linkedin.com/company/fetv
Michigan Tech Aerospace,https://www.crunchbase.com/organization/michigan-tech-aerospace,51-100,Active,http://aerospace.mtu.edu,aerospace@mtu.edu,,,,,,,,,,"Education, Hardware, Manufacturing","Education, Manufacturing, Satellite Communication",,,,,,,,,,"Houghton, Michigan, United States",,1885-01-01,year,,https://www.linkedin.com/school/aerospace-enterprise/
MCBS,https://www.crunchbase.com/organization/mcbs-f4d8,51-100,Active,https://www.mcbsintl.com/,info@mcbsintl.com,+91 79 2328 7369,,,,,,,,,"Consumer Electronics, Design, Hardware, Manufacturing, Science and Engineering","Aerospace, Electronics, Manufacturing, Product Design, Satellite Communication",,,,,,,,,,"Gandhinagar, Gujarat, India",$10M to $50M,1985-01-01,year,,https://www.linkedin.com/company/mcbs-pvt.-ltd./
TiSPACE,https://www.crunchbase.com/organization/tispace,51-100,Active,http://www.tispace.com,info@tispace.com,+886 37 586617 9,,,,,,,,,"Hardware, Manufacturing, Science and Engineering, Transportation","Manufacturing, Nanotechnology, Satellite Communication, Space Travel",,,,,,,,,,"Miaoli, T'ai-wan, Taiwan",$1M to $10M,2016-01-01,month,,https://www.linkedin.com/company/tispace
Satellites Unlimited,https://www.crunchbase.com/organization/satellites-unlimited,501-1000,Active,http://www.suidish.com/,,,,,,,,,,,"Hardware, Other, Professional Services","Consumer, Field Support, Satellite Communication",,,,,9961809,USD,9961809,,,"Birmingham, Alabama, United States",$10M to $50M,1994-01-01,day,,https://www.linkedin.com/company/satellites-unlimited-llc
ASC Signal,https://www.crunchbase.com/organization/asc-signal,51-100,Active,http://ascsignal.com/,,9056688590,,,,,,,,,"Government and Military, Hardware, Manufacturing, Media and Entertainment, Video","Broadcasting, Government, Manufacturing, Satellite Communication",4,2,Basic Electric Elements,Scientific and electric apparatus and instruments,1851492,USD,1851492,,,"Plano, Texas, United States",,2007-01-01,year,Resilience Capital Partners,https://www.linkedin.com/company/asc-signal-corporation
CESBIO,https://www.crunchbase.com/organization/cesbio,51-100,Active,https://www.cesbio.cnrs.fr,,33 5 61 55 85 01,,,,,,,,,"Data and Analytics, Hardware, Navigation and Mapping","Geospatial, Satellite Communication, Sensor",,,,,,,,,,"Toulouse, Midi-Pyrenees, France",,2001-01-01,year,,https://www.linkedin.com/company/cesbio
Airtel-Vodafone,https://www.crunchbase.com/organization/airtel-vodafone,101-250,Active,https://airtel-vodafone.com,121@airtel-vodafone.com,+44(0)1534 520121,,,,,,,,,Hardware,"Satellite Communication, Telecommunications",,,,,,,,,,"St. Peter Port, NA - Guernsey, Guernsey",,2007-06-01,month,,https://www.linkedin.com/company/airtel-vodafone_2
Ukrkosmos State Enterprise,https://www.crunchbase.com/organization/ukrkosmos-state-enterprise,51-100,Closed,http://www.ukrkosmos.kiev.ua,info@ukrkosmos.kiev.ua,380-44-5995872,,,,,,,,,"Hardware, Media and Entertainment, Video","Broadcasting, Satellite Communication, Telecommunications",,,,,,,,,,"Kyiv, Kyyiv, Ukraine",,1996-01-01,day,,https://www.linkedin.com/company/se-ukrkosmos/
Microcom Communications,https://www.crunchbase.com/organization/microcom-communications,51-100,Active,https://microcom.tv,,,,,,,,,,,"Hardware, Internet Services","Internet, Satellite Communication, Telecommunications",,,,,102589,USD,102589,,,"Anchorage, Alaska, United States",$10M to $50M,1984-01-01,year,,https://www.linkedin.com/company/microcom-communications/
GMV NSL,https://www.crunchbase.com/organization/gmv-nsl,51-100,Active,https://gmvnsl.com/,enquiries@gmvnsl.com,+44 (0)115 7486800,,,,,,,,,"Data and Analytics, Hardware, Internet Services, Navigation and Mapping","Location Based Services, Mapping Services, Navigation, Satellite Communication",3,0,Testing,,490981,USD,490981,,,"Nottingham, Nottingham, United Kingdom",,1998-01-01,year,,https://www.linkedin.com/company/gmvnsl/
Viasat Internet,https://www.crunchbase.com/organization/viasat-internet,51-100,Active,https://www.rsinc.com,info@rsinc.com,+1 877 697 2926,,,,,,,,,"Hardware, Internet Services, Media and Entertainment, Video","Broadcasting, Internet, Satellite Communication",,,,,2039348,USD,2039348,,,"Boulder, Colorado, United States",$10M to $50M,1986-05-01,month,,https://www.linkedin.com/company/information-television-network
Neta Technologies,https://www.crunchbase.com/organization/neta-technologies,51-100,Active,https://www.neta.com.tr,info@neta.com.tr,+61 7 4955 5879,,,,,,,,,Hardware,"Satellite Communication, Telecommunications",,,,,,,,,,"Istanbul, Istanbul, Turkey",$10M to $50M,1987-01-01,year,,https://www.linkedin.com/company/neta-elektronik-as/
Independence-X Aerospace,https://www.crunchbase.com/organization/independence-x-aerospace,251-500,Active,http://www.independence-x.com/,izmir.yamin@independence-x.com,+6 01 2651 7438,,,,,,,,,"Hardware, Manufacturing, Science and Engineering","Aerospace, Industrial Manufacturing, Satellite Communication",,,,,,,,,,"Seremban, Negeri Sembilan, Malaysia",$10M to $50M,2013-01-01,year,,https://www.linkedin.com/company/independence-xaerospace/
F1 Services & Solutions,https://www.crunchbase.com/organization/f1-services-solutions,101-250,Active,https://f1.services,contacto@f1services.cl,+56 2 2724 6905,,,,,,,,,"Hardware, Mobile","Communications Infrastructure, Mobile, Network Hardware, Satellite Communication, Telecommunications",,,,,,,,,,"La Florida, Maule, Chile",,2013-01-01,year,,https://www.linkedin.com/company/f1services
PA Group,https://www.crunchbase.com/organization/pa-group,51-100,Active,,,,1,1,1,,,,,,Hardware,Satellite Communication,,,,,,,,,,"London, England, United Kingdom",,,,,
Casablanca Online,https://www.crunchbase.com/organization/casablanca-online-cccc,51-100,Active,https://www.casablancaonline.com.br,info@casablancaonline.com.br,+55 11 3889 2696,,,,,,,,,"Events, Hardware, Media and Entertainment, Video","Broadcasting, Events, Satellite Communication",,,,,,,,,,"São Paulo, Sao Paulo, Brazil",$10M to $50M,1996-01-01,year,,https://www.linkedin.com/company/casablanca-online
GUOZHIHENG GROUP,https://www.crunchbase.com/organization/guozhiheng-group,251-500,Active,http://gzhpower.com,,010-82800699,,,,,,,,,"Hardware, Information Technology, Navigation and Mapping","Information Technology, Navigation, Satellite Communication",,,,,,,,,,"Haidian, Beijing, China",,2005-08-12,day,"ZGC Group, Bright Stone, Jiahe Tools, Xinjiang Daguoxin Guquan Touzi, Beijing Enxiang Wangluo Gongcheng Youxian Gongsi",
APT Mobile Satcom,https://www.crunchbase.com/organization/apt-mobile-satcom-limited,51-100,Active,https://www.apsat.com,info@apsat.com,+86 400 8389900,,,,,,,,,"Hardware, Internet Services","Internet, Satellite Communication, Telecommunications",,,,,,,,,,"Shenzhen, Guangdong, China",,2016-07-13,day,,https://www.linkedin.com/company/apsatcom
Auto Traslados sin Rodar,https://www.crunchbase.com/organization/auto-traslados-sin-rodar,101-250,Active,http://www.atrsadecv.com.mx,contacto@atrsadecv.com.mx,01 800 639 5483,,,,,,,,,"Hardware, Navigation and Mapping, Transportation","GPS, Logistics, Satellite Communication, Transportation",,,,,,,,,,"Puebla, Puebla, Mexico",$1M to $10M,1991-01-01,year,,https://www.linkedin.com/company/auto-traslados-sin-rodar/
Master,https://www.crunchbase.com/organization/master-9698,51-100,Active,https://www.masterservices.com.br,contato@masterservices.com.br,+55 11 3461 2660,,,,,,,,,"Hardware, Internet Services","Internet, Satellite Communication, Telecommunications",,,,,,,,,,"Barueri, Sao Paulo, Brazil",$1M to $10M,2011-01-01,year,,https://www.linkedin.com/company/master-servi%C3%A7os
Azam TV,https://www.crunchbase.com/organization/azam-tv,501-1000,Active,https://azamtv.co.tz/,info@azam-media.com,+255 076-470-0222,,,,,,,,,"Hardware, Media and Entertainment, Video","Broadcasting, Media and Entertainment, Satellite Communication, TV",,,,,,,,,,"Dar Es Salaam, Dar es Salaam, Tanzania",$1M to $10M,2013-01-01,year,,https://www.linkedin.com/company/azam-media-ltd
Hostmost Group,https://www.crunchbase.com/organization/hostmost-group,101-250,Active,https://www.hostmostgroup.com,globalservice@hostmostgroup.com,+852 2554 9207,,,,,,,,,"Consumer Electronics, Hardware, Navigation and Mapping","Electronics, Navigation, Satellite Communication",,,,,,,,,,"Hong Kong, Hong Kong Island, Hong Kong",,1989-01-01,year,,https://www.linkedin.com/company/hostmost-group
Telespazio VEGA Deutschland,https://www.crunchbase.com/organization/telespazio-3e95,251-500,Active,https://www.telespazio-vega.de/,info@telespazio-vega.de,49-6151-82570,,,,,,,,,"Hardware, Science and Engineering, Software","Aerospace, Satellite Communication, Simulation",,,,,4034658,USD,4034658,,,"Darmstadt, Hessen, Germany",$10M to $50M,1978-01-01,year,,https://www.linkedin.com/company/telespazio-vega-deutschland-gmbh/
MyanTel Holdings Ltd.,https://www.crunchbase.com/organization/myantel-holdings-ltd,101-250,Active,http://myantel.org/,info@myantel.org,+959258699011,,,,,,,,,Hardware,Satellite Communication,,,,,,,,,,"Yangon, Yangon, Myanmar",,2014-01-01,year,,https://www.linkedin.com/company/myantel-holdings-pte.-ltd.
Asianet Broadband,https://www.crunchbase.com/organization/asianet-broadband,101-250,Active,https://asianetbroadband.in/,helpdesk@asianetbroadband.in,90720 90721,,,,,,,,,"Hardware, Information Technology, Media and Entertainment, Privacy and Security, Video","Broadcasting, Network Security, Satellite Communication, Telecommunications",,,,,,,,,,"Klingnau, Aargau, Switzerland",$10M to $50M,1993-01-01,year,,https://www.linkedin.com/company/asianet-broadband---india
Global Track,https://www.crunchbase.com/organization/global-track,101-250,Active,https://www.globaltrack.com.mx,,+52 1 81 1572 0935,,,,,,,,,"Hardware, Navigation and Mapping, Privacy and Security, Transportation","GPS, Satellite Communication, Security, Transportation",,,,,,,,,,"Monterrey, Nuevo Leon, Mexico",$10M to $50M,,,,https://www.linkedin.com/company/global-track-mx
Bentley Walker,https://www.crunchbase.com/organization/bentley-walker-2161,101-250,Active,https://bentley-walker.com,sales@bentleywalker.com,+44 23 9231 1103,,,,,,,,,"Hardware, Internet Services","Internet, Satellite Communication, Telecommunications",,,,,,,,,,"Hayling, Hampshire, United Kingdom",$10M to $50M,1946-01-01,year,,https://www.linkedin.com/company/bentleywalker/
Redu Space Services,https://www.crunchbase.com/organization/redu-space-services,51-100,Active,http://www.reduspaceservices.com/,info@reduspaceservices.com,+32 61 22 95 18,,,,,,,,,"Hardware, Manufacturing","Industrial Manufacturing, Manufacturing, Satellite Communication",,,,,101541,USD,101541,,,"Transinne, Luxembourg, Belgium",$10M to $50M,2007-01-01,year,,https://www.linkedin.com/company/reduspaceservices/
Digisat,https://www.crunchbase.com/organization/digisat-5de3,51-100,Active,https://digisat.in,krish@digisat.in,919822788197,,,,,,,,,"Hardware, Information Technology","IT Infrastructure, Satellite Communication, Telecommunications",,,,,,,,,,"Pune, Maharashtra, India",,2000-01-01,year,,https://www.linkedin.com/company/digisat-skill-india18832525
Space Connect,https://www.crunchbase.com/organization/space-connect-b3a2,51-100,Active,https://www.spaceconnectonline.com.au,info@spaceconnectonline.com.au,,,,,,,,,,"Hardware, Information Technology, Science and Engineering","Aerospace, Information Services, Satellite Communication",,,,,,,,,,"North Sydney, New South Wales, Australia",,2018-01-01,year,,https://www.linkedin.com/company/spaceconnecthq/
Star Track,https://www.crunchbase.com/organization/star-track-0856,51-100,Active,https://startrackworld.com,,+971 42246723,,,,,,,,,"Consumer Electronics, Consumer Goods, Hardware, Media and Entertainment, Video","Consumer Electronics, Home Appliances, Satellite Communication, TV",,,,,,,,,,"Dubai, Dubai, United Arab Emirates",$50M to $100M,1995-01-01,year,,https://www.linkedin.com/company/star-track
Transat Rastreamentos,https://www.crunchbase.com/organization/transat-rastreamentos,251-500,Active,https://www.transat.com.br,sac@transat.com.br,+55 11 94023 8966,,,,,,,,,"Hardware, Other, Privacy and Security, Professional Services, Transportation","Customer Service, Fleet Management, Satellite Communication, Security",,,,,,,,,,"Brasil, Sao Paulo, Brazil",$50M to $100M,2009-01-01,year,,https://www.linkedin.com/company/transat-rastreamentos
GPSdata,https://www.crunchbase.com/organization/gpsdata-935a,501-1000,Active,https://www.gpsdata.mx,info@gpsdata.mx,+52 81 82775061,,,,,,,,,"Hardware, Navigation and Mapping, Transportation","Fleet Management, GPS, Satellite Communication, Telecommunications",,,,,,,,,,"Monterrey, Nuevo Leon, Mexico",$1M to $10M,2010-01-01,year,,https://www.linkedin.com/company/gpsdata
Fidonet,https://www.crunchbase.com/organization/fidonet-309a,1001-5000,Active,https://www.fidonet.org/index.html,,,,,,,,,,,"Consumer Electronics, Hardware","Computer, Satellite Communication, Telecommunications",,,,,13736250,USD,13736250,,,"Eugene, Oregon, United States",$50M to $100M,1984-01-01,month,,https://www.linkedin.com/company/fidonet/
Alaska Satellite Facility,https://www.crunchbase.com/organization/alaska-satellite-facility,51-100,Active,https://asf.alaska.edu,uso@asf.alaska.edu,907 474-5041,,,,,,,,,"Hardware, Information Technology","Data Center, Remote Sensing, Satellite Communication, Sensor",,,,,,,,,,"Fairbanks, Alaska, United States",,1987-01-01,year,,https://www.linkedin.com/company/aksatellite
MTI Teleport Munich,https://www.crunchbase.com/organization/mti-teleport-munich,51-100,Active,https://mti-teleport.de,,+49 8192 933 417,,,,,,,,,"Hardware, Media and Entertainment, Video","Broadcasting, Satellite Communication, Telecommunications",,,,,624436,USD,624436,,,"Unterföhring, Bayern, Germany",$1M to $10M,,,,https://www.linkedin.com/company/mti-teleport-m%C3%BCnchen-gmbh/
Qixing Communication,https://www.crunchbase.com/organization/qixing-communication,51-100,Active,http://www.7sate.com/,michael.rc.yang@7sate.com,010-52900304,,,,,,,,,"Hardware, Information Technology, Internet Services, Manufacturing, Messaging and Telecommunications","Manufacturing, Satellite Communication, Unified Communications",,,,,,,,,,"Wuhu, Anhui, China",,2022-09-01,day,Amphora Capital,
Nearshore,https://www.crunchbase.com/organization/nearshore,51-100,Active,https://www.nearshorenetworks.com,comms@nearshorenetworks.com,+1 844 526 2627,,,,,,,,,"Hardware, Transportation","Marine Transportation, Satellite Communication, Telecommunications",,,,,461229,USD,461229,,,"Houston, Texas, United States",,2016-01-01,year,,https://www.linkedin.com/company/nearshorenetworks
Canal Digitaal,https://www.crunchbase.com/organization/canal-digitaal,251-500,Active,https://www.canaldigitaal.nl,,088-003 8555,,,,,,,,,"Hardware, Media and Entertainment, Video","Broadcasting, Digital Media, Media and Entertainment, Satellite Communication, TV",,,,,,,,,,"Luxembourg, Luxembourg, Luxembourg",,1996-01-01,year,,https://www.linkedin.com/company/canaldigitaal/?originalSubdomain=nl
Pivotel,https://www.crunchbase.com/organization/pivotel,51-100,Active,https://www.pivotel.com,support@pivotel.com,+1 954 763 8650,,,,,,,,,"Commerce and Shopping, Hardware","Satellite Communication, Shopping, Telecommunications",,,,,121745,USD,121745,,,"Hollywood, Florida, United States",$10M to $50M,2000-01-01,year,,https://www.linkedin.com/company/pivotelamerica/
Tech Solutions International,https://www.crunchbase.com/organization/tech-solutions-international,51-100,Active,https://techsolint.in,info@techsolint.in,+911122146797,,,,,,,,,"Consumer Electronics, Government and Military, Hardware, Information Technology, Privacy and Security, Science and Engineering","Aerospace, Electronics, Government, Law Enforcement, Military, Public Safety, Satellite Communication",,,,,,,,,,"Delhi, Delhi, India",,2015-01-17,day,,https://www.linkedin.com/company/tech-solutions-international
Teledifusao de Macau,https://www.crunchbase.com/organization/teledifusao-de-macau,501-1000,Active,https://www.tdm.com.mo,enquiry@tdm.com.mo,+86 28517758,,,,,,,,,"Hardware, Media and Entertainment, Video","Broadcasting, Media and Entertainment, Satellite Communication, TV",,,,,,,,,,"Macao, Anhui, China",$50M to $100M,1984-01-01,year,,https://www.linkedin.com/company/tdmmacau
Benish GPS,https://www.crunchbase.com/organization/benish-gps,101-250,Active,https://www.benishgps.com/en,office@benishgps.com,+380 44 49 44 999,,,,,,,,,"Hardware, Navigation and Mapping, Privacy and Security, Transportation","Automotive, GPS, Satellite Communication, Security",,,,,,,,,,"Kyiv, Kyyiv, Ukraine",$1M to $10M,2003-01-01,year,,https://www.linkedin.com/company/benish-gps/
NetGo Group,https://www.crunchbase.com/organization/netgo-group,251-500,Active,https://www.netgogroup.com,info@netgogroup.com,+504-2239-0053,,,,,,,,,"Hardware, Navigation and Mapping","GPS, Satellite Communication, Telecommunications",,,,,,,,,,"Tegucigalpa, Francisco Morazan, Honduras",$1M to $10M,2011-01-01,year,,https://www.linkedin.com/company/netgogroup
Sat Finder,https://www.crunchbase.com/organization/sat-finder,51-100,Active,https://sat-finder.com,info@ojocloud.com,+971 564293000,,,,,,,,,"Apps, Hardware, Information Technology, Software, Transportation","Apps, Fleet Management, Information Technology, Satellite Communication, Software",,,,,,,,,,"Dubai, Dubai, United Arab Emirates",$1M to $10M,2009-01-01,year,,https://www.linkedin.com/company/satfinder/
