Alkan CIT,https://www.crunchbase.com/organization/alkan-cit,501-1000,Active,http://www.alkancit.com/,info@alkancit.com,+202 2516 9722,,,,,,,,,"Hardware, Manufacturing, Media and Entertainment, Mobile, Real Estate, Science and Engineering, Video","Construction, Industrial Automation, Industrial Engineering, Satellite Communication, Telecommunications, Video, Wireless",,,,,,,,,,"Cairo, Al Qahirah, Egypt",$100M to $500M,1996-01-01,year,,https://www.linkedin.com/company/alkan-cit/
Tesacom,https://www.crunchbase.com/organization/tesacom,101-250,Active,https://www.tesacom.net/,info@tesacom.net,+54 11 4114 2200,,,,,,,,,"Hardware, Internet Services, Mobile, Software","Internet, Mobile, Satellite Communication, Software, Telecommunications",,,,,,,,,,"Buenos Aires, Distrito Federal, Argentina",$10M to $50M,1996-01-01,year,,https://www.linkedin.com/company/grupotesacom/
SAT Corp,https://www.crunchbase.com/organization/sat-corp,251-500,Active,http://www.sat.com,,4085301030,,,,,,,,,"Hardware, Science and Engineering","Aerospace, Satellite Communication",,,,,196598,USD,196598,,,"Sunnyvale, California, United States",$10M to $50M,1990-01-01,year,,https://www.linkedin.com/company/sat-corporation/about/
Ice Group,https://www.crunchbase.com/organization/ice-group-a1f4,251-500,Active,https://icegroup.com/,info@icegroup.com,,,,,,,,,,"Community and Lifestyle, Hardware, Professional Services","Professional Networking, Satellite Communication, Telecommunications",,,,,,,,,,"Oslo, Oslo, Norway",,2008-01-01,year,,https://www.linkedin.com/company/ice-group-as/?originalSubdomain=no
SatixFy Space Systems,https://www.crunchbase.com/organization/satixfy-space-systems,101-250,Active,http://wwww.satixfy.com,,,,,,,,,,,"Hardware, Science and Engineering","Network Hardware, Satellite Communication, Semiconductor",,,,,,,,,,"Manchester, Manchester, United Kingdom",$1M to $10M,2018-01-01,year,,https://www.linkedin.com/company/satixfy-space-systems
National Radio Astronomy Observatory,https://www.crunchbase.com/organization/national-radio-astronomy-observatory,251-500,Active,http://www.nrao.edu/,,(434) 296-0222,,,,,,,,,"Community and Lifestyle, Education, Hardware, Information Technology","Communities, Education, Information Technology, Satellite Communication",,,,,10708380,USD,10708380,,,"Charlottesville, Virginia, United States",$100M to $500M,1956-01-01,year,,https://www.linkedin.com/company/national-radio-astronomy-observatory
italk,https://www.crunchbase.com/organization/italk-5fe0,51-100,Active,https://www.italktelecom.co.uk,info@italktelecom.co.uk,+44 0330 1914 962,,,,,,,,,"Commerce and Shopping, Hardware, Messaging and Telecommunications","Rental, Satellite Communication, Telecommunications, Wired Telecommunications",,,,,,,,,,"Hooe, East Sussex, United Kingdom",,2007-01-01,year,,https://www.linkedin.com/company/italk-ltd
Jaguar Technologies,https://www.crunchbase.com/organization/jaguar-technologies,51-100,Active,https://jaguartechnologies.com/,media@jaguartechnologies.com,407-523-8500,,,,,,,,,"Hardware, Information Technology","Information Technology, Satellite Communication, Telecommunications",,,,,1208188,USD,1208188,,,"Flushing, New York, United States",$10M to $50M,1994-01-01,day,,https://www.linkedin.com/company/jaguar-technologies-inc/
Vizada,https://www.crunchbase.com/organization/vizada,501-1000,Closed,http://www.vizada.com,customercare.us@vizada.com,61 28 89 99,,,,,,,,,"Government and Military, Hardware, Mobile","Mobile, National Security, Satellite Communication",,,,,,,,,,"Rockville, Maryland, United States",,2007-01-01,year,Hutton Collins Partners,
Satrec Initiative,https://www.crunchbase.com/organization/satrec-initiative,251-500,Active,https://www.satreci.com/,inquiries@satreci.com,+82 42-365-7500,,,,,,,,,"Hardware, Information Technology, Science and Engineering","Aerospace, Information Technology, Satellite Communication",1,0,Electric Communication Technique,,,,,,,"Daejeon, Taejon-jikhalsi, South Korea",,1999-12-29,day,Innopolis Partners,https://www.linkedin.com/company/satrec-initiative/
Globe Wireless,https://www.crunchbase.com/organization/globe-wireless,501-1000,Active,http://globewireless.com,customersupport@globewireless.com,16507268604,,,,,,,,,"Hardware, Mobile","Mobile, Satellite Communication",0,1,,Scientific and electric apparatus and instruments,,,,,,"Palm Bay, Florida, United States",,1983-01-01,year,Summit Partners,https://www.linkedin.com/company/globe-wireless
Viasat Group,https://www.crunchbase.com/organization/viasat-group,251-500,Active,http://www.viasatgroup.it,marketing@viasatgroup.it,+390114560201,,,,,,,,,"Consumer Electronics, Hardware, Manufacturing","Electronics, Manufacturing, Satellite Communication",3,4,Signalling,Scientific and electric apparatus and instruments,127452,USD,127452,,,"Venaria Reale, Piemonte, Italy",$1B to $10B,1974-01-01,year,,https://www.linkedin.com/company/viasat-group
United Teleports,https://www.crunchbase.com/organization/united-teleports,51-100,Active,https://www.unitedteleports.com/,info@unitedteleports.com,+1 (305) 671-3333,,,,,,,,,"Hardware, Media and Entertainment, Video","Broadcasting, Media and Entertainment, Satellite Communication",,,,,1036461,USD,1036461,,,"Miami, Florida, United States",,2010-01-01,year,,https://www.linkedin.com/company/united-teleports/
Systek,https://www.crunchbase.com/organization/systek-7780,251-500,Active,https://systek.com/,,+1-732571-6400,,,,,,,,,"Education, Hardware, Information Technology, Software","Information Technology, Satellite Communication, Software, Training",,,,,7232320,USD,7232320,,,"West Long Branch, New Jersey, United States",$10M to $50M,1989-01-01,year,,https://www.linkedin.com/company/sytem-technologies/
Televisa,https://www.crunchbase.com/organization/televisa-7d68,10001+,Active,https://www.televisair.com,ir@televisa.com.mx,(52) 55 5261 2000,,,,,,,,,"Hardware, Media and Entertainment","Media and Entertainment, Satellite Communication, Telecommunications",,,,,,,,,,"Mexico City, Distrito Federal, Mexico",$1B to $10B,1973-01-01,year,,https://www.linkedin.com/company/grupo-televisa-sab
China Satellite Communications,https://www.crunchbase.com/organization/china-satellite-communications,10001+,Active,http://english.csat.spacechina.com/,,+86-10-62586600,,,,,,,,,"Hardware, Media and Entertainment, Science and Engineering, Software, Video","Aerospace, Broadcasting, Satellite Communication, Software, Telecommunications",,,,,,,,,,"Beijing, Beijing, China",,2001-11-27,day,,https://www.linkedin.com/company/中国航天科技集团公司
Satcom Global,https://www.crunchbase.com/organization/satcom-global,51-100,Active,https://www.satcomglobal.com,emea@satcomglobal.com,+44 0 191 258 1635,,,,,,,,,"Hardware, Science and Engineering","Marine Technology, Satellite Communication, Telecommunications",,,,,1143176,USD,1143176,,,"North Shields, North Tyneside, United Kingdom",,2001-01-01,year,,https://www.linkedin.com/company/satcom-global/
XM Radio,https://www.crunchbase.com/organization/xm-radio,1001-5000,Closed,http://www.xmradio.com,advertising@siriusxm.com,866-635-5027,,,,,,,,,"Content and Publishing, Hardware, Media and Entertainment, Music and Audio","Internet Radio, Music, News, Satellite Communication",,,,,,,,,,"New York, New York, United States",,1988-01-01,year,Hearst Ventures,https://www.linkedin.com/company/sirius-xm-radio-inc.
Helios Towers Nigeria,https://www.crunchbase.com/organization/helios-towers-nigeria,251-500,Active,http://www.heliostowers.com/,info@htntowers.com,+23414625315,,,,,,,,,Hardware,"Communications Infrastructure, Satellite Communication",,,,,,,,,,"Lagos, Lagos, Nigeria",,2006-01-01,year,,
Fundació i2CAT,https://www.crunchbase.com/organization/i2cat-fundacio,101-250,Active,https://www.i2cat.net,fundacio@i2cat.net,(+34) 93 553 25 10,,,,,,,,,"Artificial Intelligence (AI), Data and Analytics, Hardware, Information Technology, Internet Services, Mobile, Privacy and Security, Science and Engineering, Software, Transportation","Artificial Intelligence (AI), Autonomous Vehicles, Cyber Security, Internet, Internet of Things, Network Security, Satellite Communication, Telecommunications, Wireless",1,0,Electric Communication Technique,,,,,,,"Barcelona, Catalonia, Spain",$10M to $50M,2003-07-01,month,,http://www.linkedin.com/company/i2cat-foundation
ZacXo,https://www.crunchbase.com/organization/zacxo,51-100,Active,https://www.zacxo.com/,webmaster@zacxo.com,+1-866-573- 0924,,,,,,,,,"Commerce and Shopping, Consumer Electronics, Hardware, Internet Services, Media and Entertainment, Other, Professional Services, Real Estate, Video","Broadcasting, Consumer Electronics, Customer Service, E-Commerce, Home Services, Internet, Media and Entertainment, Satellite Communication, Smart Home, TV",,,,,432702,USD,432702,,,"Jacksonville, Florida, United States",,2016-01-01,day,,https://www.linkedin.com/company/zacxo/
Beijing StarNeto Technology,https://www.crunchbase.com/organization/beijing-starneto-technology,501-1000,Active,http://www.starneto.com/,zzl@starneto.com,010-87838888,,,,,,,,,"Consumer Electronics, Hardware, Manufacturing","Electronics, Manufacturing, Satellite Communication",,,,,,,,,,"Beijing Shi, Beijing, China",,2005-05-20,day,,https://www.linkedin.com/company/北京星网宇达科技股份有限公司
Bendigo Telco,https://www.crunchbase.com/organization/bendigo-telco-911e,51-100,Active,https://www.bendigotelco.com.au/,customerhelp@bendigotelco.com.au,+61 1300 228 123,,,,,,,,,"Hardware, Internet Services","Internet, Optical Communication, Satellite Communication, Telecommunications",,,,,,,,,,"Bendigo, Victoria, Australia",,2000-01-01,year,,https://www.linkedin.com/company/bendigotelco/
DozeraX Space,https://www.crunchbase.com/organization/dozerax-space,10001+,Active,https://dozerax.space,support@dozera.in,,,,,,On-Site,2023-03-04,899,,"Hardware, Transportation","Satellite Communication, Space Travel",,,,,,,,,,,,2022-01-03,day,,https://www.linkedin.com/company/dozerax?trk=profile-position
Syfy,https://www.crunchbase.com/organization/syfy,51-100,Active,http://www.syfy.com,,5206236015,,,,,,,,,"Hardware, Media and Entertainment, Video","Media and Entertainment, Satellite Communication, TV",,,,,,,,,,"New York, New York, United States",Less than $1M,1970-01-01,year,,
Circet Kabel GmbH,https://www.crunchbase.com/organization/circet-kabel-gmbh,251-500,Active,https://cable-way.de/,info@cable-way.de,+49 2204 47600 00,,,,,,,,,"Hardware, Internet Services","Internet, Optical Communication, Satellite Communication, Telecommunications",,,,,,,,,,"Bergisch Gladbach, Nordrhein-Westfalen, Germany",$50M to $100M,2007-01-01,year,,https://www.linkedin.com/company/cableway-ag/
Nilesat,https://www.crunchbase.com/organization/nilesat,251-500,Active,http://www.nilesat.com.eg,marketing@nilesat.com.eg,+202 - 38400145,,,,,,,,,"Hardware, Media and Entertainment, Video","Broadcasting, Satellite Communication, Telecommunications",,,,,,,,,,"Cairo, Al Qahirah, Egypt",$100M to $500M,1996-01-01,year,,https://www.linkedin.com/company/the-egyptian-satellite-company-nilesat
Bharat Samachar,https://www.crunchbase.com/organization/bharat-samachar,501-1000,Active,https://bharatsamachartv.in,marketing@uttarpradeshtv.in,+91 05226786104,,,,,,,,,"Content and Publishing, Hardware, Media and Entertainment, Video","Broadcasting, News, Satellite Communication, TV",,,,,,,,,,"Lucknow, Uttar Pradesh, India",,2017-01-01,year,,https://www.linkedin.com/company/bharat-samachar
Tower Systems,https://www.crunchbase.com/organization/tower-systems-2c14,51-100,Active,https://www.towersystems.com,lliarikos@towersystems.com,+1.605.886.0930,,,,,,,,,"Hardware, Real Estate","Construction, Satellite Communication, Telecommunications",,,,,652556,USD,652556,,,"Watertown, Massachusetts, United States",$1M to $10M,1975-01-01,year,,https://www.linkedin.com/company/tower-systems-inc/
GEOSAT,https://www.crunchbase.com/organization/geosat-2d9e,51-100,Active,https://geosat.space,sales@geosat.space,+34 983 548 923,,,,,,,,,"Data and Analytics, Hardware, Navigation and Mapping, Transportation","Geospatial, Satellite Communication, Space Travel",,,,,,,,,,"Madrid, Madrid, Spain",,,,,https://www.linkedin.com/company/globaleosatellites/
SK Telink,https://www.crunchbase.com/organization/sk-telink,101-250,Active,https://www.sktelink.com,biz_proposal@sk.com,,,,,,,,,,"Hardware, Messaging and Telecommunications, Mobile","Satellite Communication, Wired Telecommunications, Wireless",4,0,Electric Communication Technique,,,,,,,"Mapo, Seoul-t'ukpyolsi, South Korea",$100M to $500M,1998-04-09,day,,
MT Aerospace,https://www.crunchbase.com/organization/mt-aerospace-ag,501-1000,Active,https://www.mt-aerospace.de/index-en.html,info@mt-aerospace.de,+49 0 821 505-01,,,,,,,,,"Hardware, Manufacturing, Science and Engineering, Transportation","Aerospace, Manufacturing, Satellite Communication, Space Travel",29,3,Storing Of Distributing Gases Or Liquids,Vehicles,6075675,USD,6075675,,,"Augsburg, Bayern, Germany",$100M to $500M,1965-01-01,year,,https://www.linkedin.com/company/mt-aerospace-ag/
IPA Group,https://www.crunchbase.com/organization/ipa-group,51-100,Active,https://ipstaraustralia.com/,,,,,,,,,,,"Hardware, Internet Services, Professional Services","Consulting, Internet, Satellite Communication",,,,,,,,,,"Greenwich, New South Wales, Australia",,2019-01-01,year,,https://www.linkedin.com/company/ipstar-aus
Telecom Plus,https://www.crunchbase.com/organization/telecom-plus-71b8,501-1000,Active,https://telecomplus.co.uk/,,,,,,,,,,,"Administrative Services, Hardware, Information Technology, Internet Services, Messaging and Telecommunications, Real Estate","Email, Facilities Support Services, Facility Management, Satellite Communication, Telecommunications",,,,,216630329,USD,216630329,,,"London, England, United Kingdom",$1M to $10M,1997-01-01,year,,https://www.linkedin.com/company/utilitywarehouse/
Digital TV Cable,https://www.crunchbase.com/organization/digital-tv-cable,251-500,Active,https://www.digitaltv.com.bo/,,+591 003-363-5555,,,,,,,,,"Hardware, Internet Services, Media and Entertainment, Video","Internet, Satellite Communication, Telecommunications, TV",,,,,,,,,,"Santa Cruz De La Sierra, Santa Cruz, Bolivia",$10M to $50M,2009-01-01,year,,https://www.linkedin.com/company/digital-tv-cable/
NOAA Satellite and Information Service,https://www.crunchbase.com/organization/noaa-satellite-and-information-service,5001-10000,Active,https://www.nesdis.noaa.gov/,nesdis.pa@noaa.gov,1 301-713-3578,,,,,,,,,"Government and Military, Hardware, Other, Social Impact","Government, Non Profit, Satellite Communication",,,,,3862262,USD,3862262,,,"Silver Spring, Maryland, United States",,1970-01-01,year,,https://www.linkedin.com/company/nesdis
MDL,https://www.crunchbase.com/organization/mdl,101-250,Active,http://mdllab.com/,mdlsales@mdllab.com,+1-781-292-6680,,,,,,,,,"Consumer Electronics, Hardware, Manufacturing, Science and Engineering","Electronics, Industrial Engineering, Manufacturing, Satellite Communication",,,,,824195,USD,824195,,,"Needham Heights, Massachusetts, United States",$1M to $10M,1948-01-01,year,,https://www.linkedin.com/company/microwave-development-laboratories-inc-/
STM Group,https://www.crunchbase.com/organization/stm-group-97fa,101-250,Active,https://www.stmgroupinc.com,info@stmgroupinc.com,+1 949-916-2751,,,,,,,,,"Financial Services, Hardware, Other, Real Estate","B2B, Commercial, Real Estate Investment, Satellite Communication, Telecommunications",,,,,1547170,USD,1547170,,,"El Segundo, California, United States",$10M to $50M,1984-01-01,year,,https://www.linkedin.com/company/stmgroupinc
BizConf Telecom,https://www.crunchbase.com/organization/bizconf-telecom,501-1000,Active,http://www.bizconf.cn/,BDoffice@bizconf.cn,86 21 6132 1868,,,,,,,,,"Hardware, Information Technology, Media and Entertainment, Software","Information Technology, Metaverse, Satellite Communication, Software, Telecommunications",,,,,,,,,,"Jingan, Shanghai, China",,2006-02-08,day,,https://www.linkedin.com/company/bizconf-telecom-co-ltd-
Globalsat Group,https://www.crunchbase.com/organization/globalsat-group,251-500,Active,http://www.globalsat.com,info@globalsat.com,+1 (561) 208-6088,,,,,,,,,Hardware,Satellite Communication,,,,,2467493,USD,2467493,,,"Boca Raton, Florida, United States",$10M to $50M,1999-11-01,month,,https://www.linkedin.com/company/globalsat-group
Sunwave Communications,https://www.crunchbase.com/organization/sunwave-communications-8abd,1001-5000,Active,http://www.sunwave.com.cn,hr@sunwave.com.cn,0571-88866999,,,,,,,,,Hardware,Satellite Communication,96,2,Electric Communication Technique,Scientific and electric apparatus and instruments,,,,,,"Hangzhou, Zhejiang, China",,1993-05-13,day,,https://www.linkedin.com/company/sunwave-communications-co-ltd-
Preferred Communications,https://www.crunchbase.com/organization/preferred-communications,51-100,Active,http://www.satstar.com/,sales@satstar.com,1-919-575-4600,,,,,,,,,"Hardware, Navigation and Mapping, Sales and Marketing","GPS, Hardware, Sales, Satellite Communication",,,,,494150,USD,494150,,,"Butner, North Carolina, United States",Less than $1M,1994-01-01,year,,https://www.linkedin.com/company/preferred-communications-inc-
Telenor Satellite,https://www.crunchbase.com/organization/telenor-satellite,101-250,Active,https://www.telenorsat.com,nittedalnoc@telenor.com,+47 670 73 470,,,,,,,,,"Hardware, Information Technology, Media and Entertainment, Video","Broadcasting, Information Technology, Satellite Communication, Telecommunications",,,,,,,,,,"Fornebu, Akershus, Norway",,1983-01-01,year,,https://www.linkedin.com/company/telenor-satellite-broadcasting/
Hellas Sat,https://www.crunchbase.com/organization/hellas-sat,51-100,Active,http://www.hellas-sat.net/,sales@hellas-sat.net,30 210 615 9700,,,,,,,,,"Hardware, Information Technology","Information Technology, Satellite Communication, Telecommunications",,,,,,,,,,"Koropí, Attiki, Greece",$10M to $50M,2001-01-01,year,,https://www.linkedin.com/company/hellas-sat/
GITSA Telecomunicaciones,https://www.crunchbase.com/organization/gitsa-telecomunicaciones,501-1000,Active,https://gittsa.com/,asesorcc4@gittsa.com,+52 222 555 4250,,,,,,,,,"Hardware, Information Technology, Media and Entertainment, Other","Digital Entertainment, Information and Communications Technology (ICT), Satellite Communication, Subscription Service, Telecommunications",,,,,,,,,,"Puebla, Puebla, Mexico",$100M to $500M,1998-01-01,year,,https://www.linkedin.com/company/gittsa-telecomunicaciones/
Soletop,https://www.crunchbase.com/organization/soletop,51-100,Active,https://soletop.com,contact@soletop.com,82-42-867-7440,,,,,,,,,"Data and Analytics, Hardware, Navigation and Mapping","Geospatial, Remote Sensing, Satellite Communication, Sensor",2,0,Aircraft; Aviation; Cosmonautics,,,,,,,"Yusong, Taejon-jikhalsi, South Korea",$10M to $50M,1999-01-09,day,,https://www.linkedin.com/company/soletop/
Gulfsat Communications,https://www.crunchbase.com/organization/gulfsat-communications,101-250,Active,https://www.gulfsat.com/,info@gulfsat.com,+965 2291 7777,,,,,,,,,"Hardware, Media and Entertainment, Other, Video","Broadcasting, Satellite Communication, Service Industry, Telecommunications",,,,,1794636,USD,1794636,,,"Safat, Al Kuwayt, Kuwait",$10M to $50M,1995-01-01,year,,https://www.linkedin.com/company/gulfsat-communications/
VSATplus,https://www.crunchbase.com/organization/vsatplus,51-100,Active,https://www.vsatplus.com,shop@vsatplus.com,+1 833 872 8123,,,,,,,,,Hardware,"Hardware, Satellite Communication, Telecommunications",,,,,122783,USD,122783,,,"Irvine, Kentucky, United States",,2004-01-01,year,,https://www.linkedin.com/company/vsatplus
ASTRA,https://www.crunchbase.com/organization/astra-c447,1001-5000,Active,https://astra.de,amg@ses.com,+49 89 1896 2100,,,,,,,,,"Hardware, Media and Entertainment, Video","Satellite Communication, Telecommunications, TV",,,,,10358787,USD,10358787,,,"Unterföhring, Bayern, Germany",$50M to $100M,1985-01-01,year,,https://www.linkedin.com/company/astra-deutschland
IDC Communications,https://www.crunchbase.com/organization/idc-communications,101-250,Active,https://idccommunications.com/,communications@idccomm.mb.ca,+1 204-254-8282,,,,,,,,,"Hardware, Internet Services, Mobile","Communications Infrastructure, Internet, Satellite Communication, Wireless",,,,,1897231,USD,1897231,,,"Winnipeg, Manitoba, Canada",,1990-01-01,year,,https://www.linkedin.com/company/idc-communications/
StarWin,https://www.crunchbase.com/organization/starwin,51-100,Active,http://www.xuny-sat.com/,,400-812-9329,,,,,,,,,"Hardware, Internet Services, Manufacturing, Mobile","Internet, Manufacturing, Satellite Communication, Wireless",,,,,,,,,,"Chengdu, Sichuan, China",,,,Canghai Capital,https://www.linkedin.com/company/china-starwin-science&technology-co-ltd
Playbox Neo,https://www.crunchbase.com/organization/playbox-neo,101-250,Active,https://playboxneo.com/,sales@playboxneo.com,+359-88-234-0227,,,,,,,,,"Hardware, Internet Services, Media and Entertainment, Video","Broadcasting, Cloud Infrastructure, Satellite Communication",,,,,,,,,,"Sofia, Grad Sofiya, Bulgaria",$1M to $10M,1999-01-01,year,,https://www.linkedin.com/company/playboxneo/
Strategic Advanced Technology Products And Linkages Development Agency,https://www.crunchbase.com/organization/strategic-advanced-technology-products-and-linkages-development-agency,51-100,Active,https://satpalda.com,info@satpalda.com,+91 7838410007,,,,,,,,,"Data and Analytics, Design, Hardware, Information Technology, Navigation and Mapping, Software","CAD, Geospatial, Information Technology, Satellite Communication",,,,,,,,,,"Ghaziabad, Uttar Pradesh, India",$1M to $10M,2002-06-05,day,,https://www.linkedin.com/company/satpaldageo 
RACSA,https://www.crunchbase.com/organization/racsa,101-250,Active,https://www.racsa.go.cr/,servicioacliente@racsa.go.cr,506 2287 0087,,,,,,,,,"Hardware, Mobile","Satellite Communication, Telecommunications, Wireless",,,,,,,,,,"San José, San Jose, Costa Rica",,1921-07-25,day,,https://www.linkedin.com/company/racsa_cr/
Telecom Liechtenstein,https://www.crunchbase.com/organization/telecom-liechtenstein,51-100,Active,https://wholesale.telecom.li,litelecomatoz@gmail.com,212-661-322604,,,,,,,,,"Hardware, Mobile","Mobile, Satellite Communication, Telecommunications",0,5,,Telecommunications,,,,,,"Vaduz, Vaduz, Liechtenstein",,1998-01-01,year,,https://www.linkedin.com/company/telecom-liechtenstein-ag
Profen,https://www.crunchbase.com/organization/profen,251-500,Active,https://profen.com,info@profen.com,+90 212 210 27 70,,,,,,,,,"Hardware, Internet Services, Mobile","Internet, Satellite Communication, Telecommunications, Wireless",,,,,,,,,,"Sisli, Istanbul, Turkey",,1995-01-01,year,,https://www.linkedin.com/company/profen-group
Pasifik Satelit Nusantara,https://www.crunchbase.com/organization/pasifik-satelit-nusantara-79c2,251-500,Active,https://www.psn.co.id,customercare@psn.co.id,(62) 021 8990 0333,,,,,,,,,"Hardware, Internet Services","Internet, Satellite Communication, Telecommunications",,,,,,,,,,"Bekasi, Jawa Barat, Indonesia",$50M to $100M,1991-01-01,year,,https://www.linkedin.com/company/pasifik-satelit-nusantara
Sierra Electronics,https://www.crunchbase.com/organization/sierra-electronics,51-100,Active,https://www.sierraelectronics.com,sierramarketing@sierraelectronics.com,+1 775 359 1121,,,,,,,,,"Hardware, Media and Entertainment, Mobile, Music and Audio","Internet Radio, Satellite Communication, Wireless",,,,,495875,USD,495875,,,"Sparks, Nevada, United States",,1964-01-01,year,,https://www.linkedin.com/company/sierra-electronics
TR Pty Ltd,https://www.crunchbase.com/organization/tr-pty-ltd,251-500,Active,https://www.tr.com.au,,+61398963000,,,,,,,,,"Data and Analytics, Hardware","Satellite Communication, Test and Measurement",,,,,,,,,,"Blackburn, Victoria, Australia",,1978-01-01,year,,https://www.linkedin.com/company/tr-pty-ltd
MECANO ID,https://www.crunchbase.com/organization/mecano-id,101-250,Active,https://www.mecano-id.fr,contact@mecano-id.fr,+33 0 5 34 60 84 00,,,,,,,,,"Hardware, Manufacturing, Science and Engineering","Aerospace, Manufacturing, Satellite Communication",2,0,Aircraft; Aviation; Cosmonautics,,791576,USD,791576,,,"Toulouse, Midi-Pyrenees, France",$10M to $50M,1994-01-01,year,,https://www.linkedin.com/company/mecano-id
WorkAir Ireland,https://www.crunchbase.com/organization/workair-ireland,101-250,Active,https://www.workair.ie,sales@workair.ie,00353 1 244 0560,,,,,,,,,"Hardware, Information Technology","Information Technology, Satellite Communication",,,,,,,,,,"Dublin, Dublin, Ireland",$1M to $10M,2016-01-01,year,,https://www.linkedin.com/company/workair-ireland/
OnixSat,https://www.crunchbase.com/organization/onixsat,51-100,Active,https://onixsat.com.br,vendas@onixsat.com,43 3371 3700,,,,,,,,,"Hardware, Software","Enterprise Software, Hardware, Satellite Communication",,,,,,,,,,"Londrina, Parana, Brazil",$100M to $500M,2003-01-01,year,,https://www.linkedin.com/company/onixsat-rastreamento-de-ve%C3%ADculos
IPSTAR,https://www.crunchbase.com/organization/ipstar-australia,10001+,Active,https://ipstarbroadband.com.au/,sales@ipstarbroadband.com.au,1300 464 778,,,,,,,,,"Hardware, Information Technology, Internet Services, Media and Entertainment, Privacy and Security, Video","Broadcasting, Internet, Network Security, Satellite Communication, Telecommunications",,,,,,,,,,"Saint Leonards, Victoria, Australia",,2005-01-01,year,,https://www.linkedin.com/company/ipstar-australia/
TNL Group,https://www.crunchbase.com/organization/tnl-group,51-100,Active,https://www.tnlcom.gr,info@tnlcom.gr,+30 210 412 1 566,,,,,,,,,"Hardware, Navigation and Mapping, Science and Engineering","Marine Technology, Navigation, Satellite Communication, Telecommunications",0,1,,Scientific and electric apparatus and instruments,,,,,,"Piraeus, Attiki, Greece",$1M to $10M,2002-01-01,year,,https://www.linkedin.com/company/tnl-group
