Hemisphere,https://www.crunchbase.com/organization/hemisphere,51-100,Active,http://hemispheregnss.com,Atlas@HGNSS.com,1(844) 217-2845,,,,,,,,,"Hardware, Navigation and Mapping, Science and Engineering","GPS, Marine Technology, Navigation, Satellite Communication",2,0,Testing,,693036,USD,693036,,,"Scottsdale, Arizona, United States",$50M to $100M,1990-01-01,year,"Canaccord Genuity Group, Paradigm Capital, PI Financial, Wellington West Capital Markets",https://www.linkedin.com/company/hemisphere-gps
Orbit Communication Systems,https://www.crunchbase.com/organization/orbit-communication-systems,251-500,Active,http://www.orbit-cs.com/,info@orbit-cs.com,(972) 989-2277,,,,,,,,,"Government and Military, Hardware, Science and Engineering","Aerospace, National Security, Satellite Communication, Telecommunications",6,2,Basic Electric Elements,Scientific and electric apparatus and instruments,,,,,,"Netanya, HaMerkaz, Israel",,1950-01-01,year,"Meitav Investment House, More Investment House, First Israel Mezzanine Investors",http://www.linkedin.com/company/orbit-communication-systems-ltd
CLS Groupe,https://www.crunchbase.com/organization/cls-groupe,501-1000,Active,https://www.cls.fr,info@cls.fr,33 5 61 39 47 00,1,1,1,,,,,,"Data and Analytics, Hardware, Internet Services, Navigation and Mapping, Transportation","Geospatial, Location Based Services, Satellite Communication, Space Travel",0,2,,Scientific and technological services,10178889,USD,10178889,,,"Ramonville-saint-agne, Midi-Pyrenees, France",$100M to $500M,1986-01-01,year,Ardian,https://www.linkedin.com/company/cls?trk=top_nav_home
Intellian Technology,https://www.crunchbase.com/organization/intellian-technology,501-1000,Active,http://www.intelliantech.com/,sales@intelliantech.com,+82313791000,1,1,,,,,,,"Hardware, Information Technology, Manufacturing","Information Technology, Manufacturing, Satellite Communication, Telecommunications",53,8,Basic Electric Elements,Scientific and electric apparatus and instruments,1664106,USD,1664106,,,"Pyongtaek, Kyonggi-do, South Korea",$500M to $1B,2004-01-01,year,IMM Investment,https://www.linkedin.com/company-beta/868968/
Jupiter Telecommunications,https://www.crunchbase.com/organization/jupiter-telecommunications-j-com,10001+,Active,http://www.jcom.co.jp,,0120-999-000,1,1,,,,,,,"Hardware, Internet Services, Media and Entertainment, Mobile, Video","Communications Infrastructure, Internet, Mobile, Satellite Communication, Telecommunications, TV",,,,,,,,,,"Tokyo, Tokyo, Japan",$1B to $10B,1995-01-18,day,,https://www.linkedin.com/company/jupiter-telecommunications-co.-ltd./
Seradata,https://www.crunchbase.com/organization/seradata,51-100,Active,https://www.seradata.com/,info@seradata.com,+44-6462334874,,,,,,,,,"Data and Analytics, Hardware, Science and Engineering, Software","Aerospace, Database, Satellite Communication, Software",0,1,,Advertising; business,180645,USD,180645,,,"Northampton, Northamptonshire, United Kingdom",Less than $1M,2013-01-01,year,,https://www.linkedin.com/company/seradata-limited
iDirect Technologies,https://www.crunchbase.com/organization/idirect,501-1000,Active,http://www.idirect.net,jbettinger@idirect.net,1(170)364-88155,,,,,,,,,"Hardware, Internet Services, Mobile","Internet, Mobile, Satellite Communication",,,,,30113922,USD,30113922,,,"Herndon, Virginia, United States",$100M to $500M,1994-01-01,year,,https://www.linkedin.com/company/st-engineering-idirect
Redwire Space (formerly Loadpath),https://www.crunchbase.com/organization/loadpath,501-1000,Active,https://redwirespace.com,sales@redwirespace.com,,,,,,,,,,Hardware,Satellite Communication,1,0,Generation; Conversion Or Distribution Of Electric Power,,,,,,,"Albuquerque, New Mexico, United States",,2009-01-01,year,New Mexico Economic Development Department,https://www.linkedin.com/company/redwire-space
Emerging Markets Communications,https://www.crunchbase.com/organization/emerging-markets-communications,251-500,Closed,http://emcconnected.com/,info@globaleagle.com,(954)538-4000,,,,,,,,,Hardware,"Satellite Communication, Telecommunications",,,,,427604,USD,427604,,,"Miramar Beach, Florida, United States",,1999-01-01,year,ABRY Partners,https://www.linkedin.com/company/emcconnected
Arianespace,https://www.crunchbase.com/organization/arianespace,251-500,Closed,http://www.arianespace.com/index/index.asp,,2026283936,,,,,,,,,"Hardware, Other, Sales and Marketing","Local Business, Satellite Communication, Service Industry",,,,,,,,,,"Singapore, Central Region, Singapore",Less than $1M,1980-01-01,year,,
e2v Technologies,https://www.crunchbase.com/organization/e2v-technologies,251-500,Closed,http://www.e2v.com,,+44 1245 493493,,,,,,,,,"Hardware, Software","Hardware, Satellite Communication, Software",,,,,19339267,USD,19339267,,,"Chelmsford, Essex, United Kingdom",,1947-01-01,year,,https://www.linkedin.com/company/16536
mu Space Corp,https://www.crunchbase.com/organization/mu-space-corp,51-100,Active,http://www.muspacecorp.com/,info@muspacecorp.com,+6620289425,,,,,,,,,"Hardware, Information Technology, Internet Services, Manufacturing, Real Estate, Transportation","Information Technology, Internet, Internet of Things, Manufacturing, Satellite Communication, Smart Cities, Space Travel, Telecommunications",0,2,,Telecommunications,,,,,,"Bangkok, Krung Thep, Thailand",Less than $1M,2017-06-21,day,,http://www.linkedin.com/company/muSpaceTech
"KVH, Industries",https://www.crunchbase.com/organization/kvh,501-1000,Active,http://www.kvh.com,support@kvh.com,401-847-3327,,,,,,,,,"Hardware, Manufacturing","Manufacturing, Satellite Communication",31,31,Basic Electric Elements,Scientific and electric apparatus and instruments,13297588,USD,13297588,,,"Middletown, Rhode Island, United States",$100M to $500M,1982-01-01,year,,http://www.linkedin.com/company/kvh-industries-inc.
Network Innovations,https://www.crunchbase.com/organization/network-innovations-2,101-250,Active,http://www.networkinv.com/,,(656)274-0811,,,,,,,,,"Hardware, Internet Services","Internet, Satellite Communication, Telecommunications",0,2,,Telecommunications,3520740,USD,3520740,,,"Calgary, Alberta, Canada",$1M to $10M,1989-01-01,year,,https://www.linkedin.com/company/network-innovations
NOVELSAT,https://www.crunchbase.com/organization/novelsat,101-250,Active,http://www.novelsat.com/,support@novelsat.com,+41435081067,,,,,,,,,"Hardware, Media and Entertainment, Software, Video","Broadcasting, Communications Infrastructure, Satellite Communication, Software, Telecommunications",16,4,Electric Communication Technique,Scientific and electric apparatus and instruments,,,,,,"Ra'anana, HaMerkaz, Israel",Less than $1M,2007-01-01,year,"Landa Ventures, Space Florida",https://www.linkedin.com/company/novelsat
Telespazio,https://www.crunchbase.com/organization/telespazio-ac59,1001-5000,Active,https://www.telespazio.com/,,+39-06-40791,,,,,,,,,Hardware,"Network Hardware, Satellite Communication, Telecommunications",35,19,Testing,Scientific and electric apparatus and instruments,28567045,USD,28567045,,,"Rome, Lazio, Italy",$100M to $500M,1961-01-01,year,,https://www.linkedin.com/company/telespazio/
Endwave Corporation,https://www.crunchbase.com/organization/endwave-corporation,51-100,Closed,http://www.endwave.com,,408-522-3100,,,,,,,,,"Hardware, Manufacturing, Science and Engineering","Manufacturing, Satellite Communication, Semiconductor, Telecommunications",7,0,Basic Electric Elements,,,,,,,"San Jose, California, United States",$10M to $50M,1991-01-01,year,,
Maxtena,https://www.crunchbase.com/organization/maxtena,101-250,Active,http://www.maxtena.com,info@maxtena.com,877-629-8362,,,,,,,,,"Consumer Electronics, Consumer Goods, Hardware, Internet Services, Manufacturing, Mobile, Real Estate, Science and Engineering","Aerospace, Drones, Internet of Things, Manufacturing, Mobile, Satellite Communication, Smart Cities, Telecommunications",14,0,Basic Electric Elements,,1319861,USD,1319861,,,"Rockville, Maryland, United States",$1M to $10M,2007-01-01,year,Maryland Venture Fund,http://www.linkedin.com/company/maxtena-inc.
SKY Perfect JSAT Corp,https://www.crunchbase.com/organization/sky-perfect-jsat-corp,501-1000,Active,https://www.skyperfectjsat.space/,,81 3 5571 7800,7,7,,,,,,,"Hardware, Mobile","Mobile, Satellite Communication, Telecommunications, Wireless",18,1,Aircraft; Aviation; Cosmonautics,Telecommunications,,,,,,"Tokyo, Tokyo, Japan",$500M to $1B,1994-11-10,day,,
Silicon & Software Systems,https://www.crunchbase.com/organization/silicon-software-systems,251-500,Active,http://www.s3group.com,info@s3group.com,353 1 563 2000,,,,,,,,,"Consumer Electronics, Hardware, Information Technology, Science and Engineering, Software","Consumer Electronics, Electronics, Information Technology, Satellite Communication, Semiconductor, Software",1,5,Electric Communication Technique,Medical apparatus and instruments,,,,,,"Leopardstown, Dublin, Ireland",Less than $1M,1986-01-01,year,Act Venture Capital,https://www.linkedin.com/company/7881/
DRS Defense Solutions,https://www.crunchbase.com/organization/drs-defense-solutions,1001-5000,Active,https://www.leonardodrs.com,marketing@drs-ds.com,240-238-3909,,,,,,,,,"Consumer Electronics, Government and Military, Hardware, Information Technology, Manufacturing, Privacy and Security","Electronics, Government, Information Technology, Manufacturing, Satellite Communication, Security",,,,,66217000,USD,66217000,,,"Bethesda, Maryland, United States",Less than $1M,2008-10-01,day,,https://www.linkedin.com/company/leonardodrs
AST Group,https://www.crunchbase.com/organization/ast-group,101-250,Active,https://www.theastgroup.com/sg/,info@theastgroup.com,+44 1493 440 011,,,,,,,,,"Hardware, Information Technology, Internet Services, Software","Hardware, Information and Communications Technology (ICT), Information Technology, Internet, Satellite Communication, Software, Telecommunications",0,1,,Common metals and their alloys; ores,,,,,,"Great Yarmouth, Norfolk, United Kingdom",$1M to $10M,1992-01-01,year,,https://www.linkedin.com/company/applied-satellite-technology-ltd
Chengdu Spaceon Electronics,https://www.crunchbase.com/organization/chengdu-spaceon-electronics,501-1000,Active,http://www.elecspn.com/,ta@elecspn.com,028-8755 9188,,,,,,,,,"Hardware, Manufacturing","Communication Hardware, Manufacturing, Satellite Communication",4,0,Horology,,,,,,,"Chengdu, Sichuan, China",,2004-01-04,day,,https://www.linkedin.com/company/chengdu-spaceon-electronics
EWTN Global Catholic Network,https://www.crunchbase.com/organization/ewtn-global-catholic-network,251-500,Active,http://www.ewtn.com/,viewer@ewtn.com,(205)795-5769,,,,,,,,,"Hardware, Media and Entertainment","Media and Entertainment, Satellite Communication",,,,,,,,,,"Irondale, Missouri, United States",$50M to $100M,1981-08-15,day,,https://www.linkedin.com/company/ewtn
NASK,https://www.crunchbase.com/organization/nask-ae59,51-100,Active,https://nask.world,,+1 703 715 7909,,,,,,,,,"Data and Analytics, Hardware, Software","Analytics, Developer Platform, Satellite Communication, Software",,,,,1181210,USD,1181210,,,"Fairfax, Virginia, United States",$10M to $50M,2000-01-01,year,,https://www.linkedin.com/company/n-ask
PeopleNet,https://www.crunchbase.com/organization/peoplenet,101-250,Closed,http://www.peoplenetonline.com,info@peoplenetonline.com,952-908-6200,,,,,,,,,"Hardware, Sales and Marketing","Public Relations, Satellite Communication",,,,,283655636,USD,283655636,,,"Minnetonka, Minnesota, United States",,1994-01-01,year,Norwest Equity Partners (NEP),https://www.linkedin.com/company-beta/165432/
Satlink,https://www.crunchbase.com/organization/satlink,101-250,Active,https://www.satlink.es/,info@satlink.es,+34 91 327 21 31,,,,,,,,,"Hardware, Information Technology, Sustainability","Information Technology, Satellite Communication, Sustainability",0,4,,Scientific and technological services,,,,,,"Alcobendas, Madrid, Spain",,1992-01-01,year,,https://www.linkedin.com/company/satlink/
Hanwha Phasor,https://www.crunchbase.com/organization/hanwha-phasor,51-100,Active,https://www.hanwha-phasor.com/,,,,,,,,,,,Hardware,"Communications Infrastructure, Satellite Communication, Telecommunications",11,3,Electric Communication Technique,Scientific and electric apparatus and instruments,413471,USD,413471,,,"London, England, United Kingdom",,2005-01-01,year,,https://www.linkedin.com/company/hanwha-phasor
Netas,https://www.crunchbase.com/organization/netas,5001-10000,Active,http://www.netas.com.tr/,Webmaster@netas.com.tr,+902165222000,,,,,,,,,"Consumer Electronics, Hardware, Information Technology","Electronics, Information Services, Information Technology, Satellite Communication, Telecommunications",15,2,Electric Communication Technique,Scientific and electric apparatus and instruments,,,,,,"Pendik, Istanbul, Turkey",$1B to $10B,1967-01-01,year,"One Equity Partners, ZTE, TR.PE",https://www.linkedin.com/company/netas/
Hispasat,https://www.crunchbase.com/organization/hispasat,51-100,Active,http://www.hispasat.com/,,34 91 710 25 40,1,1,1,,,,,,Hardware,"Communications Infrastructure, Satellite Communication, Telecommunications",0,21,,Telecommunications,10661877,USD,10661877,,,"Madrid, Madrid, Spain",$100M to $500M,1989-01-01,year,,https://www.linkedin.com/company/hispasat
Sky Italia,https://www.crunchbase.com/organization/sky-italia,5001-10000,Active,http://sky.it,,39 06 88 66 35 42,,,,,,,,,"Hardware, Mobile","Communications Infrastructure, Satellite Communication, Wireless",13,7,Electric Communication Technique,Education; entertainment,,,,,,"Rome, Lazio, Italy",$500M to $1B,2003-01-01,year,,https://www.linkedin.com/company/sky-italia
Lucix Corporation,https://www.crunchbase.com/organization/lucix-corporation,51-100,Active,http://www.lucix.com/,LucixNBP@lucix.com,1(805)987-6645,,,,,,,,,"Consumer Electronics, Hardware","Electronics, Satellite Communication",,,,,1968306,USD,1968306,,,"Camarillo, California, United States",$50M to $100M,1999-01-01,year,"Palisades Growth, Nimes Capital, Shepherd Ventures",https://www.linkedin.com/company/lucix-corporation
GateHouse,https://www.crunchbase.com/organization/gatehouse-b55e,51-100,Active,https://gatehouse.com,gh@gatehouse.com,+45 7020 1909,,,,,,,,,"Hardware, Other, Professional Services, Software","Consulting, Real Time, Satellite Communication, Software",,,,,170523,USD,170523,,,"Nørresundby, Nordjylland, Denmark",$1M to $10M,1992-01-01,year,,https://www.linkedin.com/company/gatehouse-a-s/
Entegra Systems,https://www.crunchbase.com/organization/entegra-systems,101-250,Active,https://www.entegrasystems.com,info@entegrasystems.com,+1-443-545-8421,,,,,,,,,"Hardware, Information Technology, Science and Engineering, Software","Information Technology, Satellite Communication, Software, Software Engineering",,,,,2315740,USD,2315740,,,"Hanover, Maryland, United States",$1M to $10M,2005-06-01,month,,https://www.linkedin.com/company/entegra-systems/
Navarino,https://www.crunchbase.com/organization/navarino,101-250,Active,https://navarino.co.uk,info@navarino.gr,30-2104111311,,,,,,,,,"Hardware, Information Technology","Communications Infrastructure, Information Technology, Satellite Communication",0,3,,Scientific and electric apparatus and instruments,,,,,,"Piraeus, Attiki, Greece",$10M to $50M,1996-01-01,day,,https://www.linkedin.com/company/navarino-sa/
"Tampa Microwave, LLC",https://www.crunchbase.com/organization/tampa-microwave-llc,51-100,Active,https://www.tampamicrowave.com/,,+1 (813) 855-2251,,,,,,,,,"Consumer Electronics, Hardware, Manufacturing, Media and Entertainment, Music and Audio, Video","Broadcasting, Electronics, Industrial Manufacturing, Internet Radio, Machinery Manufacturing, Manufacturing, Satellite Communication, TV",,,,,1351898,USD,1351898,,,"Clearwater, Florida, United States",$10M to $50M,1983-01-01,year,,https://www.linkedin.com/company/tampa-microwave/
Nomad Global Communication Solutions,https://www.crunchbase.com/organization/nomad-global-communication-solutions,101-250,Active,https://nomadgcs.com,info@nomadgcs.com,+1-888.755.1721,,,,,,,,,"Hardware, Health Care, Information Technology, Transportation","Health Care, Information Technology, Procurement, Satellite Communication",,,,,1347817,USD,1347817,,,"Kalispell, Montana, United States",$10M to $50M,2002-01-01,year,,https://www.linkedin.com/company/nomad-global-communication-solutions/
Merrimac Industries,https://www.crunchbase.com/organization/merrimac-industries,251-500,Closed,http://www.merrimacind.com,webadmin@crane-eg.com,9735750531,,,,,,,,,"Hardware, Navigation and Mapping, Software","Navigation, Satellite Communication, Software",2,13,Electric Techniques Not Otherwise Provided For,Scientific and electric apparatus and instruments,1853660,USD,1853660,,,"West Caldwell, New Jersey, United States",,1954-01-01,year,,
Argotec,https://www.crunchbase.com/organization/argotec-020e,51-100,Active,https://www.argotecgroup.com,info@argotecgroup.com,+39 011 765 0567,,,,,,,,,"Hardware, Manufacturing, Science and Engineering","Aerospace, Manufacturing, Satellite Communication",5,7,"Furniture,Domestic Articles Or Appliances; Coffee Mills; Spice Mills",Advertising; business,780896,USD,780896,,,"Turin, Piemonte, Italy",$10M to $50M,2008-01-01,year,,https://www.linkedin.com/company/argotecsrl/
Chengdu M&S Electronics Technology,https://www.crunchbase.com/organization/chengdu-m-s-electronics-technology,251-500,Active,http://www.microwave-signal.com,,400-0086-660,,,,,,,,,Hardware,"Satellite Communication, Telecommunications",,,,,,,,,,"Chengdu, Sichuan, China",,2013-01-01,year,Kingdom Capital,https://www.linkedin.com/company/sichuan-taisheng-international-special-steel-industry/
EchoStar Satellite Services,https://www.crunchbase.com/organization/echostar-satellite-services,101-250,Active,https://www.echostarsatelliteservices.com,satelliteservices@echostar.com,1.866.359.8804,,,,,,,,,Hardware,"Communications Infrastructure, Satellite Communication, Telecommunications",0,7,,Telecommunications,162822978,USD,162822978,,,"Englewood, Colorado, United States",,2006-01-01,year,,https://www.linkedin.com/company/echostar-satellite-services-llc/
Ultisat,https://www.crunchbase.com/organization/ultisat,51-100,Active,http://www.ultisat.com/,,1(240) 243-5100,,,,,,,,,Hardware,"Satellite Communication, Telecommunications",,,,,2756453,USD,2756453,,,"Gaithersburg, Maryland, United States",,2003-01-01,year,LLR Partners,https://www.linkedin.com/company/ultisat
PanAmSat,https://www.crunchbase.com/organization/panamsat,501-1000,Active,http://www.panamsat.com,bookings@panamsat.com,+1.404.381.2340,1,1,,,,,,,"Hardware, Media and Entertainment, Video","Content, Digital Media, Satellite Communication, Video",,,,,1725107,USD,1725107,,,"Wilton, Connecticut, United States",,1984-01-01,year,,
DIGI,https://www.crunchbase.com/organization/digi-1890,101-250,Active,http://www.digislovakia.sk,,421-850-211112,,,,,,,,,"Hardware, Internet Services","Internet, Satellite Communication, Telecommunications",,,,,207633,USD,207633,,,"Bratislava, Bratislava, Slovakia (Slovak Republic)",$10M to $50M,2006-01-01,day,,https://www.linkedin.com/company/digi-slovakia-s.r.o./?originalSubdomain=in
Techno-Sciences,https://www.crunchbase.com/organization/techno-sciences,101-250,Active,http://www.technosci.com/,info@mcmurdogroup.com,(240)790-0600,,,,,,,,,"Government and Military, Hardware","National Security, Satellite Communication",,,,,,,,,,"Beltsville, Maryland, United States",,1975-01-01,year,,https://www.linkedin.com/company/techno-sciences-inc.
Internet Gold - Golden Lines,https://www.crunchbase.com/organization/internet-gold-golden-lines,10001+,Active,http://www.igld.com,i.azulay@zahav.net.il,+972 3-902-0000,,,,,,,,,"Hardware, Internet Services","Internet, Satellite Communication, Web Hosting",,,,,,,,,,"Petah Tiqva, HaMerkaz, Israel",,1992-01-01,year,,
Tallysman Wireless,https://www.crunchbase.com/organization/tallysman-wireless,51-100,Active,https://www.tallysman.com/,,613-591-3131,,,,,,,,,"Data and Analytics, Design, Hardware, Manufacturing, Mobile","Manufacturing, Product Research, Satellite Communication, Wireless",3,17,Basic Electric Elements,Scientific and electric apparatus and instruments,405826,USD,405826,,,"Ottawa, Ontario, Canada",,2009-01-01,year,,https://www.linkedin.com/company/tallysman-wireless-inc-/
AvL Technologies,https://www.crunchbase.com/organization/avl-technologies,101-250,Active,https://www.avltech.com/,,(828)250-9950,,,,,,,,,"Consumer Electronics, Hardware, Manufacturing","Electronics, Manufacturing, Satellite Communication",7,0,Basic Electric Elements,,2885287,USD,2885287,,,"Asheville, North Carolina, United States",$10M to $50M,1994-01-01,year,,https://www.linkedin.com/company-beta/2180303
VestaSpace Technology,https://www.crunchbase.com/organization/vestaspace-technology,51-100,Active,https://www.vestaspacetech.com/,,,,,,,,,,,Hardware,Satellite Communication,,,,,,,,,,"Pune, Maharashtra, India",,2018-01-01,year,,https://www.linkedin.com/company/vesta-space-technology-pvt-ltd/about/
Utility Connect,https://www.crunchbase.com/organization/utility-connect,51-100,Active,https://utilityconnect.net,info@utilityconnect.net,+1-877-587-9566,,,,,,,,,"Energy, Financial Services, Hardware, Internet Services, Privacy and Security, Real Estate","Energy, Home Services, Insurance, Internet, Real Estate, Satellite Communication, Security",,,,,483149,USD,483149,,,"Dallas, Texas, United States",$1M to $10M,2012-01-01,year,,https://www.linkedin.com/company/utility-connect-llc/
Entel,https://www.crunchbase.com/organization/entel-group,251-500,Active,https://www.entel.co.uk/,info@entel.co.uk,+44 (0)20 8236 0032,1,1,,,,,,,"Hardware, Manufacturing, Other","Commercial, Manufacturing, Satellite Communication, Telecommunications",,,,,529159,USD,529159,,,"Borehamwood, Hertford, United Kingdom",$10M to $50M,1995-01-01,year,,https://www.linkedin.com/company/entel_2/
Digi,https://www.crunchbase.com/organization/digi-9212,1001-5000,Active,https://www.digi.hu,,,,,,,,,,,"Hardware, Information Technology, Internet Services, Messaging and Telecommunications","Information Technology, Internet, Satellite Communication, Telecommunications, Wired Telecommunications",,,,,,,,,,"Budapest, Budapest, Hungary",,1998-01-01,year,,https://www.linkedin.com/company/digi
Geosys,https://www.crunchbase.com/organization/geosys,101-250,Active,http://www.geosys.com/,,33 5 62 47 80 80,,,,,,,,,Hardware,Satellite Communication,,,,,462256,USD,462256,,,"Plymouth, Minnesota, United States",$10M to $50M,1987-01-01,year,,https://www.linkedin.com/company/geosys
Premier Distributing Company,https://www.crunchbase.com/organization/premier-distributing-company,251-500,Active,http://premierdistributing.com,,,,,,,,,,,"Artificial Intelligence (AI), Data and Analytics, Hardware, Information Technology, Internet Services, Privacy and Security, Science and Engineering","Intelligent Systems, Internet, Network Security, Satellite Communication",,,,,,,,,,"Albuquerque, New Mexico, United States",$1M to $10M,1982-01-01,day,,https://www.linkedin.com/company/premier-distributing-company
ITS Electronics,https://www.crunchbase.com/organization/its-electronics,101-250,Active,http://www.itselectronics.com/,info@ITSelectronics.com,+1 905 660 0405,,,,,,,,,"Consumer Electronics, Hardware, Manufacturing","Electronics, Manufacturing, Satellite Communication",3,1,Basic Electronic Circuitry,Scientific and electric apparatus and instruments,,,,,,"Vaughan, Ontario, Canada",$10M to $50M,1987-01-01,year,,https://www.linkedin.com/company/its-electronics/
Hughes Television Network,https://www.crunchbase.com/organization/hughes-television-network,501-1000,Active,http://www.hughes.in,wecare@hughes.in,91 12 4307 2500,,,,,,,,,"Consumer Electronics, Hardware, Information Technology, Media and Entertainment, Mobile","Consumer Electronics, Content, Information Technology, Mobile, Satellite Communication, Telecommunications",,,,,,,,,,"Gurgaon, Haryana, India",Less than $1M,1992-01-01,year,,https://www.linkedin.com/company/hughes-global-education
Spectrum Signal Processing,https://www.crunchbase.com/organization/spectrum-signal-processing,51-100,Active,http://www.spectrumsignal.com,info@spectrumsignal.com,(604)676-6700,,,,,,,,,"Consumer Electronics, Hardware, Software","Electronics, Hardware, Satellite Communication, Software",,,,,,,,,,"Burnaby, British Columbia, Canada",,1987-01-01,year,,https://www.linkedin.com/company/10134?trk=tyah&trkInfo=tarId%3A1408138377580%2Ctas%3Aspectrum%20s%2Cidx%3A2-2-7
Sundance Channel,https://www.crunchbase.com/organization/sundance-channel,51-100,Active,http://www.sundance.tv,feedback@sundance.tv,212-324-8500,,,,,,,,,"Hardware, Media and Entertainment","Digital Entertainment, Digital Media, Satellite Communication",,,,,1223119,USD,1223119,,,"New York, New York, United States",Less than $1M,1996-01-01,year,,https://www.linkedin.com/company/sundance-channel
Alpha Design Technologies,https://www.crunchbase.com/organization/alpha-design-technologies,1001-5000,Active,https://www.adtl.co.in/,alphacorp@adtl.co.in,+91-80-4255-6955,,,,,,,,,"Consumer Electronics, Government and Military, Hardware, Information Technology, Manufacturing","Electronics, Manufacturing, Military, Satellite Communication",,,,,,,,,,"Bengaluru, Karnataka, India",,2003-01-01,year,,https://www.linkedin.com/company/alpha-design-technologies/?originalSubdomain=in
IEC Telecom,https://www.crunchbase.com/organization/iec-telecom-group,51-100,Active,http://www.iec-telecom.com/,,33(0)1.40.17.08.03,,,,,,,,,Hardware,"Satellite Communication, Telecommunications",,,,,3933750,USD,3933750,,,,,1995-01-01,day,,https://www.linkedin.com/company/iec-telecom-group
Tersus-GNSS,https://www.crunchbase.com/organization/tersus-gnss,101-250,Active,https://www.tersus-gnss.com/,info@tersus-gnss.com,+61 8652 5033,,,,,,,,,"Hardware, Manufacturing, Other","Manufacturing, Satellite Communication, Service Industry",,,,,379607,USD,379607,,,"Box Hill, Victoria, Australia",$1M to $10M,2014-01-01,year,,https://www.linkedin.com/company/tersus-gnss/
